as_of_utc	routing_row_id	thesis_or_paper_slot	artifact_path	artifact_role_now	claim_or_question_it_supports	safe_use_now	what_it_still_does_not_prove	visualization_or_observatory_hook	next_smallest_publishability_move
2026-06-08T00:46:35Z	TRM-045-001	Shared claim boundary / results chapter anchor	claims.md:LIMEN-C-005 and LIMEN-C-006	Top-level bounded claim ceiling for the current shard-009 package	What can LIMEN currently claim about AI-washing and hidden-human-behind-AI evidence without overreading posture differences?	Use as the canonical thesis/article sentence that frames the package as two settled SEC finance rows plus one charge-stage Nate contrast row and one explicit hidden-human final-authority queue row, with DoNotPay staying sidecar-first.	It does not prove cross-sector prevalence, adjudicated hidden-human support, or that non-finance diversification has entered the default denominator.	Table 1C headline claim; claim-support map; reviewer-safe results anchor.	Keep it paired with `results/dashboard-paper/caption-control-register-v0.1.tsv:CCR-003` and `results/boost/limen-boost-009/table1c-denominator-decision-board.tsv` whenever reused outside `claims.md`.
2026-06-08T00:46:35Z	TRM-045-002	Main comparison table / core results exhibit	results/dashboard-paper/ai-washing-posture-table-v0.1.tsv	Machine-readable four-row Table 1C body for the current default ladder	Which posture states are currently default-visible inside the shard-009 package?	Use as the main table body that preserves the two settled SEC rows, the Nate accusation-stage row, and the explicit queue row as non-interchangeable publication states.	It does not by itself authorize DoNotPay core-table promotion, caption-safe wording, or hidden-human closure.	Table 1C body; posture-ladder card; settled-vs-charge-stage observatory view.	Always travel with `results/dashboard-paper/caption-control-register-v0.1.tsv:CCR-003` and `results/boost/limen-boost-021/table1c-surface-role-matrix.tsv`.
2026-06-08T00:46:35Z	TRM-045-003	Row-level diversification / methods sidecar	results/dashboard-paper/ai-washing-authority-diversification-panel-v0.1.tsv	Deterministic sidecar showing what diversification changed and what it did not	How can the paper or thesis acknowledge official non-finance breadth without silently rewriting the default ladder?	Use as the row-level sidecar showing DoNotPay as one bounded official non-finance FTC exemplar while keeping Workado branch-specific and the hidden-human queue unresolved.	It does not prove judicial unauthorized-practice findings, product truth, hidden-human final-authority closure, or a justified five-row core denominator.	Official non-finance badge; diversification panel; sidecar tooltip bundle.	If prose changes, patch this file and `CCR-003` together before changing manuscript or thesis language.
2026-06-08T00:46:35Z	TRM-045-004	Methods/results threshold note	results/boost/limen-boost-045/hidden-human-final-authority-frontier.tsv	Route-priority board separating threshold-changing hidden-human upgrades from editorial or appendix-only moves	Which next move would materially change the shard-009 ceiling rather than merely restate existing support?	Use as the canonical threshold note showing why Nate follow-through or a genuinely new final-authority hidden-human case outranks denominator revision, Workado branching, or more same-shape finance accumulation.	It does not itself supply a new case, final authority, or denominator decision; it only governs route priority.	Queue-retirement trigger card; hidden-human authority badge; next-upgrade observatory hook.	Reuse with `results/boost/limen-boost-009/table1c-denominator-decision-board.tsv` so substantive and editorial thresholds stay separate.
2026-06-08T00:46:35Z	TRM-045-005	Reviewer-response / limitations appendix	results/boost/limen-boost-045/ai-washing-hostile-reviewer-response-kit.tsv	Compact objection-and-answer control surface for predictable reviewer attacks	How can the paper or thesis answer hostile questions about finance concentration, Nate posture, DoNotPay sidecar status, and the explicit queue row without widening the claim?	Use as bounded rebuttal support for why the package is publishable now as posture-aware evidence architecture rather than as a prevalence panel.	It does not substitute for primary evidence and it does not make the hidden-human final-authority gap disappear.	Reviewer-control appendix; dashboard caveat text source; thesis limitations memo.	If reviewer questions shift after a real final-authority upgrade or denominator revision, patch this surface before rewriting high-level prose.
2026-06-08T00:46:35Z	TRM-045-006	Fast prose lift / thesis paragraph reuse	results/boost/limen-boost-045/paper-fragment.md	Compact results-plus-limitations paragraph bundle for manuscript, thesis, and reviewer memo reuse	What prose can be dropped directly into a chapter, preprint, or response memo right now?	Use when one compact paragraph plus one compact limitations block is needed without reconstructing the package from scattered files.	It does not replace the underlying denominator board, surface-role matrix, or caption control that keep the prose sidecar-safe and queue-visible.	Direct thesis prose lift; reviewer memo paragraph; Table 1C caption-adjacent narrative.	Reuse it only with `results/boost/limen-boost-021/table1c-control-travel-kit.tsv` and the current claim/caption controls visible.
