as_of_utc	block_id	prose_slot	publication_role_now	source_surface	bounded_clause_now	must_travel_with	forbidden_overread	next_threshold_change	paper_thesis_use
2026-06-08T10:30:50+02:00	RBB-019-001	topic_sentence	evidence_architecture_frame	results/boost/limen-boost-019/provenance-confusion-publication-cells.tsv:PCPC-019-001..PCPC-019-006	Shard 007 is currently publishable as a bounded provenance-confusion evidence architecture rather than as a balanced deepfake incident inventory: 2 left-anchor cells, 1 governance-context cell, 1 default main-results FCC lifecycle cell, and 2 limitations-only multilingual cells.	results/dashboard-paper/caption-control-register-v0.1.tsv:CCR-013 ; claims.md:LIMEN-C-004A ; claims.md:LIMEN-C-004B	Do not convert the six-cell ladder into prevalence, completeness, or cross-jurisdiction balance.	A second independently strong non-telecom direct-authority or direct-source row clears its gate.	Methods/results framing, table lead-in sentence, and thesis package overview.
2026-06-08T10:30:50+02:00	RBB-019-002	governance_context_sentence	context_not_results	results/boost/limen-boost-019/provenance-confusion-publication-cells.tsv:PCPC-019-003	Public U.S. institutional-response materials support a bounded governance-response claim that AI impersonation was treated as a consumer-protection, election-misinformation, caller or issuer-attribution, and telecom-authentication problem before event-level closure.	results/boost/limen-boost-043/claim-support-bridge.tsv:CSB-043-002 ; results/boost/limen-boost-031/shard-007-hostile-reviewer-objections.tsv:HRO-031-004..HRO-031-006	Do not rewrite warning letters, rulemaking, or follow-up materials as a second results-grade event family or as evidence of policy effectiveness.	One court, election-authority, regulator-final, or other final-authority event record tied to the same family.	Context-band prose, reviewer rebuttal, and thesis governance-response discussion.
2026-06-08T10:30:50+02:00	RBB-019-003	main_results_sentence	default_main_results	results/boost/limen-boost-019/provenance-confusion-publication-cells.tsv:PCPC-019-004	The strongest default-visible shard-007 result remains the FCC synthetic-voice lifecycle cluster: public texts support a bounded rule-anchor to allegation-stage enforcement to consent-decree closure pathway with a USD 1,000,000 civil penalty and explicit STIR or SHAKEN plus KYC or KYUP compliance-plan terms.	results/boost/limen-boost-043/claim-support-bridge.tsv:CSB-043-001 ; results/boost/limen-boost-007/disposition-lifecycle.tsv:DL-007-001..DL-007-005	Do not convert the consent-decree package into criminal guilt, generalized deterrence, election-law merits, or broad deepfake prevalence.	Direct state-origin release text, court-facing materials, or independent technical-forensics evidence.	Main results paragraph, table caption support, dashboard hero cell, and thesis exemplar.
2026-06-08T10:30:50+02:00	RBB-019-004	limitations_sentence	limitations_only_hidden_rows	results/boost/limen-boost-019/provenance-confusion-publication-cells.tsv:PCPC-019-005..PCPC-019-006	The Finland and Lithuania rows remain publication-safe only as limitations or blocker-class evidence: Finland has a preview-text-visible direct article shell but still lacks readable body text or a public-authority companion, while Lithuania remains rights-sensitive and modality-unresolved.	results/multilingual/finland-official-route-outcome-matrix-v0.1.tsv:FORM-007..FORM-009 ; results/multilingual/source-resolution-barriers-v0.1.tsv:LMWCS-20260606-002..LMWCS-20260606-003	Do not promote shell-visible preview text, machine translation, title glosses, or barrier-heavy mediated reports into substantive event facts.	Readable direct article body, public police companion source, or another clearly compliant direct document surface.	Rare-language methods note, blocker panel, and thesis coverage-gap discussion.
2026-06-08T10:30:50+02:00	RBB-019-005	hidden_row_rule	default_view_discipline	results/boost/limen-boost-019/provenance-confusion-publication-cells.tsv:PCPC-019-001..PCPC-019-006	Only PCPC-019-004 belongs in the default substantive results layer; anchors remain visible as framing support, governance context remains a side band, and multilingual rows stay hidden from default figure, map, and main table views.	results/dashboard-paper/caption-control-register-v0.1.tsv:CCR-013 ; results/boost/limen-boost-055/provenance-panel-surface-reconciliation.tsv	Do not flatten anchor, context, results, and limitations cells into one denominator-bearing table interpretation.	Any row-role change should be patched here before manuscript, dashboard, or thesis reuse.	Legend text, reviewer-safe tooltip language, and dashboard visibility governance.
2026-06-08T10:30:50+02:00	RBB-019-006	reviewer_response_sentence	hostile_reviewer_pass	results/boost/limen-boost-019/claim-surface-sync-audit.tsv:CSSA-019-001..CSSA-019-004	The current shard-007 contribution is a one-exemplar but reviewer-defensible package because every visible cell now carries an explicit claim ceiling, forbidden-overread rule, and next-threshold requirement instead of vague upgrade rhetoric.	results/boost/limen-boost-031/shard-007-hostile-reviewer-objections.tsv:HRO-031-001..HRO-031-006 ; results/boost/limen-boost-007/provenance-question-role-matrix.tsv	Do not describe this control layer as new empirical evidence growth or a second substantive case.	One threshold-changing source recovery event or one later shared-consumer drift event.	Reviewer-response memo, methods note, and thesis limitation framing.
