row_id	signal_id	promotion_gate	promotion_priority	source_surface_class	source_review_role	shards	queries	source_path	source_line	title_or_snippet	source_review_reason	claim_ceiling	required_hardening_step	forbidden_overread
SRPH-00903	LIMEN-SIGNAL-1C922AAAC1D901B3	needs_named_url_extraction	P3	regulator_or_public_authority	named_direct_source_surface	public-sector	regulatory sandbox	/srv/tyche/gaia/tyche-research-vault/data/global-agent-atlas-v0.1/snapshots/source-witness-repair-20260607/law-eu-ai-act-extraterritorial__1__eur-lex.europa.eu__direct_public_fetch__a8832606ac318357.html	15157	"<p class=""oj-normal"">provide SMEs, including start-ups, having a registered office or a branch in the Union, with priority access to the AI regulatory sandboxes, to the extent that they fulfil the eligibility conditions and selection criter"	Local row names a concrete official, regulator, institutional, or legal source surface suitable for bounded direct-source review.	Supports only source-surface existence and narrow descriptive posture from the local record, not incident truth, legality, compliance, deployment certainty, prevalence, or ranking.	Extract a named public URL before any case hardening.	Do not treat source-surface review as reviewed-core promotion, incident truth, legality, compliance, safety, deployment proof, prevalence, or ranking.
SRPH-00904	LIMEN-SIGNAL-24E43C9CF3425336	needs_named_url_extraction	P3	regulator_or_public_authority	official_sandbox_surface	public-sector	regulatory sandbox	/srv/tyche/atlas/tyche-thesis-atlas-factory/config/hermes-v02-expansion-seeds.json	4647	"title: ""Communications Authority of Kenya regulatory sandbox"","	Local metadata names a concrete official or institutional source surface suitable for bounded review.	source-surface existence/posture only	Extract a named public URL before any case hardening.	Do not treat source-surface review as reviewed-core promotion, incident truth, legality, compliance, safety, deployment proof, prevalence, or ranking.
SRPH-00905	LIMEN-SIGNAL-27C38139E1B0458B	needs_named_url_extraction	P3	regulator_or_public_authority	official_law_surface	public-sector	regulatory sandbox	/srv/tyche/gaia/tyche-research-vault/data/global-agent-atlas-v0.1/snapshots/source-witness-repair-20260607/law-eu-ai-act-extraterritorial__1__eur-lex.europa.eu__direct_public_fetch__a8832606ac318357.html	14335	"<p class=""oj-normal"">1. Member States shall ensure that their competent authorities establish at least one AI regulatory sandbox at national level, which shall be operational by 2 August 2026. That sandbox may also be established jointly wi"	Local EUR-Lex snapshot of AI Act Article 57 names an official sandbox law surface.	source-surface existence review only	Extract a named public URL before any case hardening.	Do not treat source-surface review as reviewed-core promotion, incident truth, legality, compliance, safety, deployment proof, prevalence, or ranking.
SRPH-00906	LIMEN-SIGNAL-2C812EAB4DDFA46F	needs_named_url_extraction	P3	regulator_or_public_authority	official_law_surface	public-sector	regulatory sandbox	/srv/tyche/gaia/tyche-research-vault/data/global-agent-atlas-v0.1/snapshots/source-witness-repair-20260607/law-eu-ai-act-extraterritorial__1__eur-lex.europa.eu__direct_public_fetch__a8832606ac318357.html	15185	"<p class=""oj-normal"">utilise existing dedicated channels and where appropriate, establish new ones for communication with SMEs including start-ups, deployers, other innovators and, as appropriate, local public authorities to provide advice"	Local EUR-Lex snapshot remains the same official AI Act sandbox law surface.	source-surface existence review only	Extract a named public URL before any case hardening.	Do not treat source-surface review as reviewed-core promotion, incident truth, legality, compliance, safety, deployment proof, prevalence, or ranking.
SRPH-00907	LIMEN-SIGNAL-3F7DFFCE207F86AA	needs_named_url_extraction	P3	regulator_or_public_authority	official_legal_text	public-sector	regulatory sandbox	/srv/tyche/gaia/tyche-research-vault/data/global-agent-atlas-v0.1/snapshots/source-witness-repair-20260607/law-eu-ai-act-extraterritorial__1__eur-lex.europa.eu__direct_public_fetch__a8832606ac318357.html	8370	"<p class=""oj-normal"">AI is a rapidly developing family of technologies that requires regulatory oversight and a safe and controlled space for experimentation, while ensuring responsible innovation and integration of appropriate safeguards a"	local EUR-Lex fetch is a concrete official legal surface	source-surface existence only; no truth, legality, prevalence, ranking, or compliance claim	Extract a named public URL before any case hardening.	Do not treat source-surface review as reviewed-core promotion, incident truth, legality, compliance, safety, deployment proof, prevalence, or ranking.
SRPH-00908	LIMEN-SIGNAL-408D5A4AC78C9D52	needs_named_url_extraction	P3	regulator_or_public_authority	official_legal_snapshot	public-sector	regulatory sandbox	/srv/tyche/gaia/tyche-research-vault/data/global-agent-atlas-v0.1/snapshots/source-witness-repair-20260607/law-eu-ai-act-extraterritorial__1__eur-lex.europa.eu__direct_public_fetch__a8832606ac318357.html	14348	"<p class=""oj-normal"">5. AI regulatory sandboxes established under paragraph 1 shall provide for a controlled environment that fosters innovation and facilitates the development, training, testing and validation of innovative AI systems for"	Local snapshot already captures a concrete official legal source surface.	Source-surface existence only; do not infer truth, legality, compliance, safety, prevalence, or ranking.	Extract a named public URL before any case hardening.	Do not treat source-surface review as reviewed-core promotion, incident truth, legality, compliance, safety, deployment proof, prevalence, or ranking.
SRPH-00909	LIMEN-SIGNAL-40B53D46F52A5723	needs_named_url_extraction	P3	regulator_or_public_authority	official_legal_snapshot	public-sector	regulatory sandbox	/srv/tyche/gaia/tyche-research-vault/data/global-agent-atlas-v0.1/snapshots/source-witness-repair-20260607/law-eu-ai-act-extraterritorial__1__eur-lex.europa.eu__direct_public_fetch__a8832606ac318357.html	14339	"<p class=""oj-normal"">2. Additional AI regulatory sandboxes at regional or local level, or established jointly with the competent authorities of other Member States may also be established.</p>"	Local snapshot already captures a concrete official legal source surface.	Source-surface existence only; do not infer truth, legality, compliance, safety, prevalence, or ranking.	Extract a named public URL before any case hardening.	Do not treat source-surface review as reviewed-core promotion, incident truth, legality, compliance, safety, deployment proof, prevalence, or ranking.
SRPH-00910	LIMEN-SIGNAL-503E15F16C6C14F7	needs_named_url_extraction	P3	regulator_or_public_authority	official_regulator_surface	public-sector	regulatory sandbox	/srv/tyche/pallas/pallas-ai-agent-observatory/reports/PALLAS_SECOND_PASS_SPRINT_10_COUNTRY_SCORE_DELTA.csv	24	AZ,I03,2,H,2,H,Keep: Central Bank source strongly supports a sectoral financial regulatory sandbox with application periods and special regulatory-regime procedure; no economy-wide or AI-specific sandbox found.,false,az-source-hardening	Names Central Bank sandbox source and special-regime procedure.	surface existence only	Extract a named public URL before any case hardening.	Do not treat source-surface review as reviewed-core promotion, incident truth, legality, compliance, safety, deployment proof, prevalence, or ranking.
SRPH-00911	LIMEN-SIGNAL-54248F7B8A72C46A	needs_named_url_extraction	P3	regulator_or_public_authority	direct_source_surface	public-sector	regulatory sandbox	/srv/tyche/gaia/tyche-research-vault/data/global-agent-atlas-v0.1/snapshots/source-witness-repair-20260607/law-eu-ai-act-extraterritorial__1__eur-lex.europa.eu__direct_public_fetch__a8832606ac318357.html	14590	"<p class=""oj-normal"">that AI regulatory sandboxes facilitate the involvement of other relevant actors within the AI ecosystem, such as notified bodies and standardisation organisations, SMEs, including start-ups, enterprises, innovators, te"	Local metadata names a concrete official or institutional source surface suitable for bounded source-surface review.	Surface existence and source posture only from the named local source surface.	Extract a named public URL before any case hardening.	Do not treat source-surface review as reviewed-core promotion, incident truth, legality, compliance, safety, deployment proof, prevalence, or ranking.
SRPH-00912	LIMEN-SIGNAL-5E52B42F0BB2980D	needs_named_url_extraction	P3	regulator_or_public_authority	official_legal_text_surface	public-sector	regulatory sandbox	/srv/tyche/gaia/tyche-research-vault/data/global-agent-atlas-v0.1/snapshots/source-witness-repair-20260607/law-eu-ai-act-extraterritorial__1__eur-lex.europa.eu__direct_public_fetch__a8832606ac318357.html	8418	"<p class=""oj-normal"">In order to accelerate the process of development and the placing on the market of the high-risk AI systems listed in an annex to this Regulation, it is important that providers or prospective providers of such systems"	local evidence names a concrete official legal or implementation surface	must resolve the underlying source before any reviewed example or paper claim	Extract a named public URL before any case hardening.	Do not treat source-surface review as reviewed-core promotion, incident truth, legality, compliance, safety, deployment proof, prevalence, or ranking.
SRPH-00913	LIMEN-SIGNAL-648D254C26233CDE	needs_named_url_extraction	P3	regulator_or_public_authority	direct_source_surface	public-sector	regulatory sandbox	/srv/tyche/gaia/tyche-research-vault/data/global-agent-atlas-v0.1/snapshots/source-witness-repair-20260607/law-eu-ai-act-extraterritorial__1__eur-lex.europa.eu__direct_public_fetch__a8832606ac318357.html	14632	"<p class=""oj-normal"">that AI regulatory sandboxes facilitate the development of tools and infrastructure for testing, benchmarking, assessing and explaining dimensions of AI systems relevant for regulatory learning, such as accuracy, robust"	Local metadata points to an official EUR-Lex / EU source surface suitable for bounded source review.	source-surface existence only	Extract a named public URL before any case hardening.	Do not treat source-surface review as reviewed-core promotion, incident truth, legality, compliance, safety, deployment proof, prevalence, or ranking.
SRPH-00914	LIMEN-SIGNAL-7551E2F98D8DBDD4	needs_named_url_extraction	P3	regulator_or_public_authority	direct_surface_candidate	public-sector	regulatory sandbox	/srv/tyche/atlas/tyche-thesis-atlas-factory/corpus/v0.2-working/reports/lanes/global-south-kenya-latest.md	56	1. **Regulatory Sandbox | Communications Authority of Kenya**	Local lane report names the Communications Authority of Kenya regulatory sandbox as a concrete official surface.	confirms source-surface existence only; no truth, legality, compliance, prevalence, or ranking claim	Extract a named public URL before any case hardening.	Do not treat source-surface review as reviewed-core promotion, incident truth, legality, compliance, safety, deployment proof, prevalence, or ranking.
SRPH-00915	LIMEN-SIGNAL-7E735716E5E00D18	needs_named_url_extraction	P3	regulator_or_public_authority	direct_source_surface	public-sector	regulatory sandbox	/srv/tyche/pallas/pallas-ai-agent-observatory/reports/PALLAS_SECOND_PASS_SPRINT_10_COUNTRY_SCORE_DELTA.csv	104	"KW,I03,2,H,2,H,""CBK Wolooj pages strongly support a mature financial-sector regulatory sandbox with supervised stages, compliance/security/privacy testing, safeguards, and scope boundaries. No score change because frozen score already refle"	score-delta row names the CBK Wolooj sandbox pages as a concrete regulator surface	existence/posture only; no truth, legality, compliance, safety, prevalence, or ranking inference	Extract a named public URL before any case hardening.	Do not treat source-surface review as reviewed-core promotion, incident truth, legality, compliance, safety, deployment proof, prevalence, or ranking.
SRPH-00916	LIMEN-SIGNAL-7FAA0D6FE0635A9E	needs_named_url_extraction	P3	regulator_or_public_authority	official_named_surface	public-sector	regulatory sandbox	/srv/tyche/pallas/pallas-ai-agent-observatory/reports/PALLAS_SECOND_PASS_SPRINT_14_CANDIDATE_MATRIX_DELTA.csv	14	dk-source-hardening,DK,Denmark,I03,2,H,2,H,none,Official sandbox page confirms a regulatory sandbox established by Digitaliseringsstyrelsen and Datatilsynet with public eligibility and process information. No stronger public outcomes eviden	Local metadata names a concrete official or institutional source surface suitable for bounded source-surface review.	surface existence only; no incident truth, legality, compliance, safety, prevalence, or ranking claim	Extract a named public URL before any case hardening.	Do not treat source-surface review as reviewed-core promotion, incident truth, legality, compliance, safety, deployment proof, prevalence, or ranking.
SRPH-00917	LIMEN-SIGNAL-84A69917567FD9FB	needs_named_url_extraction	P3	regulator_or_public_authority	named_official_source_surface	public-sector	regulatory sandbox	/srv/tyche/pallas/pallas-ai-agent-observatory/reports/PALLAS_SECOND_PASS_SPRINT_15_CANDIDATE_MATRIX_DELTA.csv	64	lk-source-hardening,LK,Sri Lanka,I03,2,H,2,H,none,CBSL FinTech Regulatory Sandbox page and framework PDF remain strong official evidence for a sectoral sandbox. No change.,false	Local metadata names the CBSL FinTech Regulatory Sandbox page and framework PDF, concrete official regulator surfaces.	source posture only	Extract a named public URL before any case hardening.	Do not treat source-surface review as reviewed-core promotion, incident truth, legality, compliance, safety, deployment proof, prevalence, or ranking.
