audit_id	as_of_utc	surface_path	surface_scope	old_contract	new_or_confirmed_contract	status	evidence_path	notes
LCE-DA-001	2026-06-07T17:48:17Z	results/dashboard-paper/figure-table-priority-register-v0.1.tsv:LIMEN-VIS-002	Figure 2 shared priority row	live_duplicate_control_scope=34_visible_rows/26_lineages	live_duplicate_control_scope=35_visible_rows/27_lineages	patched	results/boost/limen-boost-046/figure2-post-danish-drift-reaudit.tsv	Shared Figure 2 control row now points at the post-Danish six-row drift state while leaving the staged 31/23 mechanical source unchanged.
LCE-DA-002	2026-06-07T17:48:17Z	results/dashboard-paper/shared-export-promotion-register-v0.1.tsv:exp-005	Figure 2 shared export stub	regenerated live 34/26 export pending	regenerated live 35/27 export pending	patched	results/boost/limen-boost-046/figure2-post-danish-drift-reaudit.tsv	Blocked shared export stub now names the current live denominator without pretending the staged heatmap was regenerated.
LCE-DA-003	2026-06-07T17:48:17Z	results/dashboard-paper/publication-route-visual-bridge-v0.1.tsv:LIMEN-VIS-002	Figure 2 route bridge	live control layer 34 visible / 26 lineages	live control layer 35 visible / 27 lineages	patched	results/boost/limen-boost-046/figure2-post-danish-drift-reaudit.tsv	Bridge remains drift-badged because the source heatmap still uses the staged 31/23 bundle.
LCE-DA-004	2026-06-07T17:48:17Z	dashboard/limen-dashboard-spec-v0.1.md	Dashboard prose/control spec	live duplicate/taxonomy denominator 34 / 26	live duplicate/taxonomy denominator 35 / 27	patched	results/boost/limen-boost-046/figure2-post-danish-drift-reaudit.tsv	Spec now uses the post-Danish live denominator and still preserves the staged-vs-live drift warning.
LCE-DA-005	2026-06-07T17:48:17Z	papers/article-architecture-v0.1.md	Manuscript architecture prose	live duplicate/taxonomy denominator 34 / 26	live duplicate/taxonomy denominator 35 / 27	patched	results/boost/limen-boost-046/figure2-post-danish-drift-reaudit.tsv	Article architecture now points to the current live denominator for Figure 2 and Figure 7 caution language.
LCE-DA-006	2026-06-07T17:48:17Z	results/dashboard-paper/shared-export-promotion-register-v0.1.tsv:exp-002	Publication-safe aggregate headline contract	29 normalized rows / 21 publication-safe lineages	30 normalized rows / 21 publication-safe lineages	patched	results/boost/limen-boost-011/normalized-join-key-ledger.tsv	Shared publication-safe export stub now matches the physically counted 30-row normalized ledger while keeping the 21-lineage headline safe aggregate.
LCE-DA-007	2026-06-07T17:48:17Z	results/dashboard-paper/status.md	Dashboard-paper status note	34 / 26 live Figure 2 layer; 5 lagging rows	35 / 27 live Figure 2 layer; 6 lagging rows	pending_patch	results/boost/limen-boost-046/figure2-post-danish-drift-reaudit.tsv	Status note still needs synchronized wording repair after the shared register/spec/article patches.
LCE-DA-008	2026-06-07T17:48:17Z	results/boost/limen-dashboard-paper-forge/taxonomy-heatmap.tsv	Mechanical Figure 2 source	31 visible / 23 lineages staged	31 visible / 23 lineages staged	unchanged	results/boost/limen-dashboard-paper-forge/taxonomy-heatmap.tsv	No source regeneration was performed in this cycle; staged source remains intentionally unchanged.
LCE-DA-009	2026-06-07T17:48:17Z	results/boost/limen-boost-011/normalized-join-key-ledger.tsv	Physical normalized ledger count	29 or 30 disputed in downstream prose	30 data rows plus header	confirmed	results/boost/limen-boost-011/normalized-join-key-ledger.tsv	Headline aggregate prose should use the physically counted 30 normalized rows / 21 publication-safe lineages contract until a future recomputation says otherwise.
