as_of_utc	lane_id	query	row_type	case_id	title	record_status	evidence_tier	publication_bucket	mechanism_family	tool_misuse_hit_count	source_id	anchor_path_state	current_safe_use	negative_or_positive_signal	next_threshold_change	observatory_hook	notes
2026-06-07T22:28:03Z	limen-continuous-experiments	tool misuse	SUMMARY	ALL	522 total matches; 522 local; 0 external	distinct_case_hits=6; distinct_source_hits=5	recursive_hits=503; boost_hits=7; shared_security_hits=6; other_local_hits=6	1_core_results=1; 2_appendix_supporting_results=5	exfiltration_or_credential_exposure=2; supply_chain_or_plugin_extension=1; unsafe_code_execution=3	522	LIMEN-S-009; LIMEN-S-010; LIMEN-S-032; LIMEN-S-036; LIMEN-S-051	data/cases-only anchor rediscovery; no new external path in latest run	candidate-case extraction audit for seeded security rows, not corpus-growth claim	negative_result_no_novel_case_signal	new exact external case/advisory/document path or new seeded case outside current security spine	Table 6 / security publication-bucket panel; query-to-case saturation legend	Latest tool misuse query mostly replays recursive mining artifacts and existing seeded rows; no non-local novelty signal landed in this run.
2026-06-07T22:28:03Z	limen-continuous-experiments	tool misuse	CASE	LIMEN-000004	CrewAI JSON loader allowed arbitrary local file read on the server	authoritative	T3_authoritative_source	2_appendix_supporting_results	exfiltration_or_credential_exposure	38	LIMEN-S-009	rediscovered via existing local case/source anchors	bounded seeded row only	positive_seeded_row_rediscovery_not_new_case		security publication-bucket ladder; query-to-case overlay	CrewAI rows still need CVE-specific vendor bulletin certainty
2026-06-07T22:28:03Z	limen-continuous-experiments	tool misuse	CASE	LIMEN-000005	CrewAI RAG search tools enabled server-side request forgery and internal/cloud content acquisition	authoritative	T3_authoritative_source	2_appendix_supporting_results	exfiltration_or_credential_exposure	14	LIMEN-S-010	rediscovered via existing local case/source anchors	bounded seeded row only	positive_seeded_row_rediscovery_not_new_case		security publication-bucket ladder; query-to-case overlay	CrewAI rows still need CVE-specific vendor bulletin certainty
2026-06-07T22:28:03Z	limen-continuous-experiments	tool misuse	CASE	LIMEN-000006	LangChain LLMMathChain allowed prompt injection into Python exec, creating arbitrary code execution risk	authoritative	T3_authoritative_source	2_appendix_supporting_results	unsafe_code_execution	14	LIMEN-S-032	rediscovered via existing local case/source anchors	bounded seeded row only	positive_seeded_row_rediscovery_not_new_case		security publication-bucket ladder; query-to-case overlay	independent-lab/source-qualified fix layer only
2026-06-07T22:28:03Z	limen-continuous-experiments	tool misuse	CASE	LIMEN-000007	LlamaIndex safe_eval command injection enabled LLM-generated code to execute OS commands on the host	authoritative	T3_authoritative_source	2_appendix_supporting_results	unsafe_code_execution	14	LIMEN-S-036	rediscovered via existing local case/source anchors	bounded seeded row only	positive_seeded_row_rediscovery_not_new_case		security publication-bucket ladder; query-to-case overlay	independent-lab/source-qualified fix layer only
2026-06-07T22:28:03Z	limen-continuous-experiments	tool misuse	CASE	LIMEN-000001	Auto-GPT sandbox escape and host code execution risk via unsanitized file basename	authoritative	T3_authoritative_source	1_core_results	unsafe_code_execution	8	LIMEN-S-006	rediscovered via existing local case/source anchors	bounded seeded row only	positive_seeded_row_rediscovery_not_new_case		security publication-bucket ladder; query-to-case overlay	
2026-06-07T22:28:03Z	limen-continuous-experiments	tool misuse	CASE	LIMEN-000012	Playwright MCP origin validation flaw allowed unauthorized local MCP requests via DNS rebinding before 0.0.40	authoritative	T3_authoritative_source	2_appendix_supporting_results	supply_chain_or_plugin_extension	2	LIMEN-S-051	rediscovered via existing local case/source anchors	bounded seeded row only	positive_seeded_row_rediscovery_not_new_case		security publication-bucket ladder; query-to-case overlay	trust-boundary/plugin singleton stays visible
