contract_row_id	as_of_utc	execution_scope	consumer_path	consumer_row_or_anchor	current_state	if_NEJM_first_seed_executes	decision_or_patch_required	why_this_consumer_matters	exact_support_paths	paper_thesis_use	dashboard_hook	caution
RISEC-020-001	2026-06-08T15:53:41Z	shared_live_heatmap	results/dashboard/taxonomy-heatmap.tsv	research_integrity	seed_case_count=0; authoritative_seed_count=0; support_state=zero_seed_local_gap; notes still say bounded local shadow package exists off-heatmap	Count-bearing taxonomy row would stop being a pure zero-seed gap and would need one explicit seeded-row state with the shadow-package caveat preserved.	Patch counts and support-state language in one synchronized move; do not silently drop the shadow-package note when moving from 0 to 1.	This is the reviewer-visible denominator surface for Figure 2 style taxonomy claims, so an unsynchronized change here would create the most obvious drift.	results/dashboard/taxonomy-heatmap.tsv:research_integrity ; results/boost/limen-boost-020/research-integrity-seed-admission-review.tsv:RSAR-020-001..005 ; results/dashboard-paper/procedural-contamination-source-depth-panel-v0.1.tsv:SCPANEL-008-003..007	Main figure/table denominator control for observatory paper, reviewer response, and thesis chapter routing.	Taxonomy support heatmap; zero-seed-to-seeded transition card	Do not change this row unless the shared execution decision is explicit; archive-resolved notice text alone is not self-executing.
RISEC-020-002	2026-06-08T15:53:41Z	shared_live_legal_uncertainty	results/dashboard/legal-uncertainty-matrix.tsv	research_integrity	seed_case_count=0 and prose says bounded local shadow package remains below seeded shared-row status	Legal-uncertainty prose would need to say one bounded seeded row now exists while the wider shadow package still remains mixed and below blanket category-wide maturity.	Patch the count field and rewrite the explanatory sentence so it no longer says no local seeded cases, while preserving the seven-row mixed-package caution.	This matrix is the clearest legal-route explanation for hostile reviewers asking whether research-integrity is still merely conceptual.	results/dashboard/legal-uncertainty-matrix.tsv:research_integrity ; results/boost/limen-boost-020/research-integrity-seed-admission-review.tsv:RSAR-020-001..005	Methods/limitations and legal-caution table for preprint and thesis reuse.	Legal uncertainty matrix	Do not convert one seeded row into a claim that the whole category is doctrinally settled or broadly authoritative.
RISEC-020-003	2026-06-08T15:53:41Z	shared_live_crosswalk	results/crosswalks/legal-normative-crosswalk-v0.1.tsv	research_integrity	category row is all-zero with conceptual-only framework fit and no case refs	Crosswalk row would need one explicit case reference plus revised seeded-count fields while keeping the framework-fit and legal-status ceiling conservative.	Patch the category row only if the execution package also names the exact seeded case ref and preserves conceptual legal-anchor language.	This is the canonical law-to-category matrix; if it stays at none/none/none while dashboard counts move, the legal package becomes incoherent.	results/crosswalks/legal-normative-crosswalk-v0.1.tsv:research_integrity ; results/boost/limen-boost-020/research-integrity-seed-admission-review.tsv:RSAR-020-001	Core legal/methods crosswalk for article package and thesis appendix.	Legal/normative crosswalk row	Do not overstate doctrinal fit: a seeded row still does not create a direct primary legal-text anchor for research_integrity.
RISEC-020-004	2026-06-08T15:53:41Z	shared_live_framework_anchor_board	results/crosswalks/framework-anchor-coverage-v0.1.tsv	research_integrity	zero_seed_but_locally_non_empty_shadow_package with zero counts and interpretive ISO/UNESCO framing	Framework-anchor row would need one seeded-row count update and probably a revised support-state label, while preserving the point that framework fit remains interpretive.	Patch counts and state label together; keep the anchor explanation explicit that ISO/UNESCO remain conceptual framing rather than direct misconduct or legality proof.	This board explains what kind of framework text exists for each category, so it must not accidentally read as though one seeded row created direct doctrinal authority.	results/crosswalks/framework-anchor-coverage-v0.1.tsv:research_integrity ; sources/sources.md:LIMEN-S-040 ; sources/sources.md:LIMEN-S-048 ; results/boost/limen-boost-020/research-integrity-seed-admission-review.tsv:RSAR-020-001	Framework-anchor appendix and dashboard legend for cautious standards/legal reuse.	Framework-anchor coverage panel	Do not let a seed execution collapse conceptual anchor text into compliance or legal-status rhetoric.
RISEC-020-005	2026-06-08T15:53:41Z	staged_dashboard_copy	results/boost/limen-dashboard-paper-forge/taxonomy-heatmap.tsv	research_integrity	staged copy mirrors the live zero-seed row	Staged Figure 2 copy would need the same count/state patch as the live heatmap or it will immediately drift.	Apply the exact same row-level patch as the live heatmap in the same execution window.	This staged file feeds dashboard-paper generation and can silently reintroduce stale zero-seed wording even if the live dashboard file is correct.	results/boost/limen-dashboard-paper-forge/taxonomy-heatmap.tsv:research_integrity ; results/dashboard/taxonomy-heatmap.tsv:research_integrity	Staged figure-generation input for paper package and export control.	Staged taxonomy heatmap	Do not patch the staged copy alone; it must move with the live consumer and figure-register contract.
RISEC-020-006	2026-06-08T15:53:41Z	staged_dashboard_copy	results/boost/limen-dashboard-paper-forge/legal-uncertainty-matrix.tsv	research_integrity	staged copy mirrors the live zero-seed legal-uncertainty row	Staged legal-uncertainty copy would need the same seeded-count and prose update as the live matrix.	Apply the same count/prose patch as the live legal-uncertainty matrix in the same execution package.	This staged file feeds dashboard-paper assembly, so leaving it behind would create a split between manuscript and live dashboard legal wording.	results/boost/limen-dashboard-paper-forge/legal-uncertainty-matrix.tsv:research_integrity ; results/dashboard/legal-uncertainty-matrix.tsv:research_integrity	Staged legal/methods support for paper package and reviewer responses.	Staged legal-uncertainty matrix	Do not let staged package prose continue to say no local seeded cases once live shared execution has occurred.
RISEC-020-007	2026-06-08T15:53:41Z	crosswalk_sync_guard	results/boost/limen-legal-normative-crosswalk/legal-live-denominator-sync-audit.tsv	research_integrity	current sync audit marks all three consumers in_sync at zero_seed_but_locally_non_empty_shadow_package	Sync-audit row would need a fresh post-execution audit showing all linked legal consumers moved together to the new denominator state.	Do not execute a seed admission without refreshing the sync audit; otherwise there is no machine-readable proof that live legal consumers stayed aligned.	This file is the contract proving that legal front doors and category boards agree, so it is the minimal verification artifact after any denominator-bearing change.	results/boost/limen-legal-normative-crosswalk/legal-live-denominator-sync-audit.tsv:research_integrity ; results/crosswalks/legal-normative-crosswalk-v0.1.tsv:research_integrity ; results/crosswalks/framework-anchor-coverage-v0.1.tsv:research_integrity ; results/dashboard/legal-uncertainty-matrix.tsv:research_integrity	Verification artifact for hostile-reviewer-safe execution of a legal-route change.	Crosswalk denominator sync audit	Without a refreshed audit, the lane would have changed counts but not proved cross-surface coherence.
RISEC-020-008	2026-06-08T15:53:41Z	figure_register_contract	results/dashboard-paper/figure-table-priority-register-v0.1.tsv	LIMEN-VIS-002	figure register still says authoritatively_seeded=11; candidate_only_seeded=1; zero_seed_local_gap=3	Figure-register aggregate counts would need synchronized refresh if research_integrity becomes seeded, and the note should say the change came from one bounded seed execution rather than from broad category growth.	Patch aggregate figure counts and contract prose only after row-level files are updated and verified.	This register is where manuscript and dashboard planning pick up denominator totals, so stale aggregates here would misstate the whole atlas package.	results/dashboard-paper/figure-table-priority-register-v0.1.tsv:LIMEN-VIS-002 ; results/dashboard/taxonomy-heatmap.tsv:research_integrity	Figure-contract source for manuscript planning, reviewer packets, and thesis visuals.	Figure/Table priority register	Do not update package-level counts before the row-level heatmap/matrix/crosswalk changes are real and verified.
RISEC-020-009	2026-06-08T15:53:41Z	claim_layer_boundary	claims.md	LIMEN-C-008	claim currently says research-integrity slice is locally non-empty and publication-usable in Table 1E but still remains zero-seed in Figure 2/Table 2 until an explicit row-level seed-admission decision is made	If the execution occurs, this shared claim must stop describing research_integrity as zero-seed in Figure 2/Table 2 while still preserving the narrow source-depth and claim-ceiling interpretation.	Patch the caution sentence and count-language reference once the shared execution package is complete.	This is the highest-level reusable prose surface; if it remains stale, later manuscripts will keep repeating the pre-execution denominator story.	claims.md:LIMEN-C-008 ; results/boost/limen-boost-020/research-integrity-seed-admission-review.tsv:RSAR-020-001..005	Shared claims layer for article, dashboard, and thesis text reuse.	Claim-support map	Do not let the updated claim imply prevalence, broad misconduct, or doctrinal closure from one seeded archive-resolved notice row.