as_of_utc	lane_id	audit_id	target_path	target_slot	stale_state_seen	repaired_state_now	paper_readiness_delta
evidence_refs
2026-06-07T20:13:22Z	limen-boost-020	STSPA-020-001	draft/preprint.md	Table 1 package paragraph	`four intermediate research-integrity states` plus `weak residual bucket`	Names the mediated-statement and blocked DOI-pair intermediate states, the two Springer direct-notice exemplars, and the mixed residual bucket with one archived SSRN platform-action exemplar plus two still-weak residual rows.	Preprint now matches the live Table 1E ladder, reducing manuscript drift during hostile-reviewer package assembly.	results/dashboard-paper/procedural-contamination-source-depth-panel-v0.1.tsv:SCPANEL-008-003..SCPANEL-008-007 ; results/dashboard-paper/caption-control-register-v0.1.tsv:CCR-010
2026-06-07T20:13:22Z	limen-boost-020	STSPA-020-002	results/dashboard-paper/caption-control-register-v0.1.tsv	CCR-010	`mediated-statement / DOI-pair / publisher-visible / direct-notice` plus `mixed residual floor`	Names mediated-statement and blocked DOI-pair as the two intermediate states, keeps the two Springer direct-notice exemplars explicit, and aligns the tail state to one mixed residual bucket.	Shared caption-control wording no longer revives the retired publisher-visible rung when Table 1E is reused in paper, dashboard-note, or thesis surfaces.	results/dashboard-paper/procedural-contamination-source-depth-panel-v0.1.tsv:SCPANEL-008-003..SCPANEL-008-007 ; results/boost/limen-boost-020/table1e-control-travel-kit.tsv:T1E-TK-020-003..T1E-TK-020-004
2026-06-07T20:13:22Z	limen-boost-020	STSPA-020-003	results/boost/limen-boost-024/canonical-figure-table-registry.tsv	LIMEN-VIS-012	`four intermediate research-integrity states` plus `one weak residual bucket`; next gate still framed as a second direct-notice exemplar	Registry now names the specific intermediate states, the two Springer direct-notice exemplars, the mixed residual bucket, and the real next gate of one non-Springer direct notice plus one second document-grade procedural family.	Canonical visual registry now routes Table 1E reuse through the current source-depth contract rather than an outdated threshold story.	results/dashboard-paper/caption-control-register-v0.1.tsv:CCR-010 ; results/boost/limen-boost-020/publication-routing-bridge.tsv
2026-06-07T20:13:22Z	limen-boost-020	STSPA-020-004	results/boost/limen-boost-048/publication-sequence-contract.tsv	LIMEN-VIS-012	`four intermediate research-integrity states` plus `one weak residual bucket`; route gate still framed as second direct-notice exemplar	Sequence contract now preserves the specific intermediate states, the two Springer direct-notice exemplars, the mixed residual bucket, and the publisher-diversity blocker.	Publication-order planning now matches the live Table 1E package and avoids stale blocker language in downstream figure/table routing.	results/dashboard-paper/caption-control-register-v0.1.tsv:CCR-010 ; results/boost/limen-boost-024/canonical-figure-table-registry.tsv:LIMEN-VIS-012
2026-06-07T20:13:22Z	limen-boost-020	STSPA-020-005	results/boost/limen-boost-012/reviewer-caption-register.tsv	limen-ms-tab-001E	`four intermediate research-integrity source-depth states` plus `one weak residual bucket`	Reviewer caption row now names the mediated-statement and blocked DOI-pair intermediate states, the two Springer direct-notice exemplars, and the mixed residual bucket.	Compact reviewer-facing caption text now preserves the live ladder and its publisher-concentrated top-depth caution.	results/dashboard-paper/caption-control-register-v0.1.tsv:CCR-010 ; results/dashboard-paper/procedural-contamination-source-depth-panel-v0.1.tsv:SCPANEL-008-003..SCPANEL-008-007
2026-06-07T20:13:22Z	limen-boost-020	STSPA-020-006	results/boost/limen-boost-012/current-visual-package-reuse-register.tsv	LIMEN-VIS-012	`publisher-visible` and `weak residual` rung wording	Reuse register now names mediated-statement, blocked DOI-pair, two Springer direct-notice, and mixed residual states, and keeps the publisher-diversity blocker explicit.	Machine-readable current-visual routing no longer invites stale Table 1E shorthand during shared package consumption.	results/dashboard-paper/caption-control-register-v0.1.tsv:CCR-010 ; results/boost/limen-boost-048/publication-sequence-contract.tsv:LIMEN-VIS-012
2026-06-07T20:13:22Z	limen-boost-020	STSPA-020-007	results/boost/limen-legal-normative-crosswalk/legal-claim-defense-crosswalk.tsv	research_integrity	`one weak residual bucket`	Crosswalk defense row now states one mixed residual bucket with one archived SSRN platform-action exemplar plus two still-weak residual rows.	Legal/methods crosswalk prose now preserves the live residual-state nuance instead of flattening all residual research-integrity leads into one equally weak floor.	results/dashboard-paper/procedural-contamination-source-depth-panel-v0.1.tsv:SCPANEL-008-007 ; results/boost/limen-boost-032/residual-escape-audit.tsv:REA-032-001..REA-032-003
