impact_id	queue_id	jurisdiction	language	rare_language_priority	current_publication_bucket	candidate_route_now	route_type	minimum_success_delta	maximum_safe_delta_without_new_authority	first_shared_surface_helped	claim_or_caption_surface_helped	still_not_safe_after_success	priority_now	why_now	visualization_dashboard_hook	next_smallest_publishability_move
MRIM-041-001	LMWCS-20260606-004	Slovenia	sl	medium_undercovered	bounded_substantive_row	Human translation review plus at most one official partner/funding/document companion pass.	wording_hardening_plus_optional_companion	Hardens English wording for the existing direct-official exemplar and sharpens pilot-versus-deployment caution.	Keeps the row as the only bounded substantive multilingual exemplar; does not widen it into deployment, legality, procurement, or effectiveness proof without materially stronger official documentation.	Result block 6 main multilingual sentence; Table 1D top-row wording; thesis claim-support note	claims.md:LIMEN-C-013; results/dashboard-paper/caption-control-register-v0.1.tsv:CCR-006; results/dashboard-paper/caption-control-register-v0.1.tsv:CCR-016; results/boost/limen-boost-041/multilingual-translation-review-lift-matrix.tsv:MTRLM-041-001	Production deployment claims, legal/compliance claims, procurement traceability, proportionality, and effectiveness claims.	1	This is the fastest low-risk route that improves main-text multilingual prose without changing package denominator logic.	Jurisdiction/language map legend; authority-upgrade funnel; public-sector edge-case panel	Exploit now at bounded official-project ceiling; only add one official companion pass if it materially sharpens the pilot-versus-deployment ceiling.
MRIM-041-002	LMWCS-20260606-001	Finland	fi	medium_undercovered	bounded_appendix_row	One quick official police, court, or ministry corroboration route paired with human translation review if text is found.	official_corroboration_attempt	If successful, upgrades the Finland row from bounded broadcaster-only comparator to a mixed-authority comparator with phenomenon or response corroboration.	Can strengthen appendix/methods and shard-008 comparator wording, but still should not become a default substantive multilingual row without stronger direct official phenomenon text.	Shard-008 multilingual comparator reuse; Table 1D comparator note; Result block 6 caution paragraph	results/boost/limen-boost-008/finnish-official-escalation-ladder.tsv:FEL-008-001..FEL-008-006; results/dashboard-paper/caption-control-register-v0.1.tsv:CCR-006; results/boost/limen-boost-041/multilingual-result-block-routing.tsv:MRBR-041-002	Prevalence, adjudicated wrongdoing, system-wide legal-process contamination, or clean equivalence with the Slovenian direct-official row.	2	This is the highest-yield threshold-changing multilingual route still considered realistic in `next.md` and the shared routing matrices.	Procedural-contamination timeline; authority-upgrade funnel; jurisdiction/language caution layer	Try one quick official corroboration route; otherwise freeze at bounded broadcaster-grade comparator.
MRIM-041-003	LMWCS-20260606-005	Slovenia	sl	medium_undercovered	bounded_appendix_row	One materially different municipal page/document route or slower browser/human corroboration pass.	official_followthrough_retry	If successful, improves source authority for the Klara municipal-service row and reduces dependence on local-news-only wording.	May strengthen appendix/methods comparator posture, but still does not by itself prove staffing replacement, legality, procurement regularity, or measured service effect.	Institutional-absurdity appendix slice; Table 1D caution overlay; public-sector comparator note	results/boost/limen-boost-041/multilingual-blocker-route-matrix.tsv:MBRM-041-003; results/dashboard-paper/caption-control-register-v0.1.tsv:CCR-006; results/boost/limen-boost-041/multilingual-result-block-routing.tsv:MRBR-041-003	Staffing-replacement claims, procurement claims, legality claims, effectiveness claims, or broad municipal-diffusion claims.	4	Potential gain exists, but the 403-gated municipal follow-through path makes it less attractive than the Finland official-corroboration route.	Institutional-absurdity panel; public-sector edge-case panel; caution-only map overlay	Only retry with a materially different route or browser/human pass; otherwise keep the row frozen at local-news ceiling.
MRIM-041-004	LMWCS-20260606-002	Finland	fi	medium_undercovered	limitations_queue_only	One compliant Kaleva direct-article or public-police companion recovery pass, then human review if text is obtained.	direct_source_recovery	If successful, retires one queue-only row and gives shard 007 or the multilingual package a bounded Finnish deepfake-abuse comparator.	Could promote the row into appendix/limitations-plus or a bounded comparator, but does not by itself justify default-map visibility, prevalence claims, or exact-offense narration without verified dates/framing/anonymization.	Figure 6 queue-to-caution transition candidate; Table 1D limitations row; shard-007 queue note	results/dashboard-paper/caption-control-register-v0.1.tsv:CCR-006; results/dashboard-paper/caption-control-register-v0.1.tsv:CCR-013; results/boost/limen-boost-041/multilingual-result-block-routing.tsv:MRBR-041-004	Verified offense detail, broad deepfake prevalence, police-confirmed case framing, or publication-safe personal detail.	3	This is the only currently realistic unresolved multilingual recovery route named in `next.md`, so it is the best candidate for changing the `1 / 2 / 3` package split.	Queue-depth bar; deepfake blocker-class chart; language-coverage limitations map	Attempt one compliant Kaleva or public-police follow-up before any Lithuania or Estonia retry.
MRIM-041-005	LMWCS-20260606-003	Lithuania	lt	high_undercovered	limitations_queue_only	Alternative clearly compliant public route to the underlying police warning, then human review if reachable.	alternative_public_source_recovery	If successful, turns a high-undercovered blocked lead into a verified limitations/comparator row and clarifies whether the title really tracks police wording and what AI modality is named.	May promote the row out of pure title-gloss status, but stronger fraud/deepfake interpretation still depends on the content actually recovered and on careful authority separation.	High-undercovered limitations note; rare-language methods paragraph; Figure 6 queue overlay	results/dashboard-paper/caption-control-register-v0.1.tsv:CCR-006; results/boost/limen-boost-041/multilingual-rare-language-publication-overlay.tsv:MRPO-041-005; results/boost/limen-boost-041/multilingual-translation-review-lift-matrix.tsv:MTRLM-041-005	Treating 15min.lt framing as the police warning, inferring settled AI modality, or narrating Lithuania as a resolved substantive multilingual row.	5	Scientifically valuable if unlocked, but current rights/access barriers make it a worse immediate route than Kaleva and the Finland official-corroboration path.	Rare-language queue overlay; blocker-class matrix; language-coverage limitations view	Wait for a clearly compliant alternative public route or browser/human pathway before spending more effort.
MRIM-041-006	LMWCS-20260606-006	Estonia	et	high_undercovered	limitations_queue_only	Alternative public source or compliant browser/human route that clarifies the AI role in the exam-failure story.	alternative_public_source_recovery	If successful, clarifies whether the case is even a valid AI-linked education anomaly and may convert one title-level lead into a bounded limitations/comparator row.	Can improve causal-language discipline and possibly retire one queue-only row, but should not become substantive evidence unless the recovered text directly supports the AI role.	Education-anomaly limitations note; Figure 6 queue overlay; methods paragraph on challenge-gated sources	results/dashboard-paper/caption-control-register-v0.1.tsv:CCR-006; results/boost/limen-boost-041/multilingual-rare-language-publication-overlay.tsv:MRPO-041-006; results/boost/limen-boost-041/multilingual-translation-review-lift-matrix.tsv:MTRLM-041-006	Causal claims that AI itself made the decision, validated institutional wrongdoing, or a strong substantive multilingual exemplar.	6	Potentially important, but current challenge gating keeps it behind every faster or cleaner multilingual route.	Rare-language queue overlay; institutional-weirdness limitations panel; language-coverage map	Hold until a compliant browser/human route or alternative public source appears; do not spend further shell-only effort.
