queue_id	signal_id	source_review_role	review_priority	shards	queries	source_path	source_line	reason	claim_ceiling	next_action
BTPS-00116	LIMEN-SIGNAL-CE8C5EA95F27E2EA	translation_candidate_parent_source_extraction	P2_article_relevance_review	public-sector	automated decision	/srv/tyche/pallas/pallas-ai-agent-observatory/reports/PALLAS_READINESS_SPRINT_2_SOURCE_PACK.csv	290	DPA-hosted guidance is relevant parent material on automated decision-making, but not a Hungarian register or case. translation locator: https://www.naih.hu/europai-adatvedelmi-testulet-edpb/edpb-iranymutatasai/file/429-iranymutatas-az-automatizalt-donteshozatallal-es-a-profilalkotassal-kapcsolatbana-2016-679-rendelet-alkalmazasahoz-wp251	parent/source context only; no national register or compliance claim	extract as parent guidance candidate if needed
BTPS-00117	LIMEN-SIGNAL-F88B16B21293FB1B	translation_candidate_parent_source_extraction	P2_article_relevance_review	legal-research	AI evidence	/srv/tyche/atlas/tyche-thesis-atlas-factory/corpus/v0.2-working/data/lanes/russian-language-records.jsonl	183	Russian snippet explicitly discusses post-quantum public-key risk and signature algorithm work; useful technical parent context only. translation locator: https://doi.org/10.51775/2790-0886_2024_64_1_5	technical parent-source context; no deployment, safety, or legal claim	extract for signature-durability background if relevant
BTPS-00118	LIMEN-SIGNAL-66495A858D10245C	translation_candidate_parent_source_extraction	P2_article_relevance_review	public-sector	algorithm register	/srv/tyche/pallas/pallas-ai-agent-observatory/reports/PALLAS_SECOND_PASS_CANDIDATE_MATRIX_DELTA.csv	2120	Local source-refresh metadata identifies a Russian official legal source requiring sectoral lists of trusted high-risk AI systems; published lists were not verified. translation locator: https://adilet.zan.kz/rus/docs/V2600038422	parent legal/source-surface claim only; no actual list, compliance, legality, prevalence, or ranking claim	extract parent source with original-language review before any matrix/paper claim
BTPS-00119	LIMEN-SIGNAL-6D16265867C47E09	translation_candidate_parent_source_extraction	P2_article_relevance_review	public-sector	algorithm register	/srv/tyche/pallas/pallas-ai-agent-observatory/reports/PALLAS_SECOND_PASS_CONFIDENCE_CHANGES.csv	1003	Spanish official publication is locally described as a 2026 catalog of Peruvian State AI applications, but not a formal algorithm register with risk/rights/audit fields. translation locator: https://www.gob.pe/institucion/pcm/informes-publicaciones/6879780-catalogo-de-aplicaciones-con-inteligencia-artificial-en-el-estado-peruano	parent catalog/source-surface claim only; no formal-register, compliance, safety, or completeness claim	extract parent catalog source; keep conservative register wording
BTPS-00120	LIMEN-SIGNAL-7D9CC68DEFA2AD24	translation_candidate_parent_source_extraction	P2_article_relevance_review	public-sector	regulatory sandbox	/srv/tyche/pallas/pallas-ai-agent-observatory/reports/PALLAS_SECOND_PASS_CANDIDATE_MATRIX_DELTA.csv	2008	Local hardening metadata says official dossier/strategy support planned or mandated sandbox provisions, not confirmed operational sandbox. translation locator: https://wdocs-pub.chd.lu/docs/compilation/docpa/pdf/8476_Dossier_Complet.pdf	parent planned/legislative source-surface only; no enacted-law or operational-sandbox claim	extract parent Luxembourg source with explicit draft/planned caveat
BTPS-00121	LIMEN-SIGNAL-926A52050896F7C8	translation_candidate_parent_source_extraction	P2_article_relevance_review	public-sector	regulatory sandbox	/srv/tyche/pallas/pallas-ai-agent-observatory/reports/PALLAS_SECOND_PASS_CANDIDATE_MATRIX_DELTA.csv	1798	Icelandic official source metadata explicitly describes a 2022 healthcare AI regulatory sandbox pilot with supervised guidance; current/general AI Act status was not confirmed. translation locator: https://island.is/frett/sandkassi-sem-oruggt-umhverfi-fyrir-throun-abyrgrar-gervigreindar	parent sandbox-pilot source-surface only; no current operational, legal, safety, compliance, or prevalence claim	extract parent Iceland sandbox-pilot source with current-status caveat
BTPS-00122	LIMEN-SIGNAL-CCACC40DBF8AE9A9	translation_candidate_parent_source_extraction	P2_article_relevance_review	public-sector	regulatory sandbox	/srv/tyche/pallas/pallas-ai-agent-observatory/reports/PALLAS_READINESS_WORLD_SOURCE_PACK.csv	2145	Official French CNIL page title and local row explicitly describe an AI/public-services sandbox with eight projects, but not GF-specific or AI Act proof. translation locator: https://www.cnil.fr/fr/bac-sable-intelligence-artificielle-et-services-publics-la-cnil-accompagne-8-projets-innovants	candidate sandbox-source extraction only; no GF implementation, legal, compliance, safety, prevalence, or ranking claim	extract bounded French CNIL sandbox passages with France-level and non-AI-Act-sandbox caveats
