as_of_utc	rebuttal_row_id	reviewer_question	compact_reviewer_safe_answer	must_travel_with	claim_ceiling_preserved	paper_thesis_use	visualization_hook	next_smallest_publishability_move
2026-06-07T19:11:47Z	CMP-HRRK-038-001	Is the shard-002 comparator package publishable even though only one AVID direct join and one bounded AIID/OECD overlap pilot exist?	Yes, but only as an interoperability-asymmetry and claim-ceiling package. The current evidence supports a reviewer-safe demonstration that six external source families occupy five different publication roles with sharply different exactness ceilings; it does not support a general external-validation, completeness, or replicated-interoperability claim.	results/boost/limen-boost-026/result-block-citation-bundle.tsv:CMP-RBCB-026-001..005 ; results/boost/limen-boost-026/table6a-publication-cells.tsv ; results/boost/limen-boost-050/comparator-threshold-impact-matrix.tsv	Keep the package at role heterogeneity, bounded overlap, and source-specific claim ceilings; do not widen it into completeness, validation-rate, or denominator-performance rhetoric.	Compact publishability-now answer for reviewer rebuttal, cover-letter positioning, thesis defense notes, and methods/results prose.	Table 6A reviewer-warning card; comparator role-ladder inset; hostile-reviewer answer panel.	If comparator work reopens substantively, spend it on one threshold-changing event rather than more packaging-only narration.
2026-06-07T19:11:47Z	CMP-HRRK-038-002	Why are AIID and OECD not treated as one generic incident-database success story once each has one exact overlap pilot?	Because the two rows answer different questions and remain bounded in different ways. AIID is payload-stronger but snapshot-lag bounded; OECD is discovery-stronger but rights/reuse bounded. One exact overlap for each row proves a narrow local same-event pilot, not common mechanics, open reuse, or interchangeable comparator status.	results/boost/limen-boost-002/aiid-oecd-comparator-ceiling-contrast.tsv ; results/boost/limen-boost-026/dashboard-tooltip-contract.tsv:LIMEN-026-DTC-002..003 ; results/boost/limen-boost-014/comparator-threshold-register.tsv:CTR-014-001,CTR-014-002	Keep AIID and OECD as two distinct metadata-first subclasses with one bounded exact overlap each; do not flatten them into one readiness badge or imply bulk/API/archive equivalence.	Compact middle-tier comparator answer for rebuttals, legend text, thesis discussion, and methods appendix.	AIID/OECD subclass-contrast inset; tooltip pair; one-pilot-per-row badge.	Change this answer only if a second exact overlap or materially stronger route mechanics moves one row's ceiling.
2026-06-07T19:11:47Z	CMP-HRRK-038-003	Why not describe the security side as already having two direct comparator joins because AVID and MITRE ATLAS both expose exact identifiers?	Because identifier visibility is not the same as same-case identity. AVID currently has one canonical direct local join tied to an exact security row, while MITRE ATLAS remains a technique/context graph bridge with zero defensible direct local case-study IDs. Product overlap, generalized case context, and exact technique IDs are useful evidence, but they still do not constitute a second direct join.	results/boost/limen-boost-002/security-crosswalk-threshold-recheck.tsv:SCR-002-001..008 ; results/boost/limen-boost-026/table6a-publication-cells.tsv:LIMEN-026-T6A-001,LIMEN-026-T6A-004 ; results/boost/limen-boost-038/comparator-observatory-view-contract.tsv:COVC-038-003	Keep AVID at one canonical direct join and ATLAS at technique-context-only unless one exact ATLAS case-study ID becomes defensible for a seeded local row.	Compact exact-versus-analogue answer for reviewer memos, security methods prose, and thesis interoperability notes.	Security exactness split panel; direct-vs-placeholder badge; ATLAS technique-context gap card.	Prefer one real AVID or ATLAS threshold event over any wording refresh about security comparators.
2026-06-07T19:11:47Z	CMP-HRRK-038-004	Why keep MIT AI Risk and CSET in Table 6A when they still have zero populated local slots?	Because they still do useful but narrower work: MIT AI Risk supplies a visible concept/taxonomy bridge with public dataset metadata and named anchors, while CSET supplies a bounded manual harm-language overlay. Their value is precisely that they show concept-layer and manual-overlay roles without pretending row-level interoperability.	results/boost/limen-boost-002/comparator-claim-ceiling-matrix.tsv:LIMEN-002-CCM-005..006 ; results/boost/limen-boost-014/comparator-threshold-register.tsv:CTR-014-005,CTR-014-006 ; results/boost/limen-boost-038/crosswalk-threshold-route-ladder.tsv:5,6	Keep both rows below row-level interoperability, anonymous export proof, or machine-ingest rhetoric; use them only as concept/manual overlays unless a clearly stronger threshold lands.	Compact overlay-role answer for methods sections, reviewer responses, and thesis limitations language.	Concept-overlay badge; manual-overlay badge; comparator role-ladder legend.	Do not reopen MIT AI Risk or CSET unless a concrete manuscript need or a true threshold event justifies it.
2026-06-07T19:11:47Z	CMP-HRRK-038-005	Does the stronger comparator packaging justify a new shared empirical claim or higher LIMEN evidence tiers?	No. The current gain is package governance, not empirical promotion. The crosswalk stack is stronger, easier to cite, and less drift-prone, but no packaging-only step upgrades LIMEN evidence tiers, creates replicated overlap, proves same-event identity beyond the exact bounded rows, or warrants a new project-level shared empirical claim.	results/boost/limen-boost-014/comparator-claim-admission-register.tsv:CAR-014-001..005 ; results/crosswalks/status.md ; results/boost/limen-boost-050/comparator-shared-promotion-register.tsv	Keep comparator improvements at methods/results-control status until a threshold-changing event materially alters occupancy or exactness.	Compact claim-governance answer for reviewer rebuttal, thesis claim-support maps, and manuscript caution notes.	No-new-shared-claim badge; occupancy-authority note; claim-ceiling sidecar.	Only revisit shared-claim posture after a real occupancy-changing event such as a second AVID join, second AIID/OECD overlap, or first direct ATLAS case-study ID.
2026-06-07T19:11:47Z	CMP-HRRK-038-006	Is the comparator package already a materialized shared dashboard export?	No. It is a bounded local/shared-control package with ready-to-reuse boost-local sources and intended shared export stubs, but the `results/dashboard/` comparator outputs are still blocked on this host and must not be described as already materialized.	results/dashboard-paper/shared-export-promotion-register-v0.1.tsv:exp-015,exp-016 ; results/boost/limen-boost-038/comparator-observatory-view-contract.tsv:COVC-038-005 ; dashboard/limen-dashboard-spec-v0.1.md section 7.6A	Keep packaging readiness separate from filesystem promotion, dashboard materialization, or evidence upgrade language.	Compact export-state answer for dashboard planning, reviewer-response text, and thesis reproducibility notes.	Blocked-export caution badge; comparator export-stub card; observatory-governance note.	If comparator rhetoric is reused again, carry this answer with the observatory-view contract so blocked-export language does not drift.
2026-06-07T19:11:47Z	CMP-HRRK-038-007	What is the next honest comparator move if a reviewer asks for one stronger piece of evidence rather than better framing?	One threshold-changing event only: second canonical AVID direct join first, first defensible direct MITRE ATLAS case-study ID second, then a second exact AIID or OECD overlap only after those higher-yield security thresholds. That order changes publishability more than more route prose, more concept-layer packaging, or more manual-overlay commentary.	results/boost/limen-boost-050/comparator-threshold-impact-matrix.tsv ; results/boost/limen-boost-014/comparator-threshold-register.tsv ; results/boost/limen-boost-038/crosswalk-threshold-route-ladder.tsv	Keep route order explicit and threshold-based; do not reopen already-resolved first-pilot or visible-anchor work as if it were the main frontier.	Compact next-move answer for reviewer memos, future-work paragraphs, and thesis route maps.	Threshold frontier card; route-order badge; comparator publishability ladder.	If another shard-002 cycle opens, prefer the ranked frontier above over any new prose-only synchronization.
2026-06-07T20:05:53Z	CMP-HRRK-038-008	Why do AIID incident `653` and OECD incident `2024-03-18-0cfc` still not count as second overlaps if they clearly match the SEC AI-washing event family?	Because they are visible aggregate collisions, not row-exact second overlaps. Each external record collapses two split LIMEN settled-order rows (`LIMEN-000006` and `LIMEN-000007`) into one joint SEC action record, so current one-external-record-to-one-local-row denominator discipline keeps both as sidecar-only methods/limitations material rather than occupancy growth.	results/boost/limen-boost-026/aggregate-collision-publication-cells.tsv ; results/boost/limen-boost-026/aggregate-record-linkage-governor.tsv ; results/boost/limen-boost-026/comparator-collision-audit.tsv	Keep visible aggregate same-event-family coverage explicit, but do not narrate it as a second canonical AIID/OECD pilot, denominator growth, or unrestricted interoperability.	Compact exact-vs-aggregate answer for reviewer rebuttal, thesis defense, methods appendix, and Table 6A limitation prose.	Comparator-governance card; exact_overlap_denominator versus aggregate_collision_sidecar badge.	Only change this answer if LIMEN deliberately adopts a separate file-qualified aggregate-linkage sidecar with denominator separation, or if a true one-row-to-one-row second overlap appears elsewhere.
