source_id	source_name	current_interoperability_class	local_occupancy_now	safe_manuscript_claim_now	claim_support_paths	forbidden_overread_now	best_current_anchor	paper_or_thesis_use	figure_table_dashboard_hook	next_threshold_event
aiid	AI Incident Database (AIID)	bounded public incident comparator with one verified page-data route and one bounded same-event overlap pilot	1 bounded exact same-event overlap pilot (`LIMEN-000008 -> 628`)	AIID currently contributes one verified machine-readable public incident route with exact incident, report, actor, system, and taxonomy fields plus one bounded same-event overlap pilot on `LIMEN-000008`, while bulk/API equivalence remains unverified.	results/crosswalks/source-crosswalk-v0.1.tsv:aiid; results/crosswalks/field-map-appendix-v0.1.tsv:aiid; results/crosswalks/seed-import-join-prototype-v0.1.tsv:aiid; results/boost/limen-boost-038/crosswalk-priority-board.tsv:aiid	Do not describe AIID as a general joined LIMEN layer, as a verified complete bulk/API feed, or as contradicted by snapshot absence for later incidents.	LIMEN-000008 (FCC/Lingo deepfake robocall enforcement)	Methods appendix sentence for machine-readable comparator strength with explicit one-row occupancy caution.	Table/legend row separating payload-rich comparator surfaces from bounded live local occupancy.	A second independently justified same-event pilot overlap for another seeded LIMEN row.
oecd_aim_incidents	OECD AI Incidents Monitor	metadata-first official incident comparator with verified detail JSON, vocab facets, and one bounded same-event overlap pilot	1 bounded exact same-event overlap pilot (`LIMEN-000001 -> 2023-03-31-960d`)	OECD currently contributes an official public discovery chain from incident index to detail JSON and country/language/concept facets plus one bounded exact same-event overlap pilot on `LIMEN-000001`, while reuse remains metadata-first and rights-bounded.	results/crosswalks/source-crosswalk-v0.1.tsv:oecd_aim_incidents; results/crosswalks/field-map-appendix-v0.1.tsv:oecd_aim_incidents; results/crosswalks/seed-import-join-prototype-v0.1.tsv:oecd_aim_incidents; results/boost/limen-boost-038/crosswalk-priority-board.tsv:oecd_aim_incidents	Do not describe OECD as open for unrestricted export, as a verified bulk-reuse feed, or as a multi-row local overlap layer.	LIMEN-000001 (Italian DPA / ChatGPT order)	Methods/results sentence for multilingual policy-facing comparator design with rights-aware one-row occupancy caution.	Country-language comparator panel and official-metadata-rights legend.	A second justified same-event slug-level overlap or a stronger public reuse statement.
avid	AI Vulnerability Database (AVID)	machine-ready vulnerability/report bridge with one canonical direct join and explicit placeholder controls	9 populated security rows: 1 canonical direct, 8 placeholder or non-canonical	AVID is the only source in the six-source package that already supports one canonical direct LIMEN security-row join, while the rest of the populated AVID slots remain explicit non-match or non-canonical placeholders.	results/crosswalks/source-crosswalk-v0.1.tsv:avid; results/crosswalks/field-map-appendix-v0.1.tsv:avid; results/crosswalks/seed-import-join-prototype-v0.1.tsv:avid; results/boost/limen-boost-038/crosswalk-priority-board.tsv:avid	Do not flatten all non-empty AVID slots into positive joins or describe AVID as a general public incident census.	LIMEN-000002 (Langflow custom_component RCE candidate)	Security-subsection sentence demonstrating one exact external join without inflating broader interoperability.	Direct-vs-placeholder join panel for a methods appendix or security dashboard card.	A second canonical AVID join on another LIMEN security row.
mitre_atlas	MITRE ATLAS	structured security graph bridge centered on technique context rather than direct case-study identity	9 populated security rows: 0 direct case-study, 9 technique-context	MITRE ATLAS currently strengthens LIMEN as a security technique and mitigation graph, but the local package still has no defensible direct ATLAS case-study ID join.	results/crosswalks/source-crosswalk-v0.1.tsv:mitre_atlas; results/crosswalks/field-map-appendix-v0.1.tsv:mitre_atlas; results/crosswalks/seed-import-join-prototype-v0.1.tsv:mitre_atlas; results/boost/limen-boost-038/crosswalk-priority-board.tsv:mitre_atlas	Do not describe ATLAS technique links as same-event case-study matches or as a universal incident chronology layer.	LIMEN-000001 (Auto-GPT sandbox escape)	Security methods/results sentence explaining technique-context interoperability with explicit case-study-gap language.	Technique-context versus direct-case-study split panel for Figure/Table security overlays.	One defensible direct ATLAS case-study ID or continued explicit technique-only framing.
mit_ai_risk_repo	MIT AI Risk Repository	concept-level taxonomy and risk-definition overlay	0 populated local rows	MIT AI Risk currently supports category-level risk-language harmonization through visible public taxonomy anchors and licensed dataset metadata, not row-level event joins.	results/crosswalks/source-crosswalk-v0.1.tsv:mit_ai_risk_repo; results/crosswalks/field-map-appendix-v0.1.tsv:mit_ai_risk_repo; results/crosswalks/seed-import-join-prototype-v0.1.tsv:mit_ai_risk_repo; results/boost/limen-boost-038/crosswalk-priority-board.tsv:mit_ai_risk_repo	Do not describe MIT AI Risk as a seeded incident comparator, object-level anonymous export, or current case-level crosswalk.	deepfake_or_synthetic_identity category	Methods/limitations sentence clarifying concept-layer interoperability for residual and heatmap interpretation.	Concept-only overlay badge on taxonomy heatmap and category appendix.	One stronger anonymous object/export proof or one shared promotion event for the current named-anchor/category bridge.
cset_ai_harm	CSET AI Harm taxonomy / overview	manual conceptual-harm overlay	0 populated local rows	CSET currently contributes citation-level harm-language interpretation for well-supported LIMEN categories, not machine-readable or row-level interoperability.	results/crosswalks/source-crosswalk-v0.1.tsv:cset_ai_harm; results/crosswalks/field-map-appendix-v0.1.tsv:cset_ai_harm; results/crosswalks/seed-import-join-prototype-v0.1.tsv:cset_ai_harm; results/boost/limen-boost-038/crosswalk-priority-board.tsv:cset_ai_harm	Do not describe CSET as an ingest source, machine-readable taxonomy feed, or populated case-level overlay.	education_workplace_or_hr category	Related-work sentence for harm-language interpretation where authoritative LIMEN support is already strong.	Manual-overlay badge on related-work appendix and category interpretation view.	A second low-drift manual review pass before any row-level overlay is surfaced.
