audit_id	access_date	lane_id	target_case_id	route_id	frontier_role	platform	cve_id	mechanism_family	current_publication_bucket	current_authority_family	best_scholarly_publication_state_now	best_exact_signal_state_now	row_level_technical_fit_state_now	what_is_already_present_now	missing_closure_component_now	paper_thesis_value_if_closed	next_smallest_publishability_move	table_or_dashboard_hook	must_keep_caution	local_evidence_paths
SEC-040-PFG-001	2026-06-08	limen-boost-040	LIMEN-000006	SEC-PRF-001	pair_frontier_exact_signal_leader	LangChain	CVE-2023-29374	unsafe_code_execution	2_appendix_supporting_results	independent_lab_source_qualified_fix	conference_grade_published_disclosure_paper_but_not_row_level_case_analysis; preprint_or_CoRR_only	exact_live_cve_mention_for_CVE-2023-29374	exact_cve_signal_present_but_best_published_item_is_disclosure_context_not_live_vulnerable_path_analysis	exact_live_cve_subthreshold_signals_now_split_between_preprint_and_conference_grade_disclosure_for_LIMEN-000006	incident_specific_technical_analysis_of_cve_2023_29374_or_same_llmmathchain_exec_path	Would close the package-level peer-reviewed gap through the strongest current independent-lab framework row and create the cleanest reviewer-safe scholarly ladder example.	One peer-reviewed paper, workshop paper, or conference-grade technical case writeup with incident-specific discussion that maps directly to CVE-2023-29374 or CVE-2024-3271.	security_peer_review_fit_panel; case=LIMEN-000006; route=SEC-PRF-001	Keep ATLAS linkage technique-level only unless the scholarly source itself gives a defensible exact mapping. Publication status alone no longer explains the blocker; the remaining blocker is row-level technical fit.	results/security/security-agentic-publication-cell-matrix-v0.1.tsv:LIMEN-000006 ; results/security/security-agentic-peer-review-frontier-v0.1.tsv:SEC-PRF-001 ; results/security/security-agentic-scholarly-screening-v0.1.tsv ; results/security/security-agentic-scholarly-threshold-board-v0.1.tsv ; data/cases/security-agentic-candidates.jsonl:LIMEN-000006
SEC-040-PFG-002	2026-06-08	limen-boost-040	LIMEN-000007	SEC-PRF-001	pair_frontier_zero_hit_partner	LlamaIndex	CVE-2024-3271	unsafe_code_execution	2_appendix_supporting_results	independent_lab_source_qualified_fix	no_case_specific_scholarly_signal_recovered_in_local_threshold_board	no_case_specific_exact_signal_recovered_in_local_threshold_board	no_exact_case_specific_scholarly_signal_recovered_in_bounded_live_or_local_pass	exact_live_cve_subthreshold_signals_now_split_between_preprint_and_conference_grade_disclosure_for_LIMEN-000006	first_incident_specific_public_case_analysis_for_cve_2024_3271_or_same_safe_eval_path	Would convert the paired LangChain/LlamaIndex framework route from asymmetric pair logic into a true two-row independent-lab scholarly slice.	One peer-reviewed paper, workshop paper, or conference-grade technical case writeup with incident-specific discussion that maps directly to CVE-2023-29374 or CVE-2024-3271.	security_peer_review_fit_panel; case=LIMEN-000007; route=SEC-PRF-001	Keep ATLAS linkage technique-level only unless the scholarly source itself gives a defensible exact mapping. Publication status alone no longer explains the blocker; the remaining blocker is row-level technical fit.	results/security/security-agentic-publication-cell-matrix-v0.1.tsv:LIMEN-000007 ; results/security/security-agentic-peer-review-frontier-v0.1.tsv:SEC-PRF-001 ; results/security/security-agentic-scholarly-screening-v0.1.tsv ; results/security/security-agentic-scholarly-threshold-board-v0.1.tsv ; data/cases/security-agentic-candidates.jsonl:LIMEN-000007
SEC-040-PFG-003	2026-06-08	limen-boost-040	LIMEN-000003	SEC-PRF-002	core_row_exact_preprint_but_no_published_case_fit	Claude Code	CVE-2025-55284	exfiltration_or_credential_exposure	1_core_results	vendor_advisory_exact_fix_visible	preprint_only	exact_incident_narrative_for_CVE-2025-55284; exact_live_cve_mention_for_CVE-2025-55284	exact_incident_preprints_and_platform_overlap_exist_but_no_published_row_level_case_support	two_exact_live_cve_subthreshold_signals_plus_same_platform_publication_diversity_but_no_exact_published_case_support_for_LIMEN-000003	published_or_conference_grade_case_analysis_for_cve_2025_55284	Would give a core-results exfiltration/control-failure row external analytical depth beyond vendor remediation and strengthen approval-boundary discussion.	One citable public technical case analysis, conference paper, or workshop paper discussing the unauthorized file-read/network-exfiltration flaw with enough specificity to map to CVE-2025-55284.	security_peer_review_fit_panel; case=LIMEN-000003; route=SEC-PRF-002	Do not treat same-platform scholarship or generic agent-safety synthesis as row-specific support, and do not let publication status alone substitute for exact incident fit.	results/security/security-agentic-publication-cell-matrix-v0.1.tsv:LIMEN-000003 ; results/security/security-agentic-peer-review-frontier-v0.1.tsv:SEC-PRF-002 ; results/security/security-agentic-scholarly-screening-v0.1.tsv ; results/security/security-agentic-scholarly-threshold-board-v0.1.tsv ; data/cases/security-agentic-candidates.jsonl:LIMEN-000003
SEC-040-PFG-004	2026-06-08	limen-boost-040	LIMEN-000008	SEC-PRF-003	mechanism_diversity_upgrade_candidate	LangChain	CVE-2026-44843	memory_state_contamination	1_core_results	vendor_advisory_exact_fix_visible	no_case_specific_scholarly_signal_recovered_in_local_threshold_board	no_case_specific_exact_signal_recovered_in_local_threshold_board	mechanism_diversity_row_has_no_clean_incident_specific_scholarly_attachment	no_clean_incident_specific_scholarly_match_found_in_bounded_local_scan	first_incident_specific_memory_state_contamination_case_analysis	Would improve mechanism diversity by adding external analytical depth to memory/state contamination rather than another unsafe-code-execution row.	One peer-reviewed or conference-grade technical treatment of unsafe deserialization, runtime memory contamination, or attacker-controlled state revival tied directly to CVE-2026-44843 or the same vulnerable LangChain runtime path.	security_peer_review_fit_panel; case=LIMEN-000008; route=SEC-PRF-003	Keep realized-incident language out of scope unless the scholarly source itself provides it.	results/security/security-agentic-publication-cell-matrix-v0.1.tsv:LIMEN-000008 ; results/security/security-agentic-peer-review-frontier-v0.1.tsv:SEC-PRF-003 ; results/security/security-agentic-scholarly-screening-v0.1.tsv ; results/security/security-agentic-scholarly-threshold-board-v0.1.tsv ; data/cases/security-agentic-candidates.jsonl:LIMEN-000008
SEC-040-PFG-005	2026-06-08	limen-boost-040	LIMEN-000002	SEC-PRF-004	exact_avid_singleton_with_notice_depth_weakness	Langflow	CVE-2024-37014	unsafe_code_execution	3_limitations_queue_only	candidate_exact_join_notice_gap	no_case_specific_scholarly_signal_recovered_in_local_threshold_board	no_case_specific_exact_signal_recovered_in_local_threshold_board	exact_avid_singleton_still_has_no_clean_row_specific_scholarly_attachment	no_clean_incident_specific_scholarly_match_found_in_bounded_local_scan	row_specific_case_analysis_plus_separate_vendor_notice_improvement	Would strengthen the only exact-AVID singleton, but still would not remove the separate vendor-notice weakness without a direct remediation statement.	One public scholarly or conference-grade technical case analysis tied directly to CVE-2024-37014 or the custom_component RCE path, plus preferably a direct vendor remediation statement on the existing official surfaces. Keep scholarly and vendor-notice axes separate if only one lands.	security_peer_review_fit_panel; case=LIMEN-000002; route=SEC-PRF-004	Do not let a future scholarly attachment substitute for missing vendor remediation certainty; those are separate axes.	results/security/security-agentic-publication-cell-matrix-v0.1.tsv:LIMEN-000002 ; results/security/security-agentic-peer-review-frontier-v0.1.tsv:SEC-PRF-004 ; results/security/security-agentic-scholarly-screening-v0.1.tsv ; results/security/security-agentic-scholarly-threshold-board-v0.1.tsv ; data/cases/security-agentic-candidates.jsonl:LIMEN-000002
