case_id	cve_id	record_status	evidence_tier	title	primary_source_id	primary_source_url	access_date	language	jurisdiction	ai_system_type	autonomy_level	impact_surface	limen_categories	mitre_atlas_mapping	avid_mapping	owasp_llm_agentic_mapping	severity	mitigation_or_response	paper_use_note	verification_gap
LIMEN-WEB4-085		Brazilian Civil/Federal Police; COAF	T2_contested_or_interim	Brazil — Federal Police bust Gisele Bundchen deepfake-ad fraud ring	Brazilian Civil/Federal Police; COAF | Oct 2025; 4 arrested; >R$20M frozen	https://www.thestar.com.my/news/world/2025/10/04/brazilian-scammers-raking-in-millions-used-gisele-bundchen-deepfakes-on-instagram-ads	2026-06-14		Brazil	deepfake		legal/regulatory/algorithmic	deepfake_or_synthetic_identity						Brazilian police arrested four and froze millions in a ring using AI deepfakes of celebrities in ads.	Charges/convictions pending.
LIMEN-WEB4-086		Federal Public Ministry (MPF); ANPD	T2_contested_or_interim	Brazil — MPF/ANPD order xAI to curb Grok sexualised deepfakes	Federal Public Ministry (MPF); ANPD | Recommendation 20 Jan 2026; escalated 11 Feb 2026	https://www.techpolicy.press/x-tried-to-sidestep-brazils-inquiry-on-ai-deepfakes-the-government-just-pushed-back/	2026-06-14		Brazil	deepfake		legal/regulatory/algorithmic	deepfake_or_synthetic_identity						Brazilian regulators/prosecutors ordered xAI/X to prevent Grok generating non-consensual sexualised deepfakes, under threat of daily fines.	No final penalty imposed.
LIMEN-WEB4-087		European Commission (DSA)	T2_contested_or_interim	EU — European Commission opens DSA proceedings against X over Grok deepfakes	European Commission (DSA) | Proceedings opened 26 Jan 2026 (IP/26/203)	https://ec.europa.eu/commission/presscorner/detail/en/ip_26_203	2026-06-14		European Union	deepfake		legal/regulatory/algorithmic	deepfake_or_synthetic_identity						The European Commission opened formal DSA proceedings against X over Grok-generated non-consensual intimate imagery and CSAM.	Open proceedings; no finding/fine.
LIMEN-WEB4-088		Amsterdam District Court	T3_authoritative_source	Netherlands — Amsterdam District Court orders X/xAI to stop Grok sexual-abuse content	Amsterdam District Court | Order 26 Mar 2026; EUR 100,000/day penalty	https://www.techpolicy.press/dutch-court-orders-x-grok-to-stop-aigenerated-sexual-abuse-content/	2026-06-14		Netherlands	deepfake		legal/regulatory/algorithmic	deepfake_or_synthetic_identity						A Dutch court ordered X and xAI to stop Grok generating non-consensual sexual and child-abuse imagery, with a EUR 100,000/day penalty.	Civil injunction subject to possible appeal.
LIMEN-WEB4-089		Almeria Provincial Prosecutor's Office	T2_contested_or_interim	Spain (Almeria) — prosecutor investigates AI deepfake nudes of students	Almeria Provincial Prosecutor's Office | Investigation 2025; >=18 students targeted (ClothOff)	https://www.usnews.com/news/world/articles/2025-07-27/spanish-teenager-investigated-over-ai-naked-images-of-classmates	2026-06-14		Spain	deepfake		legal/regulatory/algorithmic	deepfake_or_synthetic_identity						A Spanish prosecutor opened an investigation into AI-generated deepfake nude images of at least 18 schoolchildren.	Investigation stage. | VERIFIED: The Almeria Fiscalia investigation into 18+ minors via ClothOff was disclosed in March 2026 (revealed 17 Mar 2026 at University of Almeria), not 2025; the listed 2025 source URL is actually the Valencia case.
LIMEN-WEB4-090		Spanish National Police / juvenile prose	T2_contested_or_interim	Spain (Valencia) — 17-year-old investigated over AI deepfake nudes of classmates	Spanish National Police / juvenile prosecution | July 2025; 16 classmates targeted	https://petapixel.com/2025/07/28/17-year-old-boy-investigated-over-ai-generated-nude-videos-of-classmates/	2026-06-14		Spain	deepfake		legal/regulatory/algorithmic	deepfake_or_synthetic_identity						Spanish authorities are investigating a teenager for creating and selling AI deepfake nude images of 16 classmates.	Investigation stage; minor. | VERIFIED: The investigating authority is the Guardia Civil (case before a Valencia youth court), not the Spanish National Police.
LIMEN-WEB4-091		SEC	T2_contested_or_interim	SEC charges Morocoin/Berge/Cirkor + four AI 'investment clubs' in $14M crypto scam	SEC | PR 2025-144; D. Colo. 25-cv-04102, 22 Dec 2025	https://www.sec.gov/newsroom/press-releases/2025-144-sec-charges-three-purported-crypto-asset-trading-platforms-four-investment-clubs-scheme-targeted	2026-06-14		United States	purported AI crypto-investment tips / fake AI platforms		legal/regulatory/algorithmic	finance_insurance_or_market						SEC alleges defendants lured investors with supposedly AI-generated tips and fake AI crypto platforms, misappropriating at least $14M.	Complaint stage; unadjudicated.
LIMEN-WEB4-092		DOJ (EDNY)	T2_contested_or_interim	DOJ indicts former iLearningEngines CEO & CFO over fabricated AI-automation revenue	DOJ (EDNY) | 10-count indictment unsealed 17 Apr 2026	https://www.justice.gov/usao-edny/pr/former-chief-executive-officer-and-chief-financial-officer-nasdaq-listed-company	2026-06-14		United States	AI business-automation platform (Nasdaq: AILE)		legal/regulatory/algorithmic	ai_washing_or_false_ai_claim						DOJ alleges the executives inflated revenue by hundreds of millions via sham contracts while pitching iLearning as an AI automation company.	Charges are accusations only; unproven.
LIMEN-WEB4-093		FTC	T3_authoritative_source	FTC final order vs accessiBe over deceptive AI web-accessibility claims	FTC | Matter 2223156; final order Apr 2025; $1,000,000	https://www.ftc.gov/news-events/news/press-releases/2025/01/ftc-order-requires-online-marketer-pay-1-million-deceptive-claims-its-ai-product-could-make-websites	2026-06-14		United States	AI web-accessibility overlay (accessWidget)		legal/regulatory/algorithmic	ai_washing_or_false_ai_claim						FTC found accessiBe falsely claimed its AI tool could make any website WCAG-compliant and used undisclosed paid reviews; $1M order.	Consent order without admission.
LIMEN-WEB4-094		FTC	T3_authoritative_source	FTC final order vs Sitejabber (Govest) over AI review-platform misrepresentations	FTC | Complaint Nov 2024; final consent order Jan 2025	https://www.ftc.gov/news-events/news/press-releases/2025/01/ftc-approves-final-order-against-sitejabber-which-misrepresented-ratings-reviews-consumers-who-had	2026-06-14		United States	AI-enabled consumer ratings/reviews platform		legal/regulatory/algorithmic	ai_washing_or_false_ai_claim						FTC found Sitejabber deceptively presented pre-purchase ratings as genuine post-experience reviews, inflating ratings/review counts.	Consent order without admission. | VERIFIED: The FTC respondent is GGL Projects, Inc. (d/b/a Sitejabber), not 'Govest'.
LIMEN-WEB4-095		FTC	T2_contested_or_interim	FTC settlement vs Cox Media Group over fake 'Active Listening' AI ad-targeting	FTC | Press release 21 May 2026; ~$930,000	https://www.ftc.gov/news-events/news/press-releases/2026/05/ftc-require-cox-media-group-two-other-firms-pay-nearly-1-million-settle-charges-they-deceived	2026-06-14		United States	claimed AI 'active listening' voice ad-targeting		legal/regulatory/algorithmic	ai_washing_or_false_ai_claim						FTC charged firms marketed an AI 'active listening' service that captured device voice for ad targeting, when it actually resold data-broker lists.	Proposed settlement, not yet final; no admission.
LIMEN-WEB4-096		Massachusetts AG	T3_authoritative_source	Massachusetts AG settlement vs Earnest over AI student-loan underwriting fair-lending	Massachusetts AG | 10 July 2025; $2.5M Assurance of Discontinuance	https://www.mass.gov/news/ag-campbell-announces-25-million-settlement-with-student-loan-lender-for-unlawful-practices-through-ai-use-other-consumer-protection-violations	2026-06-14		United States	AI/ML student-loan underwriting models		legal/regulatory/algorithmic	finance_insurance_or_market						The Massachusetts AG settled allegations that Earnest failed to mitigate disparate-impact fair-lending risk in its AI underwriting models ($2.5M AOD).	Settled without admission.
LIMEN-WEB4-097		Pennsylvania AG	T3_authoritative_source	Pennsylvania AG settlement vs Home365 over AI property-management failures	Pennsylvania AG | AVC, Allegheny County; announced June 2025; $45,000	https://www.attorneygeneral.gov/taking-action/ag-sunday-reaches-settlement-with-property-management-company-regarding-a-i-based-platform-resulting-in-maintenance-delays/	2026-06-14		United States	AI-based property-management operations platform		legal/regulatory/algorithmic	ai_washing_or_false_ai_claim						The Pennsylvania AG settled allegations that Home365's AI-based platform contributed to maintenance delays and unsafe housing ($45K AVC).	Settled without admission.
