priority_rank	subject_id	subject_kind	mechanism_family	trust_boundary_slice	current_package_state	external_interoperability_state	authority_shape_now	paper_or_thesis_use_now	why_not_stronger_yet	next_smallest_publishability_move	threshold_value_if_move_lands	dashboard_or_visual_hook	local_evidence_paths	access_date
1	SEC-TBB-001	seed_case	supply_chain_or_plugin_extension	mcp_deployment_secret_exposure	seeded_appendix_row	exact_avid_join_present; no_exact_atlas_case	vendor_advisory_exact_fix_visible	Use as the strongest seeded trust-boundary row when the paper needs one exact external interoperability example inside the supply-chain / deployment slice.	Current authority still depends on GitHub advisory + AVID + release metadata for one MCP deployment utility; no exact ATLAS same-case object was verified and the home-folder access precondition must stay visible.	Seek one exact ATLAS same-case join or one strong independent public-security analysis mapped directly to ToolHive rather than another MCP packaging memo.	Would give the trust-boundary slice one stronger non-vendor or exact-ATLAS attachment without widening the seed.	trust_boundary_breadth_panel; exact_join_cell; limitations_ladder	results/security/security-agentic-watch-v0.1.tsv:LIMEN-000016; results/security/security-agentic-publication-cell-matrix-v0.1.tsv:LIMEN-000016; results/security/security-agentic-case-support-register-v0.1.tsv:LIMEN-000016; results/security/security-agentic-toolhive-promotion-board-v0.1.tsv	2026-06-08
2	LIMEN-000012	seed_case	supply_chain_or_plugin_extension	mcp_browser_control_trust_boundary	seeded_appendix_row	no_external_join_visible	vulnerability_record_plus_vendor_release_note	Use as the reviewer-safe row showing that the package already has one MCP/browser-control trust-boundary event with public vulnerability-record grounding.	The row is still release-note-qualified rather than advisory-grade and does not justify ecosystem prevalence rhetoric or non-MCP breadth claims.	Seek one independent public-security analysis or one exact ATLAS same-case join for this row before treating it as more than a bounded MCP exemplar.	Would strengthen the weaker of the two seeded MCP rows without changing the denominator.	trust_boundary_breadth_panel; authority_shape_split	results/security/security-agentic-watch-v0.1.tsv:LIMEN-000012; results/security/security-agentic-publication-cell-matrix-v0.1.tsv:LIMEN-000012; results/security/security-agentic-case-support-register-v0.1.tsv:LIMEN-000012; results/security/security-agentic-next-route-board-v0.1.tsv:SEC-NRB-004	2026-06-08
3	LIMEN-000009	seed_case	identity_boundary_abuse	non_mcp_workspace_authorization_boundary	seeded_appendix_row	no_external_join_visible	vendor_advisory_exact_fix_visible	Use as the current non-MCP trust-boundary counterweight so security prose does not imply the whole slice is MCP-only.	The row is still vendor-advisory-centric and lacks direct AVID or ATLAS interoperability, so it cannot yet carry broad non-MCP authority claims by itself.	Seek one second non-framework identity / authorization-boundary attachment or one direct external interoperability join for PraisonAI before claiming balanced trust-boundary diversity.	Would let the trust-boundary slice show broader non-MCP depth instead of one isolated authorization exemplar.	trust_boundary_breadth_panel; mechanism_diversity_matrix	results/security/security-agentic-watch-v0.1.tsv:LIMEN-000009; results/security/security-agentic-publication-cell-matrix-v0.1.tsv:LIMEN-000009; results/security/security-agentic-case-support-register-v0.1.tsv:LIMEN-000009	2026-06-08
4	SEC-SCF-001	frontier_candidate	supply_chain_or_plugin_extension	non_mcp_cloud_agent_dependency_and_allowlist_surface	frontier_not_promoted	no_event_grade_join_or_case_support	provider_docs_only_in_local_package	Use only as a queue row showing where a non-MCP trust-boundary event would materially improve breadth if a bounded public vulnerability/advisory later appears.	Local evidence documents cloud-agent firewall, package-registry allowlist, browser-download, and ephemeral-execution surfaces, but no public vulnerability/advisory or realized control-failure event tied to those surfaces is in the local package.	Wait for one bounded public vulnerability/advisory, incident writeup, or official remediation notice tied directly to Copilot cloud-agent trust boundaries.	Would create a non-MCP supply-chain or dependency-trust event and reduce the impression that the seeded trust-boundary family is mainly MCP-shaped.	frontier_queue; trust_boundary_gap_map	results/security/security-agentic-supply-chain-frontier-v0.1.tsv:SEC-SCF-001; /srv/tyche/gaia/tyche-research-vault/data/global-agent-atlas-v0.1/source_documents.jsonl document_ids github-copilot-cloud-agent-docs-20260603 and cycle284-github-copilot-cloud-agent-firewall-docs-20260604	2026-06-08
5	SEC-SCF-003	frontier_candidate	supply_chain_or_plugin_extension	financial_agent_toolkit_and_mcp_permissions	frontier_not_promoted	no_event_grade_join_or_case_support	provider_docs_only_in_local_package	Use only as a frontier candidate for future agent-to-financial-infrastructure trust-boundary work, not as current seeded security evidence.	Local evidence shows a high-stakes tool surface plus human-confirmation and restricted-key cautions, but no bounded public vulnerability/advisory, official postmortem, or defensible incident-grade public failure is attached.	Wait for one event-grade public vulnerability/advisory, official postmortem, or defensible incident writeup tied to Stripe MCP or the agent toolkit permission surface.	Would open a distinct non-MCP, non-browser-control trust-boundary family with high publication value, but only after a real public event exists.	frontier_queue; sector_specific_security_map	results/security/security-agentic-supply-chain-frontier-v0.1.tsv:SEC-SCF-003; /srv/tyche/gaia/tyche-research-vault/data/global-agent-atlas-v0.1/source_documents.jsonl document_ids doc-stripe-mcp-server-2026-06-01 and doc-stripe-agent-toolkit-2026-06-01	2026-06-08
6	SEC-TBB-006	route_summary	cross_family_trust_boundary_route	seeded_vs_frontier_balance	package_route_control	seeded_trust_boundary_slice=3_rows; exact_external_join=1_row; mcp_specific=2_rows; seeded_non_mcp=1_row	synthetic_summary_from_local_package	Use as the front door when reviewer-facing prose must explain why the next trust-boundary move is breadth or stronger attachment rather than another packaging pass.	The package already has enough rows to discuss a bounded trust-boundary slice, but it remains skewed toward MCP/deployment surfaces and still lacks a second seeded non-MCP event or an exact-ATLAS / independent attachment for the current pair.	Prioritize one threshold-changing state only: non-MCP event-grade trust-boundary case, or exact-ATLAS / independent attachment for Playwright MCP or ToolHive.	Would convert the current reviewer-visible breadth blocker into a cleaner methods/results argument about trust-boundary heterogeneity.	trust_boundary_breadth_panel; reviewer_objection_router; next_route_register	results/security/security-agentic-watch-v0.1.tsv; results/security/security-agentic-next-route-board-v0.1.tsv:SEC-NRB-004; results/security/security-agentic-supply-chain-frontier-v0.1.tsv; results/security/security-agentic-publication-cell-matrix-v0.1.tsv	2026-06-08
