audit_id	target_case_id	route_context	query_surface	query_string_or_surface	observed_result_shape	best_visible_hit	publication_state_signal	exact_incident_fit_state	decision_effect_now	caution
SGRA-001	LIMEN-000006	peer_reviewed_gap_primary_baseline	OpenAlex exact-CVE search	LLMMathChain CVE-2023-29374	2 hits; one exact-title arXiv-hosted Agent Audit record plus one broader prompt-injection preprint	Agent Audit: A Security Analysis System for LLM Agent Applications	preprint_or_repository_bound_only	strongest_exact_live_signal_but_still_subthreshold	Keeps LIMEN-000006 as the first scholarly attach point for GAP-peer_reviewed_security_case_support.	Do not treat OpenAlex article labeling on an arXiv-hosted record as venue-grade publication or incident-specific technical closure by itself.
SGRA-002	LIMEN-000003	peer_reviewed_gap_secondary_contrast	OpenAlex exact-CVE search	"CVE-2025-55284"	4 hits; one exact Claude Code preprint, one broader agent-systems preprint, plus at least one article-class false-positive/mixed-fit record	Systems Security Foundations for Agentic Computing; Agent Security is a Systems Problem	preprint_only_for_exact_incident_fit	multiple_exact_or_near_exact_subthreshold_signals_but_no_exact_published_case_support	Strengthens LIMEN-000003 as a sharper secondary scholarly route than LIMEN-000008, but still below the package zero-state route anchored on LIMEN-000006.	Keep article-class false positives and broad agent-systems framing separate from exact CVE-mapped row support.
SGRA-003	LIMEN-000003	peer_reviewed_gap_secondary_contrast	OpenAlex broad platform search	"Claude Code" exfiltration	127 hits; same-platform SSRN item, broader coding-agent preprints, and one published platform-level synthesis	The Claude Code Leak: A Complete Technical & Security Investigation; What 2025 taught us about AI agent security: A practitioner's guide to the incidents shaping enterprise adoption	same_platform_or_platform_level_only_not_same_incident_case_closure	no_exact_published_case_support_for_CVE_2025_55284	Confirms that publication-state diversity around Claude Code does not close the exact incident-support rule for LIMEN-000003.	Do not let same-platform scholarship or platform-level published synthesis stand in for the unauthorized file-read/network-exfiltration CVE itself.
SGRA-004	LIMEN-000003	peer_reviewed_gap_secondary_contrast	Crossref exact-title query	Claude Code Leak	High-noise results, but first hit resolves to SSRN Electronic Journal record for a different Claude Code incident line	The Claude Code Leak: A Complete Technical & Security Investigation	ssrn_same_platform_different_incident	no_exact_published_case_support_for_CVE_2025_55284	Adds a reproducible Crossref check showing that visible DOI-bearing Claude Code scholarship still belongs to a different incident lineage.	Crossref title queries for CVE and platform strings are noisy and should be treated as route-screening evidence, not proof of absence.
SGRA-005	LIMEN-000008	mechanism_diversity_authority_upgrade_contrast	OpenAlex exact-CVE search	"CVE-2026-44843"	0 hits	none	no_exact_openalex_record_visible	zero_exact_scholarly_signal_in_checked_public_registry	Confirms LIMEN-000008 remains below LIMEN-000003 in scholarly exactness even though it stays valuable for mechanism diversity.	Zero bounded hits here do not prove no qualifying paper exists elsewhere.
SGRA-006	LIMEN-000008	mechanism_diversity_authority_upgrade_contrast	OpenAlex broader mechanism search	LangChain deserialization memory poisoning	8 hits; only broad review and supply-chain papers surfaced, not row-specific LangChain memory-state case analysis	When LLMs meet cybersecurity: a systematic literature review; An Analysis of Real-World Vulnerabilities and Root Causes in the LLM Supply Chain	published_but_non_row_specific_only	mechanism_context_without_incident_specific_closure	Keeps LIMEN-000008 as a later mechanism-diversity route rather than a stronger peer-reviewed-gap closure candidate than LIMEN-000003.	Do not convert broad review or supply-chain literature into direct support for CVE-2026-44843 or the same vulnerable runtime path.
SGRA-007	LIMEN-000003; LIMEN-000008	route_order_control	Crossref exact-CVE title queries	CVE-2025-55284 and CVE-2026-44843	Both queries return very high-noise result sets with irrelevant top hits such as Auto-CVE or unrelated datasets	noise_only_no_row_specific_hit	crossref_not_diagnostic_for_exact_route_closure_here	negative_evidence_only	Supports reviewer-safe explanation that Crossref exact-CVE title queries do not by themselves close or disprove either route.	Use Crossref here only as bounded screening evidence and pair it with OpenAlex or exact-title/manual review before drawing route conclusions.
