as_of_utc	framework_id	framework_label	exact_or_primary_coverage_case_count	partial_or_technique_context_case_count	cautious_context_only_case_count	unmapped_case_count	explicit_gap_row_count	case_ids_exact_or_primary	case_ids_partial_or_technique	case_ids_cautious_only	case_ids_unmapped	reviewer_safe_reading	main_publication_blocker_now	next_threshold_event	dashboard_hook	evidence_paths
2026-06-08T17:04:36Z	LIMEN	Local LIMEN category layer	11	0	0	0	0	LIMEN-000001; LIMEN-000002; LIMEN-000003; LIMEN-000004; LIMEN-000005; LIMEN-000006; LIMEN-000007; LIMEN-000008; LIMEN-000009; LIMEN-000012; LIMEN-000016				All live rows already sit inside LIMEN local categories; every current security row is tagged as both security_risk and agentic_control_failure.	Category presence is not the blocker; the blocker is authority depth and external interoperability asymmetry inside those categories.	Use the local categories as the stable base layer while chasing stronger external joins or authority upgrades for seeded rows.	security_crosswalk_panel; framework=LIMEN; all_rows_locally_classified=true	results/security/security-agentic-watch-v0.1.tsv
2026-06-08T17:04:36Z	AVID	AVID incident interoperability	2	0	0	9	0	LIMEN-000002; LIMEN-000016			LIMEN-000001; LIMEN-000003; LIMEN-000004; LIMEN-000005; LIMEN-000006; LIMEN-000007; LIMEN-000008; LIMEN-000009; LIMEN-000012	Langflow and ToolHive now have canonical local AVID incident IDs; the rest of the package remains negative on exact AVID interoperability.	Exact AVID coverage is still thin and should not be mistaken for broad cross-framework incident comparability.	A third canonical AVID report attached to a seeded row outside the current Langflow-plus-ToolHive pair would materially reduce interoperability asymmetry.	security_crosswalk_panel; framework=AVID; exact_rows=2; unmapped_rows=9	results/security/security-agentic-framework-verification-v0.1.tsv; results/security/security-agentic-crosswalk-strength-matrix-v0.1.tsv
2026-06-08T17:04:36Z	ATLAS	MITRE ATLAS case or technique support	0	7	4	0	0		LIMEN-000001; LIMEN-000002; LIMEN-000003; LIMEN-000004; LIMEN-000005; LIMEN-000006; LIMEN-000007	LIMEN-000008; LIMEN-000009; LIMEN-000012; LIMEN-000016		ATLAS is currently useful mainly as technique or indirect case-study context, not as exact incident-level interoperability for the seeded rows.	No seeded security row has a verified direct local ATLAS case-study match; four rows remain cautious-context-only rather than technique-mapped.	The first defensible direct ATLAS case-study ID, or one stronger exact technique attachment for the cautious rows, would change the package ceiling.	security_crosswalk_panel; framework=ATLAS; exact_rows=0; partial_rows=7; cautious_rows=4	results/security/security-agentic-framework-verification-v0.1.tsv; results/security/security-agentic-watch-v0.1.tsv
2026-06-08T17:04:36Z	OWASP	OWASP LLM plus OWASP agentic labels	11	0	0	0	0	LIMEN-000001; LIMEN-000002; LIMEN-000003; LIMEN-000004; LIMEN-000005; LIMEN-000006; LIMEN-000007; LIMEN-000008; LIMEN-000009; LIMEN-000012; LIMEN-000016				Every live row already carries both OWASP LLM and OWASP agentic labels, making OWASP the broadest current external taxonomy layer.	OWASP coverage is broad but only taxonomy-deep; it does not solve exact incident interoperability or authority-depth limits.	Keep OWASP as the stable external label layer while using stronger source upgrades to improve exactness elsewhere.	security_crosswalk_panel; framework=OWASP; dual_label_rows=11; unmapped_rows=0	results/security/security-agentic-watch-v0.1.tsv; results/security/security-agentic-crosswalk-strength-matrix-v0.1.tsv
2026-06-08T17:04:36Z	PACKAGE	Security package publication state	11	0	0	0	1	LIMEN-000001; LIMEN-000002; LIMEN-000003; LIMEN-000004; LIMEN-000005; LIMEN-000006; LIMEN-000007; LIMEN-000008; LIMEN-000009; LIMEN-000012; LIMEN-000016				The live publication split is now 3 core rows plus 8 appendix/supporting rows, with no limitations-only row and one explicit peer-reviewed gap row.	The last explicit zero state is still peer-reviewed or conference-grade incident-specific support for a seeded row, not package-shape drift or weak-notice Langflow wording.	Attach one incident-specific peer-reviewed or conference-grade technical source to LIMEN-000006 or LIMEN-000007 before widening any comparative claim.	security_crosswalk_panel; package_split=3_8_0_1; mechanisms=exfiltration_or_exposure:3;identity_boundary_abuse:1;memory_state_contamination:1;supply_chain_or_plugin_extension:2;unsafe_code_execution:4	results/security/security-agentic-publication-cell-matrix-v0.1.tsv; results/security/security-agentic-next-route-board-v0.1.tsv
