as_of_utc	router_id	reuse_question	primary_safe_answer_now	primary_bundle	why_this_matters_now	forbidden_overread	visualization_dashboard_hook	next_smallest_publishability_move
2026-06-08T09:38:46Z	F2QR-046-001	What denominator should Figure 2 / Table 2 use right now?	Use the live core duplicate/taxonomy package `40_review_rows/38_governed_records/28_unique_lineages` as denominator truth, keep the extended reviewed local surface `40/43/33` separate for shadow-package and residual explanations, and treat `35_visible_rows/27_unique_lineages` plus historical `31/23` as mechanical/staged Figure 2 sources only.	results/boost/limen-boost-046/router-threshold-event-2026-06-08T09-38-46Z.tsv; results/clusters/status.md; results/taxonomy/taxonomy-delta-v0.1.md; results/dashboard-paper/figure2-live-denominator-drift-audit-v0.1.tsv; results/dashboard-paper/caption-control-register-v0.1.tsv:CCR-001..CCR-002	This is the first hostile-reviewer check because stale `35/27`, `31/23`, `38/38/28`, or now-superseded `39/38/28` wording can silently collapse the newer live core-versus-mechanical-versus-extended stack.	Do not narrate staged heatmap counts as live atlas counts, extended reviewed local rows as seeded headline counts, or shared local copies as semantic refresh.	Figure 2 denominator badge; Table 2 provenance footnote; four-layer taxonomy QA card	If a downstream surface still cites `35/27`, `31/23`, `38/38/28`, or `39/38/28` as the live denominator truth, patch that surface against the current four-layer bundle before any new taxonomy prose work.
2026-06-07T20:11:24Z	F2QR-046-002	What do the three zero-seed rows mean?	`health_medical_or_mental_health` is true absence, `research_integrity` is zero-seed but locally non-empty shadow-package pressure, and `residual_unclassified` is a methods guardrail with one count-silent frontier lineage.	results/boost/limen-boost-022/zero-seed-currentness-audit.tsv; results/boost/limen-boost-022/zero-seed-differentiation-matrix.tsv; results/taxonomy/taxonomy-delta-v0.1.md	Later writers can otherwise flatten three different evidentiary states into one misleading `0 seeded rows` reading.	Do not read any zero-seed row as real-world absence or as evidence that a category is methodologically settled.	Zero-state tooltip set; methods appendix zero-row explainer	Consume `zero-seed-currentness-audit.tsv` explicitly in one shared Figure 2 or Table 2 prose/control surface.
2026-06-07T20:11:24Z	F2QR-046-003	Can runtime-execution abuse be treated as a new taxonomy category?	No. It is ready only as a bounded security overlay nested inside `security_risk` plus `agentic_control_failure`, not as a new count-bearing top-level category.	results/boost/limen-boost-034/taxonomy-promotion-frontier.tsv:TPF-034-001; results/boost/limen-boost-058/taxonomy-subtype-readiness-board.tsv:TSRB-058-001; results/boost/limen-boost-058/taxonomy-authority-fragility-matrix.tsv	This is one of the strongest repeated mechanism families, so it is a likely place for accidental overpromotion.	Do not convert repeated mechanism evidence into prevalence, comparative product safety, or a new top-level category.	Security overlay badge; mechanism x authority inset	Only upgrade after one additional authoritative non-framework lineage or one synchronized shared Figure 2/Table 6 integration that keeps the family nested.
2026-06-07T20:11:24Z	F2QR-046-004	Can false-capability / faux-automation be shown more prominently?	Yes, but only as a posture-aware Table 1C sidecar or overlay family, not as a widened seeded denominator or cross-sector prevalence claim.	results/boost/limen-boost-034/taxonomy-promotion-frontier.tsv:TPF-034-002; results/boost/limen-boost-058/taxonomy-subtype-readiness-board.tsv:TSRB-058-002; results/dashboard-paper/caption-control-register-v0.1.tsv:CCR-003	This family already has the best cross-sector AI-washing interpretation payoff, but its evidence posture is still mixed and finance-heavy.	Do not flatten settled SEC rows, charging-stage Nate materials, FTC final-order sidecars, and local-news caution branches into one cross-sector count.	Posture ladder with subtype badges; finance-vs-non-finance split	Land one regulator-final or adjudicated non-finance lineage, or patch one shared Table 1C sidecar surface that keeps posture states visible.
2026-06-07T20:11:24Z	F2QR-046-005	Is public-authority biometric governance ready for a seeded subtype?	No. It is ready only for a boxed comparator or appendix companion, not for a new shared subtype or recurrence claim.	results/boost/limen-boost-034/taxonomy-promotion-frontier.tsv:TPF-034-003; results/boost/limen-boost-058/taxonomy-subtype-readiness-board.tsv:TSRB-058-004	The family is strong enough to help reviewer interpretation of authority and geography, but still too narrow to widen category counts.	Do not convert the UK ICO plus Slovenia package into an international-pattern or procurement-proof claim.	Public-authority biometric map; authority x domain comparator cells	Add one non-UK/non-Slovenian authoritative lineage or one direct ORION companion document before any stronger subtype rhetoric.
2026-06-07T20:11:24Z	F2QR-046-006	How should trust-boundary and authorization failure travel?	As an appendix-ready nested security subtype and trust-architecture methods note, not as a new Figure 2 category.	results/boost/limen-boost-034/taxonomy-promotion-frontier.tsv:TPF-034-004; results/boost/limen-boost-058/taxonomy-subtype-readiness-board.tsv:TSRB-058-003; results/dashboard-paper/figure-table-priority-register-v0.1.tsv:LIMEN-VIS-015	This is publication-useful for the thesis trust architecture contribution, but still a small developer-tool/platform cluster.	Do not elevate the current cluster into a broader ecosystem claim or a top-level taxonomy split.	Authorization-boundary Sankey; trust-boundary legend badge	Upgrade only after one additional independent authoritative lineage outside the current cluster or a deliberate shared Table 6 legend need.
2026-06-08T09:38:46Z	F2QR-046-007	How should research-integrity appear if its heatmap row is still zero?	Keep the Figure 2 row at zero-seed, but route readers to the bounded shadow package, the repeated Springer direct-notice pair on the extended `40/43/33` reviewed local surface, and the Table 1E source-depth panel for non-empty local pressure.	results/boost/limen-boost-022/zero-seed-currentness-audit.tsv:ZSCA-022-002; results/boost/limen-boost-046/router-threshold-event-2026-06-08T09-38-46Z.tsv; results/taxonomy/taxonomy-delta-v0.1.md; results/clusters/status.md; results/dashboard-paper/procedural-contamination-source-depth-panel-v0.1.tsv; results/source-map/research-integrity-family-inventory-v0.1.tsv	This is a classic hostile-reviewer trap: zero in the heatmap does not mean the observatory has no research-integrity evidence, and the local package is now stronger than a generic singleton shadow note.	Do not convert Springer-family concentration, DOI metadata, or one residual linkage into seeded-count rhetoric, cross-publisher breadth, or final category promotion.	Research-integrity recurrence badge; source-depth ladder; zero-row tooltip	Capture one non-Springer direct publisher or institutional notice strong enough for a seeded crosswalk spine, or explicitly consume the repeated-shadow-package explanation in shared prose.
2026-06-07T20:11:24Z	F2QR-046-008	How should `residual_unclassified` be described?	As a zero-seed methods guardrail with one explicit count-silent frontier lineage, not as proof of a new category or of empirical absence.	results/taxonomy/taxonomy-delta-v0.1.md; results/boost/limen-boost-058/taxonomy-subtype-readiness-board.tsv:TSRB-058-009; results/boost/limen-boost-008/candidate-cases.jsonl:LIMEN-008-LEAD-007	Residual pressure is central to LIMEN novelty, but it is also the easiest place to overclaim taxonomy invention.	Do not widen Figure 2 counts from one residual frontier row or treat residual pressure as novelty proof by itself.	Residual-frontier queue panel; duplicate-collapse filter; citation-network placeholder	Wait for at least two distinct lineages plus reviewer-legible inclusion/exclusion rules and stronger authority support before proposing a new subtype.
2026-06-08T07:47:36Z	F2QR-046-009	What is the safe route for local helper reuse versus shared export claims?	Boost-local helper reuse is current again, and the local shared `results/dashboard/taxonomy-heatmap.tsv` copy is also materialized on this host; keep file-materialization state separate from claim-safe Figure 2 / Table 2 reuse.	results/boost/limen-boost-046/helper-refresh-propagation.tsv; results/boost/limen-boost-046/helper-surface-currentness-audit.tsv; results/boost/limen-boost-060/figure2-refresh-bundle-contract.tsv; results/dashboard-paper/taxonomy-shared-surface-currentness-audit-v0.1.tsv; results/dashboard-paper/shared-export-promotion-register-v0.1.tsv:exp-005	The helper stack is now safe for drafting and one local shared dashboard copy exists, yet it would still be wrong to imply that materialization alone resolves denominator drift, caption controls, fragility routing, or frozen snapshot prose.	Do not treat refreshed lane-local helpers or one synchronized local shared copy as proof that every downstream dashboard consumer, caption bundle, or frozen paper-snapshot surface is semantically current.	Refresh-vs-materialization state badge; reproducibility QA board	Patch any stale blocked-export wording first, then keep Figure 2 / Table 2 reuse routed through caption controls, denominator-drift audit, zero-seed semantics, and frontier-role sidecars instead of reopening filesystem propagation work.
