as_of_utc	audit_id	artifact_path	artifact_kind	stale_value	live_corrected_value	evidence_basis	resolution_state	paper_risk_if_unfixed	recommended_action	visualization_or_dashboard_hook
2026-06-07T11:04:43Z	TLDA-046-001	results/clusters/status.md	shared_status_source_of_truth	29 visible rows / 22 unique lineages	30 visible rows / 23 unique lineages after stable-duplicate collapse	data/cases/authoritative-candidates.jsonl=8; data/cases/security-agentic-candidates.jsonl=9; data/cases/multilingual-candidates.jsonl=6; results/boost/limen-boost-005/candidate-cases.jsonl=5; results/boost/limen-boost-009/candidate-cases.jsonl=2; results/clusters/duplicate-clusters-v0.1.tsv stable_duplicate_cluster rows=7	audit_only_not_patched_this_cycle	Duplicate-safe denominator prose is now stale at the project source-of-truth layer and can leak undercounts into taxonomy and methods writing.	Refresh `results/clusters/status.md` against the live 30/23 package before reusing it as denominator authority.	Duplicate-control denominator badge for methods note and taxonomy lineage count legend.
2026-06-07T11:04:43Z	TLDA-046-002	results/taxonomy/taxonomy-delta-v0.1.md	taxonomy_source_of_truth_note	stable-collapsed denominator remains 22 unique lineages; category counts include deepfake=2, public_sector=6, unlawful=4	stable-collapsed denominator is now 23 unique lineages; current category counts include deepfake=3, public_sector=7, unlawful=5	Live case inventories plus duplicate-cluster collapse; new authoritative FCC row `data/cases/authoritative-candidates.jsonl:LIMEN-000008` changes the counted package	audit_only_not_patched_this_cycle	Figure 2 and taxonomy-governance prose can inherit stale category counts and misstate where authority-backed support exists.	Refresh `results/taxonomy/taxonomy-delta-v0.1.md` before the next taxonomy-manuscript sync.	Taxonomy heatmap denominator and residual-pressure appendix.
2026-06-07T11:04:43Z	TLDA-046-003	results/boost/limen-dashboard-paper-forge/taxonomy-heatmap.tsv	boost_local_shared_export_seed	deepfake_or_synthetic_identity seed_case_count=2; authoritative_seed_count=0; support_state=candidate_only_seeded	deepfake_or_synthetic_identity seed_case_count=3; authoritative_seed_count=1; support_state=authoritatively_seeded	Live category recomputation over the current duplicate-collapsed package shows the FCC/Lingo row adds one authoritative deepfake lineage	output_stale_needs_regeneration	The shared Figure 2 export source currently understates deepfake authority depth and overstates candidate-only reliance.	Regenerate the boost-local taxonomy heatmap export from live case files before any Figure 2 rebuild.	Figure 2 heatmap row state and category-support tooltip.
2026-06-07T11:04:43Z	TLDA-046-004	results/dashboard-paper/figure-table-priority-register-v0.1.tsv:LIMEN-VIS-002	shared_figure_registry_row	authoritatively_seeded=10; candidate_only_seeded=2; frontier families keyed to security=7/22 ai_misstatement=3/22 biometric=2/22	authoritatively_seeded=11; candidate_only_seeded=1; frontier families remain the same but must now be expressed on a 23-lineage denominator as security=7/23 ai_misstatement=3/23 biometric=2/23	Live category recomputation plus unchanged overlay family membership from results/boost/limen-boost-010/taxonomy-overlay-routing.tsv	audit_only_not_patched_this_cycle	Shared figure-readiness prose for LIMEN-VIS-002 is now denominator-stale and category-support stale at once.	Patch LIMEN-VIS-002 after regenerating `results/boost/limen-dashboard-paper-forge/taxonomy-heatmap.tsv`.	Canonical Figure 2 readiness card and review checklist.
2026-06-07T11:04:43Z	TLDA-046-005	dashboard/limen-dashboard-spec-v0.1.md	shared_dashboard_contract	Only three residual-pressure families are overlay-ready or boxed-comparison-ready on the duplicate-controlled 22-lineage denominator: security 7/22, AI capability misstatement 3/22, biometric comparator 2/22	Overlay-ready or boxed-comparison-ready families remain the same, but the live denominator is now 23 lineages: security 7/23, AI capability misstatement 3/23, biometric comparator 2/23	Live 30/23 recomputation plus existing overlay routing contract from shard 010	audit_only_not_patched_this_cycle	A downstream renderer following the current spec would encode stale denominator text into Figure 2/Table 2 metadata.	Patch the dashboard spec only after the boost-local taxonomy heatmap export is refreshed so the contract and export move together.	Renderer metadata fields `frontier_route_state`, `frontier_reference_id`, and denominator badge text.
2026-06-07T11:04:43Z	TLDA-046-006	results/dashboard-paper/shared-export-promotion-register-v0.1.tsv:exp-005	shared_export_promotion_row	Promotion note preserves 7/22, 3/22, and 2/22 frontier wording	Promotion note should preserve 7/23, 3/23, and 2/23 frontier wording after export refresh	Live 30/23 recomputation plus shard-046 shared-export binding work already in place	audit_only_not_patched_this_cycle	If the blocked shared export is later promoted without recheck, the stale denominator will travel into the public-facing export contract.	Refresh exp-005 in the same patch set as LIMEN-VIS-002 and the dashboard spec.	Shared taxonomy export promotion gate and build blocker board.
2026-06-07T11:04:43Z	TLDA-046-007	papers/article-architecture-v0.1.md and draft/preprint.md	manuscript_routing_prose	Shard-010 routing prose still names 7/22, 3/22, and 2/22 frontier splits	Shard-010 routing prose should move to 7/23, 3/23, and 2/23 once the taxonomy source-of-truth files are refreshed	Live denominator recomputation plus existing shard-010 frontier logic	audit_only_not_patched_this_cycle	Hostile-reviewer manuscript prose can inherit a stale denominator even though the underlying overlay-family choice remains correct.	Patch manuscript routing prose only after the source-of-truth taxonomy files are refreshed.	Figure 2 / Table 2 caption-safe manuscript fragment sync.
2026-06-07T11:04:43Z	TLDA-046-008	results/dashboard-paper/caption-control-register-v0.1.tsv:CCR-001	shared_caption_control	Caption clause names the current frontier as security 7/22, AI-misstatement 3/22, biometric 2/22	Caption clause should name the current frontier as security 7/23, AI-misstatement 3/23, biometric 2/23 while keeping the same bounded overlay-vs-queue logic	Live denominator recomputation plus shard-010 frontier logic	audit_only_not_patched_this_cycle	Caption discipline remains structurally correct but numerically stale, which invites reviewer-visible inconsistency against refreshed case inventories.	Patch CCR-001 only after the supporting taxonomy files and export source are refreshed.	Shared Figure 2 caption control and thesis taxonomy-governance exhibit.