as_of_utc	contract_id	family_id	source_family	blocker_mechanism	primary_claim_id	affected_surfaces	reviewer_safe_sentence	required_caution	forbidden_overread	threshold_change_event	evidence_anchor	visualization_dashboard_hook	paper_thesis_use
2026-06-08T07:46:40Z	BSCWC-013-001	sf07	Regulator and enforcement sources	anti_automation_shell_with_direct_pdf_survival	LIMEN-C-011	Result block 1; Table 1A footnote; Figure 8 methods note	FTC-hosted AI-washing rows can be cited from direct complaint/order PDFs already captured locally even though the FTC case-library shell itself remains blocked from this host.	Keep shell reachability separate from direct-document reachability and preserve complaint-versus-order posture language.	Do not describe blocked shell access as missing official evidence or imply full official-case-page discoverability.	One reviewer-checkable official shell or docket-style page that aligns with the already-captured PDFs.	results/boost/limen-boost-013/blocked-source-state-typology-v0.1.tsv:BSST-013-001; results/source-map/source-family-publication-gate-board-v0.1.tsv:SFG-006; sources/authoritative-source-ledger.tsv	Blocked-source panel; official-shell-versus-direct-document badge	Methods prose on why blocked discovery shells do not always prevent bounded official-document use.
2026-06-08T07:46:40Z	BSCWC-013-002	sf08	Court and tribunal records	open_court_text_absence	LIMEN-C-010	Result block 1; Result block 6A; Table 1A limits note	The iTutorGroup row currently supports agency-summary-level wording with a stable civil-action number, but it does not yet support court-text wording because no public court-originating complaint, decree, docket entry, or judicial order text is captured locally.	Name the EEOC side explicitly and keep the row below court-text depth.	Do not present EEOC summaries as substitutes for complaint/decree/order text or imply adjudicated posture.	One genuinely different public court-facing or clearly labeled open-mirror complaint, decree, docket entry, or judicial order text.	results/boost/limen-boost-013/blocked-source-state-typology-v0.1.tsv:BSST-013-002; results/boost/limen-boost-001/blocked-source-negative-evidence-router.tsv line 2; results/source-map/source-family-publication-gate-board-v0.1.tsv:SFG-001	Route-B blocker panel; procedural-posture timeline	Hostile-reviewer-safe wording for why one authoritative row remains summary-grade rather than quote-ready.
2026-06-08T07:46:40Z	BSCWC-013-003	sf08	Court and tribunal records	image_only_pdf_normalization_barrier	LIMEN-C-010	Result block 1; Result block 6A; Table 1A caution badge	The Nate matter has a real DOJ-linked charging document in the local package, but exact caption and full case-number normalization remain incomplete because the publicly captured PDF is still image-only for practical extraction on this host.	Separate document presence from normalized caption metadata and keep accusation-stage wording explicit.	Do not invent unread docket digits or describe the PDF as fully normalized court text.	A materially different OCR stack, a better public original, or another exact-caption public source that recovers the caption without invention.	results/boost/limen-boost-013/blocked-source-state-typology-v0.1.tsv:BSST-013-003; results/boost/limen-boost-001/blocked-source-negative-evidence-router.tsv line 3; results/source-map/source-family-publication-gate-board-v0.1.tsv:SFG-001	Normalization-stage overlay; blocked-source panel	Methods/thesis wording that distinguishes discovery success from extraction failure.
2026-06-08T07:46:40Z	BSCWC-013-004	sf09	Public-sector registers and procurement	exact_row_linkage_gap_after_partial_official_success	LIMEN-C-012	Result block 1; Result block 6B1; Table 1B caption and footnote	The public-sector package supports a disclosure-surface heterogeneity claim and a traceability ladder, but Amsterdam still lacks exact buyer-side or public-companion proof and Helsinki remains family-level rather than page-specific procurement proof.	Keep Amsterdam and Helsinki as different midstates on the traceability ladder.	Do not rewrite governance fields, same-buyer continuity, or family-level companion evidence into exact row-linked procurement, spend, or impact proof.	One static official buyer-side tender, award, contract, DPIA, impact-assessment, or public companion tied exactly to Amsterdam or page-specifically to Helsinki.	results/boost/limen-boost-013/blocked-source-state-typology-v0.1.tsv:BSST-013-004; results/boost/limen-boost-001/blocked-source-negative-evidence-router.tsv lines 4-5; results/source-map/source-family-publication-gate-board-v0.1.tsv:SFG-002	Table 1B traceability ladder; proof-ceiling panel	Reviewer-safe wording for public-sector observability without overstating procurement reconstruction.
2026-06-08T07:46:40Z	BSCWC-013-005	sf11	Security research and advisories	peer_reviewed_case_support_absence_despite_other_depth	LIMEN-C-007	Route B gate; Table 6 caption; security methods/results prose	The security package already supports bounded comparison of source roles, mechanism coverage, remediation visibility, and authority asymmetry across eleven seeded rows, but it still does not have incident-specific peer-reviewed or proceedings-backed support for a live row.	Keep exact scholarly closure distinct from vendor, CERT, CVE, or independent-lab depth.	Do not describe the package as proceedings-backed, balanced in authority, or suitable for prevalence or comparative-safety claims.	One incident-specific peer-reviewed, workshop, or conference-grade technical case attachment mapped cleanly to a live seeded row.	results/boost/limen-boost-013/blocked-source-state-typology-v0.1.tsv:BSST-013-005; results/boost/limen-boost-001/blocked-source-negative-evidence-router.tsv line 6; results/source-map/source-family-publication-gate-board-v0.1.tsv:SFG-003	Security authority-balance panel; evidence-layer Sankey	Compact clause-safe language for Table 6 and Route B without reopening generic "more evidence" prose.
2026-06-08T07:46:40Z	BSCWC-013-006	sf13	Academic and research-integrity sources	blocked_or_mediated_non_springer_notice_surfaces	LIMEN-C-008	Result block 1; Table 1E; limitations paragraph	The research-integrity package now spans mediated, metadata-corroborated, and direct-notice states, but cross-publisher top-depth notice diversity is still incomplete because non-Springer direct publisher notice text remains blocked or mediated on the currently traced rows.	Keep source-depth classes visible and preserve the difference between metadata corroboration and readable publisher notice text.	Do not promote PubMed or Crossref role metadata, editor statements, or mediated reporting into direct publisher-notice grade.	One materially different public publisher-originating notice surface that upgrades a blocked or mediated non-Springer row to direct notice text.	results/boost/limen-boost-013/blocked-source-state-typology-v0.1.tsv:BSST-013-006; results/boost/limen-boost-001/blocked-source-negative-evidence-router.tsv line 8; results/source-map/source-family-publication-gate-board-v0.1.tsv:SFG-004	Research-integrity depth panel; publisher-notice upgrade funnel	Clause-safe limitations wording for Table 1E and procedural-contamination source-depth discussion.
