proposal_id	proposed_code	parent_or_neighbor_labels	gap_type	proposed_definition	why_current_taxonomy_is_not_quite_enough	dashboard_view	paper_use	validation_needed	evidence_basis
LIMEN-TP-010-001	provenance_attribution_confusion	deepfake_or_synthetic_identity;legal_procedural_contamination;research_integrity	category_split	Cases where the core anomaly is uncertainty or manipulation around who authored, endorsed, signed, or generated a record, statement, or artifact, even when no realistic impersonation image/audio/video is central.	The current taxonomy captures deepfakes, procedural contamination, and research integrity separately, but lacks a reusable label for authorship/provenance confusion spanning legal, academic, journalistic, and platform contexts.	Stacked bar of cases where provenance confusion is primary versus secondary; link to evidence-envelope and C2PA/SCITT-ready views.	Supports a methods/data-paper argument that LIMEN captures provenance failures that fall between misinformation, fraud, and procedural contamination.	Need at least 3-5 public cases showing cross-domain recurrence and a clean distinction from ordinary deepfake records.	README purpose lines 21-24; taxonomy labels lines 28-37; claim hypothesis about residual long-tail cases.
LIMEN-TP-010-002	simulated_autonomy_or_hidden_human_labor	ai_washing_or_false_ai_claim;institutional_absurdity	category_split	Cases where an organization represents a process or service as autonomous AI while material human labor, rule-based scripting, or manual adjudication remains hidden and normatively important.	The current ai_washing label is broad, but reviewer-facing analysis may need to distinguish marketing exaggeration from materially misleading claims about autonomy and accountability.	Matrix of claimed autonomy level versus observed human involvement; useful for sankey from marketing claim to actual workflow.	Can support a paper section on boundary cases between automation theater, accountability laundering, and false AI claims.	Need corroborated public examples and a coding rule that separates harmless hype from accountability-relevant concealment.	Taxonomy ai_washing and institutional_absurdity definitions; schema autonomy_level field; README emphasis on threshold cases and institutional process.
LIMEN-TP-010-003	agentic_authority_overhang	agentic_control_failure;security_risk;public_sector_misuse_or_gap	category_split	Cases where an agent or AI-enabled workflow is granted permissions, delegation scope, or institutional authority that exceed legible oversight, even if the visible harm is procedural or organizational rather than a classic security exploit.	Current labels capture control failure and security risk, but not the governance pattern where authority allocation itself is the anomaly.	Node-edge view linking actor role, autonomy level, and permission type; useful for agent-governance topology figure.	Supports a thesis/paper argument that some edge cases arise from delegated authority design rather than model failure alone.	Need public examples with documented tool use, delegated permissions, or workflow authority, plus careful distinction from generic agent bugs.	Taxonomy agentic_control_failure and security_risk labels; schema tools_or_permissions and autonomy_level fields; sprint priority on publishable interpretation over more corpus growth.
LIMEN-TP-010-004	register_or_disclosure_fiction	public_sector_misuse_or_gap;institutional_absurdity	category_split	Cases where an AI register, transparency page, procurement notice, or disclosure mechanism exists but is too incomplete, stylized, or misleading to support meaningful public understanding.	The current public-sector gap label is useful but broad; this split isolates performative transparency as a research object and figure-ready variable.	Country/register heatmap with disclosure completeness and fiction-risk flags; can feed observatory comparisons.	Directly useful for a comparative public-sector governance article on the difference between having a register and having usable evidence.	Need coding rubric for what counts as fiction-risk versus mere incompleteness, plus examples from public registers or notices.	Source-family ledger public-sector registers row; taxonomy public-sector misuse/gap and institutional absurdity labels; sprint hostile-reviewer emphasis on bounded claims.
LIMEN-TP-010-005	contestability_breakdown	legal_procedural_contamination;normative_or_moral_outlier	category_split	Cases where the affected person or institution cannot realistically challenge, audit, or reconstruct an AI-mediated output because explanation, provenance, or procedural hooks are absent.	Current labels note contamination and normative outliers, but do not isolate failed contestability as a cross-domain phenomenon spanning schools, welfare, HR, platforms, and courts.	Flow figure from decision/output to attempted challenge to contestability blockage; useful for claims-support maps and law-to-evidence matrices.	Could support a paper claim that some edge cases are defined less by immediate harm type than by the collapse of post-hoc reviewability.	Need authoritative or corroborated public cases and a rule to avoid inferring legal rights violations from thin reporting.	README threshold framing; taxonomy legal/procedural contamination and normative outlier labels; methods rule to separate source claims from legal conclusions.
