as_of_utc	lane_id	theme_rotation	gap_id	route_or_candidate_id	target_case_ids	subject	current_attach_point	current_public_evidence_shape	independent_security_or_scholarly_layer_now	event_grade_or_incident_specific_now	exact_row_mapping_now	mechanism_diversity_gain_if_closed	reviewer_gain_if_closed	closure_feasibility_now	threshold_distance	recommended_priority_within_gap	minimum_stronger_source_needed	paper_thesis_use_now	dashboard_hook	local_evidence_paths	decision_note
2026-06-07T13:04:11Z	limen-boost-052	004_security_and_agentic_control_failures	GAP-supply_chain_or_plugin_extension	SEC-SCF-001		GitHub Copilot cloud agent	frontier_only	provider docs plus public product blog plus public firewall docs; no public vulnerability/advisory event in the local package	no	no	no_seeded_row	high	remove_supply_chain_zero_state	low	far	1	One public vulnerability/advisory, incident writeup, or official remediation notice tied to Copilot cloud-agent MCP, allowlist, package-registry, or browser-download trust boundaries.	Use as a machine-readable frontier candidate for the security zero-state queue and for methods text about what stronger public evidence would be needed before promotion.	surface_family=supply_chain_frontier; candidate=github_copilot_cloud_agent	/srv/tyche/gaia/tyche-research-vault/data/global-agent-atlas-v0.1/source_documents.jsonl document_ids github-copilot-cloud-agent-docs-20260603; cycle284-github-copilot-cloud-agent-firewall-docs-20260604; results/security/security-agentic-gap-closure-register-v0.1.tsv:GAP-supply_chain_or_plugin_extension; results/boost/limen-boost-040/security-route-decision-register.tsv:SEC-ROUTE-040-001	Trust-surface rich but event-poor frontier candidate; publication-safe only as negative-result frontier until one advisory, incident writeup, or official remediation notice appears.
2026-06-07T13:04:11Z	limen-boost-052	004_security_and_agentic_control_failures	GAP-supply_chain_or_plugin_extension	SEC-SCF-002		Microsoft Playwright MCP browser automation server	frontier_only	provider README only; no public vulnerability/advisory event in the local package	no	no	no_seeded_row	high	remove_supply_chain_zero_state	low	far	2	One public vulnerability/advisory or official security notice tied to Playwright MCP browser automation, secrets handling, origin-control bypass, or session-state trust boundaries.	Use as a promotion frontier row showing why tool-surface richness alone is insufficient for LIMEN security-seed inclusion.	surface_family=supply_chain_frontier; candidate=playwright_mcp	/srv/tyche/gaia/tyche-research-vault/data/global-agent-atlas-v0.1/source_documents.jsonl document_id cycle285-playwright-mcp-readme-browser-automation-20260604; /srv/tyche/gaia/tyche-research-vault/data/global-agent-atlas-v0.1/lane-manifests/cycle-285-active-lanes-40-playwright-mcp-browser-automation-supply-chain-harvest-log.md; results/security/security-agentic-gap-closure-register-v0.1.tsv:GAP-supply_chain_or_plugin_extension; results/boost/limen-boost-040/security-route-decision-register.tsv:SEC-ROUTE-040-001	Trust-surface rich but event-poor frontier candidate; publication-safe only as negative-result frontier until one advisory, incident writeup, or official remediation notice appears.
2026-06-07T13:04:11Z	limen-boost-052	004_security_and_agentic_control_failures	GAP-supply_chain_or_plugin_extension	SEC-SCF-003		Stripe MCP server and agent toolkit	frontier_only	provider docs only; no public vulnerability/advisory event in the local package	no	no	no_seeded_row	high	remove_supply_chain_zero_state	low	far	3	One public vulnerability/advisory, official postmortem, or defensible incident writeup tied to Stripe MCP or agent-toolkit permission/configuration failures.	Use as a frontier queue entry for the plugin/extension zero-state and as an observatory hook for agent-to-financial-infrastructure trust surfaces.	surface_family=supply_chain_frontier; candidate=stripe_mcp	/srv/tyche/gaia/tyche-research-vault/data/global-agent-atlas-v0.1/source_documents.jsonl document_ids doc-stripe-mcp-server-2026-06-01; doc-stripe-agent-toolkit-2026-06-01; results/security/security-agentic-gap-closure-register-v0.1.tsv:GAP-supply_chain_or_plugin_extension; results/boost/limen-boost-040/security-route-decision-register.tsv:SEC-ROUTE-040-001	Trust-surface rich but event-poor frontier candidate; publication-safe only as negative-result frontier until one advisory, incident writeup, or official remediation notice appears.
2026-06-07T13:04:11Z	limen-boost-052	004_security_and_agentic_control_failures	GAP-peer_reviewed_security_case_support	SEC-PRF-001	LIMEN-000006; LIMEN-000007	LangChain LLMMathChain allowed prompt injection into Python exec, creating arbitrary code execution risk / LlamaIndex safe_eval command injection enabled LLM-generated code to execute OS commands on the host	existing_seeded_rows	primary_cve_plus_independent_lab_public_security_advisory	independent_lab_yes_scholarly_no	yes_existing_security_rows	yes_seeded_row_exists	medium	remove_peer_review_zero_state_on_existing_independent_rows	medium	moderate	1	One peer-reviewed paper, workshop paper, or conference-grade technical case writeup with incident-specific discussion that maps directly to CVE-2023-29374 or CVE-2024-3271.	Best current frontier for turning thin independent-lab support into a reviewer-safe scholarly-evidence paragraph or appendix ladder.	authority_gap=peer_reviewed_gap; candidate_pair=langchain_llamaindex	results/security/security-agentic-peer-review-frontier-v0.1.tsv:SEC-PRF-001; results/security/security-agentic-scholarly-screening-v0.1.tsv:SEC-SCH-001,SEC-SCH-002; results/security/security-agentic-gap-closure-register-v0.1.tsv:GAP-peer_reviewed_security_case_support; results/boost/limen-boost-040/security-route-decision-register.tsv:SEC-ROUTE-040-002	Best current scholarly attach route because existing rows already have the strongest non-vendor independence layer; one incident-specific workshop/conference/paper would change authority balance without adding a weak new row. Local near-miss scholarly screens: SEC-SCH-001, SEC-SCH-002.
2026-06-07T13:04:11Z	limen-boost-052	004_security_and_agentic_control_failures	GAP-peer_reviewed_security_case_support	SEC-PRF-002	LIMEN-000003	Claude Code default allowlist enabled unauthorized file read and network exfiltration before forced update	existing_seeded_rows	primary_cve_plus_vendor_fix_visibility	vendor_or_cve_only	yes_existing_security_rows	yes_seeded_row_exists	medium	remove_peer_review_zero_state_on_core_row	low	far	3	One citable public technical case analysis, conference paper, or workshop paper discussing the unauthorized file-read/network-exfiltration flaw with enough specificity to map to CVE-2025-55284.	Would strengthen the article's approval-model/control-failure story without changing the seeded row set.	authority_gap=peer_reviewed_gap; candidate=claude_code	results/security/security-agentic-peer-review-frontier-v0.1.tsv:SEC-PRF-002; results/security/security-agentic-gap-closure-register-v0.1.tsv:GAP-peer_reviewed_security_case_support; results/boost/limen-boost-040/security-route-decision-register.tsv:SEC-ROUTE-040-002	Claude Code is publication-important, but the bounded local scan found no incident-specific scholarly lead beyond generic internal references. No local near-miss scholarly screen currently maps cleanly enough to use as row support.
2026-06-07T13:04:11Z	limen-boost-052	004_security_and_agentic_control_failures	GAP-peer_reviewed_security_case_support	SEC-PRF-003	LIMEN-000008	LangChain broad load() allowlists enabled attacker-controlled object revival, chat-history poisoning, and possible credential or request side effects	existing_seeded_rows	vendor_advisory_with_exact_fix_visibility	vendor_or_cve_only	yes_existing_security_rows	yes_seeded_row_exists	high	remove_peer_review_zero_state_plus_broaden_mechanism_story	medium_low	moderate	2	One peer-reviewed or conference-grade technical treatment of unsafe deserialization, runtime memory contamination, or attacker-controlled state revival tied directly to CVE-2026-44843 or the same vulnerable LangChain runtime path.	Useful for a security-shape diversity paragraph, methods note, or limitations-to-upgrade ladder in the thesis chapter.	authority_gap=peer_reviewed_gap; candidate=langchain_memory_state	results/security/security-agentic-peer-review-frontier-v0.1.tsv:SEC-PRF-003; results/security/security-agentic-scholarly-screening-v0.1.tsv:SEC-SCH-002; results/security/security-agentic-gap-closure-register-v0.1.tsv:GAP-peer_reviewed_security_case_support; results/boost/limen-boost-040/security-route-decision-register.tsv:SEC-ROUTE-040-002	Memory/state row offers a stronger mechanism-diversity payoff than Claude Code or Langflow, but no local near-miss scholarly source is already attached. Local near-miss scholarly screens: SEC-SCH-002.
2026-06-07T13:04:11Z	limen-boost-052	004_security_and_agentic_control_failures	GAP-peer_reviewed_security_case_support	SEC-PRF-004	LIMEN-000002	Langflow custom_component endpoint allows public candidate record for remote code execution risk	existing_seeded_rows	primary_cve_plus_exact_avid_join_but_repo_issue_only_vendor_notice	vendor_or_cve_only	yes_existing_security_rows	yes_seeded_row_exists	medium	interoperability_gain_but_notice_depth_still_separate_blocker	low	far	4	One public scholarly or conference-grade technical case analysis tied directly to CVE-2024-37014 or the custom_component RCE path, plus preferably a direct vendor remediation statement on the existing official surfaces.	Can feed an interoperability-versus-notice-depth caution panel, but should stay behind rows 1-3 for paper-readiness priority.	authority_gap=peer_reviewed_gap; candidate=langflow_exact_avid_singleton	results/security/security-agentic-peer-review-frontier-v0.1.tsv:SEC-PRF-004; results/security/security-agentic-scholarly-screening-v0.1.tsv:SEC-SCH-001; results/security/security-agentic-gap-closure-register-v0.1.tsv:GAP-peer_reviewed_security_case_support; results/boost/limen-boost-040/security-route-decision-register.tsv:SEC-ROUTE-040-002	Langflow could benefit from scholarship, but its vendor-notice weakness remains a separate limiter even if a scholarly attachment appears. Local near-miss scholarly screens: SEC-SCH-001.
