as_of_utc	proof_id	case_family	case_ids	target_cve	surface_type	surface_url	final_url	http_status	content_type	etag	last_modified	response_sha256	target_cve_visible	exact_fixed_version_visible	vendor_notice_state	source_specificity	machine_translation_used	notes	paper_use	dashboard_hook	next_move_gate
2026-06-07T20:17:38Z	VNSP-052-001	Langflow	LIMEN-000002	CVE-2024-37014	github_security_advisory_listing	https://api.github.com/repos/langflow-ai/langflow/security-advisories?per_page=100	https://api.github.com/repos/langflow-ai/langflow/security-advisories?per_page=100	200	application/json	W/"09130628f2f86fd8cf9035135b1ebba87d3fb22d2d6efde6a75833e5dd958f63"	Wed, 27 May 2026 15:10:13 GMT	a885cf8db0f540c17898ad37664172839e6c12381afce68e0de99f94082d552f	no	no	target_advisory_absent	listing_level	no	rows=16; sample_cves=CVE-2026-33873,CVE-2026-33017,CVE-2026-42048	supports reviewer-safe claim that Langflow has an active public advisory program but no checked advisory row for CVE-2024-37014 on this cycle	security notice-depth / remediation-visibility audit panel	recheck only if ETag changes or a new Langflow advisory explicitly names CVE-2024-37014
2026-06-07T20:17:38Z	VNSP-052-002	Langflow	LIMEN-000002	CVE-2024-37014	github_issue	https://api.github.com/repos/langflow-ai/langflow/issues/1973	https://api.github.com/repos/langflow-ai/langflow/issues/1973	200	application/json	W/"e98f257190c252fcc54bb31783fd84f0dea5b8d271d8b8dc4b7d470a2808d259"	Fri, 29 May 2026 19:51:17 GMT	579842196ecfaca9bc6c495c0c4a95f04eacba56a1d385b3d8099690f04da5db	no	no	repo_issue_only_vendor_notice	row_specific_issue_notice	no	title=[Security Issue] Code Execution against underlying host system in Custom Component; state=closed; updated_at=2024-08-02T19:56:39Z; version_tokens=125.0.6422.60	supports the bounded claim that Langflow still has direct vendor-side issue notice but no checked formal advisory mapping on this cycle	security notice-depth / remediation-visibility audit panel	upgrade only if the issue body/comments or a linked release/advisory adds an exact fixed-version or CVE-keyed bulletin statement
2026-06-07T20:17:38Z	VNSP-052-003	Langflow	LIMEN-000002	CVE-2024-37014	github_issue_comments	https://api.github.com/repos/langflow-ai/langflow/issues/1973/comments	https://api.github.com/repos/langflow-ai/langflow/issues/1973/comments	200	application/json	W/"162239acebd563e4628525984133d768269bbd1e4ff91b39c45361854ea3a1dc"		ec9076442b6f565f5f069ca119835a4223b45d7d985e26cd6ebc37825d7f4abe	yes	no	comment_followthrough_checked	issue_comment_followthrough	no	comment_count=8; version_tokens=0.6.12,195.807,5.10.205	supports a negative-evidence statement that checked public follow-through comments did not produce a clean formal advisory upgrade by themselves	security notice-depth / remediation-visibility audit panel	recheck only if comment count or ETag changes materially
2026-06-07T20:17:38Z	VNSP-052-004	Langflow	LIMEN-000002	CVE-2024-37014	github_release_listing	https://api.github.com/repos/langflow-ai/langflow/releases?per_page=100	https://api.github.com/repos/langflow-ai/langflow/releases?per_page=100	200	application/json	W/"4d0813c8844c95a21c286fd149f9b8dcbef223f829204f5729fdbac5785c28bc"		5e5c14dc076387c77603fe134380431fd32a64f7394faef30620baf1002f2480	no	no	no_checked_release_mapping	release_listing	no	rows=100; sample_tags=1.9.6,1.9.5,v1.9.4,v1.9.3,v1.9.2	supports a bounded claim that no checked release-listing row surfaced an exact CVE-2024-37014 mapping on this cycle	security notice-depth / remediation-visibility audit panel	recheck only if ETag changes or a release body explicitly names CVE-2024-37014
2026-06-07T20:17:38Z	VNSP-052-005	Langflow	LIMEN-000002	CVE-2024-37014	github_tag_listing	https://api.github.com/repos/langflow-ai/langflow/tags?per_page=100	https://api.github.com/repos/langflow-ai/langflow/tags?per_page=100	200	application/json	W/"989b23cd90b1a4d0a3ab5d5b7f5812a3f4cab5cdf7a451a0d00800f3b8072846"	Sun, 07 Jun 2026 20:17:48 GMT	34f05cb088f438fe061eb6ab2557a6d3789facb028f5111b4b67bd48867ff1bf	no	no	tag_visibility_only	tag_listing	no	rows=100; sample_tags=v1.10.0,v1.10.0.dev68,v1.10.0.dev67,v1.10.0.dev66,v1.10.0.dev65,v1.10.0.dev64,v1.10.0.dev63,v1.10.0.dev62	provenance support only; tag visibility does not itself justify a fixed-version claim	security notice-depth / remediation-visibility audit panel	use only as chronology/provenance support unless a separate vendor text explicitly links a tag/version to the target CVE
2026-06-07T20:17:38Z	VNSP-052-006	CrewAI	LIMEN-000004;LIMEN-000005	CVE-2026-2285;CVE-2026-2286	github_security_advisory_listing	https://api.github.com/repos/crewAIInc/crewAI/security-advisories?per_page=100	https://api.github.com/repos/crewAIInc/crewAI/security-advisories?per_page=100	200	application/json	"f05c5373b0b45abcdc494dfc86fa6be1fd390e62d24512a82f7d65b24b376b1c"		4f53cda18c2baa0c0354bb5f9a3ecbe5ed12ab4d8e11ba873c2f11161202b945	no	no	target_advisory_absent	listing_level	no	rows=0; sample_cves=	supports reviewer-safe claim that no checked public GitHub advisory row was visible for CrewAI on this cycle	security notice-depth / remediation-visibility audit panel	recheck only if ETag changes or a CrewAI advisory row appears
2026-06-07T20:17:38Z	VNSP-052-007	CrewAI	LIMEN-000004;LIMEN-000005	CVE-2026-2285;CVE-2026-2286	github_release_tag	https://api.github.com/repos/crewAIInc/crewAI/releases/tags/1.14.0	https://api.github.com/repos/crewAIInc/crewAI/releases/tags/1.14.0	200	application/json	W/"a14e68a49052ae0ed21fc62b4291bc00a6ce57d0fb3a15f7fd233b0c3842f1ed"	Tue, 07 Apr 2026 17:47:52 GMT	669bdf516892c1c58ed832a9a5b5ea6ef013326ef61eeb25ca1657b51ebc41e0	no	yes	general_release_note_remediation_signal	release_note_non_cve_specific	no	tag=1.14.0; published_at=2026-04-07T17:47:49Z; body_version_tokens=1.83.0,14.0	supports a bounded claim that CrewAI release 1.14.0 is a remediation-visibility signal but not, on this checked surface, a CVE-specific bulletin	security notice-depth / remediation-visibility audit panel	upgrade only if a CrewAI release/advisory text explicitly names CVE-2026-2285 or CVE-2026-2286 and ties them to an exact fixed-version statement
2026-06-07T20:17:38Z	VNSP-052-008	CrewAI	LIMEN-000004;LIMEN-000005	VU#221883 / CVE-2026-2285;CVE-2026-2286	cert_vu_json	https://www.kb.cert.org/vuls/api/221883/	https://www.kb.cert.org/vuls/api/221883/	200	application/json			794193bb5e0bfa625ecc171f0634b6f9340223ec94aef23276e6495e6f533341	yes	no	independent_cert_notice_present	independent_notice	no	name=CrewAI contains multiple vulnerabilities including SSRF, RCE and local file read; date_public=	supports independent public notice for the CrewAI row family without overpromoting vendor-side remediation depth	security notice-depth / remediation-visibility audit panel	keep as independent notice support; vendor-depth ceiling changes only if CrewAI publishes a CVE-specific bulletin or exact fixed-version note
