as_of_utc	audit_id	target_artifact	artifact_role	stale_live_contract_found	canonical_live_contract_now	why_it_matters	recommended_action	evidence_paths	visualization_dashboard_hook	caution
2026-06-07T18:17:08Z	F2LCSA-022-001	results/boost/limen-boost-060/figure2-refresh-bundle-contract.tsv	older_bundle_handoff_contract	Rows `F2RBC-060-001`, `-006`, and `-007` still route Figure 2 work through live `33_visible_rows/25_lineages` while staged mechanics remain `31/23`.	live_duplicate_taxonomy_contract=35_visible_rows/27_lineages; staged_figure_contract=31_visible_rows/23_lineages	A future regeneration pass could reopen stale denominator logic at the exact file-order handoff layer even though `next.md` and the dashboard-paper execution board now point to `35 / 27`.	Treat the file as historical provenance only until refreshed, and carry `results/boost/limen-dashboard-paper-forge/figure2-live-refresh-execution-board-v0.1.tsv` plus `results/boost/limen-boost-046/figure2-post-danish-drift-reaudit.tsv` as the current bundle authority.	results/boost/limen-boost-060/figure2-refresh-bundle-contract.tsv; next.md:33-35,47-49; results/boost/limen-dashboard-paper-forge/figure2-live-refresh-execution-board-v0.1.tsv; results/boost/limen-boost-046/figure2-post-danish-drift-reaudit.tsv	Figure 2 refresh preflight; bundle-order QA board	This audit does not regenerate the heatmap or patch shard-060; it only prevents stale bundle reuse.
2026-06-07T18:17:08Z	F2LCSA-022-002	results/boost/limen-boost-060/visual-package-current-source-map.tsv:LIMEN-VIS-002	lane_local_visual_source_map	Current source map still exposes live_duplicate_control_scope=34_visible_rows/26_lineages next to staged `31/23`.	live_duplicate_taxonomy_contract=35_visible_rows/27_lineages; staged_figure_contract=31_visible_rows/23_lineages	Visual-package consumers can still inherit the superseded post-Playwright denominator even after the Danish promotion widened the live taxonomy layer and the project root guidance was updated.	If shard-060 is reopened, patch only the LIMEN-VIS-002 row and keep the staged/live split explicit; do not imply that the staged heatmap has already absorbed `35 / 27`.	results/boost/limen-boost-060/visual-package-current-source-map.tsv:LIMEN-VIS-002; results/boost/limen-boost-046/figure2-post-danish-drift-reaudit.tsv; results/taxonomy/taxonomy-delta-v0.1.md	Visual currentness map; Figure 2/Table 2 route validator	Do not flatten this drift into generic count error; the six lagging rows and zero-seed semantics still need to travel with any patch.
2026-06-07T18:17:08Z	F2LCSA-022-003	results/boost/limen-boost-060/status.md	lane_status_route_selector	Status still frames Figure 2 as staged `31/23` versus live `34/26` and says the lag is five category-row uplifts.	live_duplicate_taxonomy_contract=35_visible_rows/27_lineages; six lagging staged category rows	Lane status can misroute later work selection by undercounting the live denominator and by hiding the Danish-triggered sixth row divergence.	Use status only as historical evidence of the post-Playwright state; if shard-060 resumes, refresh its Figure 2 summary against the post-Danish audit before reusing it for planning.	results/boost/limen-boost-060/status.md; results/boost/limen-boost-046/figure2-post-danish-drift-reaudit.tsv; next.md:33-35	Lane-selection caution card; reviewer-safe drift chronology	This row does not claim shard-060 is wrong on Figure 4; the stale part is limited to Figure 2 denominator routing.
2026-06-07T18:17:08Z	F2LCSA-022-004	results/boost/limen-boost-048/figure2-table2-control-travel-kit.tsv	older_control_travel_kit	Travel-kit row still describes the live duplicate/taxonomy layer as `33_visible_rows/25_lineages` while the staged heatmap remains `31/23`.	live_duplicate_taxonomy_contract=35_visible_rows/27_lineages; staged_figure_contract=31_visible_rows/23_lineages	Because this file is a compact carriage artifact, stale reuse here would propagate two denominator generations behind the current live package.	Treat the travel kit as superseded by the post-Danish chain: `results/boost/limen-boost-022/post-danish-figure2-drift-register.tsv` + `results/boost/limen-dashboard-paper-forge/figure2-live-refresh-execution-board-v0.1.tsv`.	results/boost/limen-boost-048/figure2-table2-control-travel-kit.tsv; results/boost/limen-boost-022/post-danish-figure2-drift-register.tsv; next.md:47-49	Figure 2/Table 2 carriage audit; stale-helper suppression board	Historical helper artifacts remain useful for provenance, but not as current denominator authority.
2026-06-07T18:17:08Z	F2LCSA-022-005	results/dashboard-paper/status.md	current_shared_status_surface	No stale Figure 2 live-denominator wording found; shared status already states staged `31/23` versus live `35/27` and points to the execution board.	verified_current_shared_status=staged_31/23_vs_live_35/27	A positive control matters because it marks the current shared status surface that future shard-local repairs should follow instead of older 060/048 helpers.	Use this file as the current shared status comparator when scanning for remaining stale Figure 2 helper surfaces.	results/dashboard-paper/status.md; results/boost/limen-dashboard-paper-forge/figure2-live-refresh-execution-board-v0.1.tsv	Shared-status comparator row	Positive-control verification does not mean the staged heatmap has already been regenerated.