route_audit_id	candidate_ref	branch	public_route_type	probe_url	access_timestamp_utc	http_status	final_url_or_host	publisher_or_host	evidence_exposed_now	evidence_not_exposed_now	threshold_effect	paper_thesis_use	observatory_hook	next_safe_route	caution
PMRA-044-001	LIMEN-008-LEAD-002	research_integrity	doi_landing_page	https://doi.org/10.1177/25148486241235821	2026-06-07T19:04:57Z	403	https://journals.sagepub.com/doi/10.1177/25148486241235821	SAGE / journals.sagepub.com	Cloudflare challenge page confirms the DOI resolves to the expected SAGE publisher surface for the identified article.	No correction notice text, no retraction/correction status text, and no editor statement were directly visible from this bounded route.	no_upgrade_blocked_same_claim_ceiling	Reviewer-safe proof that the direct SAGE publisher-facing route remains bot-blocked from this lane even after a fresh bounded retry.	Blocked-notice facet; source-friction panel; Table 1E upgrade frontier	Try only a genuinely different public publisher-facing or archived surface; do not repeat the same blocked DOI landing as if it were new evidence.	A blocked landing page is route-feasibility evidence only; it does not prove the absence of a notice.
PMRA-044-002	LIMEN-008-LEAD-002	research_integrity	crossref_work_api	https://api.crossref.org/works/10.1177/25148486241235821	2026-06-07T19:04:57Z	200	https://api.crossref.org/works/10.1177/25148486241235821	Crossref / SAGE metadata	Crossref confirms article identity, publisher, update-policy URL, and text-mining links for the SAGE DOI.	No correction/retraction relation, no direct notice text, and no final editorial-action record were exposed in the bounded metadata payload.	no_upgrade_metadata_only_article_identity_confirmed	Strengthens methods/limitations prose by showing that a materially different public metadata route was checked and still leaves the row below direct-notice grade.	Research-integrity source-depth ladder; metadata-vs-notice split panel	Hold the row at mediated-editor-statement-plus-verified-article-identity until a direct SAGE notice or equivalent public publisher record is captured.	Metadata links and update-policy URLs are not themselves correction notices.
PMRA-044-003	LIMEN-008-LEAD-003	research_integrity	doi_landing_page	https://doi.org/10.1056/NEJMc2605962	2026-06-07T19:04:57Z	403	https://www.nejm.org/doi/10.1056/NEJMc2605962	NEJM / nejm.org	Cloudflare challenge page confirms the retraction DOI resolves to the expected NEJM publisher surface.	No publisher-originating notice text or reasoning was directly visible from this bounded route.	no_upgrade_blocked_same_claim_ceiling	Reviewer-safe proof that the direct NEJM publisher-facing route remains blocked from this lane after a fresh bounded retry.	Blocked-notice queue; source-friction facet; synthetic-evidence contamination panel	Try only a genuinely different public publisher-facing or equivalent record; do not keep replaying the same blocked DOI landing.	A blocked landing page does not justify inference about the retraction rationale.
PMRA-044-004	LIMEN-008-LEAD-003	research_integrity	crossref_work_api_retraction_doi	https://api.crossref.org/works/10.1056/NEJMc2605962	2026-06-07T19:04:57Z	200	https://api.crossref.org/works/10.1056/NEJMc2605962	Crossref / Massachusetts Medical Society metadata	Crossref exposes the retraction DOI title, publisher, journal, publication date, and an update-to relation pointing to the original DOI.	No direct notice text or editor/publisher reasoning for the retraction was exposed in the bounded metadata payload.	no_upgrade_metadata_only_retraction_pair_confirmed	Sharpens reviewer-safe wording for the NEJM row by distinguishing retraction-pair verification from direct notice capture.	Blocked-notice queue; DOI-pair verification facet; synthetic-evidence contamination timeline	Reuse for DOI-pair and status metadata only until direct notice text is captured elsewhere.	Crossref relation metadata is stronger than a generic report but still below publisher-notice reasoning.
PMRA-044-005	LIMEN-008-LEAD-003	research_integrity	crossref_work_api_original_doi	https://api.crossref.org/works/10.1056/NEJMicm2518379	2026-06-07T19:04:57Z	200	https://api.crossref.org/works/10.1056/NEJMicm2518379	Crossref / Massachusetts Medical Society metadata	Crossref exposes the original article title with visible `RETRACTED:` prefix plus publisher and journal metadata.	No direct publisher notice text or reason-bearing retraction explanation was exposed in the bounded metadata payload.	no_upgrade_metadata_only_retracted_status_confirmed	Provides one machine-readable proof that the original NEJM item now carries retracted status in public metadata even though the direct notice page remains blocked.	Source-depth ladder; metadata-status facet; synthetic-evidence contamination timeline	Carry this only as status metadata alongside the retraction DOI route; it does not close the direct-notice blocker.	Do not restate editorial reasoning beyond the title-level retracted status visible in metadata.
