sync_id	target_file	artifact_row_or_control	field	previous_value	current_value	paper_readiness_delta	shared_dependency_or_hook
SSS-047-001	results/dashboard-paper/figure-table-priority-register-v0.1.tsv	LIMEN-VIS-005	primary_source + next_smallest_publishability_move	Figure 5 cited shard-011 aggregate files only and still lacked a shared caption-control anchor in the priority register.	Figure 5 now cites `caption-control-register-v0.1.tsv:CCR-007` and explicitly requires the denominator/confidence banner when reused.	Shared figure-priority prose now has one machine-readable caption ceiling for the refreshed 21-lineage funnel.	results/dashboard-paper/caption-control-register-v0.1.tsv:CCR-007
SSS-047-002	results/dashboard-paper/figure-table-priority-register-v0.1.tsv	LIMEN-VIS-010	verified_current_state	21 lineages split authority_anchor=7; technical_authority=7; translation_caution_authority=1; provisional_or_limitations_only=6	21 publication-safe lineages split authority_anchor=7; technical_authority=7; translation_caution_authority=1; provisional_or_limitations_only=6	Shared figure-priority prose now matches the current denominator-safe authority-balance wording and keeps the Figure 7 caption-control anchor explicit.	results/dashboard-paper/caption-control-register-v0.1.tsv:CCR-005
SSS-047-003	results/dashboard-paper/caption-control-register-v0.1.tsv	CCR-007	new_shared_control	No shared Figure 5 caption-control row existed for the post-normalization shard-011 funnel.	Added `CCR-007` with the current 21-lineage / high=15 / medium=0 / low=6 contract plus explicit stale-value guardrails.	Shared manuscript, dashboard, and thesis layers can now inherit the reviewer-safe Figure 5 denominator contract from one machine-readable source.	results/boost/limen-boost-011/refreshed-evidence-funnel-safe.tsv
SSS-047-004	results/boost/limen-boost-012/manuscript-integration-register.tsv	limen-ms-fig-005	verified_quant_sentence	confidence caps high=15, medium=2, low=4	confidence caps high=15, medium=0, low=6	Shared manuscript integration text no longer overstates medium-confidence rows in the headline safe funnel.	results/dashboard-paper/caption-control-register-v0.1.tsv:CCR-007
SSS-047-005	results/boost/limen-boost-012/manuscript-integration-register.tsv	limen-ms-fig-007	verified_quant_sentence	translation_caution_authority=2, provisional_or_limitations_only=5	translation_caution_authority=1, provisional_or_limitations_only=6	Shared manuscript integration text now preserves the ORION-only authority-backed translation band and the six-row provisional/limitations layer.	results/dashboard-paper/caption-control-register-v0.1.tsv:CCR-005
SSS-047-006	results/boost/limen-boost-012/reviewer-caption-register.tsv	limen-ms-fig-005	verified_quant_sentence	confidence caps high=15, medium=2, low=4	confidence caps high=15, medium=0, low=6	Reviewer caption text for Figure 5 now matches the current safe-funnel confidence contract.	results/dashboard-paper/caption-control-register-v0.1.tsv:CCR-007
SSS-047-007	results/boost/limen-boost-012/reviewer-caption-register.tsv	limen-ms-fig-007	verified_quant_sentence	translation_caution_authority=2, provisional_or_limitations_only=5	translation_caution_authority=1, provisional_or_limitations_only=6	Reviewer caption text for Figure 7 now matches the current authority-composition split.	results/dashboard-paper/caption-control-register-v0.1.tsv:CCR-005
SSS-047-008	results/boost/limen-boost-024/canonical-figure-table-registry.tsv	LIMEN-VIS-005	shared_dependency	No caption-control pointer for the refreshed Figure 5 denominator contract.	Added `caption-control-register-v0.1.tsv:CCR-007` to the canonical registry dependency field.	The canonical visual spine now points Figure 5 readers to one reusable caption-control source instead of forcing a reconstruction from lane-local prose.	results/dashboard-paper/caption-control-register-v0.1.tsv:CCR-007
SSS-047-009	results/boost/limen-boost-024/canonical-figure-table-registry.tsv	LIMEN-VIS-010	shared_dependency	Figure 7 still depended only on the panel TSV and prose-level caution.	Added `caption-control-register-v0.1.tsv:CCR-005` to the canonical registry dependency field.	The canonical visual spine now binds Figure 7 to the shared authority-balance caption logic directly.	results/dashboard-paper/caption-control-register-v0.1.tsv:CCR-005
