audit_id	as_of_utc	surface	path	has_ccr018	has_gap_register_and_6pkg_note	verified_state	paper_readiness_delta	remaining_caution	next_smallest_publishability_move
F4-SSA-024-001	2026-06-07T12:37:21Z	canonical_registry	results/boost/limen-boost-024/canonical-figure-table-registry.tsv	true	true	14 reviewed graph edges (identifier_collision_blocker=9; reviewed_not_duplicate=5); graph currently trails the live duplicate-control ledger by 6 graph-eligible packages	Canonical Figure 4 row now points to the live shared caption control, the graph-gap register, and a reviewer-safe graph-completeness caveat instead of the stale `duplicate ledger rows=17` wording.	Graph export still remains incomplete relative to live duplicate-control ledger truth.	Either materialize the 6 graph-eligible packages from `results/boost/limen-boost-047/duplicate-graph-gap-register.tsv` or keep Figure 4 explicitly scoped as a bounded export below live ledger truth.
F4-SSA-024-002	2026-06-07T12:37:21Z	priority_register	results/dashboard-paper/figure-table-priority-register-v0.1.tsv	true	true	14 reviewed graph edges; identifier_collision_blocker=9; reviewed_not_duplicate=5; the graph still trails live duplicate-control ledger truth by 6 graph-eligible packages	Shared priority prose for `LIMEN-VIS-004` no longer carries the stale `duplicate ledger rows=17` state and now travels with `CCR-018` plus the graph-gap register.	The main blocker is no longer a one-row catch-up story but the explicit 6-package graph-versus-ledger gap.	Keep any future Figure 4 prose keyed to `CCR-018` and refresh this row whenever the gap register count changes.
F4-SSA-024-003	2026-06-07T12:37:21Z	caption_control_register	results/dashboard-paper/caption-control-register-v0.1.tsv:CCR-018	true	true	Shared Figure 4 control already requires the graph-versus-ledger split and the six-package caveat	This cycle aligned downstream registry and prose surfaces to the existing shared caption-control source of truth.	The caption-control row itself remains bounded to the current 14-edge graph export.	If Figure 4 is regenerated, re-audit every shared surface against `CCR-018` before stronger recurrence-adjacent prose is allowed.
F4-SSA-024-004	2026-06-07T12:37:21Z	preprint	draft/preprint.md	true	true	Shared prose updated	Preprint package framing and figure-order prose now explicitly route Figure 4 through `CCR-018` and the graph-gap register.	The preprint still relies on the bounded 14-edge graph rather than a fully materialized graph-export set.	Keep Figure 4 language limitations-forward until the missing 6 graph-eligible packages are materialized.
F4-SSA-024-005	2026-06-07T12:37:21Z	article_architecture	papers/article-architecture-v0.1.md	true	true	Shared prose updated	Article architecture now names the 14-edge graph, the 6-package lag, and the Figure 4 caption-control bundle directly in the visual architecture block.	The article architecture still inherits the bounded export rather than a live regenerated graph.	Refresh the Figure 4 block if the graph export grows or if `CCR-018` changes.
F4-SSA-024-006	2026-06-07T12:37:21Z	dashboard_spec	dashboard/limen-dashboard-spec-v0.1.md	true	true	Shared prose updated	Dashboard spec now preserves the Figure 4 graph-completeness caveat instead of implying a fully synchronized duplicate graph.	Dashboard-facing consumers can still overread the graph unless legend/tooltip code preserves the caveat badge.	When a dashboard implementation is attempted, surface the `6 graph-eligible packages missing from current graph export` badge by default.
