drift_id	audited_surface	field	stale_value	live_value	evidence_basis	repair_action	paper_thesis_use	dashboard_hook	residual_risk
CSND-060-001	results/boost/limen-boost-060/visual-package-current-source-note.md	shared_visual_artifacts_mapped	14	15	results/boost/limen-boost-060/visual-package-current-source-map.tsv	Refresh the note summary to enumerate all active package visuals, including `LIMEN-VIS-015` / Table 6.	Closes a reviewer-visible packaging count defect in the lane-local reuse note.	Keeps manifest-driven figure/table inventory exports from silently undercounting the live package.	The note is repaired, but any future visual-package addition still requires a paired note refresh.
CSND-060-002	results/boost/limen-boost-060/visual-package-current-source-note.md	table_rows	6	7	results/boost/limen-boost-060/visual-package-current-source-map.tsv	Refresh the note summary so table count matches the live 15-artifact manifest.	Prevents manuscript/thesis routing notes from silently dropping one live table.	Maintains correct Figure/Table split for dashboard inventory and appendix planning.	The note remains derivative and must track later manifest changes.
CSND-060-003	results/boost/limen-boost-060/visual-package-current-source-note.md	boost_local_exports_still_blocked_from_shared_results_dashboard_promotion	9	10	results/boost/limen-boost-060/visual-package-current-source-map.tsv	Refresh the blocked-export count and keep filesystem-policy language explicit.	Keeps the publishability note honest about how much of the package still depends on boost-local exports.	Signals that one additional intended shared-export path now exists but remains blocked rather than materialized.	Substantive blocker remains host write policy, not lane-local prose.
CSND-060-004	results/boost/limen-boost-060/visual-package-current-source-note.md	visuals_with_no_caption_control_row_yet	1 (`LIMEN-VIS-003`)	0	results/boost/limen-boost-060/visual-package-current-source-map.tsv; results/dashboard-paper/caption-control-register-v0.1.tsv:CCR-017; results/dashboard-paper/caption-control-register-v0.1.tsv:CCR-018; results/dashboard-paper/caption-control-register-v0.1.tsv:CCR-019	Refresh the note to reflect that every live visual now has at least one shared caption-control row.	Removes a stale hostile-reviewer warning that could wrongly route future Figure 3 or Figure 4 reuse as uncaptained.	Lets dashboard/manuscript QA start from the manifest without re-deriving whether any live visual still lacks caption governance.	Figure-specific bounded-use cautions still travel through the caption-control rows and companion gap registers.
CSND-060-005	results/boost/limen-boost-060/visual-package-current-source-note.md	visuals_with_multiple_caption_control_rows	2 (`LIMEN-VIS-002`, `LIMEN-VIS-008`)	1 (`LIMEN-VIS-002`)	results/boost/limen-boost-060/visual-package-current-source-map.tsv	Refresh the note so only the current multi-control visual remains flagged.	Avoids overstating caption-control branching complexity in the default lane-local QA note.	Simplifies dashboard/manual-routing logic to the only live multi-control visual.	Overlay-specific companion controls can still exist outside the manifest's default control_ids field.