as_of_utc	artifact_path	stale_state	patched_state	paper_readiness_delta	remaining_blocker
2026-06-07T19:10:41Z	results/boost/limen-boost-060/visual-package-current-source-map.tsv:LIMEN-VIS-002	Figure 2 still described the refreshed bundle through staged `31/23` plus live `34/26` wording.	Figure 2 now records the refreshed `35/27` boost-local source and routes reuse through CCR-001/CCR-002 plus fragility and zero-seed sidecars.	Stops lane-local routing helpers from reintroducing superseded Figure 2 denominators after the refresh bundle already landed.	Shared results/dashboard promotion remains host-blocked.
2026-06-07T19:10:41Z	results/boost/limen-boost-060/visual-package-current-source-map.tsv:LIMEN-VIS-004	Figure 4 still carried a pre-complete `20/21` graph state in lane-local routing helpers.	Figure 4 now records the current complete graph-safe `22`-edge export and keeps the graph-versus-ledger non-recurrence ceiling explicit.	Aligns lane-local graph routing with the current shared Figure 4 control contract and removes a stale completeness warning.	Shared results/dashboard promotion remains host-blocked; scope caution still required.
2026-06-07T19:10:41Z	results/boost/limen-boost-060/visual-package-current-source-map.tsv:LIMEN-VIS-015	Security Table 6 routing helper still preserved the older `3 / 5 / 1 / 2` package split.	Security Table 6 now records the live `3 / 6 / 1 / 1` package with the exact-AVID row still limitations-only.	Prevents lane-local dashboard/manuscript reuse from reopening retired shard-004 package counts.	Peer-reviewed security case support remains the last explicit family-level gap.
2026-06-07T19:10:41Z	results/boost/limen-boost-060/visual-control-gap-register.tsv	The gap register still treated Figure 2 refresh, Figure 4 completeness, and Table 1A export-stub absence as open problems.	The gap register now marks Figure 2 refresh as closed but shared-export-blocked, Figure 4 as current but scope-guarded, and Table 1A export-stub absence as resolved.	Gives later shard-012 cycles one current route selector for what is truly still open versus what is already closed.	Figure 7 multistate-safe repair remains the main unresolved shard-012 visual denominator blocker.
2026-06-07T19:10:41Z	results/boost/limen-boost-060/open-visual-blocker-register.tsv	The blocker register still described Figure 2 as needing refresh rather than promotion and sidecar discipline.	The blocker register now routes Figure 2 through post-refresh host-blocked promotion logic, preserves Figure 4 as a scope guardrail, and keeps the resolved Table 1A stub closure explicit.	Reduces route-selection drift and helps future lanes avoid reopening already-closed packaging bugs.	Host-level shared dashboard writes remain blocked; Figure 7 still needs a multistate-safe export/validator path.
