signal_id	source_review_verdict	source_review_role	reason	claim_ceiling	next_action	source_path
LIMEN-SIGNAL-A72A8CBB594D9C95	translation_review_needed	translation_sensitive_official_surface	Named official source lead appears translation-sensitive in local evidence.	translation-safe source-surface review only	route to translation-aware source review	/srv/tyche/pallas/pallas-ai-agent-observatory/reports/PALLAS_SECOND_PASS_SPRINT_7_HARDENING_SUMMARY.csv
LIMEN-SIGNAL-A72B68404E574AC1	source_reviewed_candidate	official_guidance_surface	Named Dutch government guidance page is a concrete official source surface.	source-surface existence only; no policy inference	open bounded source-surface review	/srv/tyche/pallas/pallas-ai-agent-observatory/reports/PALLAS_READINESS_WORLD_SOURCE_PACK.csv
LIMEN-SIGNAL-A7309C1F87D3A0D2	needs_named_source_extraction	derived_matrix_pointer	Matrix delta cites a guideline but does not expose a named reviewable source surface here.	extract named direct source before review	extract exact guideline title or URL locally	/srv/tyche/pallas/pallas-ai-agent-observatory/reports/PALLAS_SECOND_PASS_CANDIDATE_MATRIX_DELTA.csv
LIMEN-SIGNAL-A7493FC7B9088E1E	reject_noise	derived_atlas_gap_flags	Local atlas gap-flags JSON is derived summary, not a direct source surface.	derived/local artifact only	drop from direct-source queue	/srv/tyche/pallas/pallas-ai-agent-observatory/program/01-pallas-atlas/app/data/pallas_atlas_countries.json
LIMEN-SIGNAL-A755EF0CDA9425BD	merge_existing_surface	modeled_registry_surface	Row points to the already-modeled Dutch Algorithm Register surface.	dedupe to modeled registry surface only	merge into NL-ALG-REG surface	/srv/tyche/projects/public-ai-registry/data/registry-deployed-record-accession-all-20260607.csv
LIMEN-SIGNAL-A75D4F53E0CECA71	negative_evidence_candidate	official_regulator_negative_check	Official regulator home page is used here as a negative sandbox check.	gap/absence evidence only; not proof of no source	retain as bounded negative evidence	/srv/tyche/pallas/pallas-ai-agent-observatory/reports/PALLAS_SECOND_PASS_SPRINT_3_SOURCE_REFRESH.csv
LIMEN-SIGNAL-A7678E7A7B4FFF40	translation_review_needed	translation_sensitive_official_surface	Foreign-language official-source digest points to a plausible direct surface but needs translation-aware handling.	translation-safe source-surface review only	route to translation-aware source review	/srv/tyche/atlas/tyche-thesis-atlas-factory/corpus/v0.2-working/data/lanes/south-asian-language-records.jsonl
LIMEN-SIGNAL-A783D161DE51D81C	negative_evidence_candidate	official_database_negative_check	Official WIPO Lex results page is used here for negative sandbox screening.	gap/absence evidence only; not proof of no source	retain as bounded negative evidence	/srv/tyche/pallas/pallas-ai-agent-observatory/reports/PALLAS_READINESS_SPRINT_4_SOURCE_PACK.csv
LIMEN-SIGNAL-A784B6F3D1F0C240	reject_noise	internal_script_artifact	Python script text is internal derived artifact, not a reviewable source surface.	derived/local artifact only	drop from direct-source queue	/srv/tyche/pallas/pallas-ai-agent-observatory/scripts/synthesize-sprint4-tail-from-atlases.py
LIMEN-SIGNAL-A78BF992C4A37457	negative_evidence_candidate	country_review_negative_summary	Local row records a warning or non-find, not a direct source surface.	gap/absence evidence only; not proof of no source	retain as bounded negative evidence	/srv/tyche/pallas/pallas-ai-agent-observatory/reports/PALLAS_SECOND_PASS_COUNTRY_REVIEW_LOAD.csv
LIMEN-SIGNAL-A79634CC8011C3DC	negative_evidence_candidate	official_portal_negative_check	Local row records official-portal search-negative evidence for no public register found.	gap/absence evidence only; not proof of no source	retain as bounded negative evidence	/srv/tyche/pallas/pallas-ai-agent-observatory/reports/PALLAS_SECOND_PASS_CONFIDENCE_CHANGES.csv
LIMEN-SIGNAL-A7A2837F6CEBF15C	negative_evidence_candidate	official_portal_negative_check	Government portal lead is used only as negative transparency anchor in local metadata.	gap/absence evidence only; not proof of no source	retain as bounded negative evidence	/srv/tyche/pallas/pallas-ai-agent-observatory/reports/PALLAS_READINESS_SPRINT_5_SOURCE_PACK.csv
LIMEN-SIGNAL-A7B34EC0C3646907	reject_noise	manuscript_digest_artifact	Claim-support digest of manuscript text is derived prose, not a direct source surface.	derived/local artifact only	drop from direct-source queue	/srv/tyche/atlas/tyche-thesis-atlas-factory/results/exploitation-wave-cross-20260605T193210Z/claim-support-digest.json
LIMEN-SIGNAL-A7B39A29A59D299B	reject_noise	case_study_prose	Local case-study prose is not a named direct source surface.	derived/local artifact only	drop from direct-source queue	/srv/tyche/pallas/pallas-ai-agent-observatory/reports/PALLAS_ESTONIA_FLAGSHIP_CASE_STUDY.md
LIMEN-SIGNAL-A7B56E5D6B324F72	negative_evidence_candidate	official_search_negative_check	Official site search is used here to record a no-find for procurement AI.	gap/absence evidence only; not proof of no source	retain as bounded negative evidence	/srv/tyche/pallas/pallas-ai-agent-observatory/reports/PALLAS_SECOND_PASS_SPRINT_7_SOURCE_REFRESH.csv
LIMEN-SIGNAL-A7B68B388E407D7D	reject_noise	claim_support_digest_artifact	Claim-support digest with URL list is derived support material, not the direct source surface itself.	derived/local artifact only	drop from direct-source queue	/srv/tyche/atlas/tyche-thesis-atlas-factory/results/exploitation-wave-20260605T192332Z/claim-support-digest.json
LIMEN-SIGNAL-A7B7F55612B4FA42	merge_existing_surface	modeled_registry_surface	Preprint-package table duplicates the already-modeled Dutch Algorithm Register surface.	dedupe to modeled registry surface only	merge into NL-ALG-REG surface	/srv/tyche/projects/public-ai-registry/results/submission-preprint-packages/public-ai-registry-preprint-package-20260607T020930Z/tables/registry-deployed-record-accession-all-20260607.csv
LIMEN-SIGNAL-A7CC52EE22C603F4	reject_noise	claim_support_digest_artifact	Cross-wave claim-support digest is derived support material, not a direct source surface.	derived/local artifact only	drop from direct-source queue	/srv/tyche/atlas/tyche-thesis-atlas-factory/results/exploitation-wave-cross-20260605T193210Z/claim-support-digest.json
LIMEN-SIGNAL-A7D4A613B29967C6	reject_noise	completion_report_artifact	Completion report aggregate table is internal reporting, not a direct source surface.	derived/local artifact only	drop from direct-source queue	/srv/tyche/pallas/pallas-ai-agent-observatory/reports/PALLAS_SECOND_PASS_COMPLETION_REPORT.md
LIMEN-SIGNAL-A7DE2A06533A766B	negative_evidence_candidate	official_proxy_negative_check	Official digital-government portal is explicitly noted as not an algorithm register.	gap/absence evidence only; not proof of no source	retain as bounded negative evidence	/srv/tyche/pallas/pallas-ai-agent-observatory/reports/PALLAS_READINESS_SPRINT_3_SOURCE_PACK.csv
LIMEN-SIGNAL-A808B6957F14ABCA	reject_noise	scholarly_reference_artifact	Scholarly literature table is not a direct official source surface.	derived/local artifact only	drop from direct-source queue	/srv/tyche/projects/public-ai-registry/results/submission-preprint-packages/public-ai-registry-preprint-package-20260607T020930Z/tables/systematic-literature-included-20260608.csv
LIMEN-SIGNAL-A814CB47D915123E	negative_evidence_candidate	official_portal_negative_check	Local row records checked-official-source negative evidence for no public register found.	gap/absence evidence only; not proof of no source	retain as bounded negative evidence	/srv/tyche/pallas/pallas-ai-agent-observatory/reports/PALLAS_SECOND_PASS_SPRINT_6_CANDIDATE_MATRIX_DELTA.csv
LIMEN-SIGNAL-A81E6C2A97FDD5C6	translation_review_needed	translation_sensitive_official_surface	Foreign-language digest describes a plausible direct court source but needs translation-aware review.	translation-safe source-surface review only	route to translation-aware source review	/srv/tyche/gaia/tyche-research-vault/release/gaia-preprint-freeze-20260605T0815EEST/site/gaia-agent-atlas/public/data/foreign-language-digest.json
LIMEN-SIGNAL-A838355E4B537636	negative_evidence_candidate	official_anchor_negative_check	Local metadata records an official anchor with no procurement source found.	gap/absence evidence only; not proof of no source	retain as bounded negative evidence	/srv/tyche/pallas/pallas-ai-agent-observatory/reports/PALLAS_SECOND_PASS_SPRINT_5_COUNTRY_SCORE_DELTA.csv
LIMEN-SIGNAL-A8386DB7B2C88DA8	source_reviewed_candidate	official_guidance_surface	Named Digitale Overheid algoritmeregister guidance page is a concrete official source surface.	source-surface existence only; no policy inference	open bounded source-surface review	/srv/tyche/pallas/pallas-ai-agent-observatory/reports/PALLAS_SECOND_PASS_SPRINT_7_SOURCE_REFRESH.csv
LIMEN-SIGNAL-A8482A93057BB22A	reject_noise	scholarly_index_artifact	Scholarly index metadata is not a direct public source surface.	derived/local artifact only	drop from direct-source queue	/srv/tyche/atlas/tyche-thesis-atlas-factory/corpus/v0.2-working/data/lanes/books-theory-latest.jsonl
LIMEN-SIGNAL-A8486E0217BEDAC8	merge_existing_surface	modeled_registry_surface	Review-frame row duplicates the already-modeled Dutch Algorithm Register surface.	dedupe to modeled registry surface only	merge into NL-ALG-REG surface	/srv/tyche/projects/public-ai-registry/results/submission-preprint-packages/public-ai-registry-preprint-package-20260607T020930Z/zenodo/public-ai-registry-observatory-initial-corpus-20260608/data/stratified-record-review-frame-20260608.csv
LIMEN-SIGNAL-A877B1B8A1524F13	reject_noise	derived_atlas_fact_artifact	Derived facts JSONL about an agent page is not a direct source surface.	derived/local artifact only	drop from direct-source queue	/srv/tyche/gaia/tyche-research-vault/data/global-agent-atlas-v0.1/backups-cycle-341-active-lanes-8-ttconnect-anansi-trust-and-human-escalation-hardening/facts.jsonl
LIMEN-SIGNAL-A88209CBFFF91597	negative_evidence_candidate	official_portal_negative_check	Open-data portal row is explicitly treated as not evidence of an AI register.	gap/absence evidence only; not proof of no source	retain as bounded negative evidence	/srv/tyche/pallas/pallas-ai-agent-observatory/reports/PALLAS_SECOND_PASS_SPRINT_10_SOURCE_REFRESH.csv
LIMEN-SIGNAL-A8852798F6EC428D	negative_evidence_candidate	official_search_negative_check	Targeted official-source checks are recorded as negative evidence for no public register found.	gap/absence evidence only; not proof of no source	retain as bounded negative evidence	/srv/tyche/pallas/pallas-ai-agent-observatory/reports/PALLAS_SECOND_PASS_SPRINT_7_COUNTRY_SCORE_DELTA.csv
LIMEN-SIGNAL-A8AEC594F6DE35CC	source_reviewed_candidate	official_regulator_surface	Named Reserve Bank of Fiji sandbox guideline is a concrete regulator source surface.	source-surface existence only; no policy inference	open bounded source-surface review	/srv/tyche/pallas/pallas-ai-agent-observatory/reports/PALLAS_SECOND_PASS_SPRINT_5_SOURCE_REFRESH.csv
LIMEN-SIGNAL-A8C5F6DD8F5DD2C6	source_reviewed_candidate	official_strategy_surface	Named ministry action-plan PDF is a concrete official source surface.	source-surface existence only; no policy inference	open bounded source-surface review	/srv/tyche/pallas/pallas-ai-agent-observatory/reports/PALLAS_READINESS_WORLD_SOURCE_PACK.csv
LIMEN-SIGNAL-A8E80BCB0547A3E5	reject_noise	scholarly_index_artifact	Scholarly article metadata is not a direct public source surface.	derived/local artifact only	drop from direct-source queue	/srv/tyche/atlas/tyche-thesis-atlas-factory/corpus/v0.2-working/data/lanes/books-theory-latest.jsonl
LIMEN-SIGNAL-A9023B46D06261F5	reject_noise	claim_support_note	Claim-support markdown is internal analysis, not a direct source surface.	derived/local artifact only	drop from direct-source queue	/srv/tyche/atlas/tyche-thesis-atlas-factory/preprint-packages/tyche-thesis-atlas-v0.2.3-preprint/analysis/claim-support/claim-support-refresh-v0.2.md
LIMEN-SIGNAL-A902AC1AA0DC5700	merge_existing_surface	modeled_registry_surface	Candidate row points to the already-modeled Government of Canada AI Register surface.	dedupe to modeled registry surface only	merge into CA-AI-REG surface	/srv/tyche/projects/public-ai-registry/data/registry-record-accession-candidates-all-priorities-20260607.csv
LIMEN-SIGNAL-A9061EE943B8A703	translation_review_needed	translation_sensitive_official_surface	Foreign-language digest points to a plausible official sandbox-related source and needs translation-aware handling.	translation-safe source-surface review only	route to translation-aware source review	/srv/tyche/gaia/tyche-research-vault/submissions/gaia-preprint-package-20260607T1516EEST/daily/gaia-foreign-language-digest-latest.json
LIMEN-SIGNAL-A9190218373069C0	reject_noise	semantic_link_artifact	Semantic-links JSONL is internal linkage metadata, not a direct source surface.	derived/local artifact only	drop from direct-source queue	/srv/tyche/atlas/tyche-thesis-atlas-factory/analysis/evidence-package/evidence-package-semantic-links-v0.2.jsonl
LIMEN-SIGNAL-A919844F70C54ED8	source_reviewed_candidate	official_program_surface	Official governing-program PDF is a concrete institutional source surface.	source-surface existence only; no policy inference	open bounded source-surface review	/srv/tyche/pallas/pallas-ai-agent-observatory/reports/PALLAS_SECOND_PASS_SPRINT_9_SOURCE_REFRESH.csv
LIMEN-SIGNAL-A9199AABB09E85EF	reject_noise	foreign_language_digest_artifact	Digest theme fragment does not expose a named reviewable direct source surface.	derived/local artifact only	drop from direct-source queue	/srv/tyche/gaia/tyche-research-vault/release/gaia-preprint-freeze-20260605T0815EEST/site/gaia-agent-atlas/public/data/foreign-language-digest.json
LIMEN-SIGNAL-A92AF521F90C92AA	source_reviewed_candidate	official_framework_surface	Named IMDA/AI Verify framework page is a concrete institutional source surface.	source-surface existence only; no policy inference	open bounded source-surface review	/srv/tyche/pallas/pallas-ai-agent-observatory/reports/PALLAS_READINESS_SPRINT_1_SOURCE_PACK.csv
LIMEN-SIGNAL-A9328989A6C0F2EA	translation_review_needed	translation_sensitive_negative_check	Local row is a Hebrew-language search-gap note that needs translation-aware handling.	translation-safe source-surface review only	route to translation-aware source review	/srv/tyche/pallas/pallas-ai-agent-observatory/reports/PALLAS_OBSERVABILITY_LANE_SOURCE_CANDIDATES.csv
LIMEN-SIGNAL-A932A3D83D35F386	source_reviewed_candidate	official_regulator_surface	Named Superintendencia sandbox page is a concrete regulator source surface.	source-surface existence only; no policy inference	open bounded source-surface review	/srv/tyche/pallas/pallas-ai-agent-observatory/reports/PALLAS_READINESS_WORLD_SOURCE_PACK.csv
LIMEN-SIGNAL-A93B1474FF6BCAE6	negative_evidence_candidate	official_search_negative_check	Official government site search is used here as a negative register check.	gap/absence evidence only; not proof of no source	retain as bounded negative evidence	/srv/tyche/pallas/pallas-ai-agent-observatory/reports/PALLAS_READINESS_SPRINT_3_SOURCE_PACK.csv
LIMEN-SIGNAL-A96E936AF8D06EC0	source_reviewed_candidate	official_regulator_surface	Named Seychelles sandbox-guidelines page is a concrete regulator source surface.	source-surface existence only; no policy inference	open bounded source-surface review	/srv/tyche/pallas/pallas-ai-agent-observatory/reports/PALLAS_SECOND_PASS_SPRINT_2_SOURCE_REFRESH.csv
LIMEN-SIGNAL-A9720D6653475D9A	negative_evidence_candidate	official_search_negative_check	Official public-portal checks are recorded as negative evidence for no register found.	gap/absence evidence only; not proof of no source	retain as bounded negative evidence	/srv/tyche/pallas/pallas-ai-agent-observatory/reports/PALLAS_SECOND_PASS_SPRINT_4_SOURCE_REFRESH.csv
LIMEN-SIGNAL-A9900ADF34D100C6	merge_existing_surface	modeled_registry_surface	Deployed-record row points to the already-modeled Government of Canada AI Register surface.	dedupe to modeled registry surface only	merge into CA-AI-REG surface	/srv/tyche/projects/public-ai-registry/data/registry-deployed-record-accession-all-20260607.csv
LIMEN-SIGNAL-A99D58673A9D1CD9	merge_existing_surface	modeled_registry_surface	Review-frame row duplicates the already-modeled Dutch Algorithm Register surface.	dedupe to modeled registry surface only	merge into NL-ALG-REG surface	/srv/tyche/projects/public-ai-registry/results/submission-preprint-packages/public-ai-registry-preprint-package-20260607T020930Z/zenodo/public-ai-registry-observatory-initial-corpus-20260608/data/stratified-record-review-frame-20260608.csv
LIMEN-SIGNAL-A9A259E9AAF504BA	merge_existing_surface	modeled_registry_surface	Review-frame row duplicates the already-modeled Dutch Algorithm Register surface.	dedupe to modeled registry surface only	merge into NL-ALG-REG surface	/srv/tyche/projects/public-ai-registry/results/submission-preprint-packages/public-ai-registry-preprint-package-20260607T020930Z/zenodo/public-ai-registry-observatory-initial-corpus-20260608/data/stratified-record-review-frame-20260608.csv
LIMEN-SIGNAL-A9A3D6953D866589	translation_review_needed	translation_sensitive_official_surface	Named CAC deep-synthesis provisions are a plausible direct official source but translation-sensitive.	translation-safe source-surface review only	route to translation-aware source review	/srv/tyche/gaia/tyche-research-vault/submissions/agent-atlas-public-release-2026-06-01/03-zenodo-agent-atlas-artifact-v0.1/artifact/data/global-agent-atlas-v0.1/exports/global-agent-atlas-source-documents-v0.1.csv
LIMEN-SIGNAL-A9DFB6A80DD88B17	negative_evidence_candidate	official_portal_negative_check	Local row records checked-official-source negative evidence for no public register verified.	gap/absence evidence only; not proof of no source	retain as bounded negative evidence	/srv/tyche/pallas/pallas-ai-agent-observatory/reports/PALLAS_SECOND_PASS_SPRINT_5_COUNTRY_SCORE_DELTA.csv
LIMEN-SIGNAL-A9E0BEBD49FB3C08	merge_existing_surface	modeled_registry_surface	Gap-map template row points to the already-modeled Government of Canada AI Register surface.	dedupe to modeled registry surface only	merge into CA-AI-REG surface	/srv/tyche/projects/public-ai-registry/results/boost/public-ai-registry-boost-014/deployed-gap-map-field-coding-template-v0.1.csv
LIMEN-SIGNAL-A9FBF3D984885F52	reject_noise	hypothesis_lab_artifact	Hypothesis-lab JSON is derived analytical summary, not a direct source surface.	derived/local artifact only	drop from direct-source queue	/srv/tyche/pallas/pallas-ai-agent-observatory/results/hypothesis-lab/pallas-confidence-burden-typology-v0.1.json
LIMEN-SIGNAL-AA00B4246D54BA7D	reject_noise	world_matrix_summary_artifact	World-matrix summary JSON is derived aggregate analysis, not a direct source surface.	derived/local artifact only	drop from direct-source queue	/srv/tyche/pallas/pallas-ai-agent-observatory/results/world-readiness-overview/country-readiness-world-matrix.json
LIMEN-SIGNAL-AA1DFE21A16667F9	reject_noise	claim_support_curated_artifact	Curated claim-support JSON is derived analysis, not a direct source surface.	derived/local artifact only	drop from direct-source queue	/srv/tyche/pallas/pallas-ai-agent-observatory/results/exploitation-wave-pallas-20260605T192817Z/claim-support-curated.json
LIMEN-SIGNAL-AA388D918E34380F	source_reviewed_candidate	official_sandbox_surface	Named Cabinet Secretariat sandbox portal is a concrete official source surface.	source-surface existence only; no policy inference	open bounded source-surface review	/srv/tyche/pallas/pallas-ai-agent-observatory/reports/PALLAS_SECOND_PASS_SPRINT_14_SOURCE_REFRESH.csv
LIMEN-SIGNAL-AA50F9DEC10575FC	negative_evidence_candidate	policy_gap_negative_summary	Local row records no AI procurement controls found rather than a direct source surface.	gap/absence evidence only; not proof of no source	retain as bounded negative evidence	/srv/tyche/pallas/pallas-ai-agent-observatory/reports/PALLAS_SECOND_PASS_SPRINT_12_CANDIDATE_MATRIX_DELTA.csv
LIMEN-SIGNAL-AA5BDEA907C05453	negative_evidence_candidate	official_search_negative_check	Queue row records official-search negative evidence for no public register found.	gap/absence evidence only; not proof of no source	retain as bounded negative evidence	/srv/tyche/pallas/pallas-ai-agent-observatory/reports/PALLAS_SECOND_PASS_REVIEW_QUEUE.csv
LIMEN-SIGNAL-AA683D2404A4C03E	negative_evidence_candidate	official_portal_negative_check	Official digital-government source is used here only for a no-register negative check.	gap/absence evidence only; not proof of no source	retain as bounded negative evidence	/srv/tyche/pallas/pallas-ai-agent-observatory/reports/PALLAS_READINESS_SPRINT_4_SOURCE_PACK.csv
LIMEN-SIGNAL-AA72F58F6A885299	merge_existing_surface	modeled_registry_surface	Boost materialization row duplicates the already-modeled Dutch Algorithm Register surface.	dedupe to modeled registry surface only	merge into NL-ALG-REG surface	/srv/tyche/projects/public-ai-registry/results/boost/public-ai-registry-boost-022/field-coding-subset-materialization-v0.1.csv
LIMEN-SIGNAL-AA75BAEF1A94491C	merge_existing_surface	modeled_registry_surface	Accession candidate row points to the already-modeled Dutch Algorithm Register surface.	dedupe to modeled registry surface only	merge into NL-ALG-REG surface	/srv/tyche/projects/public-ai-registry/data/registry-record-accession-candidates-all-priorities-20260607.csv
LIMEN-SIGNAL-AA7D35F095DDBD78	source_reviewed_candidate	official_procurement_surface	Named State Procurement Agency website is a concrete official procurement source surface.	source-surface existence only; no policy inference	open bounded source-surface review	/srv/tyche/pallas/pallas-ai-agent-observatory/reports/PALLAS_SECOND_PASS_SPRINT_12_SOURCE_REFRESH.csv
LIMEN-SIGNAL-AA848561ECB26760	reject_noise	country_profile_artifact	Observability country profile prose is derived synthesis, not a direct source surface.	derived/local artifact only	drop from direct-source queue	/srv/tyche/pallas/pallas-ai-agent-observatory/program/08-observability-index/OBSERVABILITY_COUNTRY_PROFILES.md
LIMEN-SIGNAL-AA8CAB243C115BC8	negative_evidence_candidate	mixed_evidence_negative_summary	Local row records partial transparency plus explicit no-national-register finding.	gap/absence evidence only; not proof of no source	retain as bounded negative evidence	/srv/tyche/pallas/pallas-ai-agent-observatory/reports/PALLAS_SECOND_PASS_SPRINT_12_COUNTRY_SCORE_DELTA.csv
LIMEN-SIGNAL-AA923456358C56E7	reject_noise	internal_nextmd_artifact	Internal planning note is not a direct source surface.	derived/local artifact only	drop from direct-source queue	/srv/tyche/projects/limen-ai-edge-case-atlas/next.md
LIMEN-SIGNAL-AA94FA28D654E78B	merge_existing_surface	modeled_registry_surface	Preprint-package table points to the already-modeled Government of Canada AI Register surface.	dedupe to modeled registry surface only	merge into CA-AI-REG surface	/srv/tyche/projects/public-ai-registry/results/submission-preprint-packages/public-ai-registry-preprint-package-20260607T020930Z/tables/registry-deployed-record-accession-all-20260607.csv
LIMEN-SIGNAL-AAB5779435F2BEF6	negative_evidence_candidate	official_search_negative_check	Government search row records no public algorithm or AI register found.	gap/absence evidence only; not proof of no source	retain as bounded negative evidence	/srv/tyche/pallas/pallas-ai-agent-observatory/reports/PALLAS_READINESS_WORLD_SOURCE_PACK.csv
LIMEN-SIGNAL-AABFCCB9ABDE2D0E	reject_noise	wrapper_monitor_artifact	GovernanceMonitors history row is a wrapper artifact, not a named direct source surface.	derived/local artifact only	drop from direct-source queue	/srv/tyche/atlas/tyche-thesis-atlas-factory/corpus/v0.2-working/gaia-agent-atlas/gaia-governanceMonitors-history.jsonl
LIMEN-SIGNAL-AAC3B0B4DEAEBB13	reject_noise	backup_script_artifact	Backup Python artifact with prose is not a direct source surface.	derived/local artifact only	drop from direct-source queue	/srv/tyche/atlas/tyche-thesis-atlas-factory/bin/hermes_remote_factory.py.fast-20260530T130116Z.bak
LIMEN-SIGNAL-AACCE313EF9B0F9D	reject_noise	derived_product_record_artifact	Derived product-record JSONL is not a public direct source surface.	derived/local artifact only	drop from direct-source queue	/srv/tyche/gaia/tyche-research-vault/data/global-agent-atlas-v0.1/backups-cycle-123-20260603T0448/records.jsonl
LIMEN-SIGNAL-AADF1A11BD7D0487	merge_existing_surface	modeled_registry_surface	Preprint-package table duplicates the already-modeled Dutch Algorithm Register surface.	dedupe to modeled registry surface only	merge into NL-ALG-REG surface	/srv/tyche/projects/public-ai-registry/results/submission-preprint-packages/public-ai-registry-preprint-package-20260607T020930Z/zenodo/public-ai-registry-observatory-initial-corpus-20260608/data/registry-deployed-record-accession-all-20260607.csv
LIMEN-SIGNAL-AAEC2302A6C09F4F	source_reviewed_candidate	official_regulator_surface	Named Datatilsynet report page is a concrete official regulator source surface.	source-surface existence only; no policy inference	open bounded source-surface review	/srv/tyche/pallas/pallas-ai-agent-observatory/reports/PALLAS_SECOND_PASS_SPRINT_14_SOURCE_REFRESH.csv
LIMEN-SIGNAL-AAEC48BF6151B711	merge_existing_surface	modeled_registry_surface	Accession candidate row points to the already-modeled Dutch Algorithm Register surface.	dedupe to modeled registry surface only	merge into NL-ALG-REG surface	/srv/tyche/projects/public-ai-registry/data/registry-record-accession-candidates-all-priorities-20260607.csv
