as_of_utc	audit_row_id	artifact_path	surface_role	alignment_status	cycle_delta	evidence_verified_now	remaining_gap_or_scope_limit	paper_thesis_use	dashboard_hook	next_smallest_publishability_move
2026-06-07T10:57:00Z	pssa-030-001	draft/preprint.md	public-sector disclosure asymmetry fragment	patched_to_current_sf09_control_state	Added Amsterdam current-plus-history CSV export depth plus explicit buyer-side-unresolved wording so the manuscript fragment now matches the live proof-ceiling and ladder surfaces.	5-row scope; 3 evidence classes; UK regulator rows as direct notice/reprimand anchors without buyer-side procurement traces; Amsterdam export-depth plus buyer-side-unresolved state; Helsinki family-level same-buyer supplier-consistent award ceiling; no count/denominator overread.	Fragment still depends on shared control artifacts for exact caption and row-level ceiling reuse; no new municipal buyer-side companion was added.	Preprint result paragraph and thesis chapter prose can now cite the same Amsterdam/Helsinki contrast used in the shared controls.	Table 1B prose sync; Amsterdam caution badge; Helsinki linkage badge.	Reuse this fragment only with `results/dashboard-paper/caption-control-register-v0.1.tsv:CCR-015` and `results/dashboard-paper/public-sector-proof-ceilings-v0.1.tsv` visible.
2026-06-07T10:57:00Z	pssa-030-002	papers/article-architecture-v0.1.md	Result block 6B / 6B1 architecture	already_aligned	No file change this cycle; architecture already preserves Amsterdam buyer-side-unresolved wording, Helsinki family-level caution, and denominator discipline.	5-row comparison; 4 ladder states; Amsterdam current-plus-history export gain without buyer-side closure; Helsinki same-buyer supplier-consistent award ceiling; denominator tied back to the 21-lineage aggregate rather than the 5-row slice.	Does not itself provide row-level quote text; UK legal-basis wording still needs the authoritative claim-support register when quoted exactly.	Article architecture and methods/results routing spine for the first LIMEN paper and thesis package.	Table 1B and Table 1B1 route contract.	Keep future prose changes anchored to `results/boost/limen-boost-042/public-sector-traceability-ladder.tsv` and `results/dashboard-paper/public-sector-proof-ceilings-v0.1.tsv`.
2026-06-07T10:57:00Z	pssa-030-003	dashboard/limen-dashboard-spec-v0.1.md	public-sector panel and ladder contract	already_aligned	No file change this cycle; dashboard spec already carries Amsterdam export-depth wording, Helsinki family-level buyer-side continuity, and the 5-row / 3-surface-class panel summary.	Panel scope, ladder states, Amsterdam export-depth caveat, Helsinki IBM-consistent award/value note, and sf09 blocker priority remain visible.	UK rows are summarized at panel level rather than with exact quote-ready legal-basis text; that remains intentionally delegated to the authoritative support layer.	Dashboard legend/tooltip contract and thesis observatory interpretation note.	Public-sector comparison card; ladder view; blocker queue badge.	Keep dashboard-facing exports routed through `results/dashboard-paper/shared-export-promotion-register-v0.1.tsv` until the blocked shared dashboard path is materially promoted.
2026-06-07T10:57:00Z	pssa-030-004	results/dashboard-paper/public-sector-disclosure-asymmetry-v0.1.md	shared public-sector note	already_aligned	No file change this cycle; the shared note already carries the five-row heterogeneity claim, Amsterdam/Helsinki cautions, and the non-denominator rule.	Three disclosure surfaces; Amsterdam exact-row current+history export depth with buyer-side gap; Helsinki family-level same-buyer supplier-consistent award support; UK regulator rows strongest for quoted legal-basis/remedy text; ORION as project-disclosure floor.	The note remains a bounded panel summary, not a new evidence source or buyer-side upgrade.	Shared note for paper, dashboard, and thesis reuse without lane-local prose drift.	Primary Table 1B narrative source.	If another sf09 cycle lands, spend it on one genuinely different official buyer-side or public-assessment companion route rather than more wording-only edits.
2026-06-07T10:57:00Z	pssa-030-005	claims.md:LIMEN-C-012	shared claims layer	aligned_with_intended_scope_limit	No file change this cycle; `LIMEN-C-012` already states the family-level disclosure-surface heterogeneity claim and keeps Amsterdam/Helsinki caution boundaries visible.	Five-row mini-corpus; one official project page, two direct regulator-document packages, and two municipal public AI-register rows; Amsterdam buyer-side unresolved; Helsinki family-level same-buyer supplier-consistent award state.	Claims layer intentionally does not encode every row-level visual detail such as Amsterdam history-export depth; those belong in the proof-ceiling and publication-cell artifacts.	Shared claim-support line for manuscript, dashboard, and thesis cross-references.	Claim bundle root for Table 1B references.	Keep row-level caption wording and next-upgrade logic in the sf09 control artifacts rather than inflating `claims.md` into a visual registry.