shared_row_id	package_branch	case_key_or_bucket	jurisdiction_scope	sector_scope	source_depth_state	strongest_public_support_now	publication_safe_claim	publication_safe_limitation	current_support_refs	paper_thesis_use	shared_table_role	dashboard_hook	next_smallest_upgrade	caution
AWADP-009-001	ai_washing_or_false_ai_claim	LIMEN-000001	United States	regulated_finance	settled_regulator_order	SEC order text directly supports false and misleading AI and machine-learning statements, including that Delphia represented client spending and social-media data informed investment advice when such data was not used in the investment process.	LIMEN has one settled regulated-finance SEC exemplar with document-grade public support for a capability-misstatement AI-washing claim and an exact $225,000 penalty.	Use as a finance-specific settled exemplar only; do not generalize to broader AI markets, cross-sector prevalence, or judicially adjudicated fact.	results/dashboard-paper/ai-washing-posture-table-v0.1.tsv:row1; results/boost/limen-boost-057/claim-ceiling-register.tsv:MC-057-001; results/boost/limen-boost-009/claim-support.tsv:CS-009-002..CS-009-003	Main-text or appendix settled exemplar for the first LIMEN paper and thesis claim-support mapping on posture-aware AI-misstatement evidence.	Settled regulated-finance anchor row	Table 1C sidecar with sector scope and upgrade trigger visible	No row-level posture upgrade needed; a non-finance official/final row is needed to strengthen subtype-level generalization.	SEC settlement findings are regulator-order support, not independent judicial fact-finding.
AWADP-009-002	ai_washing_or_false_ai_claim	LIMEN-000002	United States	regulated_finance	settled_regulator_order	SEC order text directly supports false and misleading AI branding and service claims, including expert AI-driven forecasts and first-regulated-AI-financial-advisor wording.	LIMEN has a second settled regulated-finance SEC exemplar with document-grade public support for branding-inflation and service-misstatement AI-washing claims and an exact $175,000 penalty.	Use as a finance-specific settled exemplar only; do not treat it as support for all AI-finance products or for non-finance sectors.	results/dashboard-paper/ai-washing-posture-table-v0.1.tsv:row2; results/boost/limen-boost-057/claim-ceiling-register.tsv:MC-057-002; results/boost/limen-boost-009/claim-support.tsv:CS-009-004..CS-009-006	Main-text or appendix settled exemplar paired with Delphia to show repeated but sector-concentrated support.	Settled regulated-finance anchor row	Table 1C sidecar with sector-concentration warning badge	No row-level posture upgrade needed; subtype-level diversification still depends on one non-finance official/final row.	Keep the row narrow to SEC-backed branding/service misstatement findings.
AWADP-009-003	ai_washing_or_false_ai_claim	HUMAN-AS-AI-SDNY-2025-001	United States	non_finance_ecommerce	authoritative_charging_stage_plus_captured_document_ocr	DOJ press-release text plus captured indictment OCR support allegations that Nate misrepresented proprietary AI capabilities and relied on hidden human workers and bots behind purported automation.	LIMEN has one authoritative non-finance charging-stage hidden-human-behind-AI row with public official text and direct-document OCR corroboration, but only at accusation stage.	Do not present this row as adjudicated fact, regulator-final proof, or settled hidden-human prevalence evidence; presumption-of-innocence language must travel with it.	results/dashboard-paper/ai-washing-posture-table-v0.1.tsv:row3; results/boost/limen-boost-057/claim-ceiling-register.tsv:MC-057-003; results/boost/limen-boost-009/claim-support.tsv:CS-009-008..CS-009-012; results/boost/limen-boost-009/indictment-ocr-support.tsv:IOS-009-001..IOS-009-002	Methods/limitations exemplar showing that LIMEN can separate settled findings from charge-stage hidden-human allegations while still capturing document-depth heterogeneity.	Authoritative non-finance lower-posture contrast row	Posture ladder card with accusation-stage badge and direct-document-depth subfacet	One public disposition, judgment, consent decree, regulator order, or equivalent final-authority follow-through, plus cleaner exact docket metadata if available.	Charging-stage posture is substantively useful but procedurally lower than the SEC pair.
AWADP-009-004	ai_washing_or_false_ai_claim	LMWCS-20260606-005	Slovenia	municipal_public_administration	direct_non_official_comparator_only	A direct local-news article supports a bounded claim that Sveta Trojica announced an AI-assisted municipal-secretariat phone agent named Klara that answers calls and routes citizens to offices.	LIMEN has one non-finance municipal AI-theater comparator that is useful for route-scarcity and public-sector comparison but not for official-source confirmation.	Do not count this row as an official non-finance AI-washing exemplar, procurement proof, or deployment-verification record.	results/boost/limen-boost-009/nonfinance-official-route-register.tsv:NFR-009-002; results/boost/limen-boost-057/claim-ceiling-register.tsv:MC-057-004; draft/preprint.md:55	Comparator-only methods/limitations row on why long-tail non-finance AI-claim leads often remain below reviewer-safe official-text posture.	Non-official comparator row kept outside the authoritative ladder	Comparator badge adjacent to Table 1C or public-sector/AI-theater dashboard filter	One direct municipal page, procurement trace, council record, vendor disclosure, or official correction with exact service-description language.	Machine translation and non-official-source caution remain active for this row.
AWADP-009-006	ai_washing_or_false_ai_claim	LIMEN-000010	United States	non_finance_legal_service_automation	regulator_final_plus_complaint_text	FTC complaint text says DoNotPay described the service as the world's first robot lawyer and an AI lawyer capable of drafting ironclad demand letters, contracts, small-claims complaints, and other legal-service tasks, while the FTC final order bars representations that a covered product or service operates like a human lawyer by applying relevant laws to subscribers' legal and factual situations and records USD 193000 in monetary relief.	LIMEN now has one bounded non-finance official-text FTC exemplar that diversifies AI-claim support beyond settled SEC finance while remaining at complaint/final-order posture.	Do not narrate this row as a judicial unauthorized-practice finding, proof that the product actually functioned as claimed, hidden-human authority closure, or cross-sector prevalence evidence.	results/boost/limen-boost-009/donotpay-promotion-bridge.tsv:DPB-009-001..DPB-009-003; results/boost/limen-boost-009/nonfinance-official-route-register.tsv:NFR-009-004; results/authoritative-scout/ftc-nonfinance-promotion-matrix-v0.1.tsv:FTCPROMO-001	Shared diversification-sidecar row that gives manuscript, dashboard, and thesis surfaces one official non-finance AI-claim exemplar without changing the core Table 1C default ladder yet.	Official non-finance sidecar row	Authority-diversification panel; official non-finance badge; route-upgrade sidecar	A later deliberately bounded core-table revision or another non-finance official route beyond FTC if broader denominator change is justified.	Keep complaint/final-order posture explicit and separate from the still-open hidden-human queue.
AWADP-009-005	ai_washing_or_false_ai_claim	QUEUE-HUMAN-AS-AI-001	Multi-jurisdictional bounded package	hidden_human_final_authority_gap_after_diversification	explicit_negative_result_control	The bounded local package still lacks an adjudicated or regulator-final hidden-human-as-AI exemplar, even after official non-finance diversification becomes possible through DoNotPay.	LIMEN can publish the remaining absence itself as bounded negative evidence: cross-sector official-text diversification is improving, but hidden-human final-authority closure is still unresolved.	Do not treat this queue row as a case, as proof of external absence, or as evidence that a non-hidden-human FTC row closes Nate's accusation-stage gap.	results/dashboard-paper/ai-washing-posture-table-v0.1.tsv:row4; results/boost/limen-boost-009/donotpay-promotion-bridge.tsv:DPB-009-001..DPB-009-003; results/authoritative-scout/nonfinance-official-promotion-scenarios-v0.1.tsv:AUTHSCEN-002	Shared limitations/control row for preprint, dashboard legend, and thesis discussion of what diversification does not solve.	Explicit hidden-human gap row	Hidden-human final-authority warning badge plus next-upgrade queue card	One final-authority Nate follow-through document or another public regulator/judicial hidden-human disposition.	This is negative-result control, not substantive event evidence.
