audit_id	as_of_utc	surface_or_claim	artifact_path	state_now	bounds_or_counts	why_it_matters	next_safe_move
F2D-001	2026-06-08T20:33:25Z	live_dashboard_taxonomy_consumer	/results/dashboard/taxonomy-heatmap.tsv	live_dashboard_ground_truth	15 category rows; live_core_dashboard_taxonomy=39_governed_record_refs/29_unique_lineages; live_extended_dashboard_taxonomy=44_governed_record_refs/34_unique_lineages	This is the current count-bearing taxonomy front door for shared dashboard/article reuse. It separates the live dashboard contract from the older mechanical heatmap contract and is the safest basis for reviewer-facing Figure 2 prose.	Use this as the live Figure 2 denominator anchor for dashboard/article/thesis prose.
F2D-002	2026-06-08T20:33:25Z	mechanical_figure2_source	/results/boost/limen-dashboard-paper-forge/taxonomy-heatmap.tsv	stale_mechanical_source	15 taxonomy rows; mechanical_figure_contract_still=35_visible_rows/27_lineages; authoritatively_seeded=11; candidate_only_seeded=1; zero_seed_local_gap=3	The boost-local Figure 2 heatmap still carries an older mechanical contract and remains useful only when the live-versus-mechanical split is stated explicitly.	Do not narrate this TSV as denominator-current until it is deliberately refreshed and re-audited together with its caption/fragility/zero-seed controls.
F2D-003	2026-06-08T20:33:25Z	dashboard_spec_consumer	/dashboard/limen-dashboard-spec-v0.1.md	patched_this_cycle	Now points Figure 2 reuse to the live dashboard contract 39_governed_record_refs/29_unique_lineages core / 44_governed_record_refs/34_unique_lineages extended while preserving the mechanical 35_visible_rows/27_lineages split	This removes one remaining reviewer-visible mismatch between the dashboard-paper control bundle and the current dashboard front door.	Keep this audit plus CCR-001 / CCR-002 attached to Figure 2 reuse.
F2D-004	2026-06-08T20:33:25Z	article_architecture_consumer	/papers/article-architecture-v0.1.md	patched_this_cycle	Now points Figure 2 route planning to the live dashboard contract 39_governed_record_refs/29_unique_lineages core / 44_governed_record_refs/34_unique_lineages extended while preserving the mechanical 35_visible_rows/27_lineages split	This removes one remaining reviewer-visible mismatch between article routing prose and the current dashboard taxonomy consumer.	Refresh the mechanical heatmap source before widening any count-bearing Figure 2 prose.
F2D-005	2026-06-08T20:33:25Z	dashboard_paper_shared_control_surfaces	/results/dashboard-paper/{first-figure-table-bundle,publication-route-visual-bridge,dashboard-view-claim-route-matrix}.v0.1.tsv	patched_this_cycle	Figure 2 shared-control rows now carry live_core_dashboard_taxonomy=39_governed_record_refs/29_unique_lineages; live_extended_dashboard_taxonomy=44_governed_record_refs/34_unique_lineages; mechanical_figure_contract_still=35_visible_rows/27_lineages	The project now has a single Figure 2 contract across the dashboard spec, article architecture, and the main dashboard-paper routing tables.	Next real gain is a true mechanical Figure 2 refresh or retirement/relabeling of any remaining stale consumer outside this shared bundle.
