priority_rank	source_id	source_name	current_role	current_join_state	threshold_event_needed	why_this_matters_now	publication_payoff	observatory_hook	claim_boundary
1	avid	AI Vulnerability Database (AVID)	direct_structured_security_import	11 seeded security rows scanned; 2 canonical direct AVID joins; 9 explicit placeholder/non-match rows	land one third canonical direct AVID join in a seeded LIMEN security row outside the current Langflow-plus-ToolHive pair	highest paper-readiness payoff because replicated exactness is real but still thin, so one more direct join would reduce interoperability asymmetry without changing reuse posture	stronger Table 6A / methods / reviewer-response exactness story for security incidents	replicated_but_thin_AVID_ladder + security_interoperability_board	do not translate vulnerability/report coverage into a general incident-census claim
2	mitre_atlas	MITRE ATLAS	structured_security_graph_overlay	11 seeded security rows scanned; 0 direct case-study joins; 7 technique-mapped rows; 4 cautious-context-only rows	land one defensible direct ATLAS case-study ID for an already-seeded LIMEN row	best second interoperability move after AVID because it converts technique-context reuse into one exact case-study anchor	graph-ready case-study/technique bridge for security-governance visuals and reviewer-safe exactness language	ATLAS case-study-gap panel and technique-to-case bridge layer	do not present technique context as exact same-case identity or as a live incident census
3	aiid	AI Incident Database (AIID)	bounded_public_case_comparator	18 local rows scanned; 1 exact same-event overlap pilot; page-data and snapshot-lag caveat already grounded	land one additional carefully bounded same-event overlap or stronger stable export proof	keeps comparator package honest by distinguishing one-row overlap growth from route-legibility work	cleaner incident-comparator denominator story and one stronger machine-readable public comparator example	AIID overlap occupancy panel with page-data/export-stability caveat	do not infer bulk completeness, stable classifications, or broad import rights from the sampled public route
4	oecd_aim_incidents	OECD AI Incidents Monitor	rights_bounded_official_case_comparator	18 local rows scanned; 1 exact same-event overlap pilot; public detail JSON and vocab facets verified	land one additional exact same-event overlap or stronger explicit reuse statement	official comparator value is already clear, but rights-bounded status means exact overlap growth matters more than more navigation prose	stronger official-comparator contrast row for methods/results and multilingual policy-monitor framing	OECD overlap + vocabulary-surface panel	do not treat public reachability as permission for broad export or open mirroring
5	mit_ai_risk_repo	MIT AI Risk Repository	taxonomy_and_definition_overlay	18 local rows scanned; 13 populated shared taxonomy bridge rows including one shadow-package-aware research-integrity bridge; public JSON-LD, visible taxonomy anchors, anonymous workbook export, and four imported workbook/resource slices now grounded	add one fifth bounded workbook/resource slice or one fourteenth shared local taxonomy bridge row with explicit provenance	the package now has a reviewer-safe fourth slice plus one shadow-package-aware thirteenth bridge row, so the next real gain is a fifth bounded slice or a fourteenth bridge row rather than another route-verification-only pass	stronger methods appendix, taxonomy heatmap calibration, literature-scope provenance context, and reviewer-safe denominator context for why LIMEN uses MIT AI Risk as a bounded concept layer rather than event evidence	verified_export_taxonomy_slice + four_slice_panel + thirteen_local_bridge_rows + shadow_package_bridge_sidecar + visible_vs_workbook_drift_panel + local_vs_repo_prominence_panel + included_resources_composition_panel	do not convert workbook slice availability into incident-truth claims, row-level event joins, or blanket mirroring permission
6	cset_ai_harm	CSET AI Harm taxonomy / overview	manual_citation_only_overlay	18 local rows scanned; 0 populated row-level joins; existing role remains manual interpretation only	only a second low-drift manual review pass could justify more explicit category overlays	lowest immediate threshold because no machine-ready or permissive reuse signal changed	manual related-work and harm-interpretation note only; useful but not denominator-changing	manual-only overlay row for related-work and zero-occupancy panels	do not machine-ingest or mirror article text absent a verified permissive reuse signal
