as_of_utc	trigger_id	queue_id_or_scope	jurisdiction	language	current_default_visibility	current_publication_bucket	threshold_event_needed	if_threshold_lands_change_type	new_default_visibility_rule	what_still_does_not_follow	paper_thesis_use	observatory_hook	core_evidence_refs
2026-06-08T15:52:32Z	MDVTM-017-001	LMWCS-20260606-004	Slovenia	sl	show_default_exemplar	bounded_substantive_row	One materially different ORION procurement/register/technical/audit/evaluation/court-facing public document	ceiling_hardening_without_default_geography_change	Keep Slovenia as the sole default substantive geography, but allow a stronger tooltip/caption on pilot-versus-deployment wording.	Does not create a second default geography, procurement proof by itself, legality/compliance proof, or measured-effectiveness evidence.	Figure 6 legend note; Table 1D top-row ceiling note; thesis multilingual methods/results bridge.	Default geography map tooltip; authority-upgrade funnel; border-governance pilot ceiling panel.	results/multilingual/multilingual-threshold-frontier-board-v0.1.tsv:frontier_rank=2; results/multilingual/multilingual-observatory-view-contract-v0.1.tsv:MOVC-ML-003; results/boost/limen-boost-017/multilingual-visual-encoding-contract.tsv:mvec-017-001
2026-06-08T15:52:32Z	MDVTM-017-002	LMWCS-20260606-001	Finland	fi	show_caution_geography_only	bounded_appendix_row	One exact official Finnish police/court/ministry source corroborates the Yle-described AI-assisted appeals phenomenon	second_official_anchor_without_cleaning_full_finland_cluster	Keep Finland on caution geometry unless the Kaleva companion state also changes, but upgrade Finland's authority rung and allow a stronger official-corroboration note on the Yle row.	Does not make Finland a default substantive geography by itself, does not validate prevalence, and does not resolve the Kaleva queue companion.	Reviewer-response note on why authority gain and default visibility gain differ; thesis authority-upgrade example.	Authority-upgrade funnel; Finland caution-state overlay; procedural-contamination threshold storyboard.	results/boost/limen-boost-053/multilingual-second-direct-official-threshold-board.tsv:SDOTB-053-002; results/multilingual/multilingual-observatory-view-contract-v0.1.tsv:MOVC-ML-003,MOVC-ML-005; results/boost/limen-boost-017/rare-language-jurisdiction-cells.tsv:RLJC-017-002
2026-06-08T15:52:32Z	MDVTM-017-003	LMWCS-20260606-002	Finland	fi	show_caution_geography_only	limitations_queue_only	One clearly matching public police/document companion or other compliant readable public surface retires the Kaleva queue state	publication_bucket_improvement_without_official_denominator_change	Keep Finland on caution geometry, but move the country from mixed appendix-plus-queue tension toward a cleaner two-row comparator state and permit stronger queue-retirement wording.	Does not create official corroboration for Yle, does not make Finland default substantive by itself, and does not justify adjudication or locality claims.	Figure 6 Finland mixed-state note; Table 1D queue-retirement consequence note; thesis package-composition example.	Publication-bucket transition tracker; deepfake blocker chart; Finland route-payoff panel.	results/boost/limen-boost-053/multilingual-second-direct-official-threshold-board.tsv:SDOTB-053-004; results/multilingual/multilingual-observatory-view-contract-v0.1.tsv:MOVC-ML-003,MOVC-ML-005; results/boost/limen-boost-017/multilingual-visual-encoding-contract.tsv:mvec-017-004
2026-06-08T15:52:32Z	MDVTM-017-004	LMWCS-20260606-005	Slovenia	sl	show_as_same_geography_caution_overlay	bounded_appendix_row	One materially different municipal page/document confirms the Klara service beyond the Radio Ptuj article	possible_second_official_anchor_inside_existing_slovenia_geography	Keep Slovenia as already-default geography, but allow the caution overlay to harden into a mixed official-plus-municipal pair rather than a police-plus-local-news asymmetry.	Does not widen the number of default geographies, prove staffing replacement, or prove procurement regularity/effectiveness.	Municipal-service comparator note; thesis local-news-to-municipal-upgrade friction example.	Institutional-absurdity panel; same-geography authority-composition inset.	results/boost/limen-boost-053/multilingual-second-direct-official-threshold-board.tsv:SDOTB-053-003; results/boost/limen-boost-017/multilingual-visual-encoding-contract.tsv:mvec-017-002; results/multilingual/multilingual-threshold-frontier-board-v0.1.tsv:frontier_rank=3
2026-06-08T15:52:32Z	MDVTM-017-005	LMWCS-20260606-003	Lithuania	lt	hidden_from_default_show_only_in_queue_mode	limitations_queue_only	One clearly compliant alternative public route reaches the underlying police warning and clarifies the AI modality	high_undercovered_recovery_without_automatic_default_promotion	Move Lithuania from hidden queue-only barrier state into a visible limitations/comparator state first; only a later stronger authority pattern should justify broader visibility.	Does not automatically create a default substantive geography, settle police wording/prevalence, or remove translation caution.	Rare-language recovery methods note; thesis under-covered-language observability-bias example.	Rare-language barrier map; blocker-class chart; official-vs-media warning panel.	results/multilingual/multilingual-threshold-frontier-board-v0.1.tsv:frontier_rank=5; results/multilingual/multilingual-observatory-view-contract-v0.1.tsv:MOVC-ML-004; results/boost/limen-boost-017/high-undercovered-threshold-impact-matrix.tsv:HUTIM-017-001,HUTIM-017-003
2026-06-08T15:52:32Z	MDVTM-017-006	LMWCS-20260606-006	Estonia	et	hidden_from_default_show_only_in_queue_mode	limitations_queue_only	One compliant alternative public source or browser/human route clarifies whether AI made, suggested, or only informed the exam-failure outcome	clarification_first_recovery	Move Estonia from hidden blocked-route state into a visible but still caution-heavy education-anomaly row only if AI-role wording becomes exact enough.	Does not automatically create official corroboration, a default substantive geography, or proof that AI itself made the failing decision.	Methods/limitations note on challenge-gated public evidence; thesis AI-role ambiguity example.	Rare-language queue overlay; education anomaly panel; language-coverage limitations map.	results/multilingual/multilingual-threshold-frontier-board-v0.1.tsv:frontier_rank=6; results/multilingual/multilingual-observatory-view-contract-v0.1.tsv:MOVC-ML-004; results/boost/limen-boost-017/high-undercovered-threshold-impact-matrix.tsv:HUTIM-017-001,HUTIM-017-004
2026-06-08T15:52:32Z	MDVTM-017-007	PACKAGE-LIMEN-C-013	multi	multi	Slovenia_default_Finland_caution_Lithuania_Estonia_hidden	1_official_2_non_official_3_queue_only	A package-level visibility rewrite should happen only after a row-level threshold actually changes state, not after another packaging memo	package_rule_guardrail	Keep the current visibility contract until a real row-level event lands: Finland official corroboration, Finland Kaleva queue retirement, ORION document-grade depth, Slovenia municipal corroboration, or compliant Lithuania/Estonia recovery.	Does not permit denominator drift, map-ranking language, or any claim that translation hardening alone changes visibility rules.	Reviewer guardrail note; thesis map/table denominator discipline.	Figure 6 legend guardrail; Table 1D denominator discipline; route-priority tooltip.	results/multilingual/multilingual-observatory-view-contract-v0.1.tsv:MOVC-ML-001..006; results/boost/limen-boost-017/table1d-figure6-scope-split-register.tsv:TFSR-017-001..005; results/boost/limen-boost-017/multilingual-threshold-route-selector.tsv:MTRS-017-001..007
