as_of_utc	scope_id	surface_pair_or_scope	unit_of_analysis	live_state_now	why_reviewer_confusion_is_plausible	reviewer_safe_statement_now	forbidden_overread	next_threshold_that_would_change_this	source_refs	paper_thesis_use	observatory_hook
2026-06-07T18:22:08Z	TFSR-017-001	Table 1D versus Figure 6	row-level multilingual case rows versus jurisdiction-language map combinations plus a publication-safe lineage aggregate	Table 1D currently covers 6 multilingual rows (`1 direct_official / 2 direct_non_official / 3 queue_only`), while Figure 6 is a broader visibility surface with 10 staged jurisdiction-language combinations and a separate 21-lineage safe aggregate carrying `translation_dependent=6` and `not_translation_dependent=15`.	Both surfaces talk about multilingual visibility, so a reviewer could mistakenly read them as one denominator-bearing package instead of two linked but non-identical units.	Use Table 1D for row-level multilingual evidence-quality claims and Figure 6 for observability/visibility claims; state explicitly that they are coupled surfaces with different counting units.	Do not compare `6`, `10`, and `21` as if they were one shared denominator or treat the map as a multilingual case count.	A future synchronized export that materializes one denominator-safe multilingual map/table bundle on the same unit could change this split.	results/dashboard-paper/figure-table-priority-register-v0.1.tsv:LIMEN-VIS-006,LIMEN-VIS-011 ; results/boost/limen-dashboard-paper-forge/jurisdiction-language-coverage.tsv ; results/boost/limen-boost-017/multilingual-shared-table-register.tsv ; results/dashboard-paper/caption-control-register-v0.1.tsv:CCR-006,CCR-016	Methods/results note on why the map and ladder answer different reviewer questions; thesis figure-table routing note.	Figure 6 legend guardrail; Table 1D denominator note; observability-bias explainer
2026-06-07T18:22:08Z	TFSR-017-002	Figure 6 multilingual overlay inside broader map	multilingual overlay rows inside a cross-package jurisdiction-language surface	The multilingual Figure 6 overlay contract currently governs 6 queue IDs (`LMWCS-20260606-001..006`), but the staged jurisdiction-language source also contains non-multilingual rows from other LIMEN packages.	A reader can see country/language names on the map and assume every visible geography belongs to the six-row multilingual package, even though the map is broader than that slice.	When Figure 6 is reused, say that the multilingual overlay is a bounded sublayer inside a broader jurisdiction/language visibility surface.	Do not restate all Figure 6 jurisdictions as multilingual package members or claim that every non-English or English geography on the map comes from shard 005 evidence.	A shared export that cleanly separates multilingual-only and atlas-wide visibility layers would change this answer.	results/boost/limen-boost-053/multilingual-figure6-visibility-overlay.tsv:MF6-053-001..006 ; results/boost/limen-dashboard-paper-forge/jurisdiction-language-coverage.tsv ; results/dashboard-paper/caption-control-register-v0.1.tsv:CCR-016	Reviewer-response clause on why Figure 6 is a visibility surface rather than a multilingual denominator table.	Layer toggle note; multilingual-only overlay specification; dashboard tooltip discipline
2026-06-07T18:22:08Z	TFSR-017-003	Finland inside Table 1D and Figure 6	one jurisdiction-language combination carrying two row-level evidence states	Finland appears once as a jurisdiction-language combination on the staged map, but the multilingual package contains two Finnish rows with different roles: `LMWCS-20260606-001` is a bounded non-official comparator and `LMWCS-20260606-002` remains a queue-only metadata-recovered companion.	A single `Finland / fi` map label can make the country look cleaner or more resolved than the underlying row-level package actually is.	Describe Finland as a mixed caution geography: one resolved broadcaster-source row plus one unresolved queue companion, not as one resolved multilingual case package.	Do not infer that one visible Finland map entry means one substantive Finnish multilingual exemplar or official corroboration.	One official Finnish corroboration or one compliant Kaleva/public-police recovery that changes the mixed package state would change this answer.	results/boost/limen-boost-053/multilingual-figure6-visibility-overlay.tsv:MF6-053-003..004 ; results/boost/limen-boost-017/multilingual-visual-encoding-contract.tsv:mvec-017-003..004 ; results/boost/limen-boost-053/claim-defense-crosswalk.tsv:MCDX-053-003	Figure caption note on mixed-authority geographies; thesis note on why map units can hide row heterogeneity.	Finland caution-layer tooltip; mixed-geometry methods sidecar
2026-06-07T18:22:08Z	TFSR-017-004	Lithuania and Estonia visibility logic	hidden default map state versus explicit limitations rows	Lithuania and Estonia each remain queue-only multilingual rows and are hidden from default substantive map views, but they stay explicitly present in Table 1D limitations logic, Figure 6 queue mode, and rare-language barrier notes.	Hidden default visibility can be misread as deletion or irrelevance rather than as a deliberate negative-evidence design choice.	State that high-undercovered rows are intentionally off the default substantive map but remain analytically visible as blocked-route evidence.	Do not treat hidden default visibility as absence of evidence, abandoned leads, or resolved exclusion from the multilingual package.	A clearly compliant Lithuanian or Estonian direct-upgrade route would change the visibility rule for that row.	results/boost/limen-boost-017/high-undercovered-threshold-impact-matrix.tsv:HUTIM-017-001,HUTIM-017-003,HUTIM-017-004 ; results/boost/limen-boost-017/multilingual-visual-encoding-contract.tsv:mvec-017-005..006 ; results/multilingual/multilingual-reviewer-panels-v0.1.tsv:MWRP-004..005	Methods/limitations paragraph on blocked-route evidence; thesis note on rare-language observability bias.	Queue-mode legend; hidden-versus-visible rationale panel
2026-06-07T18:22:08Z	TFSR-017-005	Translation burden across table and map	row-level translation-review metadata versus aggregate translation-dependent counts	All 6 multilingual rows remain translation-review-required, while Figure 6's broader paired safe aggregate records `translation_dependent=6` against `not_translation_dependent=15` at atlas level.	Because the same numeral `6` appears in two related but different places, a reviewer could mistakenly think the table's six rows and the figure's translation-dependent safe aggregate refer to the same measurement.	Keep the wording explicit: Table 1D's six rows are the current multilingual package; Figure 6's `translation_dependent=6` is an atlas-wide safe-aggregate count paired to the broader visibility figure.	Do not collapse row-level translation burden into a one-to-one map denominator or imply that the figure's aggregate count by itself validates the multilingual package.	A future denominator-safe multilingual-only aggregate or a promoted second direct-official row would strengthen but not erase this distinction.	results/multilingual/multilingual-reviewer-panels-v0.1.tsv:MWRP-003 ; results/dashboard-paper/figure-table-priority-register-v0.1.tsv:LIMEN-VIS-006,LIMEN-VIS-011 ; results/dashboard-paper/caption-control-register-v0.1.tsv:CCR-006,CCR-016	Reviewer-safe methods footnote on translation burden and counting units.	Translation badge note; map-table denominator discipline