as_of_utc	lane_id	reconciliation_id	figure2_category_state	contributor_id	contributor_label	contributor_type	authority_posture	counted_in_figure2_seed_case_count	counted_in_figure2_authoritative_seed_count	visible_in_default_table1c	visible_as_sidecar_or_overlay	inside_shared_authoritative_core	inside_frozen_21_lineage_snapshot	why_this_row_matters	what_must_not_be_inferred	paper_thesis_use	visualization_dashboard_hook	next_threshold_move	evidence_refs
2026-06-08T06:53:40Z	limen-boost-009	F2T1C-009-001	Figure 2 `ai_washing_or_false_ai_claim` currently shows `6` seeded rows and `5` authoritative rows, while the default Table 1C posture ladder still shows `4` visible rows because it carries `2` settled SEC anchors, `1` charging-stage Nate row, and `1` explicit queue control.	SUMMARY-AIW-009	Category/table reconciliation summary	control_summary	mixed_posture_package	yes_summary_only	yes_summary_only	default_table_row_count_is_4_not_6	sidecars_and_overlay_exist_outside_default	mixed_core_and_noncore	no_frozen_snapshot_recompute	This summary row reconciles the reviewer-visible difference between category occupancy and the default Table 1C ladder so later prose does not flatten subtype breadth into denominator change.	Do not infer that Figure 2 occupancy automatically rewrites the Table 1C denominator, that all six seeded rows belong in the default ladder, or that diversification closes the hidden-human final-authority gap.	Methods/results note, reviewer response, and thesis claim-support bridge for shard 009.	Count-to-ladder explainer card linking Figure 2 subtype occupancy to Table 1C posture logic.	Land one regulator-final or adjudicated hidden-human-as-AI exemplar; absent that, keep the count-bearing category and the four-row ladder visibly separate.	results/dashboard/taxonomy-heatmap.tsv:ai_washing_or_false_ai_claim; results/dashboard-paper/ai-washing-posture-table-v0.1.tsv; results/boost/limen-boost-009/ai-washing-observatory-cells.tsv; results/boost/limen-boost-009/table1c-denominator-decision-board.tsv
2026-06-08T06:53:40Z	limen-boost-009	F2T1C-009-002	seeded_authoritative_anchor	LIMEN-000001	SEC / Delphia false and misleading AI-use statements settlement	count_bearing_case	settled_regulator_order	yes	yes	yes	no	yes	yes	One of the two settled finance anchors that legitimately appears both in the category count and in the default Table 1C ladder.	Do not generalize one SEC settlement into cross-sector prevalence or broader AI-market truthfulness rates.	Main text anchor row and exact support for Table 1C.	Default-visible settled-regulator badge.	No routing change needed; already at the top settled anchor posture.	results/dashboard-paper/ai-washing-posture-table-v0.1.tsv; results/boost/limen-boost-009/claim-support.tsv; claims.md:LIMEN-C-005
2026-06-08T06:53:40Z	limen-boost-009	F2T1C-009-003	seeded_authoritative_anchor	LIMEN-000002	SEC / Global Predictions false and misleading AI financial-adviser claims settlement	count_bearing_case	settled_regulator_order	yes	yes	yes	no	yes	yes	Second settled finance anchor that stabilizes the default Table 1C ladder and shows that the strongest current settled support remains finance-concentrated.	Do not treat the existence of two finance anchors as evidence of sector-neutral recurrence.	Main text anchor row and sector-concentration note.	Default-visible settled-regulator badge.	No routing change needed; already at the top settled anchor posture.	results/dashboard-paper/ai-washing-posture-table-v0.1.tsv; results/boost/limen-boost-009/claim-support.tsv; claims.md:LIMEN-C-005
2026-06-08T06:53:40Z	limen-boost-009	F2T1C-009-004	seeded_authoritative_contrast	LIMEN-000005	DOJ / SDNY Nate hidden-human-behind-AI charging-stage row	count_bearing_case	authoritative_charging_stage	yes	yes	yes_with_warning	no	yes	no	This row is why shard 009 can already show a non-finance hidden-human contrast inside the default ladder without pretending the matter is adjudicated or regulator-final.	Do not convert charging-stage allegations into adjudicated fact, hidden-human closure, or denominator-ready final authority.	Warning-tagged contrast row for Table 1C and limitations prose.	Default-visible caution row with charging-stage badge.	The highest-value substantive threshold move is still one public final-authority follow-through for this row or another hidden-human matter.	results/dashboard-paper/ai-washing-posture-table-v0.1.tsv; results/boost/limen-boost-009/nonfinance-official-route-register.tsv:NFR-009-001; draft/preprint.md:Shard_009_framing_fragment
2026-06-08T06:53:40Z	limen-boost-009	F2T1C-009-005	seeded_authoritative_sidecar	LIMEN-000010	FTC / DoNotPay AI-lawyer and robot-lawyer complaint-plus-final-order package	count_bearing_case	regulator_final_plus_complaint_text	yes	yes	no_default_table_row	yes_sidecar_only	yes	no	This row explains why Figure 2 shows wider official subtype breadth than the four-row Table 1C ladder: DoNotPay is authoritative and count-bearing, but still sidecar-first in the default posture package.	Do not treat DoNotPay as hidden-human closure, unauthorized-practice adjudication, or an automatic five-row Table 1C revision.	Official non-finance diversification note for manuscript/dashboard/thesis reuse.	Sidecar badge or inset showing one bounded non-finance official FTC row beyond finance.	Only move into the default ladder after an explicit synchronized denominator decision; even then, it still would not close the hidden-human final-authority gap by itself.	results/dashboard-paper/ai-washing-authority-diversification-panel-v0.1.tsv; results/boost/limen-boost-009/paper-freeze-sidecar-governor.tsv:PFSG-009-002; claims.md:LIMEN-C-015; claims.md:LIMEN-C-017
2026-06-08T06:53:40Z	limen-boost-009	F2T1C-009-006	seeded_authoritative_overlay	LIMEN-000011	FTC / Workado false detector-accuracy complaint-plus-final-order package	count_bearing_case	ftc_detector_governance	yes	yes	no	yes_overlay_only	yes	no	This row is part of the category occupancy story but not the default AI-washing ladder, because its best current use is a bounded detector-governance / false-capability branch rather than the main shard-009 posture table.	Do not flatten detector-governance evidence into the same substantive ladder as settled SEC finance rows, charging-stage hidden-human support, or DoNotPay diversification.	Appendix/overlay branch and category-occupancy explanation.	Overlay-only detector-governance badge.	Open a deliberate detector-governance branch only if a shared paper/dashboard surface explicitly needs it.	results/boost/limen-boost-009/ai-washing-observatory-cells.tsv:AIW-OBS-001,AIW-OBS-004; results/boost/limen-boost-009/source-depth-top-rung-propagation-register.tsv:SDTR-009-003; claims.md:LIMEN-C-018
2026-06-08T06:53:40Z	limen-boost-009	F2T1C-009-007	seeded_non_authoritative_comparator	LMWCS-20260606-005	Slovenian municipal AI-assisted phone-secretariat comparator	count_bearing_case	direct_non_official_comparator_only	yes	no	no	yes_comparator_only	no	no	This row is the non-authoritative contributor that makes the Figure 2 subtype count reach six without belonging in the authoritative default ladder.	Do not read comparator inclusion as proof of official validation, widespread public-sector practice, or default Table 1C eligibility.	Comparator/limitations row and observability note for procurement or municipal-AI theater discussion.	Comparator badge outside the authoritative ladder.	Upgrade only if a genuine official public companion appears; until then it remains useful as bounded non-official contrast.	results/boost/limen-boost-009/nonfinance-official-route-register.tsv:NFR-009-002; results/boost/limen-boost-009/ai-washing-observatory-cells.tsv:AIW-OBS-002..AIW-OBS-003
2026-06-08T06:53:40Z	limen-boost-009	F2T1C-009-008	visible_negative_result_control	QUEUE-HUMAN-AS-AI-001	Explicit hidden-human final-authority queue control	non_count_control	negative_result_control	no	no	yes_queue_row	no	no	yes_as_limitation_only	This row is why the default Table 1C ladder has four visible rows while Figure 2 only counts six seeded cases: the package intentionally shows one explicit missing-authority control in the ladder itself.	Do not count the queue row as a case or treat it as proof that no final-authority hidden-human exemplar exists outside the bounded package.	Limitations row, reviewer-safe negative evidence, and next-route pointer.	Visible queue card preserving the main claim ceiling.	Highest-value publishability move remains one public regulator-final, adjudicated, or otherwise final-authority hidden-human follow-through.	results/dashboard-paper/ai-washing-posture-table-v0.1.tsv; results/boost/limen-boost-009/nonfinance-official-route-register.tsv:NFR-009-003..NFR-009-004; results/boost/limen-boost-009/core-surface-disambiguation-board.tsv
