depth_rank	depth_class	example_public_ids	what_it_supports	what_it_does_not_support	figure_role
1	title_gloss_or_discovery_surface	LIMEN-ML-000001; LIMEN-ML-000003; LIMEN-ML-000006	Discovery, queueing, translation-friction visualization.	Fact-rich claims, attribution, legal characterization, prevalence.	Bottom rung for Figure 5.
2	single_media_or_investigation_lead	LIMEN-ML-000002; LIMEN-ML-000005	Local context and public salience under low confidence cap.	Official action, final procedural posture, legal conclusions.	Shows why low-cap rows remain useful but constrained.
3	official_project_or_register_page	LIMEN-ML-000004; LIMEN-PS-000001	Public-body disclosure, governance context, source-field completeness.	Deployment impact, effectiveness, legality, hidden procurement facts.	Public-sector depth contrast.
4	agency_press_or_summary_page	LIMEN-AUTH-000002	Official agency posture, public allegations/settlement description.	Open court text, judicial findings, merits proof.	T3 heterogeneity rung.
5	regulator_record_or_order_pdf	LIMEN-AUTH-000001; LIMEN-AUTH-000004; LIMEN-AUTH-000005; LIMEN-AUTH-000006; LIMEN-AUTH-000007	Exact regulator/order wording, remedies, posture, dates.	Prevalence, cross-sector claims, independent legal conclusion.	T3 strongest regulator rung.
6	charging_document_or_indictment_pdf	LIMEN-AUTH-000003	Court-facing accusation-stage document and procedural posture.	Guilt, liability, disposition, hidden-human prevalence.	Procedural caution rung.
7	direct_publisher_notice_text	LIMEN-RI-000001; LIMEN-RI-000002	Publisher-originating retraction rationale and research-integrity source depth.	Research-integrity prevalence, author intent, misconduct, cross-publisher pattern.	Shows T3 source-depth is not one uniform class.
8	complaint_plus_final_order_package	LIMEN-FTC-000001; LIMEN-FTC-000002	Regulator complaint/order wording, prohibitions, relief or duties.	Judicial merits, product truth, general detector validity, cross-sector prevalence.	Sidecar rung for post-freeze official additions.
