as_of_utc	audit_id	audited_surface	package_role	live_state_checked	evidence_basis	audit_result	paper_thesis_use	dashboard_hook	residual_risk	if_future_change_then
2026-06-07T15:28:39Z	CTSSA-057-001	claims.md:LIMEN-C-005 and LIMEN-C-006	shared claim ceiling pair	Claims still preserve the shard-009 four-row core logic, keep the settled SEC pair finance-bounded, keep Nate at charging-stage posture, and do not silently absorb DoNotPay or Workado into the default denominator.	claims.md:LIMEN-C-005; claims.md:LIMEN-C-006; results/boost/limen-boost-009/claim-defense-crosswalk.tsv:CDC-009-001..CDC-009-003; results/boost/limen-boost-057/core-table-revision-register.tsv:CTR-057-001..CTR-057-005	aligned_no_patch_needed	Claim-support map, thesis claim-boundary appendix, and reviewer memo anchor.	table1c_claim_ceiling_card	A future prose-only broadening could imply cross-sector settled maturity or hidden-human closure without any denominator decision.	Patch claims, the crosswalk, and the revision register together before widening shard-009 rhetoric.
2026-06-07T15:28:39Z	CTSSA-057-002	draft/preprint.md:Shard 009 framing fragment	manuscript-facing prose surface	The preprint fragment still narrates shard 009 as a four-row core ladder with a bounded DoNotPay sidecar, finance concentration caution, and an explicit hidden-human final-authority queue.	draft/preprint.md lines 45-46; results/boost/limen-boost-057/result-block-bridge.tsv:RBB-057-001..RBB-057-005; results/boost/limen-boost-057/core-table-revision-register.tsv:CTR-057-001..CTR-057-005	aligned_no_patch_needed	Preprint results paragraph, limitations paragraph, and thesis prose bridge.	preprint_table1c_sync_check	Ad hoc sentence edits could drop the sidecar-only rule or the queue-row caution while leaving the four-row count intact.	When touching preprint prose, route through the result-block bridge and revision register first rather than paraphrasing from memory.
2026-06-07T15:28:39Z	CTSSA-057-003	papers/article-architecture-v0.1.md:Result block 6C and Table 1C slots	paper architecture spine	The article architecture still uses the 4-row AI-washing posture ladder plus diversification sidecar wording, with DoNotPay outside the default denominator and the Nate/queue cautions intact.	papers/article-architecture-v0.1.md lines 249-252 and 341-342; results/boost/limen-boost-033/ai-washing-manuscript-bundle.tsv:AIMB-033-001..AIMB-033-006; results/boost/limen-boost-057/core-table-revision-register.tsv:CTR-057-001..CTR-057-004	aligned_no_patch_needed	Figure/table order control, manuscript package spine, and thesis exhibit routing.	table1c_architecture_slot	If a future writer prefers a five-row default core but patches only article architecture, manuscript and dashboard surfaces will drift immediately.	Patch article architecture, the Table 1C travel kit, and shared caption/registry surfaces together if the denominator decision changes.
2026-06-07T15:28:39Z	CTSSA-057-004	dashboard/limen-dashboard-spec-v0.1.md:Table 1C spec lines	dashboard placement prose	The dashboard spec still states 4 default-visible rows, keeps DoNotPay as sidecar/badge only, and leaves hidden-human final-authority absence as an explicit queue state.	dashboard/limen-dashboard-spec-v0.1.md lines 53-54 and 367-369; results/dashboard-paper/caption-control-register-v0.1.tsv:CCR-003; results/boost/limen-boost-021/table1c-control-travel-kit.tsv:T1C-TK-021-001..T1C-TK-021-008	aligned_no_patch_needed	Dashboard legend/tooltip routing, hidden-row logic, and thesis figure-note support.	dashboard_table1c_contract	Dashboard-path prose could overstate diversification if the sidecar badge is reused without the denominator rule.	Keep CCR-003 and the revision register attached whenever dashboard-path shard-009 prose is reused.
2026-06-07T15:28:39Z	CTSSA-057-005	results/dashboard-paper/figure-table-priority-register-v0.1.tsv:LIMEN-VIS-009	shared figure/table registry row	The canonical registry row still records the live 4-row default ladder and does not present DoNotPay as already promoted into the main shared table.	results/dashboard-paper/figure-table-priority-register-v0.1.tsv:LIMEN-VIS-009; results/dashboard-paper/ai-washing-posture-table-v0.1.tsv; results/boost/limen-boost-057/core-table-revision-register.tsv:CTR-057-001..CTR-057-003	aligned_no_patch_needed	Canonical machine-readable Table 1C registry row for figure/table planning and thesis inventory.	limen_vis_009_registry_control	A later five-row editorial choice would become chart-level drift if LIMEN-VIS-009 is not updated in lockstep with the source TSV and caption rule.	Patch LIMEN-VIS-009 together with the posture table, CCR-003, and the Table 1C travel kit.
2026-06-07T15:28:39Z	CTSSA-057-006	results/dashboard-paper/caption-control-register-v0.1.tsv:CCR-003	shared overread-control row	CCR-003 still preserves the settled SEC pair, the Nate charging-stage caution, the explicit queue row, and the sidecar-only status of official non-finance diversification.	results/dashboard-paper/caption-control-register-v0.1.tsv:CCR-003; results/boost/limen-boost-009/claim-defense-crosswalk.tsv:CDC-009-001..CDC-009-003; results/boost/limen-boost-057/core-table-revision-register.tsv:CTR-057-001..CTR-057-005	aligned_no_patch_needed	Caption-safe Table 1C legend reuse, tooltip governance, and reviewer-safe methods note.	table1c_caption_guardrail	If later edits soften queue-row or sidecar wording without a true authority upgrade, Table 1C will overstate package maturity.	Patch the caption row and revision register together whenever shard-009 denominator or queue logic changes.
2026-06-07T15:28:39Z	CTSSA-057-007	results/boost/limen-boost-021/table1c-control-travel-kit.tsv	travel discipline bundle	The travel kit still ties claims, the posture table, CCR-003, blocked export stub, manuscript bridge, dashboard spec, and article architecture to the current four-row core plus bounded sidecar rule.	results/boost/limen-boost-021/table1c-control-travel-kit.tsv:T1C-TK-021-001..T1C-TK-021-008; results/boost/limen-boost-057/core-table-revision-register.tsv:CTR-057-001..CTR-057-005	aligned_no_patch_needed	Travel-discipline artifact for article, dashboard-planning, thesis, and rebuttal reuse.	table1c_travel_bundle	Travel-kit drift will reappear if one shared surface absorbs DoNotPay into the denominator while the bundle still says sidecar-first.	Refresh the travel kit immediately after any shard-009 denominator, caption, or export-path change.
2026-06-07T15:28:39Z	CTSSA-057-008	results/boost/limen-boost-009/claim-defense-crosswalk.tsv	claim-to-visual-defense bridge	The shared crosswalk still couples allowed statements, forbidden overreads, and next-upgrade logic to the four-row core plus official non-finance sidecar posture without implying hidden-human closure.	results/boost/limen-boost-009/claim-defense-crosswalk.tsv:CDC-009-001..CDC-009-003; results/boost/limen-boost-045/hostile-reviewer-objections.tsv:HRO-045-001..HRO-045-006; results/boost/limen-boost-057/core-table-revision-register.tsv:CTR-057-002..CTR-057-005	aligned_no_patch_needed	Reviewer-response bridge, manuscript-safe claim bundle, and thesis claim-support router.	reviewer_control_panel_for_table1c	If denominator or queue logic changes without crosswalk refresh, allowed-statement discipline will lag the shared table state.	Update the crosswalk first whenever shard-009 claims/prose change; then patch the table/caption/manuscript bundle together.
2026-06-07T15:28:39Z	CTSSA-057-009	results/boost/limen-boost-033/ai-washing-manuscript-bundle.tsv	shared manuscript/dashboard/thesis entry point	The manuscript bundle still keeps claims, core Table 1C, diversification sidecar, current-versus-target funnel, and sentence-routing layer synchronized to the current four-row default package.	results/boost/limen-boost-033/ai-washing-manuscript-bundle.tsv:AIMB-033-001..AIMB-033-006; results/boost/limen-boost-057/core-table-revision-register.tsv:CTR-057-001..CTR-057-005	aligned_no_patch_needed	Main manuscript/thesis reuse bundle for shard 009.	manuscript_bundle_for_table1c	A future sidecar-to-core decision could make the bundle stale if the entry-point role map is not refreshed.	Re-audit the bundle immediately after any publication-role or denominator-state change.
2026-06-07T15:28:39Z	CTSSA-057-010	results/boost/limen-boost-057/status.md and journal.md	lane-local reporting surfaces	Lane-local reporting still states that shard 057 hardened route-governance and revision logic without promoting DoNotPay or Workado into the shared denominator and without changing Nate's charging-stage ceiling.	results/boost/limen-boost-057/status.md; results/boost/limen-boost-057/journal.md; results/boost/limen-boost-057/core-table-revision-register.tsv	aligned_no_patch_needed	Lane-local audit trail, thesis methods appendix note, and cycle-level provenance log.	lane_status_traceability	A later cycle could create self-contradiction if lane-local reporting claims a promotion that the shared package still rejects.	Update lane-local reporting immediately after any threshold-changing shard-009 source or denominator upgrade.
2026-06-07T15:28:39Z	CTSSA-057-SUMMARY	summary	shard-009 shared-surface sync summary	All ten audited shard-009 claim, manuscript, dashboard, registry, travel, defense, and lane-local surfaces remain synchronized to the live Table 1C package: 4-row default core, DoNotPay sidecar-first, Workado appendix/detector-sidecar only, and hidden-human final-authority queue still explicit.	results/boost/limen-boost-057/core-table-revision-register.tsv; results/boost/limen-boost-021/table1c-control-travel-kit.tsv; results/dashboard-paper/caption-control-register-v0.1.tsv:CCR-003; results/boost/limen-boost-033/ai-washing-manuscript-bundle.tsv	aligned_no_patch_needed	Publication-useful negative result: no reviewer-visible shard-009 shared-surface drift was found after the new core-versus-sidecar revision board.	shard009_shared_surface_validator	The remaining blocker is substantive rather than editorial: either one deliberate synchronized DoNotPay sidecar integration or one real final-authority hidden-human follow-through.	Re-run this audit after any publication-role change, sidecar promotion, denominator rewrite, or dashboard/export promotion.