as_of_utc	impact_row_id	threshold_id	route_priority_rank	source_id	source_name	threshold_event_that_counts	shared_claims_most_affected	shared_table_figure_surfaces_most_affected	current_safe_publication_state_now	publication_delta_if_threshold_lands	core_denominator_or_sidecar_effect	caption_dashboard_effect	thesis_or_methods_use	what_stays_bounded_even_if_resolved	evidence_paths
2026-06-08T08:53:54Z	ctim-050-001	CTR-014-003	1	avid	AI Vulnerability Database (AVID)	One additional local security row gets a canonical AVID report or vulnerability identifier that matches the same concrete incident rather than only same-platform or product-family analogy.	LIMEN comparator interoperability paragraph; shard-004 and shard-002 bridge language; reviewer-response memo on exact versus analogue security joins.	Table 6A / results/boost/limen-boost-026/table6a-publication-cells.tsv ; security exactness split panel in results/boost/limen-boost-038/comparator-observatory-view-contract.tsv:COVC-038-003 ; results/crosswalks/avid-direct-join-appendix-v0.1.tsv	AVID is currently the only comparator family with two canonical direct local joins (`LIMEN-000002 -> AVID-2026-R1495`; `LIMEN-000016 -> AVID-2026-R1707`), but interoperability still remains replicated-yet-thin across 11 seeded security rows with 9 explicit non-direct rows.	Highest-value shard-002 threshold remains one third exact AVID security join, because the package is already past singleton proof-of-concept and the next meaningful delta is stronger replication without widening beyond security rows.	No six-source denominator change, but the AVID sidecar now reads as 2-direct / 9-non-direct; another exact join would strengthen the replicated-exactness story rather than create it for the first time.	Direct-join badge should already read as replicated-but-thin exact security bridge; the next dashboard/caption lift comes only if a third exact row appears outside the Langflow-plus-ToolHive pair.	Still the strongest threshold for a thesis methods chapter on interoperability because AVID remains the cleanest machine-readable source and now shows early replication while preserving row-level exactness discipline.	Does not justify treating AVID as a general incident census, promoting analogue or placeholder rows, or inferring that non-security comparators have comparable machine-readiness.	results/boost/limen-boost-014/comparator-threshold-register.tsv:CTR-014-003 ; results/boost/limen-boost-002/currentness-threshold-front-door-audit.tsv:avid ; results/boost/limen-boost-002/shared-consumer-threshold-sync-audit.tsv:L002-SCTSA-002..004 ; results/boost/limen-boost-026/table6a-publication-cells.tsv:LIMEN-026-T6A-001 ; results/crosswalks/avid-direct-join-appendix-v0.1.tsv
2026-06-07T18:20:18Z	ctim-050-002	CTR-014-004	2	mitre_atlas	MITRE ATLAS	One defensible exact MITRE ATLAS case-study identifier is tied to the same concrete incident as a local security row, with enough public support to separate exact case identity from generalized technique context.	LIMEN comparator interoperability paragraph; security graph methods note; reviewer-response memo on exact versus analogue ATLAS use.	Table 6A / results/boost/limen-boost-026/table6a-publication-cells.tsv ; technique-context-versus-case-study gap panel in results/boost/limen-boost-038/comparator-observatory-view-contract.tsv:COVC-038-003 ; results/crosswalks/atlas-technique-context-appendix-v0.1.tsv	ATLAS currently contributes wide technique/context coverage across the security package but zero defensible direct case-study IDs.	Second-highest shard-002 threshold: one exact case-study ID would change the publication story from pure graph-overlay support to mixed graph-plus-case identity, materially improving interoperability nuance without requiring broad corpus growth.	No six-source denominator change, but the ATLAS sidecar would split zero direct case-study IDs from one exact case-study overlap plus remaining technique/context rows.	ATLAS case-study gap badge can lift from zero-direct to one-direct; dashboard and figure text can explicitly separate graph context from one exact case-study bridge.	Useful for thesis graph chapters and methods prose because it demonstrates how a security knowledge graph can cross the boundary from taxonomy overlay to one exact case-study overlap.	Does not justify presenting ATLAS as a chronology source, universal incident-ID registry, or broad same-case bridge across the whole security package.	results/boost/limen-boost-014/comparator-threshold-register.tsv:CTR-014-004 ; results/boost/limen-boost-002/comparator-threshold-blocker-board.tsv ; results/boost/limen-boost-026/table6a-publication-cells.tsv:LIMEN-026-T6A-004 ; results/crosswalks/seed-import-join-prototype-v0.1.tsv:mitre_atlas
2026-06-07T18:20:18Z	ctim-050-003	CTR-014-001	3	aiid	AI Incident Database (AIID)	One additional exact same-event AIID overlap lands for a second live LIMEN row, beyond the current bounded pilot `LIMEN-000008 -> 628`.	Comparator methods paragraph; AIID/OECD contrast note; reviewer-response memo on bounded public comparator reuse.	Table 6A / results/boost/limen-boost-026/table6a-publication-cells.tsv ; AIID/OECD contrast inset via results/boost/limen-boost-038/comparator-observatory-view-contract.tsv:COVC-038-002 ; results/boost/limen-boost-002/aiid-oecd-comparator-ceiling-contrast.tsv	AIID already has one bounded exact same-event overlap pilot and a payload-richer public page-data route, but still remains a singleton public-comparator pattern rather than a minimally replicated one.	A second exact overlap would promote AIID from one-row pilot to minimal replicated public-comparator pattern, strengthening methods language about same-event comparability without changing the bounded reuse posture.	No six-source denominator change; the AIID occupancy sidecar changes from one exact pilot to two bounded exact pilots, which matters more for methods credibility than for package width.	AIID overlap badge can lift from singleton to minimal replicated pilot; dashboard tooltip text can emphasize bounded replication instead of one-row proof only.	Useful for thesis comparator chapters because it shows a payload-strong public comparator crossing from one example to two while keeping snapshot-lag and bulk/API cautions visible.	Does not justify bulk/API-stability claims, archive-equivalence rhetoric, or more than row-specific bounded overlap language.	results/boost/limen-boost-014/comparator-threshold-register.tsv:CTR-014-001 ; results/boost/limen-boost-002/comparator-threshold-blocker-board.tsv ; results/boost/limen-boost-026/table6a-publication-cells.tsv:LIMEN-026-T6A-002 ; results/crosswalks/seed-import-join-prototype-v0.1.tsv:aiid
2026-06-07T18:20:18Z	ctim-050-004	CTR-014-002	4	oecd_aim_incidents	OECD AI Incidents Monitor	One additional exact same-event OECD overlap lands for a second live LIMEN row, beyond the current bounded pilot `LIMEN-000001 -> 2023-03-31-960d`.	Comparator methods paragraph; country/language comparator note; reviewer-response memo on official comparator asymmetry.	Table 6A / results/boost/limen-boost-026/table6a-publication-cells.tsv ; AIID/OECD contrast inset via results/boost/limen-boost-038/comparator-observatory-view-contract.tsv:COVC-038-002 ; results/boost/limen-boost-002/aiid-oecd-comparator-ceiling-contrast.tsv	OECD already has one bounded exact same-event official overlap pilot plus strong public detail and vocabulary discovery, but the local overlap pattern remains singleton and rights-bounded.	A second exact overlap would promote OECD from one-row pilot to minimal replicated official comparator pattern, improving the policy-facing interoperability story more than another route-mechanics refresh.	No six-source denominator change; the OECD occupancy sidecar changes from one exact official pilot to two bounded exact pilots, strengthening official-comparator replication claims while leaving reuse constraints intact.	OECD overlap badge can lift from singleton to minimal replicated pilot; dashboard tooltip text can clarify that public official metadata supports repeated bounded overlaps without implying export freedom.	Useful for thesis discussion of official-comparator asymmetry because it improves replicated same-event matching while preserving the rights-bounded reuse boundary.	Does not justify bulk-export clearance, unrestricted reuse, or broad event-equivalence claims across the OECD corpus.	results/boost/limen-boost-014/comparator-threshold-register.tsv:CTR-014-002 ; results/boost/limen-boost-002/comparator-threshold-blocker-board.tsv ; results/boost/limen-boost-026/table6a-publication-cells.tsv:LIMEN-026-T6A-003 ; results/crosswalks/seed-import-join-prototype-v0.1.tsv:oecd_aim_incidents
2026-06-07T18:20:18Z	ctim-050-005	CTR-014-005	5	mit_ai_risk_repo	MIT AI Risk Repository	Either one independently verified anonymous object/export route is confirmed without overclaiming stability, or one shared manuscript/dashboard/table surface explicitly promotes the already-verified named-anchor concept bridge.	Residual-category and taxonomy methods prose; concept-overlay discussion; reviewer-response note on concept-only interoperability.	Table 6A / results/boost/limen-boost-026/table6a-publication-cells.tsv ; concept-overlay row in results/boost/limen-boost-038/comparator-observatory-view-contract.tsv:COVC-038-001,COVC-038-004 ; taxonomy heatmap sidecar references	MIT AI Risk already has exact public named anchors and licensing metadata for concept-level use, but zero row occupancy and no verified anonymous object export.	Useful but lower-order threshold: it can improve concept-overlay confidence or shared promotion hygiene, yet it does not change row-level interoperability occupancy and therefore moves paper readiness less than AVID, ATLAS, AIID, or OECD thresholds.	No six-source denominator change and still no row-occupancy sidecar change unless a separate local mapping project is opened; effect is mainly conceptual sidecar hardening or shared promotion.	Concept-overlay badge can become export-aware or shared-surface-ready, but the dashboard still must keep MIT AI Risk outside row-level join views.	Useful for taxonomy appendix and thesis methods notes on concept-only external alignment, especially if a reviewer asks why the atlas uses named risk anchors without event-level joins.	Does not justify incident-count claims, case-level joins, evidence-tier promotion, or treating MIT AI Risk as a verified incident registry.	results/boost/limen-boost-014/comparator-threshold-register.tsv:CTR-014-005 ; results/boost/limen-boost-002/comparator-threshold-blocker-board.tsv ; results/boost/limen-boost-026/table6a-publication-cells.tsv:LIMEN-026-T6A-005 ; results/crosswalks/source-crosswalk-v0.1.tsv:mit_ai_risk_repo
2026-06-07T18:20:18Z	ctim-050-006	CTR-014-006	6	cset_ai_harm	CSET AI Harm taxonomy / overview	One second-pass low-drift manual bridge survives review for a concrete LIMEN category while staying explicitly citation-only.	Related-work paragraph; harm-interpretation note; reviewer-response note on manual comparator discipline.	Table 6A / results/boost/limen-boost-026/table6a-publication-cells.tsv ; manual-overlay row in results/boost/limen-boost-038/comparator-observatory-view-contract.tsv:COVC-038-001,COVC-038-004 ; results/boost/limen-boost-002/cset-coding-rules.tsv	CSET already has a bounded first-pass manual bridge and coding-rule layer, but it remains interpretation support only with zero row occupancy.	Lowest-priority shard-002 threshold: a concrete second-pass exemplar would make the manual overlay easier to explain, but it would still not alter interoperability occupancy, machine-readiness, or the main Table 6A frontier.	No six-source denominator change and no row-occupancy sidecar change; effect is limited to interpretive appendix quality and reviewer-facing transparency about manual mappings.	Manual-overlay badge can shift from generic citation support to one explicit exemplar, but dashboard and manuscript surfaces must still keep CSET outside ingest or row-level-join views.	Useful for thesis and related-work prose if a reviewer asks for one visible example of harm-language translation into LIMEN categories.	Does not justify machine-ingest claims, row-level event joins, or substitution for LIMEN evidence tiers.	results/boost/limen-boost-014/comparator-threshold-register.tsv:CTR-014-006 ; results/boost/limen-boost-002/comparator-threshold-blocker-board.tsv ; results/boost/limen-boost-026/table6a-publication-cells.tsv:LIMEN-026-T6A-006 ; results/boost/limen-boost-002/cset-posture-pilot.tsv