as_of_utc	route_rank	queue_id	jurisdiction	language	rare_language_priority	current_source_name	current_source_family	current_support_state	current_publication_bucket	current_claim_ceiling_short	next_public_source_family	threshold_route	threshold_class	blocker_class	paper_delta_if_hit	figure_table_delta	dashboard_hook	why_now	canonical_source_id	source_bundle	forbidden_overread
2026-06-08T06:52:50Z	1	LMWCS-20260606-001	Finland	fi	medium_undercovered	Yle	public_broadcaster_news	direct_non_official_source	bounded_appendix_row	Direct Yle article text supports a narrow claim that Internal Finland Police and the Eastern Finland Administrative Court have noticed AI-assisted administrative appeals, with fabricated case references or distorted legal support reported by a police lawyer; stronger prevalence, intent, and system-impact claims still need stronger official corroboration and human review.	official_police_or_court_or_ministry	Find one exact Finnish police, court, or ministry public companion on AI-assisted administrative appeals matching the Yle-described phenomenon.	authority_upgrade_same_event	resolved_direct_non_official	Would give Finland one authority-backed procedural-contamination row and reduce dependence on broadcaster-only support in LIMEN-C-013.	Could change Figure 6 Finland from caution-only toward stronger visibility and tighten Table 1D procedural-contamination wording.	Procedural-contamination timeline; Finland mini-cluster; authority-weighted language map.	Highest publication payoff because the row already has direct readable source text naming public institutions and workload effects.	LIMEN-S-069	results/multilingual/multilingual-weird-case-queue.tsv:LMWCS-20260606-001; data/cases/multilingual-candidates.jsonl:LMWCS-20260606-001; claims.md:LIMEN-C-013	Do not treat broadcaster text, false-positive official search results, or zero-result justice search as corroboration.
2026-06-08T06:52:50Z	2	LMWCS-20260606-004	Slovenia	sl	medium_undercovered	Policija - Domov	official_police_source	direct_official_source	bounded_substantive_row	Direct official police page plus same-family official companion support narrow claims about ORION's AI-assisted border-management purpose, privacy-preserving framing, pilot-scenario testing, and programme depth, but still do not prove deployment, legality, proportionality, procurement, or effectiveness.	procurement_register_technical_or_partner_side_public_source	Find one ORION-specific procurement, register, technical, consortium, or partner-side public companion that sharpens project depth beyond same-family police pages.	depth_upgrade_same_row	resolved_direct_official	Would strengthen the only direct-official multilingual exemplar without changing the current ceiling against deployment, legality, or effectiveness claims.	Improves Table 1D row notes and public-sector AI deployment figure captions, but not the package denominator by itself.	Border-governance topology; biometric/privacy tension panel; pilot-scenario inset.	Best route for deepening the package's strongest official rare-language row.	LIMEN-S-068	results/multilingual/multilingual-weird-case-queue.tsv:LMWCS-20260606-004; data/cases/multilingual-candidates.jsonl:LMWCS-20260606-004; claims.md:LIMEN-C-013	Do not treat same-family project-page depth alone as procurement proof, deployment proof, or legal clearance.
2026-06-08T06:52:50Z	3	LMWCS-20260606-005	Slovenia	sl	medium_undercovered	Radio Ptuj	local_news	direct_non_official_source	bounded_appendix_row	Direct Radio Ptuj article text supports a narrow claim that the mayor of the Municipality of Sveta Trojica publicly announced an AI-assisted municipal-secretariat phone agent named Klara; stronger claims about replacement, effectiveness, legality, or procurement still require direct municipal documentation and human review.	municipal_page_or_document	Capture one direct municipal page or document for the Klara phone-agent claim, ideally without replaying known 403-gated deeper paths.	official_corroboration_same_row	official_surface_partially_reachable_then_403_gated	Would turn a strong local-news institutional-absurdity comparator into a mixed media-plus-municipal row with safer wording on what was publicly announced.	Improves municipal service-channel map and institutional-absurdity appendix notes; likely no package denominator change.	Municipal service-channel map; AI theater vs workflow-substitution comparator.	Meaningful but lower payoff than Finland/Yle because the row is already usable as a bounded appendix comparator.	LIMEN-S-070	results/multilingual/multilingual-weird-case-queue.tsv:LMWCS-20260606-005; data/cases/multilingual-candidates.jsonl:LMWCS-20260606-005; claims.md:LIMEN-C-013	Do not convert a mayor announcement or municipal shell page into proof of full human replacement, effectiveness, or procurement regularity.
2026-06-08T06:52:50Z	4	LMWCS-20260606-002	Finland	fi	medium_undercovered	Kaleva	local_news	preview_text_visible_direct_article_shell_candidate	limitations_queue_only	Public Kaleva article shell supports a narrow dated direct-source claim with visible headline, date, and preview text for suspected AI-modified intimate-image abuse, but full-body chronology, locality, adjudication, and legal interpretation remain unverified.	public_police_or_other_matching_public_document	Find one clearly matching public police/document companion or another compliant readable source for the Kaleva deepfake-abuse row.	queue_retirement_or_readability_upgrade	metadata_recovered_body_unreadable	Could move Kaleva out of queue-only status and make Finland's deepfake-abuse cluster usable beyond limitations prose.	Would improve Table 1D appendix composition and deepfake-abuse dashboard cells more than any other unresolved Finland row except Yle corroboration.	Deepfake abuse cluster; hidden-by-default locality-safe Finland cell; authority-gap overlay.	Strong route because preview-text-visible shell state means the row is closer to promotion than title-gloss-only rows.	LIMEN-S-043	results/multilingual/multilingual-weird-case-queue.tsv:LMWCS-20260606-002; data/cases/multilingual-candidates.jsonl:LMWCS-20260606-002; claims.md:LIMEN-C-013	Do not treat preview text, paywall shell metadata, or generic police-family search hits as full-body verification or official corroboration.
2026-06-08T06:52:50Z	5	LMWCS-20260606-003	Lithuania	lt	high_undercovered	15min.lt	news_reporting_authority_warning	title_gloss_or_redirect_only	limitations_queue_only	The title attributes a warning to police, but live host checks still leave the exact AI modality and official warning text unresolved because the mediated news surface is rights-sensitive and the official target is challenge-gated.	official_police_warning_or_compliant_alternative_public_authority_surface	Use a clearly compliant alternative public discovery surface to locate the underlying Lithuanian police warning and separate official wording from 15min.lt framing.	blocked_route_authority_recovery	mixed_rights_and_access_barrier	Would convert one high-undercovered queue-only fraud-warning row into a stronger rare-language police-warning exemplar with clearer AI-modality boundaries.	Could finally give the rare-language barrier panel one threshold-changing Lithuania upgrade instead of pure blocked-route evidence.	Fraud-method taxonomy panel; rare-language barrier matrix; official-vs-media warning comparison.	High novelty value under the rare-language directive, but access/rights friction keeps it below the Finland routes in immediate efficiency.	LIMEN-S-027	results/multilingual/multilingual-weird-case-queue.tsv:LMWCS-20260606-003; data/cases/multilingual-candidates.jsonl:LMWCS-20260606-003; claims.md:LIMEN-C-013	Do not use title glosses or mediated news phrasing as if they were direct police wording or settled AI-modality evidence.
2026-06-08T06:52:50Z	6	LMWCS-20260606-006	Estonia	et	high_undercovered	tv3.ee	local_news	title_gloss_or_redirect_only	limitations_queue_only	Estonian-language reporting suggests an AI-linked assessment failure affecting a student, but the direct article path remains challenge-gated and the exact role of AI in the failing outcome is still ambiguous.	school_or_public_authority_or_alternative_public_media_surface	Wait for a compliant alternative public route, then determine whether the Estonian exam-failure anomaly attributes the outcome to AI directly, to an assessment system, or only to a broader AI-linked process.	blocked_route_role_clarification	challenge_gated	Would either lift one education anomaly out of queue-only status or record a cleaner negative result about source blockage and attribution ambiguity.	Main benefit is methods/limitations clarity for the education-governance anomaly panel rather than immediate denominator change.	Education/governance anomaly timeline; blocked-route caution panel.	Scientifically interesting but lowest-yield immediate route because the current host state is challenge-gated and the AI role is still ambiguous.	LIMEN-S-044	results/multilingual/multilingual-weird-case-queue.tsv:LMWCS-20260606-006; data/cases/multilingual-candidates.jsonl:LMWCS-20260606-006; claims.md:LIMEN-C-013	Do not infer that AI itself made the failing decision from a title gloss or blocked commercial-broadcaster route.
