as_of_utc	bridge_id	shared_question_or_surface	current_state	threshold_event	seed_count_effect	table1e_effect	figure2_table2_effect	first_surface_to_consult	key_evidence_paths	paper_thesis_use	visualization_dashboard_hook	caution
2026-06-08T06:58:09Z	TZTB-032-001	Why `research_integrity` can be non-empty in Table 1E but still zero-seed in Figure 2 / Table 2	The shard-008 package is locally non-empty through the seven-row Table 1E source-depth panel, but shared count-bearing surfaces still keep `research_integrity` at zero seeded rows.	Baseline control only: keep the shadow package visible while publisher-family concentration, blocked notice routes, and seeded-row admission remain unresolved.	no_change	Table 1E stays publication-usable as a source-depth and claim-ceiling panel with two Springer-originating direct notices, one mediated statement row, one blocked DOI-pair row, and one mixed residual floor.	Figure 2 / Table 2 keep `research_integrity` in the zero-seed sidecar rather than the seeded denominator.	results/boost/limen-boost-008/research-integrity-seeding-threshold-board.tsv:RISTB-008-001	results/dashboard-paper/procedural-contamination-source-depth-panel-v0.1.tsv:SCPANEL-008-003..SCPANEL-008-007 ; results/boost/limen-boost-022/zero-seed-differentiation-matrix.tsv:research_integrity ; results/boost/limen-boost-032/paper-fragment.md	Gives manuscript, reviewer-response, dashboard, and thesis surfaces one compact answer to the hostile-reviewer question "how can zero-seed still be non-empty?"	Figure 2 zero-seed sidecar; Table 1E interpretation note; category-readiness badge	Do not convert source-depth breadth into seeded-count rhetoric, cross-publisher breadth, or misconduct findings.
2026-06-08T06:58:09Z	TZTB-032-002	What one non-Springer direct notice would change	Top-depth direct notice evidence is no longer singleton, but it remains concentrated inside the Springer family across journal-article and book surfaces.	Capture one non-Springer direct journal, publisher, platform, or institutional action record with public text for an existing research-integrity row.	reopen_seed_decision_not_automatic	Table 1E could truthfully say the direct-notice slice is no longer single-publisher-family concentrated at top depth.	Figure 2 / Table 2 still do not change automatically; the new notice only reopens the seed-promotion decision rather than settling it.	results/boost/limen-boost-008/research-integrity-seeding-threshold-board.tsv:RISTB-008-002	results/boost/limen-boost-049/sf13-direct-notice-diversity-router.tsv:1..4 ; results/source-map/research-integrity-family-inventory-v0.1.tsv:sf13-ri-01..sf13-ri-04 ; results/boost/limen-boost-032/publication-threshold-register.tsv:PTR-032-004..PTR-032-006	Separates publisher-diversity progress from seeded-denominator change so later prose does not overclaim after one new notice lands.	Publisher-diversity frontier badge; notice-depth funnel; blocked-notice backlog panel	Do not count DOI pairs, blocked redirects, metadata echoes, or specialist summaries as publisher-diverse direct notice text.
2026-06-08T06:58:09Z	TZTB-032-003	What actually changes the seeded denominator	Shared count-bearing surfaces still lack one admitted research-integrity seeded row even though the local shadow package is already useful.	Promote one row only after a case-specific authority-scored package is strong enough to travel in the shared crosswalk spine with a bounded claim ceiling.	first_seeded_research_integrity_row_possible	Table 1E remains a source-depth panel, but one row can become the bridge from shadow-package pressure to seeded shared-count status.	Figure 2 / Table 2 may move `research_integrity` from zero-seed sidecar status toward one explicit seeded row while keeping the rest of the shadow package separate.	results/boost/limen-boost-008/research-integrity-seeding-threshold-board.tsv:RISTB-008-003	results/dashboard/legal-uncertainty-matrix.tsv:research_integrity ; results/dashboard-paper/procedural-contamination-source-depth-panel-v0.1.tsv:SCPANEL-008-003..SCPANEL-008-007 ; results/boost/limen-boost-032/threshold-propagation-register.tsv:TPR-032-002..TPR-032-004	Gives the article/thesis layer one explicit distinction between "the package is real" and "one row is mature enough to alter the seeded denominator."	Figure 2 / Table 2 seed-promotion sidecar; category-readiness badge	Do not promote the whole shadow package at once or flatten mixed evidence states into one seeded-count move.
2026-06-08T06:58:09Z	TZTB-032-004	What residual-floor hardening changes	The residual research-integrity floor is mixed rather than uniform after one archived SSRN action-record escape.	Capture one second direct platform-action, publisher-action, or institutional-action record for a residual research-integrity row.	no_immediate_seed_change	Table 1E would gain a less singular residual floor and a stronger methods/results explanation for residual research-integrity handling.	Figure 2 / Table 2 remain unchanged because residual hardening is not equivalent to seed-promotion.	results/boost/limen-boost-008/research-integrity-seeding-threshold-board.tsv:RISTB-008-004	results/boost/limen-boost-032/residual-escape-audit.tsv:REA-032-001..REA-032-003 ; results/dashboard-paper/procedural-contamination-source-depth-panel-v0.1.tsv:SCPANEL-008-007	Keeps residual/network-level hardening publishable without letting it silently stand in for top-depth or denominator closure.	Residual-bucket split tooltip; platform-action badge	Do not present a second residual action record as equivalent to a case-row seed decision.
2026-06-08T06:58:09Z	TZTB-032-005	Which moves are false progress	The package already has enough local packaging to support reviewer-safe prose, but many route replays still look busy without changing publication posture.	Replay the same blocked NEJM/SAGE pages, metadata-only passes, or Springer-adjacent packaging again without any threshold state change.	no_change	Table 1E wording should stay frozen and reuse existing control bundles instead of being rewritten after denominator-neutral churn.	Figure 2 / Table 2 stay exactly where they are; no seed-readiness statement changes.	results/boost/limen-boost-008/research-integrity-seeding-threshold-board.tsv:RISTB-008-005	results/boost/limen-boost-032/post-finland-route-governor.tsv:PFRG-032-001..PFRG-032-005 ; results/boost/limen-boost-032/publication-threshold-register.tsv:PTR-032-001..PTR-032-009	Protects publication time by naming the exact drift between real threshold change and route churn.	Next-route guardrail card; false-progress badge	Do not mistake blocked-page rechecks or more Springer-adjacent packaging for seeded-readiness movement.
