case_id	title	jurisdiction	language	authority_posture	document_anchor_state	anchor_priority	translation_or_context_burden	publication_use_now	next_anchor_target	caution_note	observatory_hook
LIMEN-000001	Italian DPA orders urgent provisional limitation on ChatGPT personal-data processing in Italy	Italy	it	direct_regulator_order_text	ready_for_selective_anchor_extraction	P1_high	Italian legal-language review needed for publication-safe quotation and paraphrase	Core regulator-order exemplar for procedural/privacy governance with direct order text already present	Extract 2-3 short Italian order anchors covering provisional limitation posture and listed concern types	Keep wording tied to the order text; do not convert the provisional measure into a generalized final-illegality claim.	authority_anchor_panel; jurisdiction_language_map; privacy_enforcement_table
LIMEN-000002	EEOC sues iTutorGroup over age-discriminatory automated tutor-screening software	United States	en	agency_summary_escalation_only	not_anchor_ready_missing_court_text	P4_blocked	No translation burden; blocker is lack of captured court-facing document text	Agency-summary-only escalation exemplar with stable case number and settlement/decree posture summary	Capture one open complaint, decree, docket entry, or judicial order from a court-facing or clearly labeled open mirror source	Do not treat EEOC allegations or settlement summary as court-verified findings.	court_gap_panel; escalation_ladder; blocker_class_dashboard
LIMEN-000003	UK ICO orders Serco Leisure and associated trusts to stop biometric attendance monitoring	United Kingdom	en	direct_regulator_notice_pdf	ready_for_selective_anchor_extraction	P1_high	No translation burden; keep legal-basis and remedy wording notice-bounded	Core biometric-workplace document-grade exemplar with direct notice text and remedy clauses	Extract 2-3 short anchors for cited UK GDPR provisions, attendance-monitoring posture, and Annex 1 remedy terms	Do not generalize from one notice to sector prevalence or broader legality findings beyond the notice text.	authority_anchor_panel; biometric_governance_table; remedy_type_matrix
LIMEN-000004	UK ICO reprimands Essex school over facial-recognition canteen payments	United Kingdom	en	direct_regulator_reprimand_pdf	ready_for_selective_anchor_extraction_with_context_caution	P2_high_caution	No translation burden; minors context requires metadata-first and sparse quotation practice	Document-grade minors/public-interest exemplar with direct reprimand text on DPIA and consent process failure	Extract 1-2 short anchors for Article 35(1), deployment timing, and invalid opt-out consent framing	Keep schoolchild context metadata-first and avoid unnecessary factual expansion beyond the reprimand.	authority_anchor_panel; minors_public_interest_table; biometric_governance_panel
LIMEN-000005	DOJ charges Nate founder over alleged AI investment-fraud misstatements and hidden human transaction processing	United States	en	charging_stage_plus_captured_pdf	partially_anchor_ready_caption_normalization_blocked	P3_mixed	No translation burden; accusation-stage posture and incomplete caption normalization must stay explicit	Usable for accusation-stage wording and hidden-human allegation posture, not for normalized docket metadata	Use a materially different OCR stack or another exact-caption public source before promoting precise docket metadata; meanwhile extract only accusation-stage and presumption-of-innocence anchors from the DOJ summary	Do not treat the matter as adjudicated fact or invent unread caption fields.	charging_vs_settled_panel; court_normalization_methods_table; blocker_class_dashboard
LIMEN-000006	SEC settlement with Delphia over false and misleading statements about AI and machine learning use	United States	en	settled_regulator_administrative_order	ready_for_selective_anchor_extraction	P1_high	No translation burden; settlement-order posture must remain explicit	Core settled AI-washing sanctions exemplar with direct order text and exact civil penalty	Extract 2 short anchors for misstatement substance and ordered civil penalty	Do not overread settlement posture as independent judicial fact-finding or sector prevalence evidence.	authority_anchor_panel; settled_ai_washing_table; sanctions_matrix
LIMEN-000007	SEC settlement with Global Predictions over false and misleading AI financial-adviser claims	United States	en	settled_regulator_administrative_order	ready_for_selective_anchor_extraction	P1_high	No translation burden; settlement-order posture must remain explicit	Comparator settled AI-washing exemplar with direct order text and exact civil penalty	Extract 2 short anchors for the claimed AI-adviser/forecast marketing statements and ordered civil penalty	Do not generalize one SEC settlement package into wider market prevalence or merits adjudication.	authority_anchor_panel; settled_ai_washing_table; sanctions_matrix
LIMEN-000008	FCC pursues and settles Lingo Telecom deepfake robocall enforcement over New Hampshire primary spoofing	United States	en	FCC allegation-stage plus consent-decree order text	ready_for_selective_anchor_extraction	P1_high	No translation burden; keep allegation-stage and consent-decree posture distinct when quoting or paraphrasing	Core deepfake/synthetic-identity enforcement exemplar with direct FCC document text across proposal and settlement stages	Extract 1-2 short anchors for the deepfake robocall allegation posture and 1-2 anchors for the consent-decree penalty/compliance-plan terms	Do not flatten the May apparent-liability document and the August consent-decree order into one undifferentiated final merits finding.	authority_anchor_panel; synthetic_identity_enforcement_table; telecom_authentication_lifecycle
