as_of_utc	priority_rank	blocker_id	blocker_scope	current_best_public_surface	current_ceiling	why_still_open	next_material_route_only	paper_thesis_use	observatory_hook	evidence_refs
2026-06-08T19:28:35Z	1	LIMEN-000002	open_court_depth	EEOC newsroom / settlement pages plus stable civil-action number support	agency_summary_only_or_press_release	No open complaint, decree, docket entry, or judicial-order text has been captured from a court-facing public surface on this host.	One genuinely different open court-facing or clearly labeled public mirror exposing complaint/decree/docket/order text; do not replay EEOC, CourtListener, Justia, or Bing-challenge routes unchanged.	Reviewer-safe blocker handoff for court-depth methods prose, source-family sf08 discussion, and thesis limitations.	open_court_probe_ladder; court_depth_blocker_panel; source_family_sf08	results/authoritative-scout/authoritative-jurisdiction-language-depth-register-v0.1.tsv:LIMEN-000002; results/authoritative-scout/authoritative-threshold-change-matrix-v0.1.tsv:AUTHTHRESH-002; results/authoritative-scout/eeoc-itutorgroup-html-attachment-absence-audit-v0.1.tsv
2026-06-08T19:28:35Z	2	LIMEN-000005	exact_caption_normalization	DOJ summary plus captured DOJ-linked indictment PDF	charging_document_with_partial_caption_normalization	The current public artifact remains image-only and bounded OCR/pixel-span checks still expose only `25 Cr.` without the post-period numeric suffix.	One materially different public exact-caption source or better original exposing the full case number; do not count another same-host low-variance OCR replay as progress.	Normalization-limited court-artifact methods note for manuscript, dashboard, and thesis explanation of why a real charging PDF still remains below exact publication grade.	court_document_normalization_panel; ocr_stress_test_note; source_family_sf08	results/authoritative-scout/authoritative-jurisdiction-language-depth-register-v0.1.tsv:LIMEN-000005; results/authoritative-scout/authoritative-threshold-change-matrix-v0.1.tsv:AUTHTHRESH-003; results/authoritative-scout/nate-case-number-ocr-stress-test-v0.1.tsv; results/authoritative-scout/nate-indictment-pdf-structure-audit-v0.1.tsv
2026-06-08T19:28:35Z	3	AUTHTHRESH-005	non_us_non_uk_authority_depth	Slovenia ORION now has police page plus official CORDIS HTML/XML/PDF companions; Denmark and France remain sidecars	bounded_official_companion_chain_without_document_grade_enforcement	The package now has stronger rare-language/governance support, but still lacks a non-U.S./non-UK regulator-order, procurement-document, audit, or court-facing authority chain.	A materially different non-U.S./non-UK document-grade or court-facing route such as a CNIL companion, a later Danish operational/evaluation/procurement document, or another clearly official authority chain beyond same-family ORION companions.	Geography-depth checkpoint for reviewer-response, jurisdiction map prose, and thesis limitations.	jurisdiction_language_diversification_panel; rare_language_authority_depth_ladder	results/authoritative-scout/authoritative-threshold-change-matrix-v0.1.tsv:AUTHTHRESH-005; results/authoritative-scout/authoritative-frontier-priority-register-v0.1.tsv:AUTHTHRESH-005; results/authoritative-scout/orion-cordis-pdf-factsheet-audit-v0.1.tsv; results/authoritative-scout/french-cnil-legifrance-link-friction-audit-v0.1.tsv
2026-06-08T19:28:35Z	4	QUEUE-HUMAN-AS-AI-001	final_authority_hidden_human	Nate accusation-stage package plus FTC breadth from DoNotPay/Workado and non-core Air AI sidecar	final_authority_gap_still_open	Official breadth has improved, but the package still lacks one adjudicated or regulator-final hidden-human-as-AI exemplar that can stand beside the accusation-stage Nate matter.	One later regulator-final or court-facing hidden-human row with narrow official text; keep separate from the Nate caption blocker because this is a posture gap, not an OCR gap.	Posture-ladder limitation row for hidden-human claims in manuscript, dashboard legend text, and thesis discussion.	hidden_human_final_authority_gap_badge; posture_ladder_limitation_cell	results/authoritative-scout/authoritative-threshold-change-matrix-v0.1.tsv:AUTHTHRESH-004; results/authoritative-scout/authoritative-frontier-priority-register-v0.1.tsv:QUEUE-HUMAN-AS-AI-001; results/authoritative-scout/authoritative-case-publication-routing-matrix-v0.1.tsv:LIMEN-000010; results/authoritative-scout/authoritative-case-publication-routing-matrix-v0.1.tsv:LIMEN-000011
2026-06-08T19:28:35Z	5	LIMEN-000015	case_specific_cnil_companion	CNIL warning page plus exact outbound legal-basis link with host-blocked Legifrance target	official_warning_page_sidecar	The row is reviewer-usable as a bounded warning-page sidecar, but no readable case-specific decision/sanction/companion text has been captured on this host.	A materially different readable official CNIL companion, warning/sanction record, deliberation, Legifrance-readable text, or court-facing document.	French rare-language sidecar checkpoint for biometric-governance matrices and non-U.S./non-UK authority-depth discussion.	biometric_surveillance_matrix; sports_security_governance_panel; rare_language_route_queue	results/authoritative-scout/authoritative-jurisdiction-language-depth-register-v0.1.tsv:LIMEN-000015; results/authoritative-scout/french-cnil-companion-link-audit-v0.1.tsv; results/authoritative-scout/french-cnil-official-search-discovery-audit-v0.1.tsv; results/authoritative-scout/french-cnil-legifrance-link-friction-audit-v0.1.tsv
