frontier_rank	frontier_id	case_or_queue_id	jurisdiction	language	current_package_state	current_authority_surface	document_depth_band	best_safe_use_now	threshold_gap_to_next_band	next_smallest_publishability_move	observatory_hook	evidence_refs
1	NUF-001	LIMEN-000009	Slovenia	sl;en	shared_authoritative_core_bounded_follow_through	Official Slovenian police project page plus official European Commission / CORDIS HTML/XML/PDF companion chain	companion_grade_official_chain_below_document_grade	Use as a bounded multilingual public-sector governance and policing comparator with explicit pilot-stage, translation, and deployment-status caution.	Still lacks regulator-order, procurement-document, audit/evaluation, or court-facing depth for the same matter.	Reopen only for a materially stronger official ORION companion such as a procurement, evaluation, audit, or court/public-record surface; do not spend another cycle on same-page wording sync.	jurisdiction_language_map; public_sector_edge_case_panel; policing_border_topology; rare_language_authority_depth_ladder	data/cases/authoritative-candidates.jsonl:LIMEN-000009; sources/authoritative-source-ledger.tsv:SRC-AUTH-0019;SRC-AUTH-0033;SRC-AUTH-0037;SRC-AUTH-0038; results/authoritative-scout/orion-cordis-companion-audit-v0.1.tsv; results/authoritative-scout/orion-cordis-xml-structured-companion-audit-v0.1.tsv; results/authoritative-scout/orion-cordis-pdf-factsheet-audit-v0.1.tsv
2	NUF-002	LIMEN-000012	Denmark	da	bounded_shared_public_sector_governance_sidecar_with_exact_row_follow_through	Official Datatilsynet 2024 development page plus same-journal-number 2025 drift page	regulator_exact_row_follow_through_below_operational_document_grade	Use as a bounded rare-language public-sector governance sidecar for legal-basis, screening-posture, and development-to-drift continuity claims, not as harm or compliance proof.	Still lacks case-specific procurement, DPIA, impact-assessment, evaluation, sanction, or court-facing depth.	Reopen only for one exact-row operational companion beyond the regulator-page pair: procurement, DPIA, evaluation, or other document-grade/public-record surface.	public_sector_proof_ceiling_panel; rare_language_governance_badge; development_to_drift_timeline_cell	data/cases/authoritative-candidates.jsonl:LIMEN-000012; sources/authoritative-source-ledger.tsv:SRC-AUTH-0024;SRC-AUTH-0032; results/boost/limen-boost-003/danish-su-drift-follow-through-audit.tsv
3	NUF-003	LIMEN-000015	France	fr	authoritative_candidate_warning_page_depth	Official CNIL warning page with corrected 2021-02-18 publication date and official-search negative-result audit	warning_page_official_surface_below_document_grade	Use as a bounded non-U.S./non-UK biometric-governance and legality-posture comparator with French-original-preserving paraphrase discipline.	Still lacks a direct warning decision, sanction record, Legifrance-linked deliberation, or court-facing chain for the same matter.	Reopen only for a materially different CNIL or court-facing companion surface; do not treat official-search negative evidence as proof that no stronger record exists.	non_us_authority_depth_map; biometric_governance_comparator; chronology_integrity_cell	data/cases/authoritative-candidates.jsonl:LIMEN-000015; sources/authoritative-source-ledger.tsv:SRC-AUTH-0031; results/authoritative-scout/french-cnil-companion-link-audit-v0.1.tsv; results/authoritative-scout/french-cnil-official-search-discovery-audit-v0.1.tsv; results/authoritative-scout/french-cnil-publication-date-verification-audit-v0.1.tsv
4	NUF-004	LMWCS-20260606-001	Finland	fi	appendix_only_non_official_broadcaster_lead	Direct Yle broadcaster page without captured police, court, ministry, or other official corroboration	broadcaster_only_below_official_authority_depth	Use only as a broadcaster-level procedural-contamination appendix exemplar with explicit non-official and translation caution.	Still lacks any official public corroborating source on this host.	Reopen only for a genuinely different official Finnish surface that confirms the narrow public-process facts without relying on broadcaster text alone.	procedural_contamination_timeline; language_jurisdiction_matrix; official_corroboration_queue	results/authoritative-scout/authoritative-frontier-priority-register-v0.1.tsv:LMWCS-20260606-001; results/authoritative-scout/authoritative-non-us-uk-follow-through-matrix-v0.1.tsv
5	NUF-005	AUTHTHRESH-005	mixed_non_us_non_uk_frontier	sl;da;fr;fi	mixed	The package now has one bounded Slovenian companion pair, one Danish exact-row regulator chain, one French warning-page sidecar, and one Finnish broadcaster-only lead	geography_breadth_improved_but_document_grade_gap_open	Use as the reviewer-safe route-selection front door for non-U.S./non-UK authority depth: breadth improved, but document-grade/court-facing depth is still missing.	The frontier remains below one decisive non-U.S./non-UK regulator-order, procurement-document, audit/evaluation, sanction, or court-facing chain.	Prioritize the next threshold-changing official non-U.S./non-UK document route over more currentness repair: CNIL case-specific companion first, Denmark operational companion second, another clearly official document-grade chain third.	jurisdiction_language_diversification_panel; rare_language_authority_depth_ladder; threshold_route_front_door	results/authoritative-scout/authoritative-threshold-change-matrix-v0.1.tsv:AUTHTHRESH-005; results/authoritative-scout/authoritative-frontier-priority-register-v0.1.tsv:AUTHTHRESH-005; results/boost/limen-boost-003/regulator-court-lead-board.tsv:L003-20260608-007..009
