platform	case_count	authoritative_case_count	candidate_case_count	exact_external_join_case_count	indirect_atlas_context_case_count	vendor_advisory_case_count	vendor_release_note_case_count	coordination_notice_case_count	repo_issue_case_count	negative_notice_check_case_count	framework_negative_case_count	independent_lab_or_peer_review_case_count	family_balance_reading	strongest_safe_package_use	main_remaining_blocker	dashboard_hook
Auto-GPT	1	1	0	0	1	1	0	0	0	0	1	0	single_row_with_primary_cve_plus_vendor_advisory_and_indirect_atlas_context	bounded remediation-visibility exemplar with explicit workaround_or_fix text	no exact AVID report or independent lab layer	platform=Auto-GPT; exact_external_join=0; vendor_advisory=1; release_note=0; coordination=0; independent_lab=0
Claude Code	1	1	0	0	0	1	0	0	0	0	1	0	single_row_with_primary_cve_plus_vendor_advisory_and_technique_only_framework_support	approval-model failure exemplar with exact fixed-version visibility	no exact AVID or ATLAS case-study join and no independent lab layer	platform=Claude Code; exact_external_join=0; vendor_advisory=1; release_note=0; coordination=0; independent_lab=0
CrewAI	2	2	0	0	0	0	2	2	0	2	2	0	two_row_cluster_with_primary_cve_plus_coordination_plus_release_note_signals_but_no_cve_specific_vendor_bulletin	partial-remediation-visibility cluster for bounded vendor-versus-coordination comparison	needs direct CVE-specific vendor advisory or exact fixed-version statement; no independent lab layer	platform=CrewAI; exact_external_join=0; vendor_advisory=0; release_note=2; coordination=2; independent_lab=0
LangChain	2	2	0	0	0	1	0	0	0	0	1	1	two_row_platform_now_spans_vendor_advisory_plus_independent_lab_public_advisory_across_distinct_security_shapes	platform-level evidence-layer asymmetry exemplar showing that the same framework can appear both as a vendor-advisory-backed memory-state row and as an independent-lab code-execution row	still no exact AVID join and no exact ATLAS case-study linkage; keep both rows bounded and non-prevalence-oriented	platform=LangChain; exact_external_join=0; vendor_advisory=1; release_note=0; coordination=0; independent_lab=1
Langflow	1	0	1	1	1	0	0	0	1	1	0	0	single_candidate_row_with_exact_avid_join_but_repo_issue_only_notice_depth	interoperability exemplar showing exact external incident ID without stronger remediation authority	needs vendor advisory or release-note-grade remediation statement and exact fixed-version visibility	platform=Langflow; exact_external_join=1; vendor_advisory=0; release_note=0; coordination=0; independent_lab=0
LlamaIndex	1	1	0	0	0	0	0	0	0	0	1	1	single_row_with_primary_cve_plus_independent_lab_public_advisory_and_technique_only_framework_support_with_source_qualified_fix_gap	second source-independence exemplar showing a public third-party security layer without a matching vendor bulletin and with source-qualified versioning language	needs direct vendor remediation statement or exact cross-framework join if a stronger interoperability/remediation claim is desired; fixed-version language remains source-qualified across public sources	platform=LlamaIndex; exact_external_join=0; vendor_advisory=0; release_note=0; coordination=0; independent_lab=1
Playwright MCP	1	1	0	0	0	0	1	0	0	0	0	0	single_row_with_public_vulnerability_record_plus_vendor_release_note_on_an_mcp_browser_control_trust_boundary	bounded supply-chain_or_plugin trust-boundary exemplar with patched-version visibility and release-note-grade remediation language	still no direct AVID or ATLAS incident interoperability and no second row in the same family, so keep breadth claims singleton and cautious	platform=Playwright MCP; exact_external_join=0; vendor_advisory=0; release_note=1; coordination=0; independent_lab=0
PraisonAI	1	1	0	0	0	1	0	0	0	0	1	0	single_row_with_vendor_advisory_exact_fix_visibility_and_identity_boundary_abuse_surface	bounded identity-boundary / authorization-boundary exemplar with exact patched-version visibility	needs a second non-framework identity-boundary row or a direct external interoperability join before broader family-balance claims	platform=PraisonAI; exact_external_join=0; vendor_advisory=1; release_note=0; coordination=0; independent_lab=0
