as_of_utc	travel_id	surface_path	surface_id_or_slot	role_in_package	confirmed_live_state	must_travel_with	paper_thesis_use	dashboard_hook	caution_or_remaining_gate
2026-06-08T09:45:36+02:00	T6-TK-004-001	claims.md	LIMEN-C-007	category-level security claim ceiling	already aligned to the live eleven-row plus one-gap shared security package	results/security/security-agentic-manuscript-bundle-v0.1.tsv:SEC-MSB-001..SEC-MSB-004 ; results/dashboard-paper/caption-control-register-v0.1.tsv:CCR-017 ; results/boost/limen-boost-016/security-claim-defense-crosswalk.tsv:SCDC-016-001..SCDC-016-004	Lets manuscript and thesis claim maps point directly to the current bounded security asymmetry claim instead of reconstructing shard-004 logic from scattered boost files.	Claim-support map, Table 6 legend anchor, and hostile-reviewer response bundle.	Do not reuse as prevalence, exploit-severity, comparative-safety, or balanced-ecosystem support; the one explicit peer-reviewed gap plus the still-thin MCP-heavy trust-boundary slice must keep traveling with the claim.
2026-06-08T09:45:36+02:00	T6-TK-004-002	draft/preprint.md	security fragment / Table 6 prose bridge	main manuscript prose bridge	already aligned to the shared manuscript bundle and current 3 / 7 / 1 / 1 split	results/security/security-agentic-manuscript-bundle-v0.1.tsv ; results/dashboard-paper/figure-table-priority-register-v0.1.tsv:LIMEN-VIS-015 ; results/dashboard-paper/caption-control-register-v0.1.tsv:CCR-017 ; results/boost/limen-boost-004/table6-control-travel-kit.tsv:T6-TK-004-001..T6-TK-004-008	Supports one reviewer-safe security narrative that matches the live bucket split, Langflow limitation logic, and the still-open peer-review gap while keeping Playwright MCP plus ToolHive as a thin MCP/deployment-trust slice.	Table 6 manuscript paragraph, limitations note, and thesis claim-boundary text.	Keep explicit that the package is evidence architecture and route-order control, not a general security incident panel.
2026-06-08T09:45:36+02:00	T6-TK-004-003	results/security/security-agentic-manuscript-bundle-v0.1.tsv	SEC-MSB-001..SEC-MSB-004	shared manuscript entry bundle	live and already couples LIMEN-C-007, Table 6, the one remaining package-level gap, and row-level notice/authority controls	results/security/security-agentic-publication-cell-matrix-v0.1.tsv ; results/security/security-agentic-notice-depth-matrix-v0.1.tsv ; results/security/security-agentic-evidence-role-matrix-v0.1.tsv ; results/dashboard-paper/caption-control-register-v0.1.tsv:CCR-017	Gives one shared machine-readable entry point for paper, appendix, dashboard-planning, and thesis reuse.	Security publication-bucket table, notice-depth drilldown, and gap-to-upgrade legend.	Preserve the distinction between vendor-advisory rows, coordination-plus-release-note rows, independent-lab rows, the exact-AVID-but-weak-remediation row, and the still-open peer-reviewed gap.
2026-06-08T09:45:36+02:00	T6-TK-004-004	results/dashboard-paper/figure-table-priority-register-v0.1.tsv	LIMEN-VIS-015	shared table-priority row	live and unique figure/table register row for Table 6	results/dashboard-paper/caption-control-register-v0.1.tsv:CCR-017 ; results/security/security-agentic-publication-cell-matrix-v0.1.tsv ; results/security/security-agentic-trust-boundary-breadth-board-v0.1.tsv	Keeps one canonical machine-readable statement of the security package's current denominator, cell split, and remaining blocker state.	Figure/table registry row, dashboard card seed, and reviewer-control spine for Table 6.	Do not let later reuse hide the one remaining gap row, flatten the MCP/deployment-trust slice into balanced family coverage, or convert the exact-AVID limitations row into a stronger evidence tier.
2026-06-08T09:45:36+02:00	T6-TK-004-005	results/dashboard-paper/caption-control-register-v0.1.tsv	CCR-017	shared overread-control row	live and unique caption id for Table 6	results/boost/limen-boost-004/table6-caption-control-candidate.tsv:SEC-CCR-004-001..SEC-CCR-004-003 ; results/boost/limen-boost-016/security-claim-defense-crosswalk.tsv:SCDC-016-001..SCDC-016-004 ; results/security/security-agentic-publication-cell-matrix-v0.1.tsv	Keeps caption-safe wording deterministic across manuscript, appendix, dashboard, and thesis reuse.	Caption-safe legend, tooltip bundle, and reviewer-control panel for LIMEN-VIS-015.	Do not let exact AVID interoperability, ATLAS technique context, or plugin/provider documentation stand in for remediation authority or peer-reviewed-gap closure.
2026-06-08T09:45:36+02:00	T6-TK-004-006	results/dashboard-paper/shared-export-promotion-register-v0.1.tsv	exp-017	intended shared dashboard export stub	ready_but_not_promoted because results/dashboard writes remain blocked on this host	results/security/security-agentic-publication-cell-matrix-v0.1.tsv ; results/dashboard-paper/caption-control-register-v0.1.tsv:CCR-017 ; dashboard/limen-dashboard-spec-v0.1.md	Makes dashboard-path references reviewer-safe by pointing them to the intended shared target and the current canonical source for Table 6.	Dashboard export stub and promotion-governance note for the security publication-bucket ladder.	Do not imply that results/dashboard/security-publication-buckets.tsv already exists as a materialized shared file.
2026-06-08T09:45:36+02:00	T6-TK-004-007	dashboard/limen-dashboard-spec-v0.1.md	Table 6 / security legend slot	dashboard placement prose	conceptually aligned to LIMEN-VIS-015 plus blocked shared-export state; spec should point to boost-local or shared-control sources until writes unblock	results/dashboard-paper/shared-export-promotion-register-v0.1.tsv:exp-017 ; results/dashboard-paper/caption-control-register-v0.1.tsv:CCR-017 ; results/boost/limen-boost-024/canonical-figure-table-registry.tsv	Preserves manuscript-dashboard symmetry without inventing a materialized shared file that is still blocked.	Dashboard security bucket panel, zero-state overlay, and route-order tooltip contract.	Dashboard prose must keep the blocked-export state explicit until filesystem promotion is truly available.
2026-06-08T09:45:36+02:00	T6-TK-004-008	papers/article-architecture-v0.1.md	Table 6 block	paper-architecture spine	already aligned at the slot level to a security/governance bridge excerpt, but now has one explicit travel kit tying shared bundle, caption control, and export stub together	results/security/security-agentic-manuscript-bundle-v0.1.tsv ; results/dashboard-paper/caption-control-register-v0.1.tsv:CCR-017 ; results/dashboard-paper/shared-export-promotion-register-v0.1.tsv:exp-017 ; results/boost/limen-boost-004/table6-control-travel-kit.tsv	Connects the shared security package to first-article figure/table order and thesis exhibit routing without re-deriving the package contract.	Article-architecture spine, methods/results exhibit routing, and hostile-reviewer checklist support.	The substantive blocker stays external to architecture: one incident-specific peer-reviewed/conference-grade attachment to a live row is still missing, while the current trust-boundary slice remains MCP-heavy rather than broadly balanced.