as_of_utc	case_id	cve_id	platform	source_id	surface_type	url	http_status	surface_state	exact_cve_text_visible	release_or_advisory_grade_signal	exact_fixed_version_statement_visible	bounded_signal_excerpt	evidence_decision	next_threshold_source_needed	paper_use_note
2026-06-07T18:12:42Z	LIMEN-000002	CVE-2024-37014	Langflow	LIMEN-S-014	issue_api	https://api.github.com/repos/langflow-ai/langflow/issues/1973	200	closed_issue	no	repo_issue_only	no	Issue title remains "[Security Issue] Code Execution against underlying host system in Custom Component"; the body excerpt in the bounded API check still does not state an exact fixed version.	keep_as_issue_grade_notice_only	Direct vendor advisory or release-note-grade statement explicitly tied to CVE-2024-37014 or issue #1973	Reviewer-safe proof that issue closure alone does not retire the Langflow notice-depth blocker.
2026-06-07T18:12:42Z	LIMEN-000002	CVE-2024-37014	Langflow	LIMEN-S-024	issue_comments_api	https://api.github.com/repos/langflow-ai/langflow/issues/1973/comments?per_page=100	200	8_public_comments	yes	comment_level_cve_assignment_only	no	Public comments still include "CVE-2024-37014 has been assigned by MITRE to track this security issue" and a request to publish a security-policy/advisory page.	keep_as_cve_assignment_provenance_not_remediation	Direct vendor advisory or release-note-grade statement explicitly tied to CVE-2024-37014 or issue #1973	Supports provenance/process narration while keeping remediation certainty below advisory grade.
2026-06-07T18:12:42Z	LIMEN-000002	CVE-2024-37014	Langflow	LIMEN-S-019	advisories_listing_api	https://api.github.com/repos/langflow-ai/langflow/security-advisories?per_page=100	200	16_public_advisories_listed	no	negative_listing_check	no	Current bounded GitHub advisories listing did not expose an entry keyed to CVE-2024-37014.	keep_formal_notice_gap_open	Direct vendor advisory keyed to CVE-2024-37014	Hostile-reviewer-safe negative evidence that exact AVID interoperability still outruns vendor advisory depth.
2026-06-07T18:12:42Z	LIMEN-000002	CVE-2024-37014	Langflow	LIMEN-S-025	releases_listing_api	https://api.github.com/repos/langflow-ai/langflow/releases?per_page=100	200	100_public_releases_scanned	no	generic_security_release_prose_only	no	The bounded release scan surfaced generic security/custom-component lines such as "Security Release - Critical Updates" and "feat: add var to block custom component execution", but no exact CVE-2024-37014 or issue-#1973 binding.	keep_generic_release_not_equal_exact_fix	Release note or advisory that explicitly binds CVE-2024-37014 or issue #1973 to a remediation release	Useful for overread control: later security-themed release prose exists, but it is still not row-specific enough for Table 6 remediation certainty.
2026-06-07T18:12:42Z	LIMEN-000002	CVE-2024-37014	Langflow	LIMEN-S-026	tags_listing_api	https://api.github.com/repos/langflow-ai/langflow/tags?per_page=20	200	20_public_tags_visible	no	version_visibility_only	no	Current tag visibility now reaches v1.10.0-series names, but tags alone still do not recover a CVE-specific fixed-version statement for the live row.	keep_tag_visibility_below_fix_confirmation	Direct vendor statement mapping the vulnerable path to an exact fixed version	Supports a bounded methods note that version visibility and remediation proof are separate evidence classes.
2026-06-07T18:12:42Z	LIMEN-000004;LIMEN-000005	CVE-2026-2285;CVE-2026-2286	CrewAI	LIMEN-S-021	advisories_listing_api	https://api.github.com/repos/crewAIInc/crewAI/security-advisories?per_page=100	200	0_public_advisories_listed	no	negative_listing_check	no	Current bounded GitHub advisories listing returned an empty array for CrewAI.	keep_cve_specific_bulletin_gap_open	Direct vendor advisory row keyed to either CVE-2026-2285 or CVE-2026-2286	Reviewer-safe negative evidence that the current CrewAI package still rests on coordination plus release-note signals rather than a GitHub advisory bulletin.
2026-06-07T18:12:42Z	LIMEN-000004;LIMEN-000005	CVE-2026-2285;CVE-2026-2286	CrewAI	LIMEN-S-020	release_tag_api	https://api.github.com/repos/crewAIInc/crewAI/releases/tags/1.14.0	200	tag_1.14.0	no	release_note_grade_signal_only	no	The public 1.14.0 release body still includes generic remediation lines such as "Add SSRF and path traversal protections" and "Add path and URL validation to RAG tools", but no exact CVE identifier or fixed-version statement for either row.	keep_release_note_grade_without_cve_binding	Direct vendor advisory or release text explicitly tying CVE-2026-2285 and/or CVE-2026-2286 to the remediation statement	Supports a bounded comparative-remediation sentence while preserving the CVE-specific bulletin gap.
