queue_id	jurisdiction	language	source_name	direct_source_class	translation_status	translation_confidence	translation_review_required	reviewer_safe_use_now	current_claim_ceiling	claim_support_use	next_translation_or_verification_move	observatory_panel
LMWCS-20260606-004	Slovenia	sl	Policija - Domov	direct_official	machine_read_direct_source_extraction_note	medium_high	yes	Reviewer-safe appendix row; multilingual public-sector AI deployment table; methods note on upgrading a Google-News-discovered lead into a direct-source extraction artifact; cautious border-governance example with explicit claim ceiling.	Direct official police page plus bounded extraction note support the project title, AI-assisted border-management purpose, privacy-preserving framing, six stated sub-goals, TRL-7 ambition, passenger identification/verification language, encrypted-biometric-processing language, and pilot-scenario descriptions including Slovenia risk-assessment/resource-allocation wording; stronger claims about production deployment, legality, proportionality, compliance, or effectiveness still require more direct project documentation and human review.	The direct Slovenian police page and bounded extraction note support narrow claims about project existence, stated AI-assisted border-management pu... [truncated]	Check one partner/funding/document surface only if it materially improves the deployment-versus-pilot claim ceiling.	jurisdiction_language_map; authority_upgrade_funnel; public_sector_edge_case_panel
LMWCS-20260606-001	Finland	fi	Yle	direct_non_official	machine_read_direct_source_extraction_note	medium_high	yes	Reviewer-safe procedural-contamination appendix row; multilingual public-sector/legal-process anomaly table; methods note on upgrading a Google-News-discovered lead into a direct-source-resolved public-broadcaster record with exact institutional context.	Direct Yle article text supports a narrow claim that Internal Finland Police and the Eastern Finland Administrative Court have noticed AI-assisted administrative appeals, that police lawyer Mikko Porvali says some filings contain fabricated case references or distorted legal support, and that responding still consumes official labor; stronger claims about prevalence, abuse intent, or broader legal-system contamination remain bounded because the row currently relies on one journalistic source and machine-assisted reading.	The Yle article supports narrow descriptive claims that AI-assisted administrative appeals have been observed in Internal Finland Police and the Easte... [truncated]	Only pursue official corroboration if it can be found quickly; otherwise use the row as a bounded broadcaster-source exemplar.	jurisdiction_language_map; authority_upgrade_funnel; procedural_contamination_timeline; public_sector_edge_case_panel
LMWCS-20260606-005	Slovenia	sl	Radio Ptuj	direct_non_official	machine_read_direct_source_extraction_note	medium	yes	Reviewer-safe institutional-absurdity / public-administration appendix row with explicit claim ceiling; methods note on upgrading an open regional-radio lead into a direct-source-resolved municipal-service-channel record; cautious comparator for AI theater versus actual workflow substitution.	Direct Radio Ptuj article text supports a narrow claim that the mayor of the Municipality of Sveta Trojica publicly announced an AI-assisted municipal-secretariat phone agent named Klara that answers calls naturally, recognizes the content of a call, and routes callers to the competent office; the article also says the municipality describes itself as among the first in Slovenia to introduce such a solution in everyday municipal-administration work. Stronger claims about full human replacement, the exact vendor/technical stack, legality, effectiveness, procurement process, or whether any human fallback remains behind the phone channel still require direct municipal documentation and human review.	The direct article supports narrow descriptive claims that the Municipality of Sveta Trojica introduced an AI-assisted phone-answering / routing channel branded as secretary Klara and that the mayor frames it as an early Slovenian municipal-administration adoption; it does not by itself support claims about actual staffing replacement, measured service improvement, legality, or wider municipal diffusion.	Either capture one direct municipal page/document with a cooled-off or browser-mediated pass, or freeze the row at the direct-source-resolved local-news ceiling and use the failed official corroboration attempt as a methods/limitations note.	jurisdiction_language_map; authority_upgrade_funnel; institutional_absurdity_panel; public_sector_edge_case_panel
LMWCS-20260606-002	Finland	fi	Kaleva	queue_only_unresolved	machine_read_direct_article_shell_excerpt	medium	yes	Deepfake abuse cluster; rare-language local-crime comparator; methods note on direct article-shell excerpt states that strengthen provenance without retiring queue-only caution.	Public Kaleva article shell plus browser-visible excerpt and meta description now support a narrow claim that a dated regional-news article exists about a police-investigation-framed AI-modified intimate-image abuse case in Finland, with multiple women listed as injured parties/victims, one middle-aged male suspect, a small northern Finnish town, and suspicion-stage offense framing including unauthorized distribution of a sexual image, defamation, and dissemination of information violating personal privacy; full-body chronology, exact locality naming, adjudication, and legal interpretation remain unverified.	The bounded direct article shell supports narrow descriptive methods/limitations wording about a suspicion-stage Finnish AI-modified intimate-image abuse row with multiple women listed as injured parties/victims and one suspected middle-aged man, but it still does not support chronology beyond the visible excerpt, exact locality naming, guilt, adjudication, or broader prevalence claims.	Use the direct article shell plus bounded visible excerpt for reviewer-legible limitations prose now; seek one public police companion source or another clearly compliant public document before any promotion beyond queue/limitations use.	jurisdiction_language_map; authority_upgrade_funnel; scam_modality_or_deepfake_panel
LMWCS-20260606-003	Lithuania	lt	15min.lt	queue_only_unresolved	title_gloss_only	medium	yes	Fraud-method taxonomy panel; official-vs-media warning comparison; language coverage matrix.	Journalistic report that attributes a warning to police; AI modality remains unresolved.	The title attributes the warning to police but the current retrievable path is a Lithuanian news report; exact AI modality remains to be verified.	Do not retry aggressive automated retrieval from 15min.lt or policija.lrv.lt in this shell context; either use a clearly compliant alternative public discovery surface or switch the next direct-upgrade attempt to a more reachable unresolved row.	jurisdiction_language_map; authority_upgrade_funnel; methods_limitations_matrix; public_sector_edge_case_panel
LMWCS-20260606-006	Estonia	et	tv3.ee	queue_only_unresolved	title_gloss_only	medium	yes	Education anomaly matrix; institutional weirdness table; language coverage map.	Broadcast-media lead describing an AI-linked exam-failure anomaly affecting a student.	Estonian-language reporting suggests an AI-linked assessment failure affecting a secondary-school student; the exact role of AI in the grading or evaluation chain is unconfirmed.	Deprioritize shell-only retries on tv3.ee until a compliant browser/human path or alternative public source appears; do not promote the row beyond queue-only title-level status in the meantime.	jurisdiction_language_map; authority_upgrade_funnel; methods_limitations_matrix; institutional_absurdity_panel
