as_of_utc	audit_row_id	consumer_artifact	consumer_scope	current_state_observed	alignment_verdict	problem_or_confirmation	required_action	paper_thesis_use	visualization_dashboard_hook	evidence_paths
2026-06-08T11:41:24+02:00	PSTRCDA-054-001	results/dashboard-paper/publication-route-visual-bridge-v0.1.tsv:LIMEN-VIS-008	shared visual-route front door	The row already points at the mirrored `results/dashboard/public-sector-disclosure-comparison.tsv` path and states the `6-row shared / 5-row core + Denmark sidecar` split, but its reuse gate still stops at `CCR-015` plus `exp-009` / `exp-013` without naming the live shard-054 threshold-impact board.	needs_patch	Source-path currentness is repaired, but exact event-change routing is still implicit, so later reuse can stop at proof ceilings and denominator controls without naming which public document would actually move Amsterdam, Helsinki, UK, ORION, or Denmark next.	Patch `LIMEN-VIS-008` so the reuse gate explicitly carries `results/boost/limen-boost-054/public-sector-threshold-impact-board.tsv` with the existing caption/core-sidecar controls.	Keeps the canonical dashboard/paper visual-route spine synchronized with the live threshold-change front door, not only with the mirrored comparison source.	Table 1B front-door QA card for route-safe visual reuse.	results/dashboard-paper/publication-route-visual-bridge-v0.1.tsv:LIMEN-VIS-008; results/boost/limen-boost-054/public-sector-threshold-impact-board.tsv; results/dashboard/public-sector-disclosure-comparison.tsv; results/dashboard-paper/caption-control-register-v0.1.tsv:CCR-015
2026-06-08T11:41:24+02:00	PSTRCDA-054-002	results/dashboard-paper/dashboard-view-claim-route-matrix-v0.1.tsv:LIMEN-VIS-008	shared claim-route front door	The row already preserves the bounded five-row core / six-row shared-panel split, but its next-gate language still points only to generic exact-companion need and does not name the live row-specific threshold-impact board.	needs_patch	Claim-scope wording is current, yet the strongest downstream route-control surface still lacks the exact state-change artifact that tells a writer which document type would actually change each row.	Patch `LIMEN-VIS-008` so the next-gate clause explicitly routes through `results/boost/limen-boost-054/public-sector-threshold-impact-board.tsv` alongside `CCR-015` and the core-sidecar controls.	Strengthens one shared claim-routing surface for methods/results prose, reviewer-response notes, and thesis routing without changing any evidence tier.	Claim-safe Table 1B route card with threshold-change front door visible before prose reuse.	results/dashboard-paper/dashboard-view-claim-route-matrix-v0.1.tsv:LIMEN-VIS-008; claims.md:LIMEN-C-012; results/boost/limen-boost-054/public-sector-threshold-impact-board.tsv; results/boost/limen-boost-054/public-sector-core-vs-sidecar-router.tsv
2026-06-08T11:41:24+02:00	PSTRCDA-054-003	results/boost/limen-boost-030/table1b-dashboard-view-contract.tsv:T1B-DVC-030-005	lane-local Table 1B view router	The threshold route card still cites the older shard-018 impact matrix rather than the live shard-054 threshold-impact board.	needs_patch	Route-order logic stays substantively aligned, but the artifact path is stale and can send later users to a superseded threshold-change surface instead of the current row-specific board.	Patch `T1B-DVC-030-005` to replace the shard-018 threshold matrix with `results/boost/limen-boost-054/public-sector-threshold-impact-board.tsv`.	Keeps one active Table 1B lane-local router aligned with the current threshold-change front door.	Threshold sidebar / route-order QA panel.	results/boost/limen-boost-030/table1b-dashboard-view-contract.tsv:T1B-DVC-030-005; results/boost/limen-boost-054/public-sector-threshold-impact-board.tsv
2026-06-08T11:41:24+02:00	PSTRCDA-054-004	results/boost/limen-boost-030/table1b-surface-role-matrix.tsv:T1B-SRM-030-001	lane-local surface-role matrix	The threshold-change queue row still carries the older shard-018 impact matrix in both the `must_travel_with` and `evidence_refs` fields.	needs_patch	The queue remains conceptually correct, but the live threshold-change front door is no longer fully represented inside this surface-role matrix.	Patch `T1B-SRM-030-001` so both threshold references point to `results/boost/limen-boost-054/public-sector-threshold-impact-board.tsv`.	Preserves one reviewer-facing methods/reuse surface as a current artifact router rather than an archival pointer.	Surface-role drift board for threshold-change routing.	results/boost/limen-boost-030/table1b-surface-role-matrix.tsv:T1B-SRM-030-001; results/boost/limen-boost-054/public-sector-threshold-impact-board.tsv
2026-06-08T11:41:24+02:00	PSTRCDA-054-005	results/boost/limen-boost-042/public-sector-question-router.tsv:PSQR-042-005	shared public-sector question router	The blocker/churn answer row still routes through the older shard-018 threshold matrix rather than the live shard-054 threshold-impact board.	needs_patch	The narrative remains correct, but one frequently reused front door still points to a superseded route-impact helper instead of the row-specific threshold board that now governs event-change wording.	Patch `PSQR-042-005` so its companion bundle names `results/boost/limen-boost-054/public-sector-threshold-impact-board.tsv`.	Hardens one shared reviewer-response and thesis routing question router without changing row evidence state.	Question-router QA panel for blocker-versus-progress routing.	results/boost/limen-boost-042/public-sector-question-router.tsv:PSQR-042-005; results/boost/limen-boost-054/public-sector-threshold-impact-board.tsv
