as_of_utc	bundle_id	manuscript_slot	reusable_clause	exact_evidence_bundle	mandatory_caution	paper_thesis_use	dashboard_or_visual_hook	next_smallest_publishability_move
2026-06-07T16:20:59Z	PS-RBCB-054-001	Result block 6B topic sentence	LIMEN's current public-sector slice is publishable as a disclosure-surface heterogeneity and reconstruction-ceiling contribution rather than as a procurement-transparency count, denominator surface, or public-sector AI prevalence panel.	claims.md:LIMEN-C-012 ; results/boost/limen-boost-054/public-sector-claim-defense-crosswalk.tsv:PSCX-054-001 ; results/boost/limen-boost-054/public-sector-manuscript-bridge.tsv:psmb-054-001 ; results/dashboard-paper/caption-control-register-v0.1.tsv:CCR-015	Do not widen the package into procurement completeness, deployment effectiveness, transparency ranking, or denominator-ready public-sector counting.	Opening sentence for Result block 6B, thesis section opener, and reviewer memo summary.	LIMEN-VIS-008 headline claim card; disclosure-surface heterogeneity badge.	Reuse this clause with the claim-defense crosswalk and Table 1B control bundle instead of reconstructing the package claim from scattered shard notes.
2026-06-07T16:20:59Z	PS-RBCB-054-002	Result block 6B Amsterdam-versus-Helsinki contrast sentence	Amsterdam is the richest current exact-row register exemplar because supplier and governance-companion fields plus current/history exports are public while buyer-side trace remains unresolved on tested public routes, whereas Helsinki sits one rung higher on buyer-side continuity because a same-buyer supplier-consistent award package is public while still stopping short of exact row-linked proof for the parking-chatbot page.	results/boost/limen-boost-054/public-sector-manuscript-bridge.tsv:psmb-054-002 ; results/dashboard-paper/public-sector-proof-ceilings-v0.1.tsv:pspcf-001..pspcf-002 ; results/boost/limen-boost-042/public-sector-cross-project-support-map.tsv:pscps-042-001..pscps-042-002	Do not caption Amsterdam as procurement-absent or contract-resolved, and do not caption Helsinki as exact contract-linked procurement proof, page-specific award proof, or public-assessment completeness.	Main-text contrast sentence, caption sidecar prose, and thesis traceability inset.	Amsterdam caution badge; Helsinki linkage badge; traceability-ladder overlay.	Only change this clause if one genuinely different Amsterdam official identifier/public-companion route or one page-specific Helsinki companion changes a row ceiling.
2026-06-07T16:20:59Z	PS-RBCB-054-003	Result block 6B1 ladder sentence	The five-row package currently separates four reconstruction states—official project-page disclosure only, regulator-document depth without buyer-side trace, register-rich disclosure with governance fields, and register-plus-family-level same-buyer supplier-consistent award—without claiming that any row yet closes the procurement-to-register or public-impact-document gap.	results/boost/limen-boost-042/public-sector-traceability-ladder.tsv:psl-001..psl-005 ; results/boost/limen-boost-054/public-sector-manuscript-bridge.tsv:psmb-054-003 ; results/boost/limen-boost-042/public-sector-observatory-cells.tsv:psoc-042-view-001-cell-001..psoc-042-view-001-cell-004	Do not flatten the ladder into one generic transparency scale or imply that a higher rung means exact procurement reconstruction.	Methods/results ladder paragraph, thesis claim-ceiling explanation, and reviewer-safe figure/table bridge.	Traceability ladder; surface-class × traceability-rung heatmap; Table 1B companion inset.	Keep compact-count reuse tied to the bounded five-row panel and its blocking notes rather than mixing in atlas-level denominators.
2026-06-07T16:20:59Z	PS-RBCB-054-004	Result block 6B comparator-role sentence	The two UK ICO rows strengthen the package as direct regulator-document comparators for legal-basis, remedy, DPIA, consent, and deployment-timing language, while ORION remains the low-trace official-project-page floor that shows what an official public-body page can establish without procurement, register, or enforcement depth.	results/boost/limen-boost-054/public-sector-claim-defense-crosswalk.tsv:PSCX-054-003 ; results/boost/limen-boost-042/public-sector-hostile-reviewer-objections.tsv:HRO-042-003..HRO-042-004 ; results/dashboard-paper/public-sector-proof-ceilings-v0.1.tsv:pspcf-003..pspcf-005	Do not convert the UK rows into procurement visibility, supplier proof, sector prevalence, or generalized legality conclusions, and do not present ORION as procurement-backed deployment, legality proof, or measured operational effectiveness.	Comparator sentence for manuscript results, reviewer-response caveat, and thesis source-role discussion.	Legal-basis-versus-buyer-trace split; low-trace floor comparator; regulator-depth legend note.	Leave the UK rows and ORION on maintenance/floor status unless one clean official buyer-side, register, technical, or public-assessment companion appears.
2026-06-07T16:20:59Z	PS-RBCB-054-005	Result block 6B limitations-and-route sentence	The main blocker is still exactness rather than packaging: sf09 remains a bounded disclosure-surface contribution because LIMEN still lacks one exact buyer-side tender, award, contract, DPIA, or page-specific public impact-assessment companion for a seeded municipal register row, so further prose-only refinement is lower value than a genuinely different Amsterdam or page-specific Helsinki route.	results/boost/limen-boost-054/public-sector-manuscript-bridge.tsv:psmb-054-004 ; results/boost/limen-boost-054/public-sector-claim-defense-crosswalk.tsv:PSCX-054-004 ; results/boost/limen-boost-018/public-sector-threshold-register.tsv ; results/boost/limen-boost-018/public-sector-threshold-propagation-register.tsv	Do not treat the blocker as proof that no such companion exists, and do not describe route-order guidance as an evidence upgrade by itself.	Limitations sentence for preprint/reviewer memo/thesis future-work framing and route-justification notes.	Table 1B blocker badge; sf09 threshold queue; route-order note.	If shard 054 is touched again, prefer one threshold-changing evidence move or reuse this clause bundle for manuscript-safe prose instead of opening another packaging-only cycle.