as_of_utc	propagation_row_id	threshold_id	route_priority_rank	source_id	current_threshold_state	threshold_event_that_counts	surfaces_to_patch_first	surfaces_to_leave_unchanged_until_threshold	evidence_authority_to_check_before_patch	paper_thesis_use	visualization_dashboard_hook	claim_ceiling_after_patch	still_not_safe_after_patch	next_smallest_publishability_move
2026-06-07T19:10:43Z	CTPR-014-001	CTR-014-003	1	avid	1 canonical direct join already live; 8 explicit non-direct security rows remain	One additional local security row gains a canonical AVID report or vulnerability identifier tied to the same concrete incident, not a same-platform or other-CVE analogue	results/boost/limen-boost-026/table6a-publication-cells.tsv ; results/boost/limen-boost-038/comparator-observatory-view-contract.tsv:COVC-038-003 ; results/boost/limen-boost-014/comparator-claim-admission-register.tsv:CAR-014-001..004 ; results/crosswalks/status.md	results/boost/limen-boost-014/frontier-deepening-recheck.tsv ; results/boost/limen-boost-026/threshold-frontier-recheck.tsv (keep as negative-control provenance, not as current state prose)	results/crosswalks/avid-direct-join-appendix-v0.1.tsv ; results/boost/limen-boost-014/interoperability-promotion-register.tsv ; results/boost/limen-boost-050/comparator-threshold-impact-matrix.tsv:ctim-050-001	Best route if shard 002 needs one thesis-grade interoperability upgrade that materially changes Table 6A without widening beyond security rows.	Direct-join badge can move from singleton_demo to minimal_replicated_pattern; security exactness ladder can show 2 exact joins plus remaining placeholders.	LIMEN may say AVID now shows a minimal replicated exact security-join pattern instead of only one demonstration row.	Does not justify general AVID incident-census rhetoric, promotion of placeholder rows, or extension of machine-readiness claims to non-security comparator families.	If no exact same-case AVID ID is available, stop at the current singleton-direct-join wording and do not reopen this row with same-platform analogues.
2026-06-07T19:10:43Z	CTPR-014-002	CTR-014-004	2	mitre_atlas	Technique/context coverage is wide, but direct case-study count remains zero	One defensible exact MITRE ATLAS case-study identifier is tied to the same concrete incident as a local security row with independent public anchors separating same-case identity from generalized context	results/boost/limen-boost-026/table6a-publication-cells.tsv ; results/boost/limen-boost-038/comparator-observatory-view-contract.tsv:COVC-038-003 ; results/boost/limen-boost-014/comparator-claim-admission-register.tsv:CAR-014-001..004 ; results/crosswalks/status.md	results/crosswalks/atlas-technique-context-appendix-v0.1.tsv generalized-case-context rows must remain visible as analogue/context evidence for non-promoted rows	results/crosswalks/atlas-technique-context-appendix-v0.1.tsv ; results/boost/limen-boost-014/interoperability-promotion-register.tsv ; results/boost/limen-boost-050/comparator-threshold-impact-matrix.tsv:ctim-050-002	Best route if the paper/thesis package needs a graph-to-case bridge example rather than another payload/API-style comparator replication note.	Technique-context-versus-case-study gap panel can move from zero_direct to one_exact_case_study while preserving the wider context-only package.	LIMEN may distinguish one exact ATLAS case-study overlap from the broader technique/context overlay.	Does not justify ATLAS chronology, universal incident-ID, or broad same-case rhetoric across the security package.	Require exact same-case identity before patching any direct-ATLAS prose; product overlap or generalized framework inclusion is insufficient.
2026-06-07T19:10:43Z	CTPR-014-003	CTR-014-001	3	aiid	1 bounded exact same-event overlap pilot already live on LIMEN-000008 -> 628	One additional exact AIID incident record aligns with a different LIMEN row on title/date/substance and at least one corroborating actor, report, or incident-detail field from the verified public page-data route	results/boost/limen-boost-026/table6a-publication-cells.tsv ; results/boost/limen-boost-038/comparator-observatory-view-contract.tsv:COVC-038-002 ; results/boost/limen-boost-014/comparator-claim-admission-register.tsv:CAR-014-001..005 ; results/crosswalks/status.md	results/boost/limen-boost-014/aiid-oecd-overlap-probe.tsv (retain as threshold-history provenance) ; results/boost/limen-boost-014/frontier-deepening-recheck.tsv	results/crosswalks/seed-import-join-prototype-v0.1.tsv:aiid ; results/boost/limen-boost-050/comparator-threshold-impact-matrix.tsv:ctim-050-003 ; results/boost/limen-boost-002/aiid-oecd-comparator-ceiling-contrast.tsv	Best route if methods prose needs a minimally replicated public-comparator same-event pattern without changing the six-source comparator package.	AIID overlap badge can move from singleton_bounded_pilot to minimal_replicated_bounded_pilot; AIID/OECD contrast inset can keep payload-rich versus rights-bounded asymmetry explicit.	LIMEN may say AIID now supports more than one bounded same-event overlap pilot on the tested public route.	Does not justify bulk/API-stability claims, archive-equivalence rhetoric, or corpus-wide same-event interoperability language.	Patch propagation surfaces first if a second pilot lands; do not widen shared claims beyond row-specific bounded overlap language.
2026-06-07T19:10:43Z	CTPR-014-004	CTR-014-002	4	oecd_aim_incidents	1 bounded exact same-event overlap pilot already live on LIMEN-000001 -> 2023-03-31-960d	One additional exact OECD incident slug or detail record aligns with a different LIMEN row on title/date/jurisdiction and article-level metadata	results/boost/limen-boost-026/table6a-publication-cells.tsv ; results/boost/limen-boost-038/comparator-observatory-view-contract.tsv:COVC-038-002 ; results/boost/limen-boost-014/comparator-claim-admission-register.tsv:CAR-014-001..005 ; results/crosswalks/status.md	results/boost/limen-boost-014/aiid-oecd-overlap-probe.tsv negative-route history must remain available for non-promoted candidate rows	results/crosswalks/seed-import-join-prototype-v0.1.tsv:oecd_aim_incidents ; results/boost/limen-boost-050/comparator-threshold-impact-matrix.tsv:ctim-050-004 ; results/boost/limen-boost-002/aiid-oecd-comparator-ceiling-contrast.tsv	Best route if policy-facing methods prose needs a minimally replicated official-metadata comparator pattern while keeping rights-bounded reuse explicit.	OECD overlap badge can move from singleton_bounded_pilot to minimal_replicated_bounded_pilot; AIID/OECD inset can keep official-discovery strength separate from reuse limits.	LIMEN may say OECD now supports more than one bounded official same-event overlap pilot on public detail routes.	Does not justify bulk-export clearance, unrestricted reuse, or general event-equivalence claims across the OECD corpus.	Patch propagation surfaces first if a second pilot lands; keep rights-bounded ceiling explicit in every patched surface.
2026-06-07T19:10:43Z	CTPR-014-005	CTR-014-005	5	mit_ai_risk_repo	Visible named taxonomy anchors are already resolved; row-level occupancy remains zero and concept-overlay posture governs	Either one independently verified anonymous object/export route is confirmed without overstating stability, or one shared surface deliberately promotes the existing named-anchor concept bridge	results/boost/limen-boost-038/comparator-observatory-view-contract.tsv:COVC-038-001,COVC-038-004 ; results/boost/limen-boost-014/comparator-claim-admission-register.tsv:CAR-014-001,004,005 ; results/crosswalks/status.md	results/crosswalks/framework-anchor-coverage-v0.1.tsv remains a concept-layer support artifact and should not be rewritten into case-level occupancy prose	results/crosswalks/framework-anchor-coverage-v0.1.tsv ; results/boost/limen-boost-050/comparator-threshold-impact-matrix.tsv:ctim-050-005 ; results/boost/limen-boost-002/crosswalk-route-priority.tsv	Useful only when taxonomy appendix, residual-category prose, or dashboard concept-bridge wording needs a cleaner shared promotion path.	Concept-overlay badge can become export-aware or shared-surface-ready, but Table 6A still keeps MIT AI Risk outside row-level join views.	LIMEN may say named visible MIT AI Risk anchors support concept-level taxonomy bridging and possibly a bounded export/object proof if independently verified.	Does not justify incident-count claims, row-level joins, evidence-tier promotion, or treatment as a verified incident registry.	Do not spend another shard-002 cycle on more visible-anchor capture; reopen only for anonymous export/object proof or an exact shared-surface promotion need.
2026-06-07T19:10:43Z	CTPR-014-006	CTR-014-006	6	cset_ai_harm	First-pass manual bridge exists; row-level occupancy remains zero and citation-only/manual-overlay posture governs	One second-pass low-drift category-level manual bridge survives review while staying explicitly citation-only	results/boost/limen-boost-038/comparator-observatory-view-contract.tsv:COVC-038-001,COVC-038-004 ; results/boost/limen-boost-014/comparator-claim-admission-register.tsv:CAR-014-001,004 ; results/crosswalks/status.md	results/boost/limen-boost-002/cset-coding-rules.tsv and cset-posture-pilot.tsv should remain methods/appendix support rather than being elevated into row-level occupancy text	results/boost/limen-boost-002/cset-coding-rules.tsv ; results/boost/limen-boost-002/cset-posture-pilot.tsv ; results/boost/limen-boost-050/comparator-threshold-impact-matrix.tsv:ctim-050-006	Useful only if reviewer-facing related-work prose needs one explicit manual overlay exemplar for category translation discipline.	Manual-overlay badge can move from generic citation support to one explicit second-pass exemplar while staying off row-level join views.	LIMEN may say one category-to-harm translation survived a second manual review pass under citation-only handling.	Does not justify machine-ingest language, row-level event joins, or substitution for LIMEN evidence tiers.	Keep this last in route order unless a reviewer explicitly demands one visible manual exemplar.