source_id	source_name	next_best_local_target	match_scope	current_state	minimum_positive_match_rule	insufficient_match_basis_forbidden_now	human_review_or_caution	if_positive_safe_claim	if_negative_safe_claim	paper_or_thesis_use	visualization_dashboard_hook
aiid	AI Incident Database (AIID)	LIMEN-000008	case_to_case incident overlap	1 bounded exact same-event overlap pilot already populated on `LIMEN-000008 -> 628`; broader use remains comparator-only and snapshot-lag cautioned.	For a second threshold-changing AIID gain, require one additional exact AIID incident record whose title/date and public incident substance align with a different LIMEN row, plus at least one corroborating actor, report, or incident-detail field from the verified public page-data route.	Do not treat deepfake keywords alone, taxonomy-family visibility, report-domain similarity, snapshot-presence/absence, or U.S. election context by itself as a second same-event join.	Keep AIID use metadata-first and preserve snapshot-lag caution; any future second overlap should still be reviewed against the authoritative source package rather than inferred from topic resemblance.	LIMEN can claim one bounded public AIID same-event comparator overlap for a deepfake authoritative row, not broad AIID coverage or archive equivalence.	No second AIID join is currently justified beyond `LIMEN-000008 -> 628`; AIID otherwise remains a machine-readable comparator surface.	Methods appendix and comparator-overlap note for exact public incident matching discipline.	Comparator occupancy panel with one materialized pilot-overlap badge plus a guarded second-overlap gate.
oecd_aim_incidents	OECD AI Incidents Monitor	LIMEN-000001	case_to_case incident overlap	1 bounded exact same-event overlap pilot already populated on `LIMEN-000001 -> 2023-03-31-960d`; broader use remains metadata-first and rights-bounded.	For a second threshold-changing OECD gain, require one additional exact OECD incident slug/API record aligned to a different LIMEN row with consistent title/date/jurisdiction and article-level metadata.	Do not treat ChatGPT topic overlap, Italy as country facet alone, policy vocabulary similarity, or rights-aware discovery mechanics as proof of a second same-event OECD join.	Keep OECD use metadata-first even after the current pilot; reuse/export posture stays bounded by the public detail/API plus rights language.	LIMEN can claim one bounded exact OECD metadata-first comparator overlap for a regulator-facing incident, not unrestricted OECD dataset reuse.	No second OECD join is currently justified beyond `LIMEN-000001 -> 2023-03-31-960d`; OECD otherwise remains a country/language/policy comparator.	Methods/results note on multilingual policy-facing comparator matching with explicit rights caution.	Country-language comparator panel with one materialized pilot and an exact-overlap gate for any second row.
avid	AI Vulnerability Database (AVID)	LIMEN-000002	security row direct external join	1 canonical direct join on Langflow; 8 explicit placeholder or non-canonical rows	A positive direct join requires a canonical AVID report or vulnerability identifier recorded in the local row and consistent with the underlying public CVE/advisory substance.	Do not count non-empty placeholder text, analyst-review traces, family resemblance, or product similarity as an AVID join.	Separate canonical direct IDs from placeholders in every table and chart; the exact-join exemplar remains weaker on notice depth than several non-joined rows.	LIMEN can already claim one exact LIMEN-to-AVID security-row join for Langflow, but not broader AVID interoperability across the package.	All other non-empty AVID slots currently record explicit no-direct-match or non-canonical states rather than positive joins.	Security methods appendix and interoperability-asymmetry note.	Direct-join-vs-placeholder split panel.
mitre_atlas	MITRE ATLAS	LIMEN-000001	security row direct case-study join versus technique-context link	0 direct case-study joins; 9 technique/context rows	A positive direct join requires one defensible ATLAS case-study identifier tied to the same concrete incident/product/mechanism, not merely shared techniques or generalized analogues.	Do not treat technique IDs alone, generalized case-study notes, security-mechanism resemblance, or cautious context wording as a direct ATLAS case-study match.	Technique-context use is already valuable and should remain visibly separate from case-study identity; cautious-context-only rows need stronger independent anchors before stronger framework language.	LIMEN can safely claim ATLAS technique-context interoperability, and for Auto-GPT a generalized case-context analogue, but not any exact local ATLAS case-study overlap.	LIMEN currently has zero populated direct ATLAS case-study IDs.	Security-technique graph note and methods/results caution sentence.	Technique-context versus direct-case-study split panel.
mit_ai_risk_repo	MIT AI Risk Repository	deepfake_or_synthetic_identity	category_to_taxonomy overlay	0 local slots; concept-layer bridge only	A positive overlay requires visible public MIT AI Risk domain/subdomain anchor language that can be manually aligned to the LIMEN category without claiming an event-level record or stable object identifier.	Do not treat Dataset metadata, CC BY license, distribution-link presence, or a broad risk-theme resemblance as a case-level join.	Keep overlay language concept-level only until anonymous object/export proof or stable risk-object identifiers are independently verified.	LIMEN can claim one bounded concept/risk-definition overlay for a category, not a case-level MIT AI Risk join.	LIMEN currently has no populated MIT AI Risk slots; the source remains a concept/risk-definition comparator only.	Taxonomy appendix, residual-category interpretation note, and limitations prose.	Concept-only overlay badge on taxonomy heatmap.
cset_ai_harm	CSET AI Harm taxonomy / overview	education_workplace_or_hr	category_to_manual_harm overlay	0 local slots; manual citation bridge only	A positive overlay requires a low-drift manual review that maps one well-supported LIMEN category to CSET harm language and survives a second review pass before any row-level reuse.	Do not treat article-topic similarity, discrimination/HR relevance alone, or one analyst reading as a row-level crosswalk.	Keep CSET in related-work/manual-interpretation status only; no machine-readable or event-level interoperability should be implied.	LIMEN can claim one bounded manual harm-language overlay for a category after review, not any machine-ingest or event-level join.	LIMEN currently has no populated CSET slots; the source remains citation/manual support only.	Related-work appendix and harm-interpretation language control.	Manual-overlay badge on related-work or category interpretation view.
