promotion_rank	case_id	record_status	evidence_tier	title	avid_state_now	atlas_state_now	atlas_technique_count	current_crosswalk_value	next_best_crosswalk_move	claim_ceiling_if_move_succeeds	blocker_now	paper_or_thesis_use	dashboard_hook	notes
2	LIMEN-000001	authoritative	T3_authoritative_source	Auto-GPT sandbox escape and host code execution risk via unsanitized file basename	explicit_placeholder_or_no_direct_match	generalized_case_context_plus_techniques	3	no_direct_local_avid_report; local analyst-review CSV trace only; not a canonical AVID incident ID	preserve_as_best_atlas_caution_demo_and_probe_only_if_exact_case_study_id_becomes_defensible	If exact AVID report or vulnerability ID is later verified, this row could support a second direct join; until then it remains a negative-control or placeholder state.	No exact AVID report/vulnerability ID currently present in the local row. No direct ATLAS case-study ID is populated; generalized case context must stay separate from case-specific identity.	Security-technique caution panel showing why ATLAS context is useful without claiming direct case-study identity.	Technique-context vs direct-case-study caution panel.	Richest MITRE ATLAS context already present, including generalized case-study note plus multiple technique IDs; best ATLAS caution/demo row.
1	LIMEN-000002	candidate	T1_single_public_source	Langflow custom_component endpoint allows public candidate record for remote code execution risk	canonical_direct_join	generalized_case_context_plus_techniques	1	AVID-2026-R1495	keep_generalized_case_context_separate_from_exact_avid_join	Can already support one exact LIMEN-to-AVID security-row demonstration; next gain is asymmetry hardening, not broad AVID coverage.	Singleton exact join only; row remains T1 candidate with repo-issue-grade remediation depth. No direct ATLAS case-study ID is populated; generalized case context must stay separate from case-specific identity.	Methods appendix and interoperability-asymmetry panel for exact AVID direct join with explicit evidence ceiling.	Exact-join vs placeholder split panel.	Only canonical direct AVID join in live package; best reviewer-safe demonstration row and strongest candidate for a second same-family join ceiling note.
3	LIMEN-000003	authoritative	T3_authoritative_source	Claude Code default allowlist enabled unauthorized file read and network exfiltration before forced update	explicit_placeholder_or_no_direct_match	technique_only_no_direct_case_study	2	no_direct_local_avid_report	keep_as_negative_control_unless_exact_avid_report_id_is_independently_verified	If exact AVID report or vulnerability ID is later verified, this row could support a second direct join; until then it remains a negative-control or placeholder state.	No exact AVID report/vulnerability ID currently present in the local row. ATLAS support is technique-only; no direct case-study ID is recorded.	Core results/table support for technique-only authoritative security rows with stronger independent notice depth.	Technique-only authoritative cell in security heatmap.	Authoritative row with exact ATLAS techniques and strong independent notice depth; useful for technique-only publication cells.
6	LIMEN-000004	authoritative	T3_authoritative_source	CrewAI JSON loader allowed arbitrary local file read on the server	explicit_placeholder_or_no_direct_match	technique_only_no_direct_case_study	1	no_direct_local_avid_report	keep_as_negative_control_unless_exact_avid_report_id_is_independently_verified	If exact AVID report or vulnerability ID is later verified, this row could support a second direct join; until then it remains a negative-control or placeholder state.	No exact AVID report/vulnerability ID currently present in the local row. ATLAS support is technique-only; no direct case-study ID is recorded.	Appendix support for local-file-read technique coverage with partial remediation caveat.	Local-file-read comparator row.	CrewAI local-file-read row has one ATLAS technique and partial vendor remediation, but still no exact AVID or ATLAS upgrade path.
7	LIMEN-000005	authoritative	T3_authoritative_source	CrewAI RAG search tools enabled server-side request forgery and internal/cloud content acquisition	explicit_placeholder_or_no_direct_match	technique_only_no_direct_case_study	1	no_direct_local_avid_report	keep_as_negative_control_unless_exact_avid_report_id_is_independently_verified	If exact AVID report or vulnerability ID is later verified, this row could support a second direct join; until then it remains a negative-control or placeholder state.	No exact AVID report/vulnerability ID currently present in the local row. ATLAS support is technique-only; no direct case-study ID is recorded.	Appendix support for SSRF/network-acquisition technique coverage with partial remediation caveat.	SSRF/network-access comparator row.	CrewAI SSRF row mirrors row 4: useful as appendix support, not the next best interoperability move.
4	LIMEN-000006	authoritative	T3_authoritative_source	LangChain LLMMathChain allowed prompt injection into Python exec, creating arbitrary code execution risk	explicit_placeholder_or_no_direct_match	technique_only_no_direct_case_study	2	no_direct_local_avid_report	keep_as_negative_control_unless_exact_avid_report_id_is_independently_verified	If exact AVID report or vulnerability ID is later verified, this row could support a second direct join; until then it remains a negative-control or placeholder state.	No exact AVID report/vulnerability ID currently present in the local row. ATLAS support is technique-only; no direct case-study ID is recorded.	Appendix cluster support for prompt-injection-to-exec technique family.	Prompt-injection / unsafe-code-execution cluster cell.	Authoritative prompt-injection-to-exec row with two ATLAS techniques; good for technique cluster support without overclaiming direct case-study equivalence.
5	LIMEN-000007	authoritative	T3_authoritative_source	LlamaIndex safe_eval command injection enabled LLM-generated code to execute OS commands on the host	explicit_placeholder_or_no_direct_match	technique_only_no_direct_case_study	2	no_direct_local_avid_report	keep_as_negative_control_unless_exact_avid_report_id_is_independently_verified	If exact AVID report or vulnerability ID is later verified, this row could support a second direct join; until then it remains a negative-control or placeholder state.	No exact AVID report/vulnerability ID currently present in the local row. ATLAS support is technique-only; no direct case-study ID is recorded.	Appendix cluster support for code-execution technique family diversity.	Command-execution cluster cell.	Authoritative command-injection row with two ATLAS techniques; useful for same cluster diversity but still no direct join.
8	LIMEN-000008	authoritative	T3_authoritative_source	LangChain broad load() allowlists enabled attacker-controlled object revival, chat-history poisoning, and possible credential or request side effects	explicit_placeholder_or_no_direct_match	no_direct_case_study_plus_cautious_context_only	0	no_direct_local_avid_report	keep_as_negative_control_unless_exact_avid_report_id_is_independently_verified	If exact AVID report or vulnerability ID is later verified, this row could support a second direct join; until then it remains a negative-control or placeholder state.	No exact AVID report/vulnerability ID currently present in the local row. ATLAS support is still a no-direct-case-study state with only cautious context wording; stronger independent anchor is still needed.	Limitations/control note preserving memory-state contamination without overpromoting weak ATLAS fit.	Cautious-context-only badge for memory/state row.	Memory/state contamination row preserves a valuable cautious-context-only class; stronger anchor needed before promotion.
9	LIMEN-000009	authoritative	T3_authoritative_source	PraisonAI Platform workspace member could add arbitrary user as owner, enabling agent-workspace identity abuse	explicit_placeholder_or_no_direct_match	no_direct_case_study_plus_cautious_context_only	0	no_direct_local_avid_report	keep_as_negative_control_unless_exact_avid_report_id_is_independently_verified	If exact AVID report or vulnerability ID is later verified, this row could support a second direct join; until then it remains a negative-control or placeholder state.	No exact AVID report/vulnerability ID currently present in the local row. ATLAS support is still a no-direct-case-study state with only cautious context wording; stronger independent anchor is still needed.	Limitations/control note preserving identity-boundary abuse without overpromoting weak ATLAS fit.	Cautious-context-only badge for identity-boundary row.	Identity-boundary row preserves another cautious-context-only class; stronger independent anchor needed before promotion.
