priority_rank	surface_path	surface_scope	stale_or_mixed_claim_now	live_verified_contract_now	priority_rationale	paper_thesis_use	dashboard_hook	next_safe_action	evidence_basis_paths
1	dashboard/limen-dashboard-spec-v0.1.md	reviewer-facing dashboard architecture prose	Header and denominator sections still mix `27 visible rows / 20 reviewed lineages / 17 duplicate-review rows / 28 normalized rows / 21 publication-safe lineages` with the live 14-edge graph.	Separate the layers explicitly: `29 raw visible rows`; `19 duplicate-ledger rows`; `14 duplicate-review graph edges`; `22 stable-collapsed lineages`; `29 normalized join-ledger rows`; `21 publication-safe lineages`.	Highest-priority stale reviewer surface because the dashboard spec is a shared routing spine and still flattens several denominator layers into one outdated package summary.	Methods/data paper and thesis architecture note on denominator discipline and duplicate-control reproducibility.	Dashboard maintainer QA card and denominator badge source-of-truth note.	Patch the header plus sections 2, 3.1, and 3.2 so each denominator layer is named separately and the graph stays explicitly narrower than the ledger.	results/clusters/duplicate-clusters-v0.1.tsv; results/clusters/status.md; results/boost/limen-dashboard-paper-forge/duplicate-review-graph.tsv; results/boost/limen-boost-011/normalized-join-key-ledger.tsv; results/boost/limen-boost-011/publication-safe-aggregate-matrix.tsv
2	papers/article-architecture-v0.1.md	reviewer-facing manuscript architecture prose	Header and evidence-base bullets still say `27 visible rows / 20 reviewed lineages / 17 review rows / 28 normalized rows / 21 collapsed lineages`.	Use the same live split as the dashboard spec: raw=29; duplicate ledger=19; graph edges=14; stable-collapsed lineages=22; normalized join rows=29; publication-safe lineages=21.	High-priority because this file can leak stale counts directly into manuscript planning and reviewer-facing framing.	Article package architecture and thesis chapter spine on evidence infrastructure.	Manuscript planning card for denominator-safe figure and table prose.	Patch the status sentence and section-2 evidence-base bullets so the duplicate-review package is no longer described with the older 27/20/17 bundle.	results/clusters/duplicate-clusters-v0.1.tsv; results/clusters/status.md; results/boost/limen-dashboard-paper-forge/duplicate-review-graph.tsv; results/boost/limen-boost-011/normalized-join-key-ledger.tsv; results/boost/limen-boost-011/publication-safe-aggregate-matrix.tsv
3	results/dashboard-paper/figure-table-priority-register-v0.1.tsv :: LIMEN-VIS-004	shared figure priority register	`14 graph edges ... duplicate ledger rows=17 with blocker=5 stable_duplicate_cluster=7 reviewed_not_duplicate=5`.	Figure 4 should still state `14 graph edges`, but the paired ledger denominator is now `19 duplicate-ledger rows` split `blocker=5; stable_duplicate_cluster=7; reviewed_not_duplicate=7`.	High-value because it feeds shared figure readiness and could still teach later lanes the wrong ledger denominator for Figure 4.	Methods-quality figure routing for duplicate control and join safety.	Figure 4 readiness card and duplicate-control legend source.	Patch only the Figure-4 row so graph-edge scope remains intact while the paired live ledger denominator and reviewed-not-duplicate count are updated.	results/dashboard-paper/figure-table-priority-register-v0.1.tsv; results/clusters/duplicate-clusters-v0.1.tsv; results/boost/limen-dashboard-paper-forge/duplicate-review-graph.tsv
4	results/boost/limen-boost-024/canonical-figure-table-registry.tsv :: LIMEN-VIS-004	canonical figure/table registry row	`14 graph edges (blocker=9; reviewed_not_duplicate=5); duplicate ledger rows=17`.	Keep `14 graph edges` but update the companion ledger scope to `19 duplicate-ledger rows`; preserve the narrower-than-ledger warning.	High-value because this registry is the machine-readable figure spine for manuscript/dashboard reuse and currently understates the live ledger denominator.	Figure registry control surface for manuscript slots and caption propagation.	Canonical Figure 4 denominator legend and export map.	Patch the Figure-4 registry row so later reuse cites the live ledger denominator without inflating the graph-edge count.	results/boost/limen-boost-024/canonical-figure-table-registry.tsv; results/clusters/duplicate-clusters-v0.1.tsv; results/boost/limen-dashboard-paper-forge/duplicate-review-graph.tsv
5	results/boost/limen-boost-012/manuscript-integration-register.tsv :: limen-ms-fig-004	manuscript integration row	Figure-4 support prose still treats `reviewed_not_duplicate=5` and the older 17-row ledger bundle as if they describe the whole duplicate-review package.	Figure 4 should be described as `14 graph edges` over blocker and reviewed-non-merge relations, while the live duplicate ledger is `19 rows` and the full reviewed-non-merge package count is `7`.	Medium-high because it can flatten graph scope into manuscript prose even after the visual registry is repaired.	Main-text figure-callout discipline and hostile-reviewer methods prose.	Figure 4 prose QA note and duplicate-control appendix bridge.	Patch the Figure-4 manuscript row so `5` is clearly a graph-edge subset and `7 reviewed_not_duplicate` remains visible as the live ledger package count.	results/boost/limen-boost-012/manuscript-integration-register.tsv; results/clusters/duplicate-clusters-v0.1.tsv; results/boost/limen-dashboard-paper-forge/duplicate-review-graph.tsv
6	results/boost/limen-boost-012/reviewer-caption-register.tsv :: limen-ms-fig-004	caption draft control row	The current caption draft still says the duplicate ledger contains `17 rows` while the graph shows `14 edges`.	The caption should preserve `14 graph edges` but say the live duplicate ledger is `19 rows` and that stable duplicate clusters belong to lineage-counting logic rather than recurrence narration.	Medium because it is closer to final reviewer-visible wording than lane-local notes, but its drift is narrower than the two shared headers.	Reviewer-facing caption control for duplicate-control figure reuse.	Caption QA row for Figure 4 and appendix carry-over text.	Patch only the Figure-4 caption row after the figure registry row is corrected so caption and registry stay aligned.	results/boost/limen-boost-012/reviewer-caption-register.tsv; results/clusters/duplicate-clusters-v0.1.tsv; results/boost/limen-dashboard-paper-forge/duplicate-review-graph.tsv
7	results/dashboard-paper/shared-export-promotion-register-v0.1.tsv :: exp-002	shared export promotion row	`28 normalized rows / 21 publication-safe lineages`.	The publication-safe lineage denominator remains `21`, but the upstream normalized join-ledger row count is now `29`.	Lower priority than Figure-4 drift because the lineage contract is still safe, but the upstream normalized-row wording is stale and should not silently persist.	Safe aggregate export provenance note for dashboard and manuscript count-bearing prose.	Promotion register note for blocked `results/dashboard/` aggregate export.	Patch the row when next touched so the normalized-row layer says `29` while keeping the 21-lineage contract unchanged.	results/dashboard-paper/shared-export-promotion-register-v0.1.tsv; results/boost/limen-boost-011/normalized-join-key-ledger.tsv; results/boost/limen-boost-011/publication-safe-aggregate-matrix.tsv
