as_of_utc	router_row_id	reuse_scenario	default_denominator_state	required_bundle	allowed_statement_now	must_not_overread	paper_thesis_use	visualization_dashboard_hook	next_threshold_trigger	evidence_refs
2026-06-07T16:11:43Z	AFLR-033-001	frozen_paper_core_without_ftc_promotion	Keep the Route A paper package frozen at 21 publication-safe lineages; do not let live FTC sidecars silently enter the headline denominator.	results/paper-snapshot-20260607/status.md ; results/paper-snapshot-20260607/paper/limen-paper-snapshot-20260607-report.md ; results/boost/limen-boost-009/paper-freeze-sidecar-governor.tsv:PFSG-009-001 ; results/boost/limen-boost-033/ai-washing-manuscript-bundle.tsv:AIMB-033-001..AIMB-033-006	LIMEN can state that the frozen paper package keeps shard-009 AI-washing support inside a 21-lineage headline denominator while preserving later FTC, Springer, and Datatilsynet material as explicit non-denominator anchors or sidecars.	Do not mix the live 33/25 duplicate-taxonomy layer into the frozen paper denominator, do not treat later sidecars as already counted core rows, and do not imply that freeze discipline solves the hidden-human authority gap.	Reviewer-safe frozen-paper methods/results prose, thesis package note on denominator discipline, and cover-note explanation of why later live anchors remain outside the frozen count.	Route A denominator note paired with Table 1C claim-ceiling controls and the snapshot drift warning.	Only a synchronized denominator recomputation or a paper staying permanently freeze-only changes this routing choice.	results/paper-snapshot-20260607/status.md:9-14,28-34 ; results/paper-snapshot-20260607/paper/limen-paper-snapshot-20260607-report.md:24-37,78-90,163-165 ; results/boost/limen-boost-009/paper-freeze-sidecar-governor.tsv:PFSG-009-001
2026-06-07T16:11:43Z	AFLR-033-002	donotpay_sidecar_inside_frozen_package	Keep the Route A denominator frozen at 21 while allowing one bounded FTC non-finance DoNotPay sidecar to strengthen prose about diversification beyond settled finance.	results/boost/limen-boost-009/paper-freeze-sidecar-governor.tsv:PFSG-009-002 ; results/boost/limen-boost-009/table1c-diversification-sidecar-sync.tsv:T1C-DSS-009-001..T1C-DSS-009-004 ; results/boost/limen-boost-021/table1c-control-travel-kit.tsv:T1C-TK-021-001..T1C-TK-021-008 ; results/boost/limen-boost-033/ai-washing-manuscript-bundle.tsv:AIMB-033-001..AIMB-033-006	LIMEN can state that one official FTC complaint/final-order row widens shard-009's official non-finance support as a bounded sidecar without changing the default four-row Table 1C ladder or the frozen 21-lineage paper denominator.	Do not rewrite DoNotPay as hidden-human closure, judicial unauthorized-practice proof, product-truth proof, or a silent fifth default Table 1C row.	Best immediate hostile-reviewer repair when a paper or thesis paragraph needs one exact non-finance official-text example without reopening all frozen counts.	Official non-finance badge, diversification-sidecar note, and four-row-core-plus-sidecar visual explanation.	If one publication slot opens, DoNotPay sidecar-first remains the safest gain before any denominator revision debate.	results/boost/limen-boost-009/paper-freeze-sidecar-governor.tsv:PFSG-009-002 ; results/boost/limen-boost-009/donotpay-promotion-bridge.tsv:DPB-009-001..DPB-009-003 ; results/dashboard-paper/ai-washing-authority-diversification-panel-v0.1.tsv:AWADP-009-005..AWADP-009-006
2026-06-07T16:11:43Z	AFLR-033-003	workado_appendix_or_detector_branch_only	Keep Workado outside both the frozen denominator and the default four-row Table 1C core unless a narrower detector-governance appendix branch is deliberately opened.	results/boost/limen-boost-009/paper-freeze-sidecar-governor.tsv:PFSG-009-004 ; results/boost/limen-boost-021/nonfinance-subtype-branch-register.tsv:NSBR-021-003 ; results/boost/limen-boost-021/workado-detector-branch-activation.tsv:WDBA-021-001..WDBA-021-003	LIMEN can use Workado only as a bounded detector-governance or false-capability appendix/support row after the DoNotPay sidecar rule is understood.	Do not present Workado as general detector-validity proof, a default official non-finance diversification row, or a reason to skip the DoNotPay-first route.	Thesis appendix branch, detector-governance methods note, or reviewer-response clarification on why all FTC rows are not interchangeable.	Appendix-only overlay and narrower false-capability badge.	A deliberate detector-governance branch opening is required before Workado becomes more than appendix support.	results/boost/limen-boost-009/paper-freeze-sidecar-governor.tsv:PFSG-009-004 ; results/boost/limen-boost-021/nonfinance-subtype-branch-register.tsv:NSBR-021-003 ; results/paper-snapshot-20260607/paper/limen-paper-snapshot-20260607-report.md:86-90,164-165
2026-06-07T16:11:43Z	AFLR-033-004	deliberate_denominator_recompute	If the paper intentionally wants DoNotPay inside the default denominator or core Table 1C logic, abandon the frozen 21-lineage headline and recompute synchronized exports, caption controls, and manuscript surfaces together.	results/boost/limen-boost-009/paper-freeze-sidecar-governor.tsv:PFSG-009-003 ; results/paper-snapshot-20260607/status.md:28-34 ; results/paper-snapshot-20260607/paper/limen-paper-snapshot-20260607-report.md:24-37 ; results/boost/limen-boost-057/core-table-revision-register.tsv:CTR-057-003	LIMEN can choose a live-post-FTC paper package, but only if the denominator change is explicit and synchronized across snapshot exports, claim/caption controls, and manuscript prose.	Do not make this a prose-only choice, do not leave frozen 21-lineage wording standing beside a revised default FTC denominator, and do not present the revised ladder as hidden-human closure or subtype completeness.	Decision memo for whether the first paper remains a freeze package or becomes a live refreshed package with denominator consequences made explicit.	Possible revised LIMEN-VIS-009 denominator with Figure 2/Table 2 denominator-ripple warning.	Choose this only if publication value from one default official non-finance row exceeds the stability value of the existing frozen package.	results/boost/limen-boost-009/paper-freeze-sidecar-governor.tsv:PFSG-009-003 ; results/paper-snapshot-20260607/status.md:33-34 ; results/paper-snapshot-20260607/paper/limen-paper-snapshot-20260607-report.md:163-165 ; next.md:28-30
2026-06-07T16:11:43Z	AFLR-033-005	hidden_human_queue_remains_substantive_trigger	Whether the package stays frozen or is recomputed, the hidden-human final-authority queue remains the real shard-009 substantive upgrade trigger.	results/boost/limen-boost-009/paper-freeze-sidecar-governor.tsv:PFSG-009-005 ; results/dashboard-paper/ai-washing-posture-table-v0.1.tsv:row4 ; results/boost/limen-boost-033/ai-washing-authority-funnel.tsv:AF-033-001..AF-033-006	LIMEN can keep publishing the missing final-authority hidden-human-as-AI exemplar as bounded negative evidence and as the clearest remaining shard-009 blocker, regardless of whether FTC sidecars stay outside or inside the frozen denominator.	Do not infer hidden-human closure from DoNotPay, Workado, charge-stage Nate updates, or freeze-vs-live packaging choices.	Limitation sentence, reviewer objection response, thesis gap register, and next-route selector for shard-009.	Queue-row retention rule and next-upgrade card for the AI-washing package.	Only a real public disposition, judgment, consent decree, settlement, or regulator-order equivalent changes this state.	results/boost/limen-boost-009/paper-freeze-sidecar-governor.tsv:PFSG-009-005 ; results/dashboard-paper/ai-washing-posture-table-v0.1.tsv:row4 ; results/paper-snapshot-20260607/paper/limen-paper-snapshot-20260607-report.md:114-119