as_of_utc	audit_id	artifact_under_test	audit_scope	historical_lane_contract	live_contract_now	drift_state	historical_value	live_value	delta	bounded_cause_now	paper_safe_interpretation	next_surface_or_move	source_paths
2026-06-07T17:28:54Z	TFLD-058-001	taxonomy-authority-fragility-matrix.tsv	denominator_family	23_lineages_matrix_snapshot	35_visible_rows/27_unique_lineages	historical_matrix_below_live_taxonomy_layer	matrix built on 23 lineages before FTC, Playwright MCP, and Danish Datatilsynet uplifts	live duplicate/taxonomy package now resolves to 35 visible rows and 27 unique lineages	+4 lineages vs matrix baseline; +12 visible rows vs matrix baseline	The matrix remains useful as a fragility logic sidecar, but its count-bearing snapshot predates the later live uplifts already documented in Figure 2 denominator audits.	Use the matrix for fragility flags and category-shape cautions, not as the current live denominator or current category-count source.	Refresh the matrix only as part of a synchronized taxonomy-fragility bundle tied to Figure 2 live/staged controls, not via isolated prose reuse.	results/boost/limen-boost-058/taxonomy-authority-fragility-matrix.tsv; results/taxonomy/taxonomy-delta-v0.1.md; results/clusters/status.md; results/boost/limen-boost-046/figure2-post-danish-drift-reaudit.tsv
2026-06-07T17:28:54Z	TFLD-058-002	taxonomy-authority-fragility-matrix.tsv	category::security_risk	23_lineages_matrix_snapshot	35_visible_rows/27_unique_lineages	count_drift	9 stable collapsed lineages; 8 direct authority; 1 single public	10 live lineages in taxonomy delta	+1 lineage	Playwright MCP added one live-only security lineage after the matrix snapshot.	The repeated-mechanism overlay remains valid, but the old nine-lineage wording is stale.	Update any count-bearing prose to ten live lineages or cite the matrix as historical snapshot only.	results/boost/limen-boost-058/taxonomy-authority-fragility-matrix.tsv; results/taxonomy/taxonomy-delta-v0.1.md
2026-06-07T17:28:54Z	TFLD-058-003	taxonomy-authority-fragility-matrix.tsv	category::agentic_control_failure	23_lineages_matrix_snapshot	35_visible_rows/27_unique_lineages	count_drift	9 stable collapsed lineages; 8 direct authority; 1 single public	10 live lineages in taxonomy delta	+1 lineage	Playwright MCP added one live-only agentic-control lineage after the matrix snapshot.	The bounded overlay logic still holds, but the old nine-lineage wording is stale.	Update any count-bearing prose to ten live lineages or cite the matrix as historical snapshot only.	results/boost/limen-boost-058/taxonomy-authority-fragility-matrix.tsv; results/taxonomy/taxonomy-delta-v0.1.md
2026-06-07T17:28:54Z	TFLD-058-004	taxonomy-authority-fragility-matrix.tsv	category::public_sector_misuse_or_gap	23_lineages_matrix_snapshot	35_visible_rows/27_unique_lineages	count_drift	7 stable collapsed lineages	8 live lineages in taxonomy delta	+1 lineage	Danish Datatilsynet adds one rare-language regulator-governance lineage after the matrix snapshot.	The disclosure-surface heterogeneity caution remains valid, but seven is no longer the live count.	Keep Denmark as bounded governance-sidecar evidence and refresh the matrix only in a synchronized bundle.	results/boost/limen-boost-058/taxonomy-authority-fragility-matrix.tsv; results/taxonomy/taxonomy-delta-v0.1.md; results/clusters/status.md
2026-06-07T17:28:54Z	TFLD-058-005	taxonomy-authority-fragility-matrix.tsv	category::education_workplace_or_hr	23_lineages_matrix_snapshot	35_visible_rows/27_unique_lineages	count_drift	4 stable collapsed lineages	6 live lineages in taxonomy delta	+2 lineages	Workado plus Danish Datatilsynet widened the live education/workplace slice after the matrix snapshot.	The comparator logic remains useful, but the old four-lineage wording is materially stale.	Any count-bearing reuse should now cite six live lineages and carry staged-vs-live Figure 2 caution.	results/boost/limen-boost-058/taxonomy-authority-fragility-matrix.tsv; results/taxonomy/taxonomy-delta-v0.1.md; results/boost/limen-boost-046/figure2-post-danish-drift-reaudit.tsv
2026-06-07T17:28:54Z	TFLD-058-006	taxonomy-authority-fragility-matrix.tsv	category::ai_washing_or_false_ai_claim	23_lineages_matrix_snapshot	35_visible_rows/27_unique_lineages	count_drift	4 stable collapsed lineages	6 live lineages in taxonomy delta	+2 lineages	DoNotPay and Workado widened the live AI-washing slice after the matrix snapshot.	Finance-heavy posture caution still holds, but four-lineage wording is stale.	Keep subtype logic posture-aware and update count-bearing prose to six live lineages.	results/boost/limen-boost-058/taxonomy-authority-fragility-matrix.tsv; results/taxonomy/taxonomy-delta-v0.1.md; results/boost/limen-boost-046/figure2-post-danish-drift-reaudit.tsv
2026-06-07T17:28:54Z	TFLD-058-007	paper-fragment.md	count_bearing_manuscript_sidecar	23_lineages_matrix_snapshot	35_visible_rows/27_unique_lineages	patched_this_cycle	Paper fragment described 9-lineage security/agentic, 4-lineage AI-washing, and 3-lineage institutional-absurdity logic as current.	Paper fragment now labels the matrix as a historical fragility snapshot and routes live counts to taxonomy delta plus Figure 2 sidecars.	count-bearing prose removed or rewritten	The fragment needed wording repair so shard-058 would not silently reuse stale category counts.	Count-bearing live claims now route through the live duplicate/taxonomy controls rather than the older lane-local matrix.	Use this audit before any future shared-surface refresh that cites shard-058 fragility logic.	results/boost/limen-boost-058/paper-fragment.md; results/boost/limen-boost-058/taxonomy-authority-fragility-matrix.tsv; results/taxonomy/taxonomy-delta-v0.1.md
