as_of_utc	family_id	source_family	priority	saturation_state	dashboard_readiness	route_rank	authority_profile_short	language_scope	jurisdiction_scope	update_cadence	likely_case_types	coverage_signal	thin_family_flag	exact_upgrade_trigger	next_verification_move	dashboard_hook	paper_safe_claim_now
2026-06-07T21:06:57Z	sf01	AI Incident Database (AIID)	P0	seeded	grounded_now	13	Curated incident database with strong discovery and comparison value, but not a final authority for legal status or allegation truth.	English-facing interface with global incident coverage.	Global, multi-jurisdiction.	Rolling/continuous.	Public incident reports, deployment failures, misuse, and controversy traces.	1 stable public incident page sample plus one appendix row verified; public backup discoverability confirmed; bulk/API semantics still partial.	no	Verify one snapshot manifest or single-record machine-readable extraction that ties public page labels to field names without broad harvesting.	Verify one snapshot manifest or single-record machine-readable extraction that ties public page labels to field names without broad harvesting.	Source-family saturation map; comparator-overlap panel; interoperability readiness board.	Strong for overlap, residual-gap detection, and source-baseline discussion; weak alone for legal/compliance or incident-truth claims.
2026-06-07T21:06:57Z	sf02	OECD AI Incidents Monitor (OECD AIM)	P0	seeded	grounded_now	12	Official institutional monitor with strong policy-facing authority for incident indexing and controlled vocabularies, but not itself a final authority on underlying allegations.	English-facing interface with international article references and platform vocabularies.	Global, multi-jurisdiction.	Rolling/continuous.	Public incident summaries, article-linked records, and policy-facing monitoring rows.	1 stable public detail-page sample plus live country/language/concept endpoint evidence verified locally; record-discovery route still partial.	no	Trace one public detail page back to a stable list/discovery route and document the minimal safe metadata subset.	Trace one public detail page back to a stable list/discovery route and document the minimal safe metadata subset.	Country/language coverage comparison; vocabulary bridge; incident-monitor interoperability board.	Strong for comparator metadata, vocabulary bridges, and country/language context; still insufficient alone for strong factual or legal claims.
2026-06-08T10:58:00Z	sf03	AI Vulnerability Database (AVID)	P0	seeded	grounded_now	9	High structured technical authority for public AI vulnerability/report metadata when exact IDs and references are preserved.	Primarily English technical reporting.	Global.	Rolling/continuous.	AI vulnerabilities, security edge cases, technical misuse, and failure reports.	11 live seeded security rows now carry 2 canonical direct AVID joins plus 9 explicit non-match/context-control rows in the reviewer-safe appendix.	no	Treat the current AVID appendix as the reviewer-safe control surface; only add a third canonical direct join outside the current Langflow-plus-ToolHive pair or an exact negative-match rule if justified, otherwise return effort to sf08/sf09 authority hardening.	Treat the current AVID appendix as the reviewer-safe control surface; only add a third canonical direct join outside the current Langflow-plus-ToolHive pair or an exact negative-match rule if justified, otherwise return effort to sf08/sf09 authority hardening.	Security-edge-case bridge; direct-versus-placeholder join panel; reviewer-safe interoperability appendix.	Strong for technical mechanism, vulnerability metadata, and two exact security-row bridges; weak for general incident census or treating placeholder rows as solved joins.
2026-06-07T21:06:57Z	sf04	MITRE ATLAS	P0	seeded	grounded_now	8	High structured authority for adversarial-ML and agentic-security techniques, mitigations, and case-study relations.	English technical/security knowledge base.	Global.	Periodic framework/data releases.	Adversarial techniques, mitigations, case-study relations, and agentic/security anomaly structure.	ATLAS technique context appears across all 9 current security rows with 12 technique-ID occurrences; the appendix separates generalized case-context, no-direct-case-study, and cautious-context-only states.	no	Treat the current ATLAS appendix as the reviewer-safe control surface; only add a defensible exact case-study ID or stronger independent anchor for cautious rows if justified, otherwise return effort to sf08/sf09 authority hardening.	Treat the current ATLAS appendix as the reviewer-safe control surface; only add a defensible exact case-study ID or stronger independent anchor for cautious rows if justified, otherwise return effort to sf08/sf09 authority hardening.	Security/agentic crosswalk; technique-coverage heatmap; case-context-versus-cautious-context panel.	Strong for security-technique structure, mitigation framing, and operational technique-context joins; weak for non-security completeness or direct case-study equivalence claims.
2026-06-07T21:06:57Z	sf05	MIT AI Risk Repository	P0	seeded	grounded_now	10	Secondary but important structured authority for risk and harm definitions; not an incident-truth source.	English-facing taxonomy surface.	Global / framework-defined.	Periodic revisions.	Risk classes, hazard definitions, and residual-category comparison support.	Homepage-level reuse signal and taxonomy role verified; no bulk export route yet documented.	no	Extract one compact manual risk-category bridge for the most used LIMEN harm labels before any stronger comparative language.	Extract one compact manual risk-category bridge for the most used LIMEN harm labels before any stronger comparative language.	Taxonomy heatmap; residual-category overlay; methods table on definition-layer comparators.	Strong for methods, taxonomy, and harm-definition claims; invalid as event evidence.
2026-06-07T21:06:57Z	sf06	CSET AI Harm taxonomy / overview	P1	seeded	grounded_now	5	Secondary conceptual authority for harm framing and related-work comparison, but not machine-ready incident evidence.	English.	Global / conceptual.	Irregular article/report updates.	Harm framing, interpretive taxonomy support, and related-work positioning.	Public article plus exact PDF/README anchors verified; 7-row local harm bridge and 5-rule coding memo exist; machine-ingest path remains absent.	no	Keep the family explicitly outside machine-ingest claims and add a second low-drift reviewer pass before any row-level posture aggregate is exposed.	Keep the family explicitly outside machine-ingest claims and add a second low-drift reviewer pass before any row-level posture aggregate is exposed.	Harm-taxonomy note; conceptual-support panel; related-work table; Route-A appendix-only methods note.	Strong for appendix-only harm-posture interpretation and related-work positioning; invalid as event evidence or ingest-ready comparator.
2026-06-08T01:06:59Z	sf07	Regulator and enforcement sources	P0	seeded	grounded_now	6	High authority for official actions, allegations, orders, fines, guidance, and procedural posture within issuing jurisdiction.	Multilingual depending on regulator.	Jurisdiction-specific; collectively global.	Irregular, high-value discrete updates.	Enforcement actions, deceptive-marketing cases, privacy breaches, official warnings, and procedural escalations.	11-row shared authoritative core now counts 8 direct-document-grade rows across Italy, the United States, the United Kingdom, and promoted FTC non-finance official rows, while the court-family blocker remains tracked separately under sf08.	no	Add one non-U.S./non-UK follow-through row tied to a public record or court-facing document to reduce current geography concentration, while keeping the court-family bottleneck on exact sf08 depth separate.	Add one non-U.S./non-UK follow-through row tied to a public record or court-facing document to reduce current geography concentration, while keeping the court-family bottleneck on exact sf08 depth separate.	Authority-weighted evidence matrix; regulator-action timeline; jurisdiction map.	Best current family for upgrading weak media or company claims into paper-grade bounded statements.
2026-06-08T01:06:59Z	sf08	Court and tribunal records	P0	seeded	grounded_now	1	Highest authority for filings, judgments, consent decrees, and procedural posture when records are official and public.	Highly multilingual.	Jurisdiction-specific.	Event-driven / irregular.	Litigation, injunctions, complaints, decrees, judgments, and review of automated/public AI decisions.	1 DOJ-linked indictment PDF remains image-only with partial caption OCR plus 1 EEOC filing/settlement pair exposing Civil Action No. 1:22-cv-02565 in agency summaries, but there is still no open court-originating complaint, decree, docket entry, or judicial order text.	yes	Either capture one open complaint, consent decree, docket entry, or judicial order text for the iTutorGroup row from a genuinely different public court-facing surface or clearly labeled open mirror, or use a materially different OCR stack / another public exact-caption source before retrying the Nate suffix.	Either capture one open complaint, consent decree, docket entry, or judicial order text for the iTutorGroup row from a genuinely different public court-facing surface or clearly labeled open mirror, or use a materially different OCR stack / another public exact-caption source before retrying the Nate suffix.	Regulator-to-court escalation matrix; procedural-posture timeline; Route-B blocker panel.	Critical for hostile-reviewer resilience where regulator or agency summaries alone are too thin.
2026-06-08T01:27:51Z	sf09	Public-sector registers and procurement	P1	seeded	grounded_now	2	Medium-to-high authority for what a public body disclosed or procured; weak for deployment impact, legality, or efficacy unless corroborated.	Often local-language first.	Country, regional, and municipal public-sector jurisdictions.	Periodic / batch releases varying by portal.	Algorithm registers, procurement anomalies, AI system disclosures, and public deployment surfaces.	2 municipal public AI register rows, 1 Slovenian official police project-page row, 2 UK regulator-document anchors, and 1 Helsinki same-buyer procurement companion still stand, with Amsterdam now carrying an explicit same-buyer Azure/Public Cloud family bridge while remaining below exact buyer-side or public-companion proof.	yes	Add one buyer-side tender, award, contract, or public impact-assessment companion for either register row, or keep the family bounded at register-plus-non-register disclosure surfaces.	Add one buyer-side tender, award, contract, or public impact-assessment companion for either register row, or keep the family bounded at register-plus-non-register disclosure surfaces.	Jurisdiction/language map; disclosure-field completeness chart; register-versus-project-page-versus-regulator panel; Route-B blocker panel.	Strong for disclosure-surface heterogeneity and public-body-existence claims; still weak for buyer-side traceability, capability, legality, or impact claims.
2026-06-07T21:06:57Z	sf10	Company and platform notices	P1	seeded	grounded_now	11	Primary only for what the issuer disclosed; self-interested and incomplete for broader truth claims.	Mostly English with some localized notices.	Global firm/platform scope.	Irregular / incident-driven.	Outages, rollbacks, remediation notices, policy changes, and deployment pauses.	5 metadata-normalized issuer/coordinator notice rows exist locally for Auto-GPT, Langflow, Claude Code, and CrewAI-linked cases.	no	Verify missing direct vendor remediation details for Langflow and CrewAI while preserving the advisory-vs-issue distinction.	Verify missing direct vendor remediation details for Langflow and CrewAI while preserving the advisory-vs-issue distinction.	Remediation timeline overlay; issuer-vs-independent-source comparison table.	Useful for timing and remediation claims; should rarely stand alone for incident characterization.
2026-06-08T01:26:30Z	sf11	Security research and advisories	P1	seeded	grounded_now	3	Variable authority; strongest when tied to CERTs, established labs, coordinated disclosure, or peer-reviewed work.	Mostly English with some multilingual advisories.	Global.	Continuous.	Prompt injection, exfiltration, model inversion, unsafe agent tooling, red-team findings, and coordinated disclosures.	11-row live security package still sits at 3 / 7 / 1 / 1 with the supply-chain/plugin zero state retired; Claude Code now has two public exact scholarly incident signals below closure threshold, but 1 explicit peer-reviewed gap row still remains and trust-boundary breadth is still singleton-only.	yes	Close `GAP-peer_reviewed_security_case_support` first with one incident-specific peer-reviewed, workshop, or conference-grade technical case attachment to a live row; after that, treat Langflow exact-vendor-remediation notice depth as the fastest same-row hardening move and keep LIMEN-000012 explicitly singleton-only until a second exemplar or stronger independent attachment appears.	Close `GAP-peer_reviewed_security_case_support` first with one incident-specific peer-reviewed, workshop, or conference-grade technical case attachment to a live row; after that, treat Langflow exact-vendor-remediation notice depth as the fastest same-row hardening move and keep LIMEN-000012 explicitly singleton-only until a second exemplar or stronger independent attachment appears.	Security-source authority matrix; advisory-to-CVE linkage graph; remediation-visibility overlay; Route-B security hardening panel.	Useful for mechanism discovery, source-independence comparison, coordination posture, and remediation-visibility comparisons when vendor/CERT/release-note/independent-lab roles stay explicit; still weak for prevalence or complete remediation claims.
2026-06-07T21:06:57Z	sf12	Reputable multilingual media and investigations	P1	seeded	grounded_now	7	Secondary corroborative authority valuable for discovery, local context, and timeline stitching, but weaker than official sources.	Multilingual, including underrepresented and local-language reporting.	Global.	Continuous.	Discovery leads, local context, public reactions, timeline stitching, and cases absent from English summaries.	6 local leads across Finland, Lithuania, Slovenia, and Estonia; 1 lead already upgraded from media/discovery friction to a direct official source.	no	Resolve one additional direct source from Finland, Lithuania, or Estonia and record whether the stronger authority comes from broadcaster, police, court, or agency sources.	Resolve one additional direct source from Finland, Lithuania, or Estonia and record whether the stronger authority comes from broadcaster, police, court, or agency sources.	Jurisdiction/language map; lead-to-authority upgrade funnel; rare-language methods note.	Strong for discovery, coverage-gap analysis, and rare-language methods; still weak alone for strong legal or normative claims.
2026-06-08T01:18:27Z	sf13	Academic and research-integrity sources	P1	seeded	grounded_now	4	Medium-to-high authority for retractions, correction notices, benchmark-integrity notes, and scholarly dispute records depending on source.	Mostly English with some multilingual notices.	Global scholarly ecosystem.	Continuous / irregular.	Retracted AI papers, benchmark contamination, fabricated evaluation claims, and research-integrity anomalies.	7 locally classified rows still split into 4 evidence-depth classes, now with blocked-notice public-index corroboration showing NEJM retraction/original role links in PubMed and SAGE corrigendum relation metadata in Crossref while direct journal notice text remains partially blocked.	yes	Probe one blocked or mediated row for direct publisher notice text while preserving the four current family-depth classes and keeping weak specialist/platform-gated rows explicitly below direct-notice grade.	Probe one blocked or mediated row for direct publisher notice text while preserving the four current family-depth classes and keeping weak specialist/platform-gated rows explicitly below direct-notice grade.	Research-integrity dashboard facet; publisher-notice upgrade funnel; scholarly-integrity timeline; Route-A limitations panel.	Strong for bounded claims about article identification, retraction/correction surfaces, publisher-notice depth, and source-resolution friction; weaker for editorial reasoning where direct notice text is blocked or absent.
2026-06-07T21:06:57Z	sf14	Social and web lead sources	P2	planned	planned_not_seeded	14	Low authority alone; discovery surface only until independently corroborated.	Highly multilingual.	Global.	Continuous / high-volume.	Emergent weird cases, community debugging threads, screenshots of odd deployments, and first-signal anomalies.	Implemented empty lead-queue template FQI-001 now exists with mandatory corroboration and safety fields; 0 populated rows promoted into seeded use.	no	Use the implemented empty lead queue template and count progress only if one populated row preserves the low-authority lead state while adding at least one higher-authority corroboration target plus one re-fetchable exact public anchor.	Use the implemented empty lead queue template and count progress only if one populated row preserves the low-authority lead state while adding at least one higher-authority corroboration target plus one re-fetchable exact public anchor.	Lead queue; corroboration backlog; source-upgrade funnel.	Useful only for discovery until upgraded.
2026-06-07T23:20:03Z	sf15	Creative/absurd and normative outlier sources	P2	planned	planned_not_seeded	15	Usually low formal authority but valuable for taxonomy stress tests and novelty-boundary cases.	Multilingual.	Global.	Irregular.	AI persona incidents, fake-AI service claims, uncanny deployments, and governance-threshold anomalies.	Implemented residual-frontier queue now has 1 governed populated row (FQI-002-ROW-001) held below seeded use, alongside the empty-template and intake-contract controls.	no	Use the governed residual row as the live control surface and count further progress only if a direct platform moderation, indexing-service action, publisher statement, or institutional report lands for the same lineage, or if a second governed row materially changes taxonomy pressure without widening seeded use.	Use the governed residual row as the live control surface and count further progress only if a direct platform moderation, indexing-service action, publisher statement, or institutional report lands for the same lineage, or if a second governed row materially changes taxonomy pressure without widening seeded use.	Residual-category queue; novelty/authority matrix; taxonomy stress-test panel; Figure 2 residual-methods note.	Potentially important for article differentiation if sharply bounded and reviewer-legible; one governed queue row now proves handling discipline, but the family remains below shared-claim and seeded-evidence use.
