audit_id	checked_utc	family_id	artifact_path	stale_phrase_or_state	repaired_phrase_or_state	repair_scope	paper_readiness_delta
SF11-BRIEF-001	2026-06-08T17:07:37Z	sf11	results/source-map/source-family-required-brief-route-board-v0.1.tsv	stale sf11 Route-B wording still leaned on older trust-boundary carryover	live 11-row 3 core / 8 appendix / 1 gap package with bounded three-row trust-boundary slice plus explicit ToolHive, Playwright MCP/deployment, and PraisonAI wording	required-brief routing currentness repair only	Prevents lane-brief and route-selection surfaces from understating the live security-family blocker shape.
SF11-BRIEF-002	2026-06-08T17:07:37Z	sf11	results/source-map/source-family-priority-objective-coverage-v0.1.tsv	objective-coverage row still described sf11 with retired 3 / 7 / 1 / 1 package wording	objective-coverage row now states the live 3 core / 8 appendix / 1 gap package plus bounded three-row trust-boundary slice	objective-layer currentness repair only	Keeps lane-objective routing aligned with the current security-family package rather than a retired intermediate state.
SF11-BRIEF-003	2026-06-08T17:07:37Z	sf11	results/source-map/source-family-shared-claim-coverage-matrix-v0.1.tsv	shared-claim router row still carried pre-sync sf11 blocker wording	shared-claim router now states the live three-row trust-boundary slice and the remaining peer-reviewed gap explicitly	claim-routing currentness repair only	Prevents Table 6 and reviewer-response claim routing from leaking older sf11 helper language.
SF11-BRIEF-004	2026-06-08T17:07:37Z	sf11	results/source-map/source-family-lane-brief-compliance-audit-v0.1.tsv	compliance audit had become truncated and no longer covered the full source-family set	compliance audit now rebuilds all 15 source families from the canonical ledger and marks priority-objective-table presence explicitly	compliance-surface integrity repair plus sf11 currentness refresh	Removes a stale audit surface that could otherwise make the lane look internally inconsistent during hostile-reviewer checks.
SF11-BRIEF-005	2026-06-08T17:07:37Z	sf11	sources/source-family-ledger.tsv	canonical ledger was already directionally correct but did not point to the new helper-sync audit	canonical ledger now carries the new helper-sync audit anchor and current check timestamp alongside the live sf11 package wording	canonical-front-door traceability repair only	Makes the ledger the stable citation spine for both the canonical package state and the newly repaired helper surfaces.
