as_of_utc	drift_id	artifact_path	line_or_row_ref	visual_slot_or_surface	current_state	stale_or_repaired_text	live_replacement_or_control_state	evidence_basis	paper_risk_if_unfixed	action_state	recommended_next_route
2026-06-07T12:12:02Z	SVDR-012-001	draft/preprint.md	line 5	Figure 8 / dashboard framing fragment	outstanding_shared	"a bounded authority-geography concentration panel showing an 8-row authoritative package split United States=5, United Kingdom=2, and Italy=1"	Use the live shared Figure 8 control state: 9 authoritative-package rows split United States=5, United Kingdom=2, Italy=1, Slovenia=1, with a 6 / 1 / 1 / 1 depth bridge.	results/boost/limen-boost-027/status.md; results/boost/limen-boost-027/authority-geography-panel.tsv; results/dashboard-paper/caption-control-register-v0.1.tsv:CCR-011	Reviewer-visible understatement of geography coverage and loss of the bounded Slovenian follow-through caveat.	needs_shared_patch	Patch the preprint fragment to the 9-row / 5-2-1-1 Figure 8 state while keeping Slovenia explicitly bounded as official-project-page follow-through only.
2026-06-07T12:12:02Z	SVDR-012-002	draft/preprint.md	line 7	Figure 8 order paragraph	outstanding_shared	"Figure 8 should carry the authority-geography concentration panel as a limitations-forward companion showing the current 8-row authoritative split of United States=5, United Kingdom=2, and Italy=1"	Use the live shared Figure 8 control state: 9 authoritative rows with United States=5, United Kingdom=2, Italy=1, Slovenia=1, plus only one non-U.S./non-UK direct-document anchor and one bounded Slovenian follow-through row.	results/boost/limen-boost-027/status.md; results/dashboard-paper/caption-control-register-v0.1.tsv:CCR-011	Figure-order prose can drift behind the current caption-control spine and invite stale reuse in manuscript variants.	needs_shared_patch	Patch the figure-order paragraph together with SVDR-012-001 so Figure 8 prose and caption controls travel together.
2026-06-07T12:12:02Z	SVDR-012-003	results/boost/limen-boost-024/canonical-figure-table-registry.tsv	row LIMEN-VIS-002	Figure 2 canonical registry	outstanding_shared	Registry still says 15 categories with authoritatively_seeded=10, candidate_only_seeded=2, zero_seed_local_gap=3, and frontier fractions 7/22, 3/22, 2/22.	Treat the live duplicate-controlled taxonomy state as 11 authority-backed, 1 candidate-only, and 3 zero-seed on a 31 visible / 23 lineage denominator until the staged heatmap export is regenerated.	results/boost/limen-boost-046/taxonomy-second-pass-refresh-queue.tsv; results/taxonomy/taxonomy-delta-v0.1.md; dashboard/limen-dashboard-spec-v0.1.md	Canonical Figure 2 routing can reintroduce stale category-support and denominator wording into dashboard/manuscript surfaces.	needs_shared_patch	Patch LIMEN-VIS-002 in the canonical registry after or alongside the staged heatmap regeneration route from shard 046.
2026-06-07T12:12:02Z	SVDR-012-004	results/boost/limen-boost-024/canonical-figure-table-registry.tsv	row LIMEN-VIS-007	Table 1A canonical registry	outstanding_shared	Next-move text still says "preserve the five direct-document rows" even though the same row already declares an 8-row table with document_grade=6.	Preserve six direct-document rows, one normalization-limited charging-stage row, and one summary-only official row under CCR-009.	results/dashboard-paper/authoritative-document-depth-facet-v0.1.tsv; results/dashboard-paper/caption-control-register-v0.1.tsv:CCR-009; results/boost/limen-boost-012/status.md	Internal contradiction inside the canonical Table 1A registry can propagate undercounting into later manuscript or dashboard edits.	needs_shared_patch	Patch LIMEN-VIS-007 next-move wording to six direct-document rows and keep Table 1A tied to CCR-009.
2026-06-07T12:12:02Z	SVDR-012-005	results/boost/limen-boost-012/figure-table-readiness.tsv	row FIG-012-002	Figure 2 lane-local readiness gate	repaired_in_cycle	Earlier row described the staged heatmap as if the current package were still 10 authoritatively_seeded / 2 candidate_only_seeded / 3 zero_seed_local_gap.	Lane-local row now states that the staged export lags the live 11 / 1 / 3 control state on a 31 visible / 23 lineage denominator.	results/boost/limen-boost-046/taxonomy-second-pass-refresh-queue.tsv; results/taxonomy/taxonomy-delta-v0.1.md	Without repair, shard-012 could keep promoting stale Figure 2 wording even after the taxonomy control spine moved.	repaired_local	Keep local Figure 2 prose tied to the live control state until shared exports are regenerated.
2026-06-07T12:12:02Z	SVDR-012-006	results/boost/limen-boost-012/paper-fragment.md	lines 10 and 23	Lane-local Figure 2 / Figure 8 paper fragment	repaired_in_cycle	Lane-local fragment previously treated the taxonomy heatmap as a flat current 15-row heatmap and Figure 8 as a 5 / 2 / 1 geography split.	Lane-local fragment now states the staged-vs-live Figure 2 distinction and the live 9-row Figure 8 state with the 5 / 2 / 1 / 1 geography split and 6 / 1 / 1 / 1 depth bridge.	results/boost/limen-boost-027/status.md; results/boost/limen-boost-027/authority-geography-panel.tsv; results/boost/limen-boost-046/taxonomy-second-pass-refresh-queue.tsv	Without repair, shard-012 would remain an easy source of stale reviewer-facing prose even after later shard upgrades.	repaired_local	Use this lane-local fragment as the current shard-012 handoff while shared manuscript surfaces await patching.
