as_of_utc	audit_id	surface_path	surface_scope	checked_contract	verified_live_state	drift_result	why_this_matters_for_paper_or_thesis	dashboard_or_visual_hook	evidence_refs
2026-06-07T15:39:16Z	PBSA-055-001	claims.md:LIMEN-C-004A and LIMEN-C-004B	claim-ceiling pair	results/dashboard-paper/caption-control-register-v0.1.tsv:CCR-013 ; results/boost/limen-boost-055/claim-defense-crosswalk.tsv:PCDC-055-001..004	Claims layer still separates governance-context support from the sole default-visible FCC lifecycle result and keeps limitations/gate logic outside the main results claim.	no_drift	Confirms that top-level shard-007 claim prose still matches the one-exemplar Table 1F package rather than silently widening into a multirow incident claim.	Claim-support map and reviewer-response control card for Table 1F.	claims.md:LIMEN-C-004A ; claims.md:LIMEN-C-004B ; results/boost/limen-boost-055/claim-defense-crosswalk.tsv:PCDC-055-001..004 ; results/boost/limen-boost-043/claim-support-bridge.tsv:CSB-043-001..002
2026-06-07T15:39:16Z	PBSA-055-002	draft/preprint.md:Shard 007 framing fragment	main manuscript prose	results/boost/limen-boost-055/table1f-manuscript-integration-bridge.tsv:TMIB-055-001..004 ; results/boost/limen-boost-007/provenance-confusion-manuscript-bundle.tsv:PCMB-007-001..007 ; results/dashboard-paper/caption-control-register-v0.1.tsv:CCR-013	Preprint prose still states the 2 left-anchor / 1 governance-context / 1 default-main-results / 2 limitations-only split, keeps New Hampshire blocked-origin, and keeps Pennsylvania metadata-only.	no_drift	Shows that manuscript-facing prose is synchronized to the latest shard-055 row-visibility and limitation logic rather than only older shard-019 table counts.	Table 1F narrative paragraph and hostile-reviewer prose bundle.	draft/preprint.md:21-29 ; results/boost/limen-boost-055/table1f-manuscript-integration-bridge.tsv:TMIB-055-001..004 ; results/boost/limen-boost-055/provenance-visual-encoding-contract.tsv:PVC-055-003..008
2026-06-07T15:39:16Z	PBSA-055-003	papers/article-architecture-v0.1.md:Table 1F block	figure/table architecture prose	results/boost/limen-boost-007/table1f-control-travel-kit.tsv:T1F-TK-007-001..008 ; results/boost/limen-boost-055/provenance-visual-encoding-contract.tsv:PVC-055-001..008	Article architecture still routes Table 1F through CCR-013 plus the shard-007 manuscript bundle and the shard-055 visual-encoding contract, preserving Finland/Lithuania hidden-row discipline and the FCC-only default-results rule.	no_drift	Protects figure/table architecture from drifting into a denominator-ready deepfake panel when the package is still one-exemplar by design.	Table 1F slot rule and article/thesis exhibit router.	papers/article-architecture-v0.1.md:347-348 ; results/boost/limen-boost-007/table1f-control-travel-kit.tsv:T1F-TK-007-003..008 ; results/dashboard-paper/caption-control-register-v0.1.tsv:CCR-013
2026-06-07T15:39:16Z	PBSA-055-004	dashboard/limen-dashboard-spec-v0.1.md:Table 1F spec line	dashboard placement and legend prose	results/dashboard-paper/shared-export-promotion-register-v0.1.tsv:exp-014 ; results/boost/limen-boost-055/provenance-visual-encoding-contract.tsv:PVC-055-003..008	Dashboard spec still keeps the FCC lifecycle row as the only default main-results cell, routes New Hampshire to methods/badge logic, and keeps Pennsylvania appendix/metadata-only while preserving the blocked shared-export state.	no_drift	Shows that dashboard-facing reuse remains caption-safe and does not pretend a promoted shared dashboard export already exists.	Dashboard hidden-row toggle, legend, and intended shared-export stub for LIMEN-VIS-014.	dashboard/limen-dashboard-spec-v0.1.md:418 ; results/dashboard-paper/shared-export-promotion-register-v0.1.tsv:exp-014 ; results/boost/limen-boost-055/table1f-manuscript-integration-bridge.tsv:TMIB-055-003
2026-06-07T15:39:16Z	PBSA-055-005	results/dashboard-paper/caption-control-register-v0.1.tsv:CCR-013 ; results/dashboard-paper/figure-table-priority-register-v0.1.tsv:LIMEN-VIS-014 ; results/dashboard-paper/shared-export-promotion-register-v0.1.tsv:exp-014	shared caption/priority/export controls	results/boost/limen-boost-019/provenance-confusion-publication-cells.tsv:PCPC-019-001..006 ; results/boost/limen-boost-055/claim-defense-crosswalk.tsv:PCDC-055-003..004	Shared control rows still agree on the live six-cell table, the FCC-only default-results role, the hidden Finland/Lithuania limitations rows, and the non-materialized shared dashboard path.	no_drift	Provides one machine-readable answer that shared control surfaces remain synchronized even after the later shard-055 claim-defense and visual-encoding additions.	Caption-safe legend bundle, priority register row, and blocked-export governance note.	results/dashboard-paper/caption-control-register-v0.1.tsv:CCR-013 ; results/dashboard-paper/figure-table-priority-register-v0.1.tsv:LIMEN-VIS-014 ; results/dashboard-paper/shared-export-promotion-register-v0.1.tsv:exp-014 ; results/boost/limen-boost-055/claim-defense-crosswalk.tsv:PCDC-055-003..004
2026-06-07T15:39:16Z	PBSA-055-006	results/boost/limen-boost-055/paper-fragment.md	human-readable prose lift	results/boost/limen-boost-055/provenance-publication-cell-matrix.tsv:CELL-055-001..008 ; results/boost/limen-boost-055/provenance-visual-encoding-contract.tsv:PVC-055-001..008	The lane-local paper fragment remains aligned to the three-panel architecture: anchors only, one synthetic-voice governance/lifecycle panel with blocked New Hampshire branch, and a residual caution panel for Finland/Lithuania/Pennsylvania.	no_drift	Confirms that the fastest reusable human-readable shard-007 prose lift still matches the machine-readable publication-cell and visibility contracts.	Paper/thesis paragraph lift and reviewer-response quick reuse.	results/boost/limen-boost-055/paper-fragment.md ; results/boost/limen-boost-055/provenance-publication-cell-matrix.tsv:CELL-055-001..008 ; results/boost/limen-boost-055/provenance-visual-encoding-contract.tsv:PVC-055-001..008
