as_of_utc	lane_id	audit_row_id	artifact_path	family_id	field_or_surface	previous_local_state	current_canonical_state	action_taken	paper_readiness_delta	remaining_guardrail
2026-06-08T03:18:18+02:00	limen-boost-001	FGCA-001	results/boost/limen-boost-001/family-claim-ceiling-register.tsv	sf14	reviewer_control_state_and_next_trigger	hold_until_corrob_schema_exists / lead_intake_schema_with_mandatory_corroboration_fields_added	maintain_current_bounded_use_with_implemented_empty_queue / one_populated_queue_row_with_exact_public_anchor_and_corroboration_target_added	row_refreshed_to_match implemented empty queue governance already grounded in local frontier artifacts	Writers and reviewers can now cite sf14 as an implemented queue with zero populated rows rather than a pre-implementation placeholder.	No social/web lead may enter seeded use without a re-fetchable exact public anchor and a higher-authority corroboration route.
2026-06-08T03:18:18+02:00	limen-boost-001	FGCA-002	results/boost/limen-boost-001/family-claim-ceiling-register.tsv	sf15	reviewer_control_state_and_next_trigger	hold_until_residual_rules_exist / residual_category_intake_note_with_exclusion_rules_added	maintain_current_bounded_use_with_one_governed_queue_row_below_seeded_use / direct_action_document_for_the_same_lineage_or_second_governed_row_without_seeded_promotion	row_refreshed_to_match live governed residual queue row already captured locally	Figure 2 and methods prose can now point to one concrete count-silent sf15 queue row without overstating seeded evidence.	The governed residual row remains queue-only until a direct platform, publisher, indexing, or institutional action document lands.
2026-06-08T03:18:18+02:00	limen-boost-001	FGCA-003	results/boost/limen-boost-001/source-family-figure-guardrails.tsv	sf11	caption_guardrail_and_upgrade_trigger	No peer-reviewed support, but singleton MCP/plugin exemplar was omitted from the main misread warning; trigger was phrased as generic peer_reviewed_exemplar_or_stronger_vendor_bulletin_hardening_added	No peer-reviewed support and one singleton MCP/plugin exemplar remain explicit; trigger aligned to peer_reviewed_security_case_support_added	row_refreshed_to keep Figure/Table reuse aligned with the live security-family blocker language	Reviewer-facing visuals now preserve the post-Playwright singleton-breadth caution instead of flattening sf11 into a simpler zero-state narrative.	Do not describe sf11 as a balanced independent-validation family or broad ecosystem sample.
2026-06-08T03:18:18+02:00	limen-boost-001	FGCA-004	results/boost/limen-boost-001/saturation-review.tsv	sf14	saturation_readiness	not_ready	methods_support_now	row_refreshed_to reflect implemented queue governance without any seeded promotion	The source-family saturation narrative now distinguishes between frontier families that are structurally unimplemented and frontier families that already support methods-facing governance discussion.	Progress only counts when a governed queue row adds an exact public anchor plus a higher-authority corroboration target.
2026-06-08T03:18:18+02:00	limen-boost-001	FGCA-005	results/boost/limen-boost-001/saturation-review.tsv	sf15	saturation_readiness	not_ready	methods_support_now	row_refreshed_to reflect one governed residual queue row held below seeded use	The saturation narrative now records that sf15 contributes a bounded methods/taxonomy control surface even though it still contributes no seeded evidence denominator.	Do not flatten the governed residual queue row into seeded evidence, prevalence, legality, or novelty-completeness rhetoric.
