query	path	line	snippet_hash	snippet
prompt injection	/srv/tyche/projects/limen-ai-edge-case-atlas/sources/source-family-ledger.tsv	12	sha256:b1e2c76b375e2c2d88ce7800d5ad92e16b610665db83807291c709c06cfc813f	sf11 Security research and advisories P1 Variable authority; strongest when tied to CERTs, established labs, coordinated disclosure, or peer-reviewed work Public blogs, conference papers, CERT notes, vendor advisories, coordinated-disclosure pages Preserve bou
prompt injection	/srv/tyche/projects/limen-ai-edge-case-atlas/results/source-map/source-family-coverage-map-v0.1.tsv	12	sha256:1ff9934a8291d395aa048146c06d420c1d80177921a56ae19a2e1a73e055e2e2	2026-06-07T06:28:33Z sf11 Security research and advisories P1 seeded grounded_now 3 Variable authority Mostly English with some multilingual advisories Global Continuous Prompt injection, exfiltration, model inversion, unsafe agent tooling, red-team findings, 
prompt injection	/srv/tyche/projects/limen-ai-edge-case-atlas/results/clusters/duplicate-clusters-v0.1.tsv	14	sha256:edb73e95c19012cd4c6410917755cb38a35d36c2e4383838a5df9fa12793a591	REVIEW-NOMERGE-CODEEXEC-001 reviewed_not_duplicate shared_concrete_failure_mode data/cases/security-agentic-candidates.jsonl:LIMEN-000001;data/cases/security-agentic-candidates.jsonl:LIMEN-000006 LIMEN-S-006;LIMEN-S-032 Auto-GPT and LangChain LLMMathChain unsa
prompt injection	/srv/tyche/projects/limen-ai-edge-case-atlas/results/clusters/duplicate-clusters-v0.1.tsv	15	sha256:cce0c958e1cb8ef7ec8549ed654ae7cc11744b8ec0a0bc8762c96a441f9acfc5	REVIEW-NOMERGE-CODEEXEC-002 reviewed_not_duplicate shared_concrete_failure_mode data/cases/security-agentic-candidates.jsonl:LIMEN-000006;data/cases/security-agentic-candidates.jsonl:LIMEN-000007 LIMEN-S-032;LIMEN-S-036 LangChain LLMMathChain and LlamaIndex sa
prompt injection	/srv/tyche/pallas/pallas-ai-agent-observatory/config/release_boundary.yml	57	sha256:6b744ecacf63577ca165cad3a242c37acbf008afd497501f7c3020dff53c0783	- "\\bprompt injection\\b"
prompt injection	/srv/tyche/pallas/pallas-ai-agent-observatory/config/release_boundary_preprint.yml	60	sha256:6b744ecacf63577ca165cad3a242c37acbf008afd497501f7c3020dff53c0783	- "\\bprompt injection\\b"
prompt injection	/srv/tyche/pallas/pallas-ai-agent-observatory/tests/test_release_scan.py	20	sha256:4cf20aafdf46080ab2afe3af4cac751c56c9e4c6fcc29f6ddf8b84ef5da0c69c	security_sensitive_patterns=[r"\bprompt injection\b"],
prompt injection	/srv/tyche/pallas/pallas-ai-agent-observatory/tests/test_release_scan.py	42	sha256:4cf20aafdf46080ab2afe3af4cac751c56c9e4c6fcc29f6ddf8b84ef5da0c69c	security_sensitive_patterns=[r"\bprompt injection\b"],
prompt injection	/srv/tyche/pallas/pallas-ai-agent-observatory/tests/test_release_scan.py	47	sha256:860601babb531dab40cbc28464c86715d998ae35e6d0c9a388e78b8c11916a5c	"System X is non-compliant and vulnerable to prompt injection.\n",
prompt injection	/srv/tyche/projects/limen-ai-edge-case-atlas/results/security/security-agentic-watch-v0.1.tsv	4	sha256:4b273f79378800e0b4829d5aa43ab7faab3f38f5164a9f400cb9ff729d43e9fc	LIMEN-000003 CVE-2025-55284 authoritative T3_authoritative_source Claude Code default allowlist enabled unauthorized file read and network exfiltration before forced update LIMEN-S-008 https://raw.githubusercontent.com/CVEProject/cvelistV5/main/cves/2025/55xxx
prompt injection	/srv/tyche/projects/limen-ai-edge-case-atlas/results/security/security-agentic-watch-v0.1.tsv	6	sha256:54fe926d0aa63ab0c413ab7314df0a677a0d00d483eb51799639a9fd51c2389c	LIMEN-000005 CVE-2026-2286 authoritative T3_authoritative_source CrewAI RAG search tools enabled server-side request forgery and internal/cloud content acquisition LIMEN-S-010 https://raw.githubusercontent.com/CVEProject/cvelistV5/main/cves/2026/2xxx/CVE-2026-
prompt injection	/srv/tyche/projects/limen-ai-edge-case-atlas/results/security/security-agentic-watch-v0.1.tsv	7	sha256:67986a4af7f1372278a75d7d3e58394b7cf8568d1c24141ec415603874eb3992	LIMEN-000006 CVE-2023-29374 authoritative T3_authoritative_source LangChain LLMMathChain allowed prompt injection into Python exec, creating arbitrary code execution risk LIMEN-S-032 https://raw.githubusercontent.com/CVEProject/cvelistV5/main/cves/2023/29xxx/C
prompt injection	/srv/tyche/projects/limen-ai-edge-case-atlas/results/security/security-agentic-watch-v0.1.tsv	8	sha256:ac9ff7d2c4f44eb53818b40467c55d07ec1e9dfd5f3fd93789ca0ed0e01246e3	LIMEN-000007 CVE-2024-3271 authoritative T3_authoritative_source LlamaIndex safe_eval command injection enabled LLM-generated code to execute OS commands on the host LIMEN-S-036 https://raw.githubusercontent.com/CVEProject/cvelistV5/main/cves/2024/3xxx/CVE-202
prompt injection	/srv/tyche/projects/limen-ai-edge-case-atlas/results/security/security-agentic-watch-v0.1.tsv	9	sha256:5a0e3ac28579264c20611e8bd6cc4edc35643f9b1b45a4818e8f8379c6f9c619	LIMEN-000008 CVE-2026-44843 authoritative T3_authoritative_source LangChain broad load() allowlists enabled attacker-controlled object revival, chat-history poisoning, and possible credential or request side effects LIMEN-S-041 https://raw.githubusercontent.co
prompt injection	/srv/tyche/projects/limen-ai-edge-case-atlas/data/cases/security-agentic-candidates.jsonl	3	sha256:bbe80ab1964c62fe17faac8fef2cea35bb2207269b60c062ea8e3ff55aa05066	{"case_id": "LIMEN-000003", "cve_id": "CVE-2025-55284", "title": "Claude Code default allowlist enabled unauthorized file read and network exfiltration before forced update", "summary": "Public CVE text states that Claude Code prior to version 1.0.4 could be i
prompt injection	/srv/tyche/projects/limen-ai-edge-case-atlas/data/cases/security-agentic-candidates.jsonl	5	sha256:fd731baa4470a515060c16c489bb28704ac5bce491c90114039f3b649794cfb7	{"case_id": "LIMEN-000005", "cve_id": "CVE-2026-2286", "title": "CrewAI RAG search tools enabled server-side request forgery and internal/cloud content acquisition", "summary": "Public CVE text states that CrewAI RAG search tools did not properly validate runt
prompt injection	/srv/tyche/projects/limen-ai-edge-case-atlas/data/cases/security-agentic-candidates.jsonl	6	sha256:1586caeda939cad4dae584987a7076728641507ccd808ae5f74fddbdb1031cdf	{"case_id": "LIMEN-000006", "cve_id": "CVE-2023-29374", "title": "LangChain LLMMathChain allowed prompt injection into Python exec, creating arbitrary code execution risk", "summary": "Public CVE text states that LangChain through 0.0.131 allowed prompt inject
prompt injection	/srv/tyche/projects/limen-ai-edge-case-atlas/data/cases/security-agentic-candidates.jsonl	7	sha256:76dbeccbb79586ffb3f179f0fa337bfcf1f0ad17acdf2250d21d050b4c926810	{"case_id": "LIMEN-000007", "cve_id": "CVE-2024-3271", "title": "LlamaIndex safe_eval command injection enabled LLM-generated code to execute OS commands on the host", "summary": "A command injection vulnerability exists in the run-llama/llama_index repository
prompt injection	/srv/tyche/projects/limen-ai-edge-case-atlas/data/cases/security-agentic-candidates.jsonl	8	sha256:27918c36c4bd254e0c24a18bcbe658b81136be6db4ec8c151bb3497076d3ee52	{"case_id": "LIMEN-000008", "cve_id": "CVE-2026-44843", "title": "LangChain broad load() allowlists enabled attacker-controlled object revival, chat-history poisoning, and possible credential or request side effects", "summary": "Public CVE and vendor advisory
prompt injection	/srv/tyche/gaia/tyche-research-vault/papers/trust-field-bundle/paper-b-fm-argus-audit-2026-05-26.md	26	sha256:678d40f2b612bcc7744cb460cdba0a5ff919be46568c1a445770e74a80b6e0ff	rg -n -i "you are an ai|system prompt|developer message|assistant|ignore previous|act as|jailbreak|prompt injection" \
prompt injection	/srv/tyche/projects/limen-ai-edge-case-atlas/results/boost/limen-boost-002/cset-posture-pilot.tsv	5	sha256:957cbda83cf2ffe1f35394f3c346a37d725a06a1dc3ec8894292a03b94683d38	LIMEN-002-CPP-004 security_agentic_candidates LIMEN-000006 LangChain LLMMathChain allowed prompt injection into Python exec, creating arbitrary code execution risk public_cve_record security_risk; agentic_control_failure cybersecurity harm; privacy or data pro
prompt injection	/srv/tyche/projects/limen-ai-edge-case-atlas/results/boost/limen-boost-004/security-reviewer-matrix.tsv	7	sha256:ceec5480a21142468b011329fdfd68f3f5e67fb7075f86a03756193674f03a7c	LIMEN-000006 CVE-2023-29374 LangChain authoritative T3_authoritative_source technique_only_or_negative no_direct_report_found_in_local_avid_repo no_direct_case_study_match_found independent_lab_plus_primary_cve_no_direct_vendor_bulletin no_direct_vendor_securi
prompt injection	/srv/tyche/projects/limen-ai-edge-case-atlas/results/boost/limen-security-agentic-watch/cycle-2026-06-07T03-39-08Z.md	30	sha256:e571ed6a6c482fb0610ddba3b837cf83406238632ea47a28d52e4825686cc9d0	Added `LIMEN-000006` for LangChain `CVE-2023-29374`. The shared package now records that public CVE text describes prompt injection against `LLMMathChain` leading to arbitrary code execution via Python `exec`, while a public Snyk advisory adds an independent-l
prompt injection	/srv/tyche/projects/limen-ai-edge-case-atlas/results/boost/limen-dashboard-paper-forge/duplicate-review-graph.tsv	14	sha256:bc45fdc012d909e641596c35875be6287e85f3c3452b755a1d0c5be6a77b9f81	REVIEW-NOMERGE-CODEEXEC-001::edge1 security-agentic-candidates.jsonl:LIMEN-000001 security-agentic-candidates.jsonl:LIMEN-000006 reviewed_not_duplicate shared_concrete_failure_mode Auto-GPT and LangChain LLMMathChain unsafe execution of model-supplied Python /
prompt injection	/srv/tyche/projects/limen-ai-edge-case-atlas/results/boost/limen-dashboard-paper-forge/duplicate-review-graph.tsv	16	sha256:06c59bdc44ca38202d6fddc44b85e98248bc3cc567806a3a1844e933d822e737	REVIEW-NOMERGE-CODEEXEC-002::edge1 security-agentic-candidates.jsonl:LIMEN-000006 security-agentic-candidates.jsonl:LIMEN-000007 reviewed_not_duplicate shared_concrete_failure_mode LangChain LLMMathChain and LlamaIndex safe_eval LLM-generated or model-mediated
prompt injection	/srv/tyche/projects/limen-ai-edge-case-atlas/results/boost/limen-boost-011/source-authority-balance.tsv	12	sha256:d7595fd60bc91943e22ca095804b6ed49a400834b90aebdadc996bb3a3ff464b	REVIEW-NOMERGE-CODEEXEC-001 data/cases/security-agentic-candidates.jsonl:LIMEN-000006 LangChain LLMMathChain allowed prompt injection into Python exec, creating arbitrary code execution risk security_public_cve_or_advisory technical_authority_or_curated_public
prompt injection	/srv/tyche/projects/limen-ai-edge-case-atlas/results/boost/limen-boost-011/normalized-join-key-ledger.tsv	14	sha256:989901a9dfa37bad0a940e6d4f74e915426a00eed8f95faa9a0352164ba9d615	data/cases/security-agentic-candidates.jsonl:LIMEN-000006 data/cases/security-agentic-candidates.jsonl 6 case_id LIMEN-000006 LangChain LLMMathChain allowed prompt injection into Python exec, creating arbitrary code execution risk authoritative T3_authoritativ
prompt injection	/srv/tyche/projects/limen-ai-edge-case-atlas/results/boost/limen-boost-011/publication-safe-aggregate-matrix.tsv	12	sha256:312a69af496ca76a3cf1ef1f601d6d733727f2580ec599e8059c84047419762b	REVIEW-NOMERGE-CODEEXEC-001 data/cases/security-agentic-candidates.jsonl:LIMEN-000006 LangChain LLMMathChain allowed prompt injection into Python exec, creating arbitrary code execution risk Global English T3_authoritative_source high not_flagged not_translati
prompt injection	/srv/tyche/gaia/tyche-research-vault/release/gaia-preprint-freeze-20260605T0815EEST/site/gaia-agent-atlas/public/downloads/gaia-agent-atlas-facts-v0.1.csv	372	sha256:6901b8779436929766d975eee599d4aac1b700f73dd62f76e716fad8c6a08876	Global,servicenow-ai-control-tower-inventory-mcp-identity-logs-20260602,service-now-ai-agents,ServiceNow AI Agents / AI Control Tower,trust_artifact,"ServiceNow AI Control Tower page says it can discover and inventory AI agents, models, identities, and MCP ser
prompt injection	/srv/tyche/gaia/tyche-research-vault/release/gaia-preprint-freeze-20260605T0815EEST/site/gaia-agent-atlas/public/downloads/gaia-agent-atlas-facts-v0.1.csv	446	sha256:6c3d1f97e004615387d1b793c7e8104cafbadc7274f04f044287414257f21c2d	Global,cycle146-openai-chatgpt-agent-prompt-injection-real-world-action-risk-20260603,openai-chatgpt-agent,ChatGPT agent,risk_mapping,"OpenAI frames prompt injection as a higher-impact risk for ChatGPT agent because the agent can encounter malicious web instru
prompt injection	/srv/tyche/pallas/pallas-ai-agent-observatory/program/10-pallas-gaia-bridge/data/pallas_gaia_case_source_pack.csv	111	sha256:904d08099bbd00a7089cf40200e9e0610e5f9138fbe22557e92fc656e5299b2d	PG-020,openai-chatgpt-agent,ChatGPT / ChatGPT Agent,3,gaia_fact,official_provider,4,Introducing ChatGPT agent: bridging research and action,,,https://openai.com/index/introducing-chatgpt-agent/,"OpenAI frames prompt injection as a higher-impact risk for ChatGP
prompt injection	/srv/tyche/gaia/tyche-research-vault/release/gaia-preprint-freeze-20260605T0815EEST/site/gaia-agent-atlas/public/downloads/gaia-agent-atlas-source-documents-v0.1.csv	137	sha256:de6d55e26770a39df3b21c91a474d7697171afea152cfa3fcf824c6900aabae7	Global,anthropic-computer-use-sandbox-and-confirmation-20260602,Computer use tool - Claude API Docs,en,en,en,Computer use tool - Claude API Docs,Computer use tool - Claude API Docs,False,none_needed,,not_required,"Candidate public evidence only; not a legal co
prompt injection	/srv/tyche/gaia/tyche-research-vault/release/gaia-preprint-freeze-20260605T0815EEST/site/gaia-agent-atlas/public/downloads/gaia-agent-atlas-source-documents-v0.1.csv	328	sha256:d72f36c9b8da4bb12f70968daf9850a3246a53a7e82bc105b8aa34bdd0137063	Global,cycle146-openai-chatgpt-agent-launch-jina-20260603,Introducing ChatGPT agent: bridging research and action,en,en,en,Introducing ChatGPT agent: bridging research and action,Introducing ChatGPT agent: bridging research and action,False,none_needed,,not_re
prompt injection	/srv/tyche/gaia/tyche-research-vault/release/gaia-preprint-freeze-20260605T0815EEST/site/gaia-agent-atlas/public/data/facts.json	8734	sha256:c79a429d91b4bf097ed580ca74019ba0ed017a7e889ffeb30595d8df00157f16	"claim": "ServiceNow AI Control Tower page says it can discover and inventory AI agents, models, identities, and MCP servers; track identity, access, and exposure; block prompt injections; and monitor agent performance with metrics and log traces.",
prompt injection	/srv/tyche/gaia/tyche-research-vault/release/gaia-preprint-freeze-20260605T0815EEST/site/gaia-agent-atlas/public/data/facts.json	10398	sha256:a8d2948efeab4a2fb84e94a096b52c9409990e113b557b5eb164eda66bf56d14	"claim": "OpenAI frames prompt injection as a higher-impact risk for ChatGPT agent because the agent can encounter malicious web instructions while taking direct actions, potentially affecting connector data or logged-in websites.",
prompt injection	/srv/tyche/gaia/tyche-research-vault/release/gaia-preprint-freeze-20260605T0815EEST/data/global-agent-atlas-v0.1/backups-cycle-313-active-lanes-88-fiji-frcs-tax-customs-chatbot/facts.jsonl	414	sha256:7db435ee5fcae7029d9d9b495d7a335403b96392f69cf7f7920fab92090ad679	{"agent_id": "service-now-ai-agents", "claim": "ServiceNow AI Control Tower page says it can discover and inventory AI agents, models, identities, and MCP servers; track identity, access, and exposure; block prompt injections; and monitor agent performance wit
prompt injection	/srv/tyche/gaia/tyche-research-vault/release/gaia-preprint-freeze-20260605T0815EEST/data/global-agent-atlas-v0.1/backups-cycle-313-active-lanes-88-fiji-frcs-tax-customs-chatbot/facts.jsonl	795	sha256:f3c50b779db33307a16c8f01bc68383f0f2292f2d538c10d9d8cca5535794776	{"agent_id": "openai-chatgpt-agent", "claim": "OpenAI frames prompt injection as a higher-impact risk for ChatGPT agent because the agent can encounter malicious web instructions while taking direct actions, potentially affecting connector data or logged-in we
prompt injection	/srv/tyche/gaia/tyche-research-vault/release/gaia-preprint-freeze-20260605T0815EEST/data/global-agent-atlas-v0.1/backups-cycle-295-active-lanes-40-barbados-chest-pain-ai-health-pilot/facts.jsonl	414	sha256:7db435ee5fcae7029d9d9b495d7a335403b96392f69cf7f7920fab92090ad679	{"agent_id": "service-now-ai-agents", "claim": "ServiceNow AI Control Tower page says it can discover and inventory AI agents, models, identities, and MCP servers; track identity, access, and exposure; block prompt injections; and monitor agent performance wit
prompt injection	/srv/tyche/gaia/tyche-research-vault/release/gaia-preprint-freeze-20260605T0815EEST/data/global-agent-atlas-v0.1/backups-cycle-295-active-lanes-40-barbados-chest-pain-ai-health-pilot/facts.jsonl	795	sha256:f3c50b779db33307a16c8f01bc68383f0f2292f2d538c10d9d8cca5535794776	{"agent_id": "openai-chatgpt-agent", "claim": "OpenAI frames prompt injection as a higher-impact risk for ChatGPT agent because the agent can encounter malicious web instructions while taking direct actions, potentially affecting connector data or logged-in we
prompt injection	/srv/tyche/gaia/tyche-research-vault/release/gaia-preprint-freeze-20260605T0815EEST/data/global-agent-atlas-v0.1/backups-cycle-111-20260603T051321/facts.jsonl	414	sha256:7db435ee5fcae7029d9d9b495d7a335403b96392f69cf7f7920fab92090ad679	{"agent_id": "service-now-ai-agents", "claim": "ServiceNow AI Control Tower page says it can discover and inventory AI agents, models, identities, and MCP servers; track identity, access, and exposure; block prompt injections; and monitor agent performance wit
prompt injection	/srv/tyche/gaia/tyche-research-vault/release/gaia-preprint-freeze-20260605T0815EEST/data/global-agent-atlas-v0.1/backups-cycle-111-20260603T051321/source_documents.jsonl	82	sha256:e6e33344489991b355751ede79f61eacee72b3c905467dcfda5ec5cf6d9ca5a2	{"agent_ids": ["anthropic-claude"], "archive_status": "local_snapshot_saved", "author_or_org": "Anthropic", "collision_guard_targets": ["world_agent_atlas", "agentic_supply_chain_atlas", "nekropolis", "future_paper"], "content_hash": "ccb8941e685d86f3224bd31fc
prompt injection	/srv/tyche/gaia/tyche-research-vault/release/gaia-preprint-freeze-20260605T0815EEST/data/global-agent-atlas-v0.1/backups-cycle-111-20260603T051321/source_documents.jsonl	84	sha256:2969a3506683475bf68fecc869f787123f34e6c0e19da3dbe7f99295411db1fd	{"agent_ids": ["anthropic-claude", "anthropic-claude-computer-use-tool"], "archive_status": "local_snapshot", "author_or_org": "Anthropic", "collision_guard_targets": ["world_agent_atlas", "agentic_supply_chain_atlas", "brokered_trust", "future_paper"], "conte
prompt injection	/srv/tyche/gaia/tyche-research-vault/release/gaia-preprint-freeze-20260605T0815EEST/data/global-agent-atlas-v0.1/backups-cycle-111-20260603T051321/source_documents.jsonl	138	sha256:040f0f2b6616123a2b150f0d0163663c5c6725470733316e95d03bce4803ce91	{"agent_ids": ["stripe-agent-toolkit-mcp"], "archive_status": "not_archived_hash_recorded", "author_or_org": "Stripe", "collision_guard_targets": ["world_agent_atlas", "agentic_supply_chain_atlas", "brokered_trust", "future_paper"], "content_hash": "ee420df4cb
prompt injection	/srv/tyche/gaia/tyche-research-vault/release/gaia-preprint-freeze-20260605T0815EEST/data/global-agent-atlas-v0.1/backups-cycle-111-20260603T051321/source_documents.jsonl	498	sha256:25a81185594c3879f2a7be11590ff39183539930de874b5967d1de7ee03b387b	{"agent_ids": ["service-now-ai-agents"], "archive_status": "local_snapshot_saved; retrieval_method=reader-api:jina", "author_or_org": "ServiceNow", "collision_guard_targets": ["world_agent_atlas", "agentic_supply_chain_atlas", "future_paper"], "content_hash": 
prompt injection	/srv/tyche/gaia/tyche-research-vault/release/gaia-preprint-freeze-20260605T0815EEST/data/global-agent-atlas-v0.1/facts.jsonl.bak-cycle221	414	sha256:7db435ee5fcae7029d9d9b495d7a335403b96392f69cf7f7920fab92090ad679	{"agent_id": "service-now-ai-agents", "claim": "ServiceNow AI Control Tower page says it can discover and inventory AI agents, models, identities, and MCP servers; track identity, access, and exposure; block prompt injections; and monitor agent performance wit
prompt injection	/srv/tyche/gaia/tyche-research-vault/release/gaia-preprint-freeze-20260605T0815EEST/data/global-agent-atlas-v0.1/facts.jsonl.bak-cycle221	795	sha256:f3c50b779db33307a16c8f01bc68383f0f2292f2d538c10d9d8cca5535794776	{"agent_id": "openai-chatgpt-agent", "claim": "OpenAI frames prompt injection as a higher-impact risk for ChatGPT agent because the agent can encounter malicious web instructions while taking direct actions, potentially affecting connector data or logged-in we
prompt injection	/srv/tyche/gaia/tyche-research-vault/release/gaia-preprint-freeze-20260605T0815EEST/data/global-agent-atlas-v0.1/facts.jsonl.bak-cycle237-20260604-kaanta-ai-nigeria-tax-assistant	414	sha256:7db435ee5fcae7029d9d9b495d7a335403b96392f69cf7f7920fab92090ad679	{"agent_id": "service-now-ai-agents", "claim": "ServiceNow AI Control Tower page says it can discover and inventory AI agents, models, identities, and MCP servers; track identity, access, and exposure; block prompt injections; and monitor agent performance wit
prompt injection	/srv/tyche/gaia/tyche-research-vault/release/gaia-preprint-freeze-20260605T0815EEST/data/global-agent-atlas-v0.1/facts.jsonl.bak-cycle237-20260604-kaanta-ai-nigeria-tax-assistant	795	sha256:f3c50b779db33307a16c8f01bc68383f0f2292f2d538c10d9d8cca5535794776	{"agent_id": "openai-chatgpt-agent", "claim": "OpenAI frames prompt injection as a higher-impact risk for ChatGPT agent because the agent can encounter malicious web instructions while taking direct actions, potentially affecting connector data or logged-in we
prompt injection	/srv/tyche/gaia/tyche-research-vault/release/gaia-preprint-freeze-20260605T0815EEST/data/global-agent-atlas-v0.1/backups-cycle-284-active-lanes-40-github-copilot-cloud-agent-supply-chain/facts.jsonl	414	sha256:7db435ee5fcae7029d9d9b495d7a335403b96392f69cf7f7920fab92090ad679	{"agent_id": "service-now-ai-agents", "claim": "ServiceNow AI Control Tower page says it can discover and inventory AI agents, models, identities, and MCP servers; track identity, access, and exposure; block prompt injections; and monitor agent performance wit
prompt injection	/srv/tyche/gaia/tyche-research-vault/release/gaia-preprint-freeze-20260605T0815EEST/data/global-agent-atlas-v0.1/backups-cycle-284-active-lanes-40-github-copilot-cloud-agent-supply-chain/facts.jsonl	795	sha256:f3c50b779db33307a16c8f01bc68383f0f2292f2d538c10d9d8cca5535794776	{"agent_id": "openai-chatgpt-agent", "claim": "OpenAI frames prompt injection as a higher-impact risk for ChatGPT agent because the agent can encounter malicious web instructions while taking direct actions, potentially affecting connector data or logged-in we
prompt injection	/srv/tyche/gaia/tyche-research-vault/release/gaia-preprint-freeze-20260605T0815EEST/data/global-agent-atlas-v0.1/backups-cycle-304-active-lanes-44-sau-gosi-amin-agentic-risk-hardening/facts.jsonl	414	sha256:7db435ee5fcae7029d9d9b495d7a335403b96392f69cf7f7920fab92090ad679	{"agent_id": "service-now-ai-agents", "claim": "ServiceNow AI Control Tower page says it can discover and inventory AI agents, models, identities, and MCP servers; track identity, access, and exposure; block prompt injections; and monitor agent performance wit
prompt injection	/srv/tyche/gaia/tyche-research-vault/release/gaia-preprint-freeze-20260605T0815EEST/data/global-agent-atlas-v0.1/backups-cycle-304-active-lanes-44-sau-gosi-amin-agentic-risk-hardening/facts.jsonl	795	sha256:f3c50b779db33307a16c8f01bc68383f0f2292f2d538c10d9d8cca5535794776	{"agent_id": "openai-chatgpt-agent", "claim": "OpenAI frames prompt injection as a higher-impact risk for ChatGPT agent because the agent can encounter malicious web instructions while taking direct actions, potentially affecting connector data or logged-in we
prompt injection	/srv/tyche/gaia/tyche-research-vault/release/gaia-preprint-freeze-20260605T0815EEST/data/global-agent-atlas-v0.1/backups-cycle-121-20260603T0419/facts.jsonl	414	sha256:7db435ee5fcae7029d9d9b495d7a335403b96392f69cf7f7920fab92090ad679	{"agent_id": "service-now-ai-agents", "claim": "ServiceNow AI Control Tower page says it can discover and inventory AI agents, models, identities, and MCP servers; track identity, access, and exposure; block prompt injections; and monitor agent performance wit
prompt injection	/srv/tyche/gaia/tyche-research-vault/release/gaia-preprint-freeze-20260605T0815EEST/data/global-agent-atlas-v0.1/backups-cycle-121-20260603T0419/source_documents.jsonl	85	sha256:e6e33344489991b355751ede79f61eacee72b3c905467dcfda5ec5cf6d9ca5a2	{"agent_ids": ["anthropic-claude"], "archive_status": "local_snapshot_saved", "author_or_org": "Anthropic", "collision_guard_targets": ["world_agent_atlas", "agentic_supply_chain_atlas", "nekropolis", "future_paper"], "content_hash": "ccb8941e685d86f3224bd31fc
prompt injection	/srv/tyche/gaia/tyche-research-vault/release/gaia-preprint-freeze-20260605T0815EEST/data/global-agent-atlas-v0.1/backups-cycle-121-20260603T0419/source_documents.jsonl	87	sha256:2969a3506683475bf68fecc869f787123f34e6c0e19da3dbe7f99295411db1fd	{"agent_ids": ["anthropic-claude", "anthropic-claude-computer-use-tool"], "archive_status": "local_snapshot", "author_or_org": "Anthropic", "collision_guard_targets": ["world_agent_atlas", "agentic_supply_chain_atlas", "brokered_trust", "future_paper"], "conte
prompt injection	/srv/tyche/gaia/tyche-research-vault/release/gaia-preprint-freeze-20260605T0815EEST/data/global-agent-atlas-v0.1/backups-cycle-121-20260603T0419/source_documents.jsonl	141	sha256:040f0f2b6616123a2b150f0d0163663c5c6725470733316e95d03bce4803ce91	{"agent_ids": ["stripe-agent-toolkit-mcp"], "archive_status": "not_archived_hash_recorded", "author_or_org": "Stripe", "collision_guard_targets": ["world_agent_atlas", "agentic_supply_chain_atlas", "brokered_trust", "future_paper"], "content_hash": "ee420df4cb
