as_of_utc	lift_id	case_id	route_posture	readiness_band	manuscript_lift_type	manuscript_safe_clause	anchor_source	anchor_quote_or_support	shared_claim_binding	caption_control_binding	paper_thesis_use	visualization_hook	forbidden_overread	next_smallest_publishability_move
2026-06-07T15:24:55Z	AALK-003-001	LIMEN-000001	regulator_order_text	ready	ready_anchor_clause	The order imposes a provisional limitation on the processing. The order states that no privacy notice was provided to users/data subjects, that there was no suitable legal basis for training-related processing, that outputs could be inaccurate, and that no age-verification mechanism was present.	SRC-AUTH-0001	la misura della limitazione provvisoria del trattamento || non viene fornita alcuna informativa agli utenti ... l’assenza di idonea base giuridica ... il trattamento di dati personali ... risulta inesatto ... l’assenza di qualsivoglia verifica dell’età degli utenti	claims.md:LIMEN-C-011; results/authoritative-scout/authoritative-claim-support-register-v0.1.tsv:LIMEN-C-011	CCR-009; CCR-011	Compact quote-safe clause for manuscript, thesis, reviewer response, and table-caption drafting where shard-003 needs exact document-text support.	authority_anchor_panel; privacy_enforcement_table; jurisdiction_language_map; privacy_enforcement_table; legal_basis_issue_matrix; minors_governance_note	Keep Italian original alongside any paraphrase; do not overread provisional measure as a final illegality finding.	Add selective human-reviewed Italian anchor extraction for article-ready claim-support rows.
2026-06-07T15:24:55Z	AALK-003-002	LIMEN-000002	agency_summary_escalation_only	blocked_no_claim_support	blocker_clause	Agency summaries support filing-to-settlement/decree progression and the EDNY civil action number, but the package still lacks open court-facing complaint, decree, docket-entry, or judicial-order text.	SRC-AUTH-0002; SRC-AUTH-0005; results/boost/limen-boost-003/public-record-chain-matrix.tsv	No direct quote-safe court text is currently available in the local package; this row remains the court-depth blocker.	claims.md:LIMEN-C-010; results/authoritative-scout/authoritative-claim-support-register-v0.1.tsv:LIMEN-C-010	CCR-009; CCR-011	Methods/results limitation sentence for Table 1A / Figure 8 and reviewer-safe explanation of why authoritative support remains heterogeneous.	court-gap badge; blocker board; authority-depth funnel	Do not rewrite agency allegations or agency-reported settlement terms as judicial findings or document-grade court text.	Capture one open complaint, decree, docket entry, or judicial order from a court-facing or clearly labeled open-mirror source.
2026-06-07T15:24:55Z	AALK-003-003	LIMEN-000003	regulator_notice_pdf	ready	ready_anchor_clause	The notice states that Serco used biometric systems, including facial recognition, for employee attendance monitoring across 38 facilities. The notice ties the enforcement action to Articles 5(1)(a), 6, and 9 UK GDPR and orders Serco to stop biometric attendance processing and destroy data not legally required to be retained.	SRC-AUTH-0008	Serco processes biometric data for the purpose of monitoring employee attendance. Facial recognition technology (FRT) is in use at all 38 Relevant Facilities. || This Notice is in relation to contraventions of Articles 5(1)(a), 6 and 9 of the UK GDPR. ... Cease all processing of biometric data for the purpose of employment attendance checks ... Destroy all biometric data and all other personal and special category data that Serco is not legally obliged to retain.	claims.md:LIMEN-C-009; results/authoritative-scout/authoritative-claim-support-register-v0.1.tsv:LIMEN-C-012	CCR-009; CCR-011	Compact quote-safe clause for manuscript, thesis, reviewer response, and table-caption drafting where shard-003 needs exact document-text support.	biometric_governance_table; remedy_type_matrix; authority_anchor_panel; remedy_type_matrix; biometric_governance_table; legal_basis_issue_matrix	Keep the claim tied to the notice and avoid converting one case into a broader sector-prevalence statement.	Extract a small set of publication-useful notice anchors and remedy clauses.
2026-06-07T15:24:55Z	AALK-003-004	LIMEN-000004	regulator_reprimand_pdf	ready_with_context_caution	ready_anchor_clause	The reprimand states that a DPIA should have been completed before processing and that the school introduced facial recognition in March 2023. The reprimand states that the controller relied on assumed opt-out consent from March to November 2023 and that such consent would not have been valid or lawful.	SRC-AUTH-0009	Article 35(1) of the UK GDPR ... prior to the processing, carry out an assessment ... Chelmer Valley High School introduced facial recognition technology in March 2023. || from March to November 2023 the controller had been relying on assumed consent ... consent on an opt-out basis would not have been valid or lawful	claims.md:LIMEN-C-009; results/authoritative-scout/authoritative-claim-support-register-v0.1.tsv:LIMEN-C-013	CCR-009; CCR-011	Compact quote-safe clause for manuscript, thesis, reviewer response, and table-caption drafting where shard-003 needs exact document-text support.	minors_public_interest_table; biometric_governance_panel; authority_anchor_panel; minors_public_interest_table; consent_failure_matrix; authority_anchor_panel	Keep schoolchild context metadata-first and avoid unnecessary factual expansion.	Extract a compact anchor set while preserving student-context caution.
2026-06-07T15:24:55Z	AALK-003-005	LIMEN-000005	charging_stage_plus_captured_pdf	partially_ready	partial_anchor_clause	The DOJ summary plus the captured indictment PDF support accusation-stage wording and document-presence methods claims, but exact caption metadata remains partially unread.	SRC-AUTH-0010; SRC-AUTH-0011; results/authoritative-scout/document-normalization-matrix-v0.1.tsv	The DOJ summary supports accusation-stage wording; local OCR verified the court, district, and party-caption structure, but only partial case-number text is readable.	claims.md:LIMEN-C-006; results/authoritative-scout/authoritative-claim-support-register-v0.1.tsv:LIMEN-C-016	CCR-009; CCR-011	Charge-stage caution sentence for Table 1A, Figure 8, and AI-washing posture ladders that need document presence without false caption precision.	normalization-status badge; charging-vs-settled panel; blocker board	Do not treat the matter as adjudicated fact and do not invent unread docket metadata from the current PDF image.	Use a materially different OCR stack or another exact-caption public source before promoting case-number metadata.
2026-06-07T15:24:55Z	AALK-003-006	LIMEN-000006	settled_regulator_administrative_order	ready	ready_anchor_clause	The order states that Delphia claimed to use AI/ML on client spending and social-media data for investment advice when no such data was being used in the investment process. The order requires Delphia to pay a $225,000 civil money penalty.	SRC-AUTH-0013	From at least August 2019 to August 2023, Delphia represented that it used artificial intelligence and machine learning to analyze its retail clients’ spending and social media data to inform its investment advice when, in fact, no such data was being used in its investment process. || Delphia shall, within 10 days of entry of this Order, pay a civil money penalty of $225,000 to the Securities and Exchange Commission	claims.md:LIMEN-C-005; results/authoritative-scout/authoritative-claim-support-register-v0.1.tsv:LIMEN-C-014	CCR-009; CCR-011	Compact quote-safe clause for manuscript, thesis, reviewer response, and table-caption drafting where shard-003 needs exact document-text support.	sanctions_matrix; settled_ai_washing_table; authority_anchor_panel; settled_ai_washing_table; sanctions_matrix; authority_anchor_panel	Keep settlement-order posture explicit; do not present the order as independent judicial fact-finding.	Add selective order anchors for the most publication-useful misstatement and remedy passages.
2026-06-07T15:24:55Z	AALK-003-007	LIMEN-000007	settled_regulator_administrative_order	ready	ready_anchor_clause	The order states that Global Predictions made false and misleading claims about its AI use, its claimed status as the first regulated AI financial advisor, and the services it offered. The order requires Global Predictions to pay a $175,000 civil money penalty.	SRC-AUTH-0015	making false and misleading claims about its use of artificial intelligence (“AI”), its status as the “first regulated AI financial advisor,” and the services that it offered || Respondent shall pay a civil money penalty in the amount of $175,000 to the Commission	claims.md:LIMEN-C-005; results/authoritative-scout/authoritative-claim-support-register-v0.1.tsv:LIMEN-C-015	CCR-009; CCR-011	Compact quote-safe clause for manuscript, thesis, reviewer response, and table-caption drafting where shard-003 needs exact document-text support.	sanctions_matrix; settled_ai_washing_table; authority_anchor_panel; settled_ai_washing_table; authority_anchor_panel; sanctions_matrix	Keep the settlement-order posture explicit and avoid generalizing beyond the named respondent.	Add selective order anchors for the most publication-useful marketing-claim passages.
2026-06-07T15:24:55Z	AALK-003-008	LIMEN-000008	fcc_enforcement_lifecycle_with_document_text	ready	ready_anchor_clause	The FCC order states that Lingo Telecom entered into a Consent Decree to resolve the investigation, agreed to implement a robust compliance plan, and agreed to pay a $1,000,000 civil penalty in connection with STIR/SHAKEN attestation violations tied to spoofed robocalls.	SRC-AUTH-0017; LIMEN-S-046; LIMEN-S-047	The FCC order states that Lingo Telecom entered into a Consent Decree to resolve the investigation, agreed to implement a robust compliance plan, and agreed to pay a $1,000,000 civil penalty in connection with STIR/SHAKEN attestation violations tied to spoofed robocalls.	claims.md:LIMEN-C-004B; results/authoritative-scout/authoritative-claim-support-register-v0.1.tsv:LIMEN-C-017	CCR-009; CCR-011	Compact quote-safe clause for manuscript, thesis, reviewer response, and table-caption drafting where shard-003 needs exact document-text support.	authority_anchor_panel; synthetic_identity_enforcement_table; telecom_authentication_lifecycle	Do not overread one FCC enforcement lifecycle into broad election-deepfake prevalence or final judicial findings.	Extract a compact anchor set that keeps the May apparent-liability stage distinct from the August consent-decree resolution stage.
2026-06-07T15:24:55Z	AALK-003-009	LIMEN-000009	official_project_page_with_translation_caution	ready_with_translation_caution	bounded_follow_through_clause	The official Slovenian police page supports narrow project-existence, pilot-language, biometric/privacy, and geography-diversification wording only.	LIMEN-S-043; results/authoritative-scout/authoritative-case-publication-routing-matrix-v0.1.tsv	Official police surface supports project purpose and pilot framing, but not legality, procurement proof, production deployment, or effectiveness.	claims.md:LIMEN-C-010	CCR-011	Figure 8 geography-diversification sidecar and limitations-aware non-U.S./non-UK follow-through sentence.	geography-diversification badge; language/jurisdiction caution panel	Do not present a project page as enforcement, adjudication, procurement proof, or external validation.	If more depth is needed, target one genuinely different partner or project-document surface; otherwise reuse this as the bounded geography-diversification exemplar.
