as_of_utc	lane_id	matrix_id	route_family	current_state_now	why_it_matters	why_it_is_not_threshold_closing_now	what_would_change_package	what_to_do_now	what_not_to_repeat	paper_thesis_use	visualization_dashboard_hook	evidence_refs
2026-06-07T20:17:15Z	limen-boost-021	HHFANRM-021-001	same_case_official_and_open_court_routes_for_Nate	DOJ charging-stage anchor remains live; SDNY calendar / open-discovery checks remain negative or blocked on this host	This is still the most direct same-case route to retire or rewrite the hidden-human final-authority queue without changing case identity.	The live official surface still stops at charging stage, and the tested open court/discovery surfaces still do not expose plea, judgment, sentencing, settlement, or comparable final-authority text.	One genuinely different public court-facing or later-official Saniger document with disposition-grade text.	Keep Nate/Saniger follow-through as the highest-value route, but reopen only when a materially different public source family or exact case-linked document appears.	Do not rerun the same DOJ landing page, CourtListener 403 query, SDNY weekly calendar keyword check, or blocked Justice/SDNY discovery shapes as if they were new evidence.	Methods/limitations note explaining why the only hidden-human row remains accusation-stage despite repeated open-route testing.	Shard-009 route-exhaustion panel; sf08 blocker-vs-threshold card.	results/boost/limen-boost-021/saniger-final-authority-open-route-audit.tsv:SFAORA-021-001..SFAORA-021-SUMMARY; results/boost/limen-boost-045/hidden-human-final-authority-frontier.tsv:HHFAF-045-001
2026-06-07T20:17:15Z	limen-boost-021	HHFANRM-021-002	DOJ_linked_indictment_pdf_processing_path	Official charging document is already captured locally, but the PDF remains extraction-limited and still serves processing-boundary more than later-authority support	This path matters for reproducibility and exact caption normalization, but not for finding later disposition posture by itself.	An image-only or OCR-limited charging document cannot upgrade accusation-stage posture into final authority.	Either materially better caption/metadata extraction that clarifies case-normalization fields, or a different later-stage public court/officer document.	Keep the captured indictment as a processing-limit explanation and a court-family artifact-presence proof.	Do not treat another OCR retry on the same charging document as a substitute for later-authority follow-through.	Reproducibility note on document-processing ceilings in public court-family material.	Court-document processing barrier facet attached to the shard-009 queue row.	results/authoritative-scout/nate-indictment-pdf-structure-audit-v0.1.tsv; results/authoritative-scout/ocr-readiness-matrix-v0.1.tsv:LIMEN-000005
2026-06-07T20:17:15Z	limen-boost-021	HHFANRM-021-003	DoNotPay_regulator_final_nonfinance_sidecar	Bounded official non-finance FTC sidecar already exists and is safe for diversification prose	DoNotPay proves that shard 009 now has one official non-finance regulator-final exemplar outside settled SEC finance.	It does not involve hidden humans standing behind claimed AI operation in a way that closes the Nate queue, and current package rules keep it denominator-neutral by default.	Only an explicit synchronized editorial denominator decision changes its default table role; it still would not retire the hidden-human queue.	Use DoNotPay as the current official non-finance sidecar-first answer to breadth objections.	Do not mistake DoNotPay sidecar promotion for hidden-human closure, unauthorized-practice adjudication, or cross-sector prevalence proof.	Reviewer-response and manuscript note separating diversification progress from hidden-human final-authority scarcity.	Table 1C diversification sidecar badge; official non-finance panel.	claims.md:LIMEN-C-015; results/boost/limen-boost-009/table1c-denominator-decision-board.tsv:DDB-009-002..DDB-009-003; results/authoritative-scout/nonfinance-official-promotion-scenarios-v0.1.tsv:AUTHSCEN-002
2026-06-07T20:17:15Z	limen-boost-021	HHFANRM-021-004	Workado_detector_governance_nonfinance_branch	Bounded FTC complaint/final-order row exists, but only for detector-governance / false-capability branching	This route widens non-finance official breadth in a subtype-distinct way that may help appendix or overlay work.	It is narrower and more overread-prone than DoNotPay for default shard-009 reuse, and it still does not answer the hidden-human final-authority question.	A deliberate appendix/overlay branch decision after DoNotPay stabilization.	Keep Workado as an overlay/appendix branch rather than a default shard-009 fix.	Do not reopen Workado as if equal FTC posture made it interchangeable with DoNotPay or with a hidden-human final-authority case.	Appendix methods note on subtype separation inside official non-finance shard-009 materials.	Detector-governance overlay / side-branch legend.	results/boost/limen-boost-021/table1c-surface-role-matrix.tsv:TSRM-021-003..TSRM-021-006; results/authoritative-scout/nonfinance-official-promotion-scenarios-v0.1.tsv:AUTHSCEN-003
2026-06-08T00:43:36Z	limen-boost-021	HHFANRM-021-005	FTC_post-disposition_rows_Rytr_and_AirAI	Two additional FTC families are real public candidate matters with late disposition documents now captured on host, but neither changes the hidden-human final-authority ceiling.	These rows still matter because they are tempting places to overstate official breadth once more FTC paper exists, even though the safe roles diverge sharply.	Rytr is now chronology-resolved reversibility/negative-result material after the later set-aside order; Air AI is now a bounded noncore settlement-sidecar branch after the stipulated order; neither is safe as current hidden-human-closing shard-009 support.	A true public final-authority hidden-human document, or a deliberate synchronized editorial decision to consume Air AI as a noncore settlement sidecar on a downstream shared surface.	Keep Rytr as chronology/limitations material and treat Air AI only as an optional bounded settlement-sidecar branch; do not reopen generic document-read backlog work for either row.	Do not convert FTC row volume, settlement posture, or set-aside chronology into a promoted hidden-human exemplar or silent default-denominator change.	Methods/limitations note on why extra FTC disposition depth changes branch roles without closing the main queue.	FTC route-state QA panel with reversibility badge and settlement-sidecar badge.	results/boost/limen-boost-033/ftc-late-disposition-route-shift.tsv:FLDRS-033-001..FLDRS-033-003; results/authoritative-scout/ftc-late-disposition-resolution-board-v0.1.tsv; data/cases/authoritative-candidates.jsonl:LIMEN-000013..LIMEN-000014
2026-06-07T20:17:15Z	limen-boost-021	HHFANRM-021-006	same_shape_settled_SEC_finance_accumulation	Already-strong settled finance cluster remains open to additional same-shape rows, but this is low-yield for current reviewer objections	This route can only thicken an already settled finance pocket and may help sector-concentration discussion marginally.	It does not diversify non-finance support, does not upgrade Nate beyond accusation stage, and does not retire the explicit queue row.	A new same-shape finance row changes density only, not the main shard-009 ceiling.	Deprioritize this route behind hidden-human closure and behind already-grounded non-finance sidecar governance.	Do not spend another shard-009 cycle on more finance-only accumulation while the substantive hidden-human gap remains open.	Methods note explaining route priority and why more settled finance is not the same as package maturation.	Low-yield route badge in the shard-009 threshold board.	results/boost/limen-boost-045/hidden-human-final-authority-frontier.tsv:HHFAF-045-005; claims.md:LIMEN-C-005
2026-06-07T20:17:15Z	limen-boost-021	HHFANRM-021-007	genuinely_new_hidden_human_final_authority_case	No bounded new-case final-authority hidden-human exemplar is yet present in the live shard-009 package	This is the only substantive alternative to same-case Nate follow-through that would change the same package ceiling.	Current sidecars diversify official non-finance AI-claim support but still do not provide final-authority hidden-human closure.	One public regulator order, judgment, consent decree, official settlement, or similarly final authority text with exact hidden-human-behind-AI or faux-automation language in a distinct case.	Pursue only if a genuinely different public final-authority source appears, and keep the route separate from generic FTC or SEC breadth work.	Do not reopen generic low-yield scouting permutations that lack clear final-authority posture or exact hidden-human language.	Route-priority note for thesis future-work and reviewer explanation of why diversification and closure are separate scientific moves.	Queue-retirement alternative branch; new-case threshold trigger panel.	results/boost/limen-boost-045/hidden-human-final-authority-frontier.tsv:HHFAF-045-002; results/boost/limen-boost-009/table1c-denominator-decision-board.tsv:DDB-009-004
2026-06-07T20:17:15Z	limen-boost-021	HHFANRM-021-SUMMARY	shard009_nonrepeat_route_governance	The current package now has one compact route-family board separating same-case follow-through, processing ceilings, non-finance sidecars, held FTC rows, same-shape low-yield finance routes, and the only true new-case closure path	This matters because future shard-009 work can now distinguish threshold-changing routes from presentation-only, backlog-only, or already-exhausted route families without rereading a long artifact chain.	The matrix governs route choice only; it does not itself add a final-authority hidden-human exemplar or change any denominator.	A real later-authority hidden-human document or a deliberate synchronized denominator decision.	Use this matrix as the front door before any new shard-009 retrieval or manuscript/dashboard/thesis reuse decision.	Do not count packaging-only churn or repeated blocked/no-hit discovery as substantive shard-009 progress.	Reviewer-safe route-governance appendix, thesis claim-support map, and dashboard-side threshold legend.	Shard-009 route-family frontier matrix linked to Table 1C / LIMEN-VIS-009 and sf08 blocker notes.	results/boost/limen-boost-021/saniger-final-authority-open-route-audit.tsv; results/boost/limen-boost-057/ftc-hold-resolution-matrix.tsv; results/authoritative-scout/nonfinance-official-promotion-scenarios-v0.1.tsv; results/boost/limen-boost-045/hidden-human-final-authority-frontier.tsv
