row_id	signal_id	promotion_gate	promotion_priority	source_surface_class	source_review_role	shards	queries	source_path	source_line	title_or_snippet	source_review_reason	claim_ceiling	required_hardening_step	forbidden_overread
SRPH-01261	LIMEN-SIGNAL-ED09223D09B5146A	needs_named_url_extraction	P3	regulator_or_public_authority	named_official_or_sectoral_surface	public-sector	algorithm register	/srv/tyche/pallas/pallas-ai-agent-observatory/reports/PALLAS_SECOND_PASS_CANDIDATE_MATRIX_DELTA.csv	1740	"12,US,United States,I05,,2,M,2,H,,true,,""OMB eGov 2024 Federal Agency AI Use Case Inventory replaces weak portal evidence and raises confidence, but scope is federal agency AI use cases rather than a comprehensive national algorithm registe"	local row names a concrete official/sectoral inventory, sandbox, testbed, or transparency surface for bounded source review	source-surface posture only; scope may be sectoral/federal/reactive, not comprehensive	Extract a named public URL before any case hardening.	Do not treat source-surface review as reviewed-core promotion, incident truth, legality, compliance, safety, deployment proof, prevalence, or ranking.
SRPH-01319	LIMEN-SIGNAL-26EF867382AC288F	needs_named_url_extraction	P3	regulator_or_public_authority	direct_source_surface	public-sector	algorithm register	/srv/tyche/pallas/pallas-ai-agent-observatory/reports/PALLAS_SECOND_PASS_REVIEW_QUEUE.csv	1566	"16,BE,Belgium,I05,,1,M,2,M,,true,,""BOSA/AI4Belgium observatory states that a cartography inventories AI projects in the Belgian public sector and is regularly updated. This is partial transparency/inventory evidence, not a full national alg"	Local metadata names a concrete institutional source surface suitable for bounded source-surface review.	May claim only that the local row names a reviewable direct source surface; no incident truth or prevalence claim.	Extract a named public URL before any case hardening.	Do not treat source-surface review as reviewed-core promotion, incident truth, legality, compliance, safety, deployment proof, prevalence, or ranking.
SRPH-01320	LIMEN-SIGNAL-5F9AE2279FE5EABA	needs_named_url_extraction	P3	regulator_or_public_authority	named_review_surface	public-sector	algorithm register	/srv/tyche/pallas/pallas-ai-agent-observatory/reports/PALLAS_SECOND_PASS_CONFIDENCE_CHANGES.csv	908	"13,SJ,Svalbard and Jan Mayen,I05,,1,M,1,H,,true,,""No score uplift but confidence improves: Digdir's AI overview is an official public-sector AI transparency layer, yet Digdir describes it as outreach-based and voluntary, not exhaustive; no"	Second-pass row names a concrete official surface/mechanism sufficient for bounded surface review.	Source-surface existence only; no incident, prevalence, legality, compliance, safety, deployment, or ranking claim.	Extract a named public URL before any case hardening.	Do not treat source-surface review as reviewed-core promotion, incident truth, legality, compliance, safety, deployment proof, prevalence, or ranking.
SRPH-01321	LIMEN-SIGNAL-62C249795BF8A36B	needs_named_url_extraction	P3	regulator_or_public_authority	named_review_surface	public-sector	algorithm register	/srv/tyche/pallas/pallas-ai-agent-observatory/reports/PALLAS_SECOND_PASS_CONFIDENCE_CHANGES.csv	979	"15,KZ,Kazakhstan,I05,,0,L,1,M,,true,,""2026 rule requires sectoral state bodies to form and publish lists of trusted high-risk AI systems. This is a transparency/listing mechanism, but not a general public algorithm register and actual publi"	Second-pass row names a concrete official surface/mechanism sufficient for bounded surface review.	Source-surface existence only; no incident, prevalence, legality, compliance, safety, deployment, or ranking claim.	Extract a named public URL before any case hardening.	Do not treat source-surface review as reviewed-core promotion, incident truth, legality, compliance, safety, deployment proof, prevalence, or ranking.
SRPH-01322	LIMEN-SIGNAL-6BA43C3A01CDE88F	needs_named_url_extraction	P3	regulator_or_public_authority	named_official_surface	public-sector	algorithm register	/srv/tyche/pallas/pallas-ai-agent-observatory/reports/PALLAS_SECOND_PASS_REVIEW_QUEUE.csv	1441	14,NO,Norway,I05,,2,H,2,H,,true,,Digdir AI-use overview is strong transparency evidence but explicitly described as based on outreach and voluntary participation; data.norge endpoint should not be overclaimed as a mandatory algorithm regist	Derived review row names a concrete official/institutional source surface sufficient for bounded source-surface review.	source-surface existence/posture only; no operational, legal, or prevalence claim	Extract a named public URL before any case hardening.	Do not treat source-surface review as reviewed-core promotion, incident truth, legality, compliance, safety, deployment proof, prevalence, or ranking.
SRPH-01323	LIMEN-SIGNAL-A2F8175BB820843C	needs_named_url_extraction	P3	regulator_or_public_authority	named_institutional_surface	public-sector	algorithm register	/srv/tyche/pallas/pallas-ai-agent-observatory/reports/PALLAS_SECOND_PASS_CANDIDATE_MATRIX_DELTA.csv	2270	"16,BE,Belgium,I05,,1,M,2,M,,true,,""BOSA/AI4Belgium observatory states that a cartography inventories AI projects in the Belgian public sector and is regularly updated. This is partial transparency/inventory evidence, not a full national alg"	Second-pass local row names a concrete institutional source surface, but claims are limited to surface existence.	source-surface existence only; no maturity, adequacy, compliance, or coverage claim	Extract a named public URL before any case hardening.	Do not treat source-surface review as reviewed-core promotion, incident truth, legality, compliance, safety, deployment proof, prevalence, or ranking.
SRPH-01324	LIMEN-SIGNAL-B57257F061B0238E	needs_named_url_extraction	P3	regulator_or_public_authority	named_institutional_surface	public-sector	algorithm register	/srv/tyche/pallas/pallas-ai-agent-observatory/reports/PALLAS_SECOND_PASS_CANDIDATE_MATRIX_DELTA.csv	2180	"15,PE,Peru,I05,,1,L,1,M,,true,,""Confidence hardening only. 2026 PCM catalog of AI applications in the Peruvian State is stronger transparency evidence than generic open-data news, but it is not clearly a formal public algorithm register wit"	Second-pass local row names a concrete institutional source surface, but claims are limited to surface existence.	source-surface existence only; no maturity, adequacy, compliance, or coverage claim	Extract a named public URL before any case hardening.	Do not treat source-surface review as reviewed-core promotion, incident truth, legality, compliance, safety, deployment proof, prevalence, or ranking.
SRPH-01325	LIMEN-SIGNAL-C6E91F94CF27EBF9	needs_named_url_extraction	P3	regulator_or_public_authority	official_database	public-sector	algorithm register	/srv/tyche/pallas/pallas-ai-agent-observatory/reports/PALLAS_SECOND_PASS_REVIEW_QUEUE.csv	1273	"13,CH,Switzerland,I05,,1,M,2,M,,true,,""New official March 2026 Federal Administration AI project database materially improves transparency evidence. Candidate increase is limited because it is a project inventory, not clearly a statutory pu"	Snippet names an official Federal Administration AI project database; review only source posture.	source-surface existence/posture only; no incident truth, legality, compliance, safety, deployment, prevalence, or ranking claim	Extract a named public URL before any case hardening.	Do not treat source-surface review as reviewed-core promotion, incident truth, legality, compliance, safety, deployment proof, prevalence, or ranking.
SRPH-01326	LIMEN-SIGNAL-C715F61029552DBA	needs_named_url_extraction	P3	regulator_or_public_authority	official strategy and sandbox pages	public-sector	algorithm register	/srv/tyche/pallas/pallas-ai-agent-observatory/reports/PALLAS_SECOND_PASS_COUNTRY_REVIEW_LOAD.csv	32	"3,ZM,Zambia,Africa expansion A,10,3,7,8,1.1,16,Medium: candidate score increase review,""I01: Official National AI Strategy 2025-2027 and launch page materially improve source strength and show implementa; I03: BoZ regulatory sandbox page/gu"	local review row names official Zambia AI strategy and BoZ sandbox pages	surface existence only; no maturity or effectiveness inference	Extract a named public URL before any case hardening.	Do not treat source-surface review as reviewed-core promotion, incident truth, legality, compliance, safety, deployment proof, prevalence, or ranking.
SRPH-01327	LIMEN-SIGNAL-CAE72D537A52D086	needs_named_url_extraction	P3	regulator_or_public_authority	official policy page	public-sector	automated decision	/srv/tyche/projects/public-ai-registry/results/boost/public-ai-registry-boost-012/source-role-vocabulary-v0.2.csv	8	"CA-DADM-2025,Canada Directive on Automated Decision-Making,Canada,Canada,English,policy_comparator,""policy/directive comparator, not active register disclosure"",policy_page,retrieved_substantive,preliminary_unresolved,no,0,CA-DADM-2025,poli"	Canada Directive on Automated Decision-Making is a named official policy surface.	surface existence only; no legality, safety, prevalence, or compliance inference	Extract a named public URL before any case hardening.	Do not treat source-surface review as reviewed-core promotion, incident truth, legality, compliance, safety, deployment proof, prevalence, or ranking.
SRPH-01328	LIMEN-SIGNAL-CBBED70384559077	needs_named_url_extraction	P3	regulator_or_public_authority	official guideline text extract	public-sector	automated decision	/srv/tyche/atlas/tyche-thesis-atlas-factory/inbox/official/aesia/text/07-data-and-data-governance-guideline.txt	3035	Monitoring is a well-known process in many industries that leverage automated decision-	Local AESIA official-text extract exposes a concrete official guidance surface.	Names a bounded direct source surface only; no substantive claim.	Extract a named public URL before any case hardening.	Do not treat source-surface review as reviewed-core promotion, incident truth, legality, compliance, safety, deployment proof, prevalence, or ranking.
SRPH-01329	LIMEN-SIGNAL-CE3F53A8D659BA5F	needs_named_url_extraction	P3	policy_or_guidance_surface	official_named_surface	legal-research	research integrity	/srv/tyche/gaia/tyche-research-vault/policies/ai-coauthorship-disclosure-v0.1.md	30	| **UKRIO (UK Research Integrity Office)** | Guidance issued 2023; disclosure required; institutions encouraged to develop local policies. | UKRIO 2023 |	Names concrete UKRIO guidance as a direct institutional source surface.	must resolve direct public source before promotion	Extract a named public URL before any case hardening.	Do not treat source-surface review as reviewed-core promotion, incident truth, legality, compliance, safety, deployment proof, prevalence, or ranking.
SRPH-01330	LIMEN-SIGNAL-FCD3A173B06188C7	needs_named_url_extraction	P3	regulator_or_public_authority	direct_source_surface	public-sector	algorithm register	/srv/tyche/pallas/pallas-ai-agent-observatory/reports/PALLAS_READINESS_WORLD_WEAK_SOURCE_WARNINGS.md	310	- I05: Plataforma de Algoritmos Públicos is valuable transparency evidence, but first pass did not confirm it as a statutory, comprehensive, mandatory government algorithm register.	Names a concrete reviewable source surface: Plataforma de Algoritmos Públicos.	source-surface existence only	Extract a named public URL before any case hardening.	Do not treat source-surface review as reviewed-core promotion, incident truth, legality, compliance, safety, deployment proof, prevalence, or ranking.
SRPH-01499	LIMEN-SIGNAL-0D226065942FB775	needs_named_url_extraction	P3	regulator_or_public_authority	official_gazette_or_statute	public-sector	AI procurement	/srv/tyche/pallas/pallas-ai-agent-observatory/reports/PALLAS_SECOND_PASS_SPRINT_14_COUNTRY_SCORE_DELTA.csv	59	GR,I08,2,M,2,H,Official Gazette Article 7 strengthens AI procurement/contractor-obligation evidence. It supports score 2 but does not by itself demonstrate mature AI procurement assurance/audit workflows sufficient for score 3.,true,gr-sour	Row names a concrete Official Gazette article as the procurement evidence surface.	must resolve direct public source before promotion	Extract a named public URL before any case hardening.	Do not treat source-surface review as reviewed-core promotion, incident truth, legality, compliance, safety, deployment proof, prevalence, or ranking.
SRPH-01500	LIMEN-SIGNAL-2AC747FE59F8B96F	needs_named_url_extraction	P3	regulator_or_public_authority	paired_direct_surfaces	public-sector	algorithm register	/srv/tyche/projects/public-ai-procurement-gap/results/boost/public-ai-procurement-gap-boost-004/article-a-table-direct-row-packet-v0.1.csv	3	"article-a-t1-02,T1-02,Netherlands,Netherlands,TenderNed + Dutch Algorithm Register,""Official procurement route and bounded public resource probe recorded; project-local portal provenance records CC-0 dataset metadata, while the live `size=1"	Local row names concrete official source surfaces: TenderNed and the Dutch Algorithm Register.	surface existence/posture only	Extract a named public URL before any case hardening.	Do not treat source-surface review as reviewed-core promotion, incident truth, legality, compliance, safety, deployment proof, prevalence, or ranking.
SRPH-01501	LIMEN-SIGNAL-2C950F0E426742C2	needs_named_url_extraction	P3	regulator_or_public_authority	named_direct_source_surface	public-sector	algorithm register	/srv/tyche/projects/public-ai-procurement-gap/sources/source-ledger-v0.1.md	33	| src-008 | Dutch Algorithm Register | algorithm register | official | Netherlands | 200 HTML; `/api` root 404 | structured routes need capture | primary register source | api_route_documentation_needed; license_review_needed |	Local source ledger names Dutch Algorithm Register as an official primary register surface.	source-surface existence only	Extract a named public URL before any case hardening.	Do not treat source-surface review as reviewed-core promotion, incident truth, legality, compliance, safety, deployment proof, prevalence, or ranking.
SRPH-01502	LIMEN-SIGNAL-31F65B7B99FDCF18	needs_named_url_extraction	P3	regulator_or_public_authority	official_source_surface	public-sector	algorithm register	/srv/tyche/projects/public-ai-procurement-gap/sources/source-ledger-v0.1.md	50	| src-022 | Algorithmes de la Ville de Paris | algorithm register | official | France/Paris | 2026-06-08 bounded checks: official data.gouv dataset API returned 200 JSON with `access_type=open`, `license=odc-odbl`, certified `Ville de Paris	source ledger verifies Paris municipal algorithm register as a concrete official surface	source-surface existence only; no legality/compliance/prevalence inference	Extract a named public URL before any case hardening.	Do not treat source-surface review as reviewed-core promotion, incident truth, legality, compliance, safety, deployment proof, prevalence, or ranking.
SRPH-01503	LIMEN-SIGNAL-60A180395ED0A17F	needs_named_url_extraction	P3	regulator_or_public_authority	named_direct_surface	public-sector	algorithm register	/srv/tyche/pallas/pallas-ai-agent-observatory/reports/PALLAS_OBSERVABILITY_COUNTRY_INDEX.csv	132	"BW,Botswana,35.0,30.9,D thin visibility,0.61,40.0,26.7,33.3,46.7,33.3,17,11,2,0,high,10,10,High: candidate score decrease review,""I01: Official government news shows AI readiness validation and a National AI Policy in finalisation, but no e"	Names a concrete direct source surface suitable for bounded source review.	source-surface existence only; no incident or compliance inference	Extract a named public URL before any case hardening.	Do not treat source-surface review as reviewed-core promotion, incident truth, legality, compliance, safety, deployment proof, prevalence, or ranking.
SRPH-01504	LIMEN-SIGNAL-681F4412F6C6AD06	needs_named_url_extraction	P3	regulator_or_public_authority	named_official_source_surface	public-sector	algorithm register	/srv/tyche/projects/public-ai-procurement-gap/data/pilot/public-release-codebook-v0.1.csv	347	"data/pilot/register-records-v0.1.csv,source_rights_terms_note,provenance,""Short note on reuse/terms status for the row source, kept conservative and metadata-only."",free text rights/terms caution,No blanks observed in current bounded rows.,"	Local metadata names a concrete government framework/source surface suitable for bounded review.	source posture only	Extract a named public URL before any case hardening.	Do not treat source-surface review as reviewed-core promotion, incident truth, legality, compliance, safety, deployment proof, prevalence, or ranking.
SRPH-01505	LIMEN-SIGNAL-693A74E245481F8B	needs_named_url_extraction	P3	regulator_or_public_authority	institutional guidance	public-sector	automated decision	/srv/tyche/atlas/tyche-thesis-atlas-factory/inbox/official/aesia/text/05-risk-management-guideline.txt	1939	autonomous action systems. Depending on the specific use case, automated decisions	official Spanish AI sandbox risk-management guidance is explicit in local text	bounded existence/relevance of source surface only	Extract a named public URL before any case hardening.	Do not treat source-surface review as reviewed-core promotion, incident truth, legality, compliance, safety, deployment proof, prevalence, or ranking.
SRPH-01506	LIMEN-SIGNAL-7123642FE14D55C4	needs_named_url_extraction	P3	regulator_or_public_authority	concrete_named_source_surface	public-sector	automated decision	/srv/tyche/atlas/tyche-thesis-atlas-factory/inbox/official/aesia/text/05-risk-management-guideline.txt	1415	safeguards relating to Article 22 GDPR on automated decisions will have to be specifically	Local AESIA guideline text is a concrete institutional sandbox guidance surface.	surface existence and posture only; no truth, legality, compliance, prevalence, or ranking inference	Extract a named public URL before any case hardening.	Do not treat source-surface review as reviewed-core promotion, incident truth, legality, compliance, safety, deployment proof, prevalence, or ranking.
SRPH-01507	LIMEN-SIGNAL-9919176F5D93F40F	needs_named_url_extraction	P3	regulator_or_public_authority	named direct source surface	public-sector	AI register	/srv/tyche/projects/public-ai-procurement-gap/sources/source-ledger-v0.1.md	36	| src-028 | City of Helsinki AI Register governance pages and sitemap | algorithm/AI register governance docs | official | Helsinki, Finland | 2026-06-07 bounded checks: English privacy and accessibility pages resolved to stable `/en/` rout	source ledger names Helsinki AI Register governance pages as concrete official surfaces	bounded source-surface existence only	Extract a named public URL before any case hardening.	Do not treat source-surface review as reviewed-core promotion, incident truth, legality, compliance, safety, deployment proof, prevalence, or ranking.
SRPH-01508	LIMEN-SIGNAL-B7C1565D1EFF445E	needs_named_url_extraction	P3	regulator_or_public_authority	municipal_register_dataset	public-sector	algorithm register	/srv/tyche/projects/public-ai-procurement-gap/sources/source-ledger-v0.1.csv	23	"src-022,Algorithmes de la Ville de Paris,algorithm register,official,France/Paris,see notes/source-specific artifacts,see markdown ledger row and sources/sources.md,""2026-06-08 bounded checks: official data.gouv dataset API returned 200 JSO"	Local row names a concrete official Paris algorithm-register dataset with verified municipal routes.	surface existence and title only	Extract a named public URL before any case hardening.	Do not treat source-surface review as reviewed-core promotion, incident truth, legality, compliance, safety, deployment proof, prevalence, or ranking.
SRPH-01509	LIMEN-SIGNAL-B9F205612899DAC9	needs_named_url_extraction	P3	regulator_or_public_authority	direct_source_surface	public-sector	algorithm register	/srv/tyche/atlas/tyche-thesis-atlas-factory/config/hermes-v02-expansion-seeds.json.bak-gaia-gaps-20260604T051859Z	61	"label: ""v0.2 sandboxes, case studies, and algorithm registers"","	Local metadata names a concrete official or institutional source surface suitable for bounded source-surface review.	May claim only that this named source surface exists locally for bounded source-surface review.	Extract a named public URL before any case hardening.	Do not treat source-surface review as reviewed-core promotion, incident truth, legality, compliance, safety, deployment proof, prevalence, or ranking.
SRPH-01510	LIMEN-SIGNAL-D67D0B86ACD981A7	needs_named_url_extraction	P3	regulator_or_public_authority	direct named source surface	public-sector	AI register	/srv/tyche/projects/public-ai-procurement-gap/results/boost/public-ai-procurement-gap-boost-004/article-a-table-source-provenance-matrix-v0.1.json	525	"source_name: ""City of Helsinki AI Register governance pages and sitemap"","	Names a concrete official, legal, registry, procurement, or institutional source surface.	Source-surface existence/posture only.	Extract a named public URL before any case hardening.	Do not treat source-surface review as reviewed-core promotion, incident truth, legality, compliance, safety, deployment proof, prevalence, or ranking.
SRPH-01566	LIMEN-SIGNAL-1747C1D64046B2E4	needs_named_url_extraction	P3	regulator_or_public_authority	official_regulator_guidance	public-sector	AI register	/srv/tyche/projects/public-ai-procurement-gap/journal.md	2036	- Claims verified, rewritten, or dropped: verified that TED's live legal notice still includes explicit notice-reuse language; verified that the Dutch Algorithm Register landing page and official `openapi.json` remain live; verified that th	Row names Traficom’s official AI regulatory sandboxes page as a concrete source surface.	surface existence only; no operational-cohort claim	Extract a named public URL before any case hardening.	Do not treat source-surface review as reviewed-core promotion, incident truth, legality, compliance, safety, deployment proof, prevalence, or ranking.
SRPH-01567	LIMEN-SIGNAL-2E468D06483BF703	needs_named_url_extraction	P3	regulator_or_public_authority	named_direct_source_surface	public-sector	algorithm register	/srv/tyche/pallas/pallas-ai-agent-observatory/reports/PALLAS_OBSERVABILITY_LANE_SOURCE_CANDIDATES.csv	908	batch-07-xk-pn,transparency/evidence,gap evidence / human review,gap interpretation review,NU,Niue,public visibility,Search for Niue algorithm register / AI inventory / AI sandbox,Public web and official sources,N/A,2026,negative-search,No	Local source-candidate row names the Government of Niue official site as a concrete source surface.	source-surface existence only	Extract a named public URL before any case hardening.	Do not treat source-surface review as reviewed-core promotion, incident truth, legality, compliance, safety, deployment proof, prevalence, or ranking.
SRPH-01576	LIMEN-SIGNAL-61E7335B95A52801	needs_named_url_extraction	P3	regulator_or_public_authority	named_direct_surface	public-sector	algorithm register	/srv/tyche/pallas/pallas-ai-agent-observatory/program/01-pallas-atlas/app/data/pallas_atlas_countries.json	5526	"summary: ""Turkey shows operational digital identity, e-government, procurement, cyber, open-data and AI-strategy infrastructure, but first-pass public evidence for AI-specific law, sandboxing, public algorithm registers, procurement assuran"	Names a concrete direct source surface suitable for bounded source review.	source-surface existence only; no incident or compliance inference	Extract a named public URL before any case hardening.	Do not treat source-surface review as reviewed-core promotion, incident truth, legality, compliance, safety, deployment proof, prevalence, or ranking.
