row_id	signal_id	promotion_gate	promotion_priority	source_surface_class	source_review_role	shards	queries	source_path	source_line	title_or_snippet	source_review_reason	claim_ceiling	required_hardening_step	forbidden_overread
SRPH-01142	LIMEN-SIGNAL-7DD86A3AB87CA5CD	needs_named_url_extraction	P3	regulator_or_public_authority	direct_source_surface	public-sector	regulatory sandbox	/srv/tyche/pallas/pallas-ai-agent-observatory/reports/PALLAS_SECOND_PASS_SCORE_CHANGES.csv	299	15,OM,Oman,I03,,1,L,2,M,,true,,CBO public Fintech Regulatory Sandbox page shows live controlled testing regulator monitoring framework/application materials and first cohort closed; sectoral rather than AI-specific,,,,,,,,om-source-hardenin	score-change row names the CBO fintech regulatory sandbox page as a concrete regulator surface	existence/posture only; no truth, legality, compliance, safety, prevalence, or ranking inference	Extract a named public URL before any case hardening.	Do not treat source-surface review as reviewed-core promotion, incident truth, legality, compliance, safety, deployment proof, prevalence, or ranking.
SRPH-01143	LIMEN-SIGNAL-80F87B1866DE0866	needs_named_url_extraction	P3	regulator_or_public_authority	named_official_surface	public-sector	regulatory sandbox	/srv/tyche/pallas/pallas-ai-agent-observatory/reports/PALLAS_SECOND_PASS_REVIEW_QUEUE.csv	1267	"13,AE,United Arab Emirates,I03,,2,M,2,H,,true,,""SCA/CMA FinTech Regulatory Sandbox page is accessible and detailed; CBUAE and UAE regulatory-sandbox leads remain official but some were bot-blocked/timed out. Evidence supports mature sectora"	Derived review row names a concrete official/institutional source surface sufficient for bounded source-surface review.	source-surface existence/posture only; no operational, legal, or prevalence claim	Extract a named public URL before any case hardening.	Do not treat source-surface review as reviewed-core promotion, incident truth, legality, compliance, safety, deployment proof, prevalence, or ranking.
SRPH-01144	LIMEN-SIGNAL-82DAD0859801436D	needs_named_url_extraction	P3	regulator_or_public_authority	source_surface_triage	public-sector	regulatory sandbox	/srv/tyche/pallas/pallas-ai-agent-observatory/reports/PALLAS_SECOND_PASS_CONFIDENCE_CHANGES.csv	1005	"15,TH,Thailand,I03,,1,L,1,M,,true,,""ETDA Digital Service Sandbox is a stronger official sandbox source for electronic transaction services. It is not verified as an AI-specific regulatory sandbox, so no score increase."",,,,,,,,th-source-har"	Second-pass note names a concrete official/regulator source surface for bounded review.	source-surface existence only	Extract a named public URL before any case hardening.	Do not treat source-surface review as reviewed-core promotion, incident truth, legality, compliance, safety, deployment proof, prevalence, or ranking.
SRPH-01145	LIMEN-SIGNAL-84A1B47BE6D29157	needs_named_url_extraction	P3	regulator_or_public_authority	named_official_source_surface	public-sector	regulatory sandbox	/srv/tyche/pallas/pallas-ai-agent-observatory/reports/PALLAS_SECOND_PASS_SCORE_CHANGES.csv	117	"4,NA,Namibia,I03,,1,L,2,M,,,,""NAMFISA has an official regulatory sandbox page describing controlled live testing of innovations under regulator supervision in the non-bank financial sector. Candidate upgrade is for generic/sectoral sandbox"	Local metadata names the NAMFISA regulatory sandbox page, a concrete official regulator surface.	source posture only	Extract a named public URL before any case hardening.	Do not treat source-surface review as reviewed-core promotion, incident truth, legality, compliance, safety, deployment proof, prevalence, or ranking.
SRPH-01146	LIMEN-SIGNAL-85661E413966871B	needs_named_url_extraction	P3	regulator_or_public_authority	named_official_source_surface	public-sector	regulatory sandbox	/srv/tyche/pallas/pallas-ai-agent-observatory/reports/PALLAS_SECOND_PASS_CONFIDENCE_CHANGES.csv	116	"2,RW,Rwanda,I03,,1,L,2,M,,true,,""Official BNR regulatory sandbox page and Regulation No 41/2022 verify a formal fintech regulatory sandbox with live testing safeguards. It is sectoral and not AI-specific, so human review should decide wheth"	Local metadata names the BNR regulatory sandbox page and Regulation No 41/2022, concrete official regulator surfaces.	source posture only	Extract a named public URL before any case hardening.	Do not treat source-surface review as reviewed-core promotion, incident truth, legality, compliance, safety, deployment proof, prevalence, or ranking.
SRPH-01147	LIMEN-SIGNAL-865B2E9B47D21D60	needs_named_url_extraction	P3	regulator_or_public_authority	official_regulatory_sandbox_page	public-sector	regulatory sandbox	/srv/tyche/atlas/tyche-thesis-atlas-factory/source-cache/v0.2/objects/dc/dc55afd30b050ca679015bf6.html	1587	"<div class=""views-row""><div class=""views-field views-field-nid""><span class=""field-content""><div class=""rhn__item""><a href=""/firms/innovation/regulatory-sandbox/eligibility-criteria"">Regulatory Sandbox eligibility criteria</a></div></span><"	Cached eligibility-criteria page is a concrete regulatory sandbox source surface.	bounded source-surface existence/posture only	Extract a named public URL before any case hardening.	Do not treat source-surface review as reviewed-core promotion, incident truth, legality, compliance, safety, deployment proof, prevalence, or ranking.
SRPH-01148	LIMEN-SIGNAL-88449D00148AF846	needs_named_url_extraction	P3	regulator_or_public_authority	local_metadata_only	public-sector	regulatory sandbox	/srv/tyche/pallas/pallas-ai-agent-observatory/reports/PALLAS_SECOND_PASS_CONFIDENCE_CHANGES.csv	146	"3,BW,,I03,,1,L,2,M,,true,,""Bank of Botswana official fintech portal shows a Regulatory Sandbox, application artefact, and sandbox resources/guidelines. This supports sectoral sandbox maturity but remains non-AI-specific and the application"	Names Bank of Botswana official fintech sandbox portal as a concrete regulator surface.	Surface existence/posture only; no truth, legality, safety, compliance, or prevalence inference.	Extract a named public URL before any case hardening.	Do not treat source-surface review as reviewed-core promotion, incident truth, legality, compliance, safety, deployment proof, prevalence, or ranking.
SRPH-01149	LIMEN-SIGNAL-88FCF0475218587D	needs_named_url_extraction	P3	regulator_or_public_authority	official_regulatory_sandbox_pdf	public-sector	regulatory sandbox	/srv/tyche/pallas/pallas-ai-agent-observatory/program/01-pallas-atlas/app/data/pallas_atlas_countries.json	21720	"claim_role: ""regulatory sandbox framework evidence"""	Local context names Central Bank of Sri Lanka FinTech Regulatory Sandbox Framework PDF as an official central bank PDF.	source-surface posture only; no incident truth, legality, compliance, safety, deployment, prevalence, or ranking claim	Extract a named public URL before any case hardening.	Do not treat source-surface review as reviewed-core promotion, incident truth, legality, compliance, safety, deployment proof, prevalence, or ranking.
SRPH-01150	LIMEN-SIGNAL-892073C7EAB81EF9	needs_named_url_extraction	P3	regulator_or_public_authority	local_metadata_only	public-sector	regulatory sandbox	/srv/tyche/pallas/pallas-ai-agent-observatory/reports/PALLAS_SECOND_PASS_REVIEW_QUEUE.csv	626	7,WS,Samoa,I03,,1,L,2,M,,TRUE,,CBS public Regulatory Sandbox Framework evidence and a 2026 approved digital-payment test are stronger than indirect ITU source; sector sandbox is not AI-specific.,,,,ws-source-hardening,score_increase	Names CBS public Regulatory Sandbox Framework as a concrete official sandbox surface.	Surface existence/posture only; no truth, legality, safety, compliance, or prevalence inference.	Extract a named public URL before any case hardening.	Do not treat source-surface review as reviewed-core promotion, incident truth, legality, compliance, safety, deployment proof, prevalence, or ranking.
SRPH-01151	LIMEN-SIGNAL-8A9E7598D3A68280	needs_named_url_extraction	P3	regulator_or_public_authority	official_regulatory_sandbox_page	public-sector	regulatory sandbox	/srv/tyche/atlas/tyche-thesis-atlas-factory/config/hermes-v02-expansion-seeds.json.bak-gaia-gaps-20260604T051859Z	2590	"title: ""Singapore MAS FinTech Regulatory Sandbox"","	Seed metadata names the MAS regulatory sandbox page with a concrete official title and URL.	Surface exists as a named regulator sandbox page only; no AI-specific operation or eligibility claims beyond the local row.	Extract a named public URL before any case hardening.	Do not treat source-surface review as reviewed-core promotion, incident truth, legality, compliance, safety, deployment proof, prevalence, or ranking.
SRPH-01152	LIMEN-SIGNAL-8B27F631352BEEA0	needs_named_url_extraction	P3	regulator_or_public_authority	source_surface_triage	public-sector	regulatory sandbox	/srv/tyche/pallas/pallas-ai-agent-observatory/reports/PALLAS_SECOND_PASS_CANDIDATE_MATRIX_DELTA.csv	1478	"11,LV,Latvia,I03,,1,L,1,M,,true,,""Fintech Latvia/Latvijas Banka regulatory sandbox is a stronger official sectoral sandbox source than generic innovation-hub evidence; however it is financial-services-specific, not a confirmed AI Act sandbo"	Second-pass note names a concrete official/regulator source surface for bounded review.	source-surface existence only	Extract a named public URL before any case hardening.	Do not treat source-surface review as reviewed-core promotion, incident truth, legality, compliance, safety, deployment proof, prevalence, or ranking.
SRPH-01153	LIMEN-SIGNAL-8B55182F06C5CA10	needs_named_url_extraction	P3	regulator_or_public_authority	official_sandbox_framework_page	public-sector	regulatory sandbox	/srv/tyche/atlas/tyche-thesis-atlas-factory/source-cache/v0.2/objects/42/424318a6d2d45b6907910d6e.html	317	"<a href=""/en/regulations-and-tools/sandbox-for-artificial-intelligence/framework-for-the-regulatory-sandbox/"">Framework for the Regulatory Sandbox</a>"	Local cached HTML shows an official sandbox page linking a named regulatory-sandbox framework.	Surface exists as an official sandbox/framework page only; no operation, uptake, or compliance claims.	Extract a named public URL before any case hardening.	Do not treat source-surface review as reviewed-core promotion, incident truth, legality, compliance, safety, deployment proof, prevalence, or ranking.
SRPH-01154	LIMEN-SIGNAL-8C6CFE49637D080D	needs_named_url_extraction	P3	regulator_or_public_authority	official_source_surface	public-sector	automated decision	/srv/tyche/pallas/pallas-ai-agent-observatory/reports/PALLAS_SECOND_PASS_SCORE_CHANGES.csv	241	"8,EC,Ecuador,I10,,1,M,2,M,,true,,""Candidate +1 because SPDP Resolution 2026-0009-R requires risk management, impact assessment, security measures, RAT inclusion of qualifying AI automated decisions, and audits for personal-data AI systems;"	Local artifact names a concrete official, institutional, register, regulator, statute, or dataset surface suitable for bounded source-surface review.	surface existence/reviewability only	Extract a named public URL before any case hardening.	Do not treat source-surface review as reviewed-core promotion, incident truth, legality, compliance, safety, deployment proof, prevalence, or ranking.
SRPH-01155	LIMEN-SIGNAL-9160621676597EBF	needs_named_url_extraction	P3	regulator_or_public_authority	cached_official_sandbox_page	public-sector	regulatory sandbox	/srv/tyche/atlas/tyche-thesis-atlas-factory/source-cache/v0.2/objects/dc/dc55afd30b050ca679015bf6.html	1150	<p>The Sandbox isn’t just for start-ups that may need to be authorised in the future.</p><p>We accept applications from authorised firms seeking to trial new products and services, and technology companies that want to help regulated firms	cached FCA sandbox page exposes a concrete official source surface in local HTML.	source-surface existence only	Extract a named public URL before any case hardening.	Do not treat source-surface review as reviewed-core promotion, incident truth, legality, compliance, safety, deployment proof, prevalence, or ranking.
SRPH-01156	LIMEN-SIGNAL-9586B72753AA9A9A	needs_named_url_extraction	P3	regulator_or_public_authority	named official / regulator source surface	public-sector	regulatory sandbox	/srv/tyche/atlas/tyche-thesis-atlas-factory/corpus/v0.2-working/data/seeds/hermes-v02-expansion-seeds.json	3096	"why: ""Canonical financial regulatory sandbox model useful for comparison to AI Act sandbox design."""	Local metadata names a concrete official source surface with enough detail for bounded source-surface review.	source-surface existence only	Extract a named public URL before any case hardening.	Do not treat source-surface review as reviewed-core promotion, incident truth, legality, compliance, safety, deployment proof, prevalence, or ranking.
SRPH-01157	LIMEN-SIGNAL-98466680C2D869DE	needs_named_url_extraction	P3	regulator_or_public_authority	direct_official_source_surface	public-sector	regulatory sandbox	/srv/tyche/atlas/tyche-thesis-atlas-factory/source-cache/v0.2/objects/dc/dc55afd30b050ca679015bf6.html	1227	<h2>Regulatory Sandbox tests</h2><p>Firms will have a dedicated case manager to provide support in the development and implementation of a test.</p><p>Sandbox tests are expected to have a clear objective and a clear positive impact on consu	Local cache exposes a named official sandbox page suitable for source-surface review.	May claim bounded existence of this official source surface only.	Extract a named public URL before any case hardening.	Do not treat source-surface review as reviewed-core promotion, incident truth, legality, compliance, safety, deployment proof, prevalence, or ranking.
SRPH-01158	LIMEN-SIGNAL-99A07AC1D76E1A16	needs_named_url_extraction	P3	regulator_or_public_authority	direct_source_surface	public-sector	regulatory sandbox	/srv/tyche/atlas/tyche-thesis-atlas-factory/config/hermes-v02-expansion-seeds.json.bak-seedtune-20260604T044720Z	2454	"title: ""Singapore MAS FinTech Regulatory Sandbox"","	local metadata names a concrete direct source surface sufficient for bounded review	existence of named source surface only	Extract a named public URL before any case hardening.	Do not treat source-surface review as reviewed-core promotion, incident truth, legality, compliance, safety, deployment proof, prevalence, or ranking.
SRPH-01159	LIMEN-SIGNAL-9AC6AB5F3F04776F	needs_named_url_extraction	P3	regulator_or_public_authority	official_sandbox_surface	public-sector	regulatory sandbox	/srv/tyche/atlas/tyche-thesis-atlas-factory/source-cache/v0.2/objects/dc/dc55afd30b050ca679015bf6.html	66	"headline: ""Regulatory Sandbox"","	Local cached page identifies FCA Regulatory Sandbox with canonical official FCA URL.	Names a concrete source surface only; no incident, legality, compliance, safety, deployment, prevalence, or ranking inference.	Extract a named public URL before any case hardening.	Do not treat source-surface review as reviewed-core promotion, incident truth, legality, compliance, safety, deployment proof, prevalence, or ranking.
SRPH-01160	LIMEN-SIGNAL-9C98F3F90138C85D	needs_named_url_extraction	P3	regulator_or_public_authority	needs_source_resolution	public-sector	regulatory sandbox	/srv/tyche/atlas/tyche-thesis-atlas-factory/source-cache/v0.2/objects/dc/dc55afd30b050ca679015bf6.html	120	<title>Regulatory Sandbox | FCA</title>	Cached page exposes a concrete official FCA sandbox surface.	source-surface existence only; no truth, legality, safety, compliance, or prevalence claims	Extract a named public URL before any case hardening.	Do not treat source-surface review as reviewed-core promotion, incident truth, legality, compliance, safety, deployment proof, prevalence, or ranking.
SRPH-01161	LIMEN-SIGNAL-9DB30FAECDB8D88A	needs_named_url_extraction	P3	regulator_or_public_authority	direct_official_or_regulator_surface	public-sector	regulatory sandbox	/srv/tyche/pallas/pallas-ai-agent-observatory/program/01-pallas-atlas/app/data/pallas_atlas_countries.json	28863	"claim_role: ""sectoral regulatory sandbox"""	Local atlas context names an official regulator source surface with publisher/title/URL; review only source-surface existence.	May state only that a named official/regulator source surface is locally queued; no incident, compliance, legality, deployment, or prevalence claim.	Extract a named public URL before any case hardening.	Do not treat source-surface review as reviewed-core promotion, incident truth, legality, compliance, safety, deployment proof, prevalence, or ranking.
SRPH-01162	LIMEN-SIGNAL-9E91569848532A3A	needs_named_url_extraction	P3	regulator_or_public_authority	official_regulator_page	public-sector	regulatory sandbox	/srv/tyche/atlas/tyche-thesis-atlas-factory/source-cache/v0.2/objects/dc/dc55afd30b050ca679015bf6.html	1238	<h2>Regulatory Sandbox tools</h2><p>The Regulatory Sandbox gives firms access to regulatory expertise and a set of tools to facilitate testing. The tools your firm will need will depend on the nature of your business and your test.</p>	Local HTML is an FCA Regulatory Sandbox page with concrete regulator-owned surface content.	source-surface existence only	Extract a named public URL before any case hardening.	Do not treat source-surface review as reviewed-core promotion, incident truth, legality, compliance, safety, deployment proof, prevalence, or ranking.
SRPH-01163	LIMEN-SIGNAL-9F9742A4A3559AD1	needs_named_url_extraction	P3	regulator_or_public_authority	official_regulator_page	public-sector	regulatory sandbox	/srv/tyche/pallas/pallas-ai-agent-observatory/reports/PALLAS_SECOND_PASS_SCORE_CHANGES.csv	68	"3,BW,,I03,,1,L,2,M,,true,,""Bank of Botswana official fintech portal shows a Regulatory Sandbox, application artefact, and sandbox resources/guidelines. This supports sectoral sandbox maturity but remains non-AI-specific and the application"	Local metadata already names a Bank of Botswana official sandbox portal with application and guideline surfaces.	source-surface existence only	Extract a named public URL before any case hardening.	Do not treat source-surface review as reviewed-core promotion, incident truth, legality, compliance, safety, deployment proof, prevalence, or ranking.
SRPH-01164	LIMEN-SIGNAL-A22B57AE18D88AE7	needs_named_url_extraction	P3	regulator_or_public_authority	named_institutional_surface	public-sector	regulatory sandbox	/srv/tyche/pallas/pallas-ai-agent-observatory/reports/PALLAS_SECOND_PASS_CANDIDATE_MATRIX_DELTA.csv	1808	13,JE,Jersey,I03,,1,M,1,H,,true,,JFSC Innovation Hub and Digital Economy Framework harden evidence for innovation support and planned expansion of regulatory sandbox opportunities. No formal operational AI sandbox or statutory sandbox progr	Second-pass local row names a concrete institutional source surface, but claims are limited to surface existence.	source-surface existence only; no maturity, adequacy, compliance, or coverage claim	Extract a named public URL before any case hardening.	Do not treat source-surface review as reviewed-core promotion, incident truth, legality, compliance, safety, deployment proof, prevalence, or ranking.
SRPH-01165	LIMEN-SIGNAL-A2E05CC3BE0C50FB	needs_named_url_extraction	P3	regulator_or_public_authority	official_or_institutional_source_surface	public-sector	regulatory sandbox	/srv/tyche/pallas/pallas-ai-agent-observatory/reports/PALLAS_SECOND_PASS_CONFIDENCE_CHANGES.csv	217	"3,TZ,,I03,,1,L,1,M,,TRUE,,""Bank of Tanzania official FinTech Regulatory Sandbox page verifies a sectoral controlled test-and-learn environment. It is financial-sector only, so retain maturity score 1 while raising confidence."",,,tz-source-h"	Row names Bank of Tanzania FinTech Regulatory Sandbox page.	surface-level existence/posture only	Extract a named public URL before any case hardening.	Do not treat source-surface review as reviewed-core promotion, incident truth, legality, compliance, safety, deployment proof, prevalence, or ranking.
SRPH-01166	LIMEN-SIGNAL-A36EBB887D3709E7	needs_named_url_extraction	P3	regulator_or_public_authority	direct_official_or_regulator_surface	public-sector	regulatory sandbox	/srv/tyche/pallas/pallas-ai-agent-observatory/program/01-pallas-atlas/app/data/pallas_atlas_countries.json	34690	"title: ""FinTech Regulatory Sandbox Guideline"","	Local atlas context names an official regulator source surface with publisher/title/URL; review only source-surface existence.	May state only that a named official/regulator source surface is locally queued; no incident, compliance, legality, deployment, or prevalence claim.	Extract a named public URL before any case hardening.	Do not treat source-surface review as reviewed-core promotion, incident truth, legality, compliance, safety, deployment proof, prevalence, or ranking.
SRPH-01167	LIMEN-SIGNAL-AA6AA8DA4F306C0F	needs_named_url_extraction	P3	regulator_or_public_authority	named_direct_source_surface	public-sector	regulatory sandbox	/srv/tyche/pallas/pallas-ai-agent-observatory/reports/PALLAS_SECOND_PASS_SCORE_CHANGES.csv	160	"5,FJ,Fiji,I03,,1,L,2,M,,TRUE,,""Reserve Bank of Fiji has official FinTech Regulatory Sandbox guideline and launch notice with risk-management, consumer-protection, redress, and test-parameter principles; this supports sectoral sandbox maturi"	Reserve Bank of Fiji sandbox guideline/launch notice are named official source surfaces.	must resolve direct public source before promotion	Extract a named public URL before any case hardening.	Do not treat source-surface review as reviewed-core promotion, incident truth, legality, compliance, safety, deployment proof, prevalence, or ranking.
SRPH-01168	LIMEN-SIGNAL-AB0D8270612FD265	needs_named_url_extraction	P3	court_or_tribunal	official_judiciary_surface	legal-research	court AI	/srv/tyche/pallas/pallas-ai-agent-observatory/reports/PALLAS_SECOND_PASS_CANDIDATE_MATRIX_DELTA.csv	736	"6,PW,Palau,I01,,0,L,1,M,,TRUE,,""Official Supreme Court AI-use policy dated 2025-02-25 is direct AI-specific public evidence, but it is sectoral judiciary policy rather than horizontal national AI law or AI Act implementation."",,,,,,,,pw-sou"	Local metadata names an official Supreme Court AI-use policy as a concrete judiciary source surface.	source-surface existence only; no policy inference	Extract a named public URL before any case hardening.	Do not treat source-surface review as reviewed-core promotion, incident truth, legality, compliance, safety, deployment proof, prevalence, or ranking.
SRPH-01169	LIMEN-SIGNAL-AEAAA91598D512A2	needs_named_url_extraction	P3	regulator_or_public_authority	source_surface	public-sector	regulatory sandbox	/srv/tyche/pallas/pallas-ai-agent-observatory/reports/PALLAS_SECOND_PASS_SPRINT_7_COUNTRY_SCORE_DELTA.csv	124	"VU,I03,1,L,2,H,""RBV official National Regulatory Sandbox Guideline verifies a functioning regulatory sandbox framework with application, testing/monitoring, reporting, and exit controls; scope appears fintech/payments, not AI."",TRUE,vu-sour"	Local row names the RBV National Regulatory Sandbox Guideline, a concrete official sandbox surface; scope noted as fintech/payments, not AI-specific.	source-surface existence/posture only	Extract a named public URL before any case hardening.	Do not treat source-surface review as reviewed-core promotion, incident truth, legality, compliance, safety, deployment proof, prevalence, or ranking.
SRPH-01170	LIMEN-SIGNAL-AFB2D8406B596D5E	needs_named_url_extraction	P3	regulator_or_public_authority	named_institutional_surface	public-sector	regulatory sandbox	/srv/tyche/pallas/pallas-ai-agent-observatory/reports/PALLAS_SECOND_PASS_CANDIDATE_MATRIX_DELTA.csv	2168	15,OM,Oman,I03,,1,L,2,M,,true,,CBO public Fintech Regulatory Sandbox page shows live controlled testing regulator monitoring framework/application materials and first cohort closed; sectoral rather than AI-specific,,,,,,,,om-source-hardenin	Second-pass local row names a concrete institutional source surface, but claims are limited to surface existence.	source-surface existence only; no maturity, adequacy, compliance, or coverage claim	Extract a named public URL before any case hardening.	Do not treat source-surface review as reviewed-core promotion, incident truth, legality, compliance, safety, deployment proof, prevalence, or ranking.
SRPH-01171	LIMEN-SIGNAL-AFFE8FA3FE54A6B5	needs_named_url_extraction	P3	regulator_or_public_authority	official_sandbox_page	public-sector	regulatory sandbox	/srv/tyche/atlas/tyche-thesis-atlas-factory/source-cache/v0.2/objects/dc/dc55afd30b050ca679015bf6.html	1588	"<div class=""views-row""><div class=""views-field views-field-nid""><span class=""field-content""><div class=""rhn__item""><a href=""/firms/innovation/regulatory-sandbox/stablecoins-cohort"">Regulatory Sandbox: stablecoins cohort </a></div></span></d"	Named official sandbox page is a concrete direct source surface.	Existence of named source surface only	Extract a named public URL before any case hardening.	Do not treat source-surface review as reviewed-core promotion, incident truth, legality, compliance, safety, deployment proof, prevalence, or ranking.
SRPH-01172	LIMEN-SIGNAL-B4308AABF1AFB0BE	needs_named_url_extraction	P3	regulator_or_public_authority	named_institutional_surface	public-sector	regulatory sandbox	/srv/tyche/pallas/pallas-ai-agent-observatory/reports/PALLAS_SECOND_PASS_REVIEW_QUEUE.csv	1525	"15,TH,Thailand,I03,,1,L,1,M,,true,,""ETDA Digital Service Sandbox is a stronger official sandbox source for electronic transaction services. It is not verified as an AI-specific regulatory sandbox, so no score increase."",,,,th-source-hardeni"	Second-pass local row names a concrete institutional source surface, but claims are limited to surface existence.	source-surface existence only; no maturity, adequacy, compliance, or coverage claim	Extract a named public URL before any case hardening.	Do not treat source-surface review as reviewed-core promotion, incident truth, legality, compliance, safety, deployment proof, prevalence, or ranking.
