as_of_utc	lane_id	closure_row_id	request_artifact	request_locator	expected_output_or_test	implementation_artifact	implementation_locator	outcome	paper_thesis_use	visualization_dashboard_hook	remaining_caution	evidence_basis
2026-06-07T20:12:00Z	limen-boost-059	F57RC-059-001	results/boost/limen-boost-059/figure5-figure7-multistate-export-execution-request.json	111-123	Produce the three named local outputs: contract TSV, sample TSV, acceptance note	results/boost/limen-boost-011/figure5-figure7-multistate-export-contract.tsv; results/boost/limen-boost-011/figure5-figure7-multistate-export-sample.tsv; results/boost/limen-boost-011/figure5-figure7-multistate-export-acceptance.md	whole-file	fulfilled	Shows that the earlier shard-011 request is no longer a speculative handoff; a later lane already materialized the exact local contract bundle.	Implementation-status card for Figure 5 / Figure 7 denominator-stack repair.	Local fulfillment does not mean any shared denominator-bearing surface has already consumed the contract.	results/boost/limen-boost-059/figure5-figure7-multistate-export-execution-request.json; results/boost/limen-boost-011/status.md
2026-06-07T20:12:00Z	limen-boost-059	F57RC-059-002	results/boost/limen-boost-059/figure5-figure7-multistate-export-execution-request.json	125-130	Acceptance tests AT-001..AT-005 stay satisfied: both omitted rows present, no bare-ID join keys, 21/23/25 split preserved, Figure 5 high=15->17, Figure 7=7/7/1/6->8/8/1/6, patch order synchronized	results/boost/limen-boost-011/figure5-figure7-multistate-export-acceptance.md	17-39	fulfilled	Gives a reviewer-safe closure record that the request was implemented against explicit tests rather than by prose drift or count intuition.	Acceptance/pass-fail panel for denominator-control QA.	Still only a local contract/sample validation; public-facing shared figures remain bounded at 21 until downstream consumption.	results/boost/limen-boost-011/figure5-figure7-multistate-export-acceptance.md; results/boost/limen-boost-059/figure5-figure7-sidecar-validator.tsv:SUM-059-005
2026-06-07T20:12:00Z	limen-boost-059	F57RC-059-003	results/boost/limen-boost-059/figure5-figure7-multistate-export-execution-request.json	89-109	Required fields and multistate rules preserved: normalized_record_key canonical; primary_review_state plus additional_join_hazard_state; sidecar_required; denominator-family separation; no silent 21->23 replacement	results/boost/limen-boost-011/figure5-figure7-multistate-export-contract.tsv	1-6	fulfilled	Supports methods/thesis reproducibility because future writers can cite one exact contract row set instead of reconstructing field semantics from multiple validators.	Schema/field audit card for export readiness.	The contract exists locally but has not yet been promoted into shared dashboard/manuscript surfaces.	results/boost/limen-boost-059/figure5-figure7-multistate-export-execution-request.json; results/boost/limen-boost-011/figure5-figure7-multistate-export-contract.tsv
2026-06-07T20:12:00Z	limen-boost-059	F57RC-059-004	results/boost/limen-boost-059/figure5-figure7-multistate-export-execution-request.json	150-152	Next route should move from request-definition to bounded shared-surface consumption or explicit blocked implementation note	results/boost/limen-boost-012/figure7-multistate-safe-export.tsv; results/boost/limen-boost-012/figure7-sidecar-consumption-contract.tsv; results/boost/limen-boost-011/figure5-figure7-multistate-export-contract.tsv	whole-file	fulfilled_and_advanced	Closes one paper-readiness blocker and sharpens the next smallest move to consumption/governance instead of repeating request creation.	Route-transition card from request stage to consumption stage.	Figure 5 still lacks shared-surface consumption; Figure 7 has a local projected export but shared surfaces still remain 21-lineage legacy outputs until synchronized patching occurs.	results/boost/limen-boost-012/status.md; results/boost/limen-boost-011/status.md; results/boost/limen-boost-059/figure5-figure7-propagation-threshold-register.tsv
2026-06-07T20:12:00Z	limen-boost-059	F57RC-059-SUMMARY	results/boost/limen-boost-059/figure5-figure7-multistate-export-execution-request.json	SUMMARY	The request is locally satisfied; do not reopen shard-011 request-definition work unless implementation artifacts drift or acceptance evidence breaks	results/boost/limen-boost-059/figure5-figure7-execution-request-closure.tsv	SUMMARY	closed_locally_pending_shared_consumption	Turns the lane's earlier execution request into a closed local research artifact with explicit downstream caution, useful for reviewer response and thesis methods chronology.	Denominator-stack implementation ledger with state labels request_created -> contract_materialized -> local_acceptance_passed -> shared_consumption_pending.	Shared Figure 5 / Figure 7 surfaces are still bounded legacy outputs until a synchronized consumption patch or explicit implementation failure is recorded.	results/boost/limen-boost-059/figure5-figure7-multistate-export-execution-request.json; results/boost/limen-boost-011/figure5-figure7-multistate-export-acceptance.md; results/boost/limen-boost-012/figure7-sidecar-consumption-contract.tsv