as_of_utc	lane_id	audit_id	target_surface	state_before_cycle	state_after_cycle	alignment_status	paper_thesis_use	visualization_dashboard_hook	next_smallest_publishability_move	evidence_basis
2026-06-07T16:22:59Z	limen-boost-059	F4HS-059-001	results/boost/limen-boost-047/figure4-control-travel-kit.tsv	Figure 4 helper bundle still carried the older 26-row / 3-singleton ledger family in source-of-truth, export-stub, manuscript-hook, and shared-status-watch rows.	Helper bundle now carries the live 28 review rows / 33 visible rows / 25 stable-or-standalone lineages stack while preserving the bounded 18-edge graph and 2-edge residual gap contract.	fixed_in_cycle	Keeps Figure 4 travel guidance synchronized for manuscript, dashboard, thesis, and reviewer-response reuse.	Figure 4 helper-surface QA card; travel-bundle freshness badge.	If the two missing reviewed-not-duplicate overlays are later materialized, refresh this helper bundle together with the gap register and shared priority row.	results/boost/limen-boost-047/figure4-control-travel-kit.tsv; results/clusters/status.md; results/boost/limen-boost-047/duplicate-graph-gap-register.tsv
2026-06-07T16:22:59Z	limen-boost-059	F4HS-059-002	results/boost/limen-boost-047/figure4-shared-surface-reaudit.tsv	Shared-surface re-audit still certified manuscript and dashboard prose against the older 26-row helper state.	Shared-surface re-audit now certifies the live 28-row ledger plus 33-visible-row / 25-lineage duplicate-collapse context.	fixed_in_cycle	Reduces risk that later hostile-reviewer prose cites a stale helper audit as if it matched the current duplicate ledger.	Figure 4 denominator-stack verifier strip.	Re-run only if graph edges change or ledger counts change again.	results/boost/limen-boost-047/figure4-shared-surface-reaudit.tsv; papers/article-architecture-v0.1.md; dashboard/limen-dashboard-spec-v0.1.md
2026-06-07T16:22:59Z	limen-boost-059	F4HS-059-003	results/dashboard-paper/shared-export-promotion-register-v0.1.tsv:exp-007	Export stub still told downstream users to carry the live 26-row ledger with the bounded 18-edge export.	Export stub now requires the live 28-row ledger plus the 33-visible-row / 25-lineage duplicate-collapse context whenever exp-007 is reused.	fixed_in_cycle	Hardens blocked-dashboard export governance so future copy does not understate current duplicate-control scope.	Blocked-export governance note; Figure 4 export-sidecar card.	Keep exp-007 blocked until a writable dashboard path exists; if promotion ever happens, carry CCR-018 and the gap register unchanged unless a full graph catch-up pass lands.	results/dashboard-paper/shared-export-promotion-register-v0.1.tsv:exp-007; results/clusters/status.md; results/dashboard-paper/caption-control-register-v0.1.tsv:CCR-018
2026-06-07T16:22:59Z	limen-boost-059	F4HS-059-004	results/boost/limen-boost-012/manuscript-integration-register.tsv:limen-ms-fig-004	Manuscript Figure 4 slot still stated 26 review rows and 3 singleton rows.	Manuscript Figure 4 slot now states 28 review rows, 5 singleton rows, and the 33-visible-row / 25-lineage duplicate-collapse context.	fixed_in_cycle	Strengthens direct manuscript/table drafting safety for Figure 4 without widening claims beyond join safety and overcount prevention.	Figure 4 manuscript-slot QA badge.	Keep manuscript prose bounded to graph-versus-ledger logic unless the two missing overlays are intentionally added to the graph.	results/boost/limen-boost-012/manuscript-integration-register.tsv; results/clusters/status.md; results/boost/limen-boost-047/duplicate-graph-gap-register.tsv
2026-06-07T16:22:59Z	limen-boost-059	F4HS-059-005	results/boost/limen-boost-024/canonical-figure-table-registry.tsv:LIMEN-VIS-004	Canonical Figure 4 slot still described the graph as trailing a live 26-row duplicate-control ledger.	Canonical Figure 4 slot now ties the bounded 18-edge graph to the live 28-row ledger and the 33-visible-row / 25-lineage duplicate-collapse context.	fixed_in_cycle	Keeps canonical figure-order planning synchronized with the repaired duplicate-control denominator stack.	Figure 4 slot registry freshness badge.	If Figure 4 ready_state changes, patch this row together with exp-007, CCR-018 dependencies, and the helper bundle.	results/boost/limen-boost-024/canonical-figure-table-registry.tsv:LIMEN-VIS-004; results/clusters/status.md
2026-06-07T16:22:59Z	limen-boost-059	F4HS-059-006	results/boost/limen-boost-012/reviewer-caption-register.tsv:limen-ms-fig-004	Reviewer caption row still said 26 review rows and 3 singleton rows, below the current duplicate ledger.	Reviewer caption row now states 28 review rows, 5 singleton rows, and the 33-visible-row / 25-lineage duplicate-collapse context while keeping the 18-edge / 2-gap graph ceiling.	fixed_in_cycle	Prevents reviewer-response or caption drafting from reintroducing stale duplicate-control counts after the helper refresh.	Figure 4 caption QA badge.	Before any caption rewrite, keep this row aligned with the manuscript register and shared export stub.	results/boost/limen-boost-012/reviewer-caption-register.tsv; results/clusters/status.md; results/dashboard-paper/caption-control-register-v0.1.tsv:CCR-018