matrix_row_id	comparison_row_id	jurisdiction	surface_class	primary_surface_url	buyer_side_trace_state	supplier_consistency_state	page_specificity_state	public_companion_doc_state	public_assessment_state	contractor_signal	contract_value_signal	evidence_tier	paper_use_now	dashboard_hook	evidence_ceiling_note	next_verification_move	accessed_utc
006-pcsm-001	psdc-001	Slovenia	official_project_page	https://www.policija.si/eng/prevention/projects/orion-a-project-for-identification-of-travellers-at-the-external-borders-of-the-schengen-area	no_local_buyer_side_trace	no_public_supplier_signal	project_page_only	no_public_companion_doc_local	no_public_assessment_doc_local	none	none	direct official project page only	Keeps the Slovenian row in the disclosure-asymmetry table without overstating procurement or register visibility.	Use as the low-trace anchor in a buyer-side companion-state panel.	Official project-page visibility does not yet reconstruct acquisition, award, contract, or assessment-chain evidence.	Hold for now unless a public procurement/register route appears from direct official surfaces.	2026-06-07T06:35:13Z
006-pcsm-002	psdc-002	United Kingdom	regulator_enforcement_package	https://ico.org.uk/action-weve-taken/enforcement/serco-leisure-operating-limited-and-associated-trusts/	no_local_buyer_side_trace	no_public_supplier_signal	regulator_notice_not_buyer_side	regulator_notice_pdf_present	no_public_assessment_doc_local	none	none	direct regulator notice package	Supports a bounded contrast between governance-enforcement visibility and acquisition visibility in public-sector AI cases.	Use as a regulator-depth / buyer-side-absence row.	Document-grade legal and remediation text exists, but no procurement or contract-chain companion is attached locally.	Do not expand unless a public buyer-side acquisition record is discoverable from official sources.	2026-06-07T06:35:13Z
006-pcsm-003	psdc-003	United Kingdom	regulator_enforcement_package	https://ico.org.uk/action-weve-taken/enforcement/chelmer-valley-high-school/	no_local_buyer_side_trace	no_public_supplier_signal	regulator_notice_not_buyer_side	reprimand_pdf_present	public_DPIA_discussed_in_reprimand_but_not_attached	none	none	direct regulator reprimand package	Keeps the school-biometrics row visible as an authority-rich but acquisition-thin comparator.	Use as a regulator-depth / buyer-side-absence row with a distinct DPIA-discussion state.	The reprimand confirms governance defects around an operational system, but the buyer-side procurement chain remains locally unresolved.	Prefer no new work here until one clean buyer-side surface becomes available.	2026-06-07T06:35:13Z
006-pcsm-004	psdc-004	Netherlands	public_ai_register_entry	https://algoritmes.overheid.nl/nl/algoritme/23189993	no_public_buyer_side_trace_on_captured_page	public_supplier_named_on_register_page	register_entry_not_linked_to_buyer_side_contract	named_companion_items_without_public_attachment_link	named_assessment_without_public_document_link_or_download	Microsoft via Azure	none	direct official public AI-register entry	Shows that a rich public AI-register row can still stop short of public procurement or inspectable companion-document transparency.	Use as the high-register-visibility / no-buyer-side-trace comparator.	The public register page names governance companions and a supplier, but the linked source registration remains internal-only and no public buyer-side tender/award/contract trace is attached locally.	One bounded Amsterdam buyer-side trace probe is still the main missing upgrade if Helsinki is frozen at family-level linkage.	2026-06-07T06:35:13Z
006-pcsm-005	psdc-005	Finland	public_ai_register_entry	https://ai.hel.fi/en/parking-chatbot/	family_level_same_buyer_procurement_trace_with_supplier_consistent_award	award_notice_supplier_matches_register_page_IBM_signal	family_level_same_buyer_same_modality_not_page_specific	general_register_doc_public_but_no_page_specific_assessment_or_procurement_companion	no_page_specific_public_dpia_or_impact_assessment_link_found	Oy IBM Finland Ab	EUR 270992 award notice total	direct register page plus public procurement notice-detail JSON	Upgrades the Helsinki row into a reviewer-safe middle state between register-only transparency and exact row-linked contract proof.	Add buyer_side_trace_state, supplier_consistency_state, and page_specificity_state as separate dashboard fields.	The public award notice names a supplier and value consistent with the register-page IBM signal, but the procurement title still describes a broader city chatbot package and does not identify the parking-chatbot page specifically.	Freeze Helsinki at this stronger family-level ceiling unless a page-specific buyer-side companion or public assessment document appears.	2026-06-07T06:35:13Z
