claim_support_id	claim_id	comparison_row_id	claim_scope	evidence_anchor	bounded_support_statement	evidence_tier	uncertainty_or_gap	forbidden_overread	paper_thesis_use	visualization_hook	next_smallest_publishability_move
CS-006-001	LIMEN-C-012	psdc-001..psdc-005	aggregate_family_claim	results/boost/limen-boost-006/public-sector-caption-control-register.tsv; results/boost/limen-boost-042/public-sector-traceability-ladder.tsv; results/dashboard-paper/public-sector-disclosure-asymmetry-v0.1.md	The current five-row public-sector mini-corpus is strongest as a disclosure-surface heterogeneity panel spanning one official project page, two regulator-document packages, and two municipal public AI-register rows rather than as a simple count of public-sector AI cases.	derivative synthesis over direct public-source captures	Still no exact row-linked buyer-side procurement, contract, or page-specific public impact-assessment companion.	Do not treat the five-row panel as a procurement-transparency ranking, deployment-effectiveness dataset, or prevalence denominator.	Shared claims layer for methods/data paper, thesis evidence-infrastructure chapter, and reviewer-facing table notes.	Table 1B / Table 1B1 claim ceiling; dashboard legend root for public-sector panel.	Land one exact buyer-side companion for Amsterdam, Helsinki, or another already-seeded row before widening family rhetoric.
CS-006-002	LIMEN-C-012	psdc-001	row_anchor	results/boost/limen-boost-006/public-sector-caption-control-register.tsv:psdc-001	The Slovenian ORION row supports only narrow claims about public-body involvement, stated project purpose, pilot framing, and governance language from an official police project page.	direct official project page reused through caption control	No local procurement trace, contract identifier, supplier normalization, or operational deployment proof is attached.	Do not restate the row as procurement-backed deployment, legality proof, or measured border-control effectiveness.	Methods/results contrast between project-page visibility and stronger document/register surfaces.	Traceability-ladder low state; project-vs-register-vs-regulator filter.	Upgrade only if a public procurement, contract, or companion project document materially sharpens project-versus-deployment wording.
CS-006-003	LIMEN-C-012	psdc-002..psdc-003	regulator_document_anchor	results/boost/limen-boost-006/public-sector-caption-control-register.tsv:psdc-002..psdc-003; results/authoritative-scout/authoritative-claim-support-register-v0.1.tsv	The two UK ICO rows are strongest for quoted legal-basis, remediation, DPIA, consent, and deployment-timing language because they contain direct regulator notice/reprimand text, but they remain acquisition-thin without buyer-side procurement traces.	direct regulator-document package plus authoritative claim-support register	No buyer-side procurement, supplier, or public contract chain is attached locally.	Do not convert regulator notice text into procurement visibility, supplier proof, sector prevalence, or generalized legality conclusions.	Authority-depth comparator prose and hostile-reviewer quotation control.	Traceability-ladder regulator state; legal-basis-vs-buyer-trace split.	Only upgrade if a public buyer-side procurement, contract, supplier, or public DPIA companion becomes available.
CS-006-004	LIMEN-C-012	psdc-004	register_anchor_with_negative_route	results/boost/limen-boost-006/public-sector-caption-control-register.tsv:psdc-004; results/boost/limen-boost-006/amsterdam-buyer-side-trace-probe-v0.1.tsv	The Amsterdam register row is LIMEN's richest current register-style disclosure surface because it names a supplier and governance companions, while tested public routes still show no exact-name procurement hit and a same-buyer Azure/Public Cloud procurement-family bridge remains visible below exact row-linked buyer-side or public-companion proof.	direct official register page plus bounded negative-route probe	Named assessment instruments and supplier are visible, but no public buyer-side tender, award, contract, or attachment was verified locally.	Do not caption Amsterdam as procurement-absent, contract-resolved, or implementation-verified.	Municipal register comparator and limitations paragraph on register transparency versus reconstructability.	High-register-visibility / no-buyer-side-trace badge.	Hold frozen unless a new static official procurement or public assessment surface appears.
CS-006-005	LIMEN-C-012	psdc-005	register_plus_family_level_procurement_companion	results/boost/limen-boost-006/public-sector-caption-control-register.tsv:psdc-005; results/boost/limen-boost-006/procurement-companion-state-matrix.tsv	The Helsinki parking-chatbot row sits above register-only disclosure because a same-buyer procurement package and IBM-consistent award metadata are public, but the linkage remains family-level rather than exact page-specific contract proof.	direct register page plus public procurement notice-detail synthesis	No exact row-to-contract proof, no page-specific public DPIA, and no page-specific public impact-assessment companion are attached.	Do not caption Helsinki as exact contract-linked procurement proof or public-assessment-complete.	Middle-state comparator for methods/results and thesis traceability discussion.	Register-to-procurement bridge state with linkage badge.	Freeze at family-level same-buyer supplier-consistent award unless a page-specific buyer-side companion or public assessment document appears.
