as_of_utc	lane_id	route_rank	theme_scope	target_case_or_queue	jurisdiction	language	current_state	current_shared_role	shared_claim_or_surface_if_unchanged	threshold_event_or_route_decision	paper_thesis_delta_if_lands	main_overread_to_block	visualization_dashboard_hook	evidence_bundle
2026-06-07T17:27:45Z	limen-boost-015	1	shard-003 court-depth blocker	LIMEN-000002	United States	en	EEOC filing and settlement press releases plus stable civil-action number are local, but no open complaint, decree, docket entry, or judicial-order text is captured.	summary-grade blocker row inside `LIMEN-C-010`, Table 1A document-depth facet, and Figure 8 authority-depth caution.	If unchanged, LIMEN can still claim only agency-reported filing-to-settlement progression from the EEOC perspective.	One genuinely different public court-facing or clearly labeled open-mirror complaint, decree, docket entry, or judicial-order text.	Converts the weakest authoritative row from agency-summary-only into mixed agency-plus-court support and gives the first article one cleaner court-depth exemplar.	Do not present EEOC allegations or settlement summary as court-verified merits findings before a court-originating text is captured.	Table 1A blocker badge; Figure 8 authority-depth callout; court-gap methods appendix.	results/authoritative-scout/court-anchor-progress-matrix-v0.1.tsv; results/authoritative-scout/authoritative-frontier-priority-register-v0.1.tsv; results/boost/limen-boost-025/source-family-route-b-claim-surface-bundle.tsv
2026-06-07T17:27:45Z	limen-boost-015	2	theme-003 normalization-limited court record	LIMEN-000005	United States	en	DOJ press release and linked indictment PDF are local, but exact caption metadata remains partial because only `25 Cr.` is recoverable from the current image-quality path.	partial-document charging-stage row supporting accusation-stage wording and normalization-limited methods claims.	If unchanged, LIMEN can still use the row for charge-stage hidden-human-behind-AI wording with presumption-of-innocence caution.	One materially different OCR stack, better public original, or another exact-caption public source that recovers the unread docket suffix.	Improves citation precision and reproducibility for the charge-stage row without inflating it into regulator-final or adjudicated support.	Do not invent unread docket digits or let caption cleanup be narrated as hidden-human final-authority closure.	Court-normalization methods panel; charge-stage versus settled-order ladder; accusation-stage badge.	results/authoritative-scout/nate-case-number-ocr-stress-test-v0.1.tsv; results/authoritative-scout/court-anchor-progress-matrix-v0.1.tsv; results/dashboard-paper/ai-washing-authority-diversification-panel-v0.1.tsv
2026-06-07T17:27:45Z	limen-boost-015	3	theme-003 official AI-claim diversification decision	LIMEN-000010	United States	en	FTC complaint-plus-final-order package is locally captured and already safe for bounded non-finance official AI-claim sidecar use.	shared diversification sidecar for `LIMEN-C-015` and Table 1C authority-diversification discussion, not default core-ladder closure.	If unchanged, LIMEN can already claim one bounded non-finance official-text AI-claim exemplar outside SEC finance.	Decide deliberately whether DoNotPay stays sidecar-only or becomes the first core-table non-finance official AI-claim promotion.	Clarifies exactly which manuscript/dashboard/thesis surfaces would change if a non-finance official FTC row moved from sidecar to core routing.	Do not narrate the FTC materials as judicial unauthorized-practice findings, product-truth proof, or hidden-human closure.	Table 1C diversification sidecar; official non-finance badge; Figure 2 live-only AI-washing delta note.	results/authoritative-scout/ftc-nonfinance-promotion-matrix-v0.1.tsv; results/dashboard-paper/ai-washing-authority-diversification-panel-v0.1.tsv; claims.md:LIMEN-C-015
2026-06-07T17:27:45Z	limen-boost-015	4	theme-003 detector-governance frontier	LIMEN-000011	United States	en	FTC complaint-plus-final-order package is locally captured, but shared use is intentionally narrower than DoNotPay because the row is detector-governance specific.	frontier-only authoritative candidate usable for Figure 2 live-only denominator commentary and future detector-governance sidecar work.	If unchanged, LIMEN can already use Workado as bounded false-capability / detector-governance support in local frontier surfaces without promoting it into a broader authoritative claim.	Open a detector-governance sidecar deliberately only if the narrower claim ceiling is preserved across article, dashboard, and thesis surfaces.	Adds a publication-safe route note for how official detector-accuracy enforcement could enter the package without being mistaken for general detector-validity evidence.	Do not generalize FTC complaint allegations into scientific detector verdicts or ecosystem prevalence claims.	Detector-governance bridge card; Figure 2 legal/procedural contamination live-only delta; false-capability appendix.	results/authoritative-scout/ftc-nonfinance-promotion-matrix-v0.1.tsv; data/cases/authoritative-candidates.jsonl; results/boost/limen-boost-022/post-danish-figure2-drift-register.tsv
2026-06-07T17:27:45Z	limen-boost-015	5	theme-003 rare-language regulator governance sidecar	LIMEN-000012	Denmark	da	Danish Datatilsynet decision page is locally captured and already promoted into shared public-sector governance sidecar surfaces with translation caution.	shared governance sidecar for `LIMEN-C-012` and public-sector proof-ceiling discussion, still outside the five-row Table 1B core.	If unchanged, LIMEN can already claim that public-sector AI rows sometimes expose legal-basis/governance analysis without buyer-side traceability or harm evidence.	Either keep Denmark sidecar-only with translation caution or capture one official procurement, DPIA/assessment, or linked companion document before any denominator widening.	Gives the paper/thesis package one explicit rare-language governance anchor that softens public-sector Anglophone bias without pretending procurement depth or harm proof.	Do not present the Danish page as procurement-backed deployment, legality finding beyond the page, impact evidence, or certification.	Public-sector proof-ceiling badge; rare-language governance sidecar; jurisdiction-language governance map.	results/dashboard-paper/public-sector-proof-ceilings-v0.1.tsv; results/authoritative-scout/danish-governance-sidecar-promotion-bridge-v0.1.tsv; claims.md:LIMEN-C-012
2026-06-07T17:27:45Z	limen-boost-015	6	theme-003 non-U.S./non-UK official-corroboration frontier	LMWCS-20260606-001	Finland	fi	The Finnish Yle row remains broadcaster-level only; no official police, court, ministry, or administrative-process companion is locally captured.	official-corroboration queue relevant to shard-003 geography deepening and multilingual/public-institution process anomalies.	If unchanged, LIMEN can use the row only as bounded broadcaster-level comparator and route-scarcity evidence.	One genuinely different official Finnish surface confirming the narrow public-process facts named by Yle.	Would add a second underrepresented-language authority-upgrade path and strengthen the non-U.S./non-UK route beyond the current Italy-plus-Slovenia split.	Do not promote broadcaster-only support into official process findings, legal fault, or multilingual prevalence claims.	Authority-upgrade funnel; jurisdiction-language matrix; procedural-contamination crossover card.	results/authoritative-scout/authoritative-non-us-uk-follow-through-matrix-v0.1.tsv; publication-goal-card-current.md; next.md
