as_of_utc	route_row_id	route_scope	case_or_frontier_key	jurisdiction	language	primary_source_surface_now	current_authority_posture	threshold_class	why_this_matters_now	why_it_does_not_substitute_for_sf08	safest_current_paper_use	next_smallest_publishability_move	observatory_hook	evidence_bundle
2026-06-07T21:58:27Z	RCN-015-001	shared_authoritative_blocker	LIMEN-000002	United States	en	EEOC filing + settlement press releases with civil-action number but no court-originating text captured	agency_summary_escalation_only	true_threshold_changing_court_depth_upgrade	A single open complaint, consent decree, docket entry, or judicial order would upgrade the weakest court/public-record row inside the authoritative funnel and directly strengthen reviewer-facing authority-depth discussion.	It is the actual sf08 access-gap row; regulator summaries, FTC complaint/order packages, or company/platform notice depth do not create court-originating support for this row.	Methods/limitations exemplar for regulator-to-court escalation without captured court text; keep court-text absence explicit.	Find one genuinely different public court-facing or clearly labeled open-mirror surface; do not repeat exhausted newsroom, node, site-search, Justia, CourtListener, or EDNY entry paths.	Route-B blocker panel; regulator-to-court escalation matrix; authority-depth funnel.	results/authoritative-scout/court-anchor-progress-matrix-v0.1.tsv; results/authoritative-scout/eeoc-itutorgroup-open-court-probe-v0.1.tsv; results/source-map/source-family-route-b-blocker-cadence-v0.1.tsv
2026-06-07T21:58:27Z	RCN-015-002	shared_authoritative_blocker	LIMEN-000005	United States	en	DOJ press release + captured image-only indictment PDF with partial OCR	charging_stage_plus_captured_pdf	true_threshold_changing_normalization_upgrade	Exact caption normalization would tighten citation precision for the charging-stage hidden-human / AI-washing row without changing its accusation-stage caution.	It is the actual sf08 normalization-gap row; more FTC, FCC, or regulator-order depth elsewhere does not recover the missing unread case-number suffix here.	Methods/limitations exemplar for captured court-document presence with normalization friction; preserve presumption-of-innocence and accusation-stage wording.	Use only a materially different OCR/public-caption source or better public original before retrying exact case-number extraction.	Normalization-stage panel; court-record reproducibility note; authority-depth funnel.	results/authoritative-scout/court-anchor-progress-matrix-v0.1.tsv; results/authoritative-scout/nate-case-number-ocr-stress-test-v0.1.tsv; results/authoritative-scout/nate-indictment-pdf-structure-audit-v0.1.tsv
2026-06-07T21:58:27Z	RCN-015-003	shared_authoritative_frontier	LIMEN-000010 / FTCPROMO-001	United States	en	FTC complaint PDF + FTC final-order PDF	FTC complaint/final-order candidate promotion	package_integration_threshold_not_source_depth_threshold	This is the cleanest next regulator-final non-finance AI-claim promotion and would diversify the authoritative package beyond settled SEC finance rows.	It widens official non-finance claim diversity, but it does not solve the court-originating-text weakness that keeps sf08 first in the Route-B blocker order.	Authoritative-frontier and bounded Table 1C sidecar reuse as a non-finance official AI-claim exemplar; keep complaint/final-order posture explicit.	Decide whether DoNotPay becomes the first shared non-finance official-text AI-claim row before wider detector-governance expansion.	Authority-depth funnel sidecar; posture-aware AI-claim panel; official-nonfinance diversification note.	results/authoritative-scout/authoritative-frontier-priority-register-v0.1.tsv; results/authoritative-scout/ftc-nonfinance-promotion-matrix-v0.1.tsv
2026-06-07T21:58:27Z	RCN-015-004	shared_authoritative_frontier	LIMEN-000011 / FTCPROMO-002	United States	en	FTC complaint PDF + FTC final-order PDF	FTC complaint/final-order candidate promotion	package_integration_threshold_not_source_depth_threshold	This is the strongest ready official detector-governance / false-capability row and could later bridge AI-washing to detector-governance or research-integrity discussion.	It supplies a narrower regulator-final comparator, but it still does not convert any agency-summary-only or normalization-limited court row into court-originating support.	Detector-governance appendix/sidecar or later authoritative-frontier promotion with narrow claim ceiling preserved.	Keep Workado queued behind DoNotPay unless a detector-governance slot is deliberately opened.	False-capability matrix; detector-governance bridge; authority-depth sidecar.	results/authoritative-scout/authoritative-frontier-priority-register-v0.1.tsv; results/authoritative-scout/ftc-nonfinance-promotion-matrix-v0.1.tsv
2026-06-07T21:58:27Z	RCN-015-005	held_direct_document_negative_result	LIMEN-000013	United States	en	FTC complaint PDF + FTC final decision and order PDF; later set-aside/reopening document still uncaptured	FTC direct documents readable but chronology incomplete	document_read_negative_result_not_promotable_core	Rytr is now a defensible direct-document-backed complex-posture negative result rather than a title-only blocked shell, which matters for reviewer explanations of why some FTC rows remain held.	Improved document readability and exact complaint/order support do not close the missing later-disposition gap and do not address sf08 court-depth weakness.	Appendix/limitations row on readable-direct-document versus chronology-incomplete enforcement posture.	Keep the row held unless a direct public set-aside/reopening document is captured.	Authority-depth dashboard split between readable documents and chronology-incomplete rows; FTC hold-resolution panel.	results/authoritative-scout/ftc-held-case-document-read-board-v0.1.tsv; results/authoritative-scout/ftc-held-disposition-gap-probe-v0.1.tsv
2026-06-07T21:58:27Z	RCN-015-006	held_direct_document_negative_result	LIMEN-000014	United States	en	FTC complaint PDF + FTC TRO motion PDF; later settlement/stipulated-order document still uncaptured	FTC direct documents readable but disposition incomplete	document_read_negative_result_not_promotable_core	Air AI is now a document-read complaint-bounded human-replacement-marketing queue row rather than a title-only placeholder, which strengthens conservative classification and reproducibility notes.	Complaint-bounded classification and TRO support do not produce settled posture, do not justify hidden-human or AI-washing promotion, and do not improve sf08 court depth.	Queue-only complaint-bounded sidecar for conversational-AI business-opportunity / human-replacement marketing allegations.	Keep the row held unless a direct public settlement, stipulated order, or final approval document is captured.	Authority-depth dashboard split; human-replacement-marketing queue; FTC hold-resolution panel.	results/authoritative-scout/ftc-held-case-document-read-board-v0.1.tsv; results/authoritative-scout/ftc-held-disposition-gap-probe-v0.1.tsv
