row_id	signal_id	translation_review_verdict	language_reviewed	source_url_or_locator	source_name	reason	claim_ceiling	next_action
TH-00030	LIMEN-SIGNAL-0FA19807DCF5FE72	candidate_for_url_extraction	en	https://moitt.gov.pk/Detail/ZWUzMjIyN2UtMWQ3Yi00Y2M1LTgxYTctY2QxMmUzOTdhNjVj	Pakistan Ministry of IT and Telecom AI Policy material	Local factory record names source URL and title but fetch/local content is absent or failed (URLError(OSError(101, 'Network is unreachable).	translation-safe source review only; no legal or policy conclusion from machine translation	extract_named_url_and_capture_original_source_surface
TH-00031	LIMEN-SIGNAL-0FA558FD523379BA	candidate_for_url_extraction	pt	https://www.gov.br/anpd/pt-br/assuntos/projetos-acoes-iniciativas/sandbox/por-que-inteligencia-artificial	ANPD sandbox regulatório: Por que Inteligência Artificial?	local lane record names same ANPD Portuguese sandbox URL but has no fetched content	source locator only; no sandbox/legal claim	deduplicate with other ANPD rows then extract/stage URL
TH-00038	LIMEN-SIGNAL-12DFAB428240D351	reject_noise	en	/srv/tyche/atlas/tyche-thesis-atlas-factory/results/submission-preprint-packages/atlas-preprint-package-20260606T050415Z/manuscript.md:18	Tyche Thesis Atlas manuscript markdown abstract	internal manuscript abstract, not an external original-language source locator	internal-method text only; no external source claim	exclude from translation-source promotion
TH-00088	LIMEN-SIGNAL-2F6DC936BED52522	cross_project_duplicate	dutch	https://algoritmes.overheid.nl/en/algoritme/gm1735/93184465/datamask	Algorithm Register of the Dutch government (Datamask)	public-ai-registry derived artifact; English auto-translation from Dutch; local record NL-ALG-REC-93184465; route upstream/dedupe rather than LIMEN promotion.	translation-safe source review only; no legal or policy conclusion from machine translation	Route to public-ai-registry upstream translation/source review and deduplicate repeated Dutch Algorithm Register artifacts.
TH-00104	LIMEN-SIGNAL-34F19B81CEEB4934	cross_project_duplicate	en	https://egov-ai.e.gov.ph/developers/chat-ai	Chat AI / eGovAI API	GAIA fact row restates archived eGovAI developer-document evidence as issue-spotting hook	GAIA issue-spotting/source-surface only; no automated-decision claim	deduplicate with other GAIA eGovAI rows
TH-00133	LIMEN-SIGNAL-43FF33C05AE5F9D0	candidate_for_url_extraction	en	https://www.mcit.gov.qa/wp-content/uploads/sites/4/2025/02/national_artificial_intelligence_strategy_for_qatar_2019_en.pdf	Qatar National Artificial Intelligence Strategy	Local factory record names source URL and title but fetch/local content is absent or failed (<HTTPError 500: 'Internal Server Error'>).	translation-safe source review only; no legal or policy conclusion from machine translation	extract_named_url_and_capture_original_source_surface
TH-00134	LIMEN-SIGNAL-443DA798D860B8BC	cross_project_duplicate	es/local English summary	/srv/tyche/gaia/tyche-research-vault/papers/global-agent-atlas/daily/gaia-foreign-language-digest-latest.json:4038	UN Guatemala Spanish AI Sprint page via GAIA digest	GAIA digest English summary is derived and human-review-needed; route upstream rather than promote in LIMEN	GAIA governance-radar context only; no named-agent or regulatory claim	deduplicate with TH-00089 and review upstream Spanish source if needed
TH-00138	LIMEN-SIGNAL-46671D763C633DAC	cross_project_duplicate	dutch	https://algoritmes.overheid.nl/en/algoritme/gm1735/93184465/datamask	Algorithm Register of the Dutch government (Datamask)	public-ai-registry derived artifact; English auto-translation from Dutch; local record NL-ALG-REC-93184465; route upstream/dedupe rather than LIMEN promotion.	translation-safe source review only; no legal or policy conclusion from machine translation	Route to public-ai-registry upstream translation/source review and deduplicate repeated Dutch Algorithm Register artifacts.
TH-00211	LIMEN-SIGNAL-70F79662D94099D5	translation_source_reviewed	ru	http://publication.pravo.gov.ru/Document/View/0001202004240030	Federal Law No. 123-FZ on the Moscow AI experimental legal regime	GAIA digest names Russian official-law source URL, reader target, language, and human-review-needed boundary.	translation-safe source review only; no legal or policy conclusion from machine translation	review original Russian legal source before quotation; keep as issue-spotting only
TH-00236	LIMEN-SIGNAL-7DCFB65BEF05D102	cross_project_duplicate	en	https://ico.org.uk/for-organisations/advice-and-services/regulatory-sandbox/	UK ICO Regulatory Sandbox	Staged package source-ledger duplicate of ICO source reviewed at TH-00147.	translation-safe source review only; no legal or policy conclusion from machine translation	deduplicate into TH-00147 source-review record
TH-00250	LIMEN-SIGNAL-862187D5C52707DB	cross_project_duplicate	dutch	https://algoritmes.overheid.nl/en/algoritme/mnre1153/33698247/zylab-disclosure-support	Algorithm Register of the Dutch government	Derived public-ai-registry artifact with Dutch Algorithm Register auto-translation context; route upstream/deduplicate rather than promote here.	translation-safe source review only; no legal or policy conclusion from machine translation	Deduplicate against public-ai-registry and, if needed, perform original Dutch source review upstream.
TH-00253	LIMEN-SIGNAL-87C730379D41D629	cross_project_duplicate	language_not_resolved	path:/srv/tyche/atlas/tyche-thesis-atlas-factory/results/submission-preprint-packages/atlas-preprint-package-20260606T050050Z/manuscript.md#L18	Tyche Thesis Atlas preprint abstract	Atlas package abstract is an internal cross-project research-object statement, not an original language source.	translation-safe source review only; no legal or policy conclusion from machine translation	dedupe to Atlas manuscript/source-ledger hardening; do not promote as LIMEN source
TH-00274	LIMEN-SIGNAL-94AC565178D464AE	cross_project_duplicate	language_not_resolved	path:/srv/tyche/atlas/tyche-thesis-atlas-factory/results/submission-preprint-packages/atlas-preprint-package-20260606T050415Z/source-draft.md#L8	Tyche Thesis Atlas source draft abstract	Atlas source draft repeats internal abstract language, not an external translation source.	translation-safe source review only; no legal or policy conclusion from machine translation	dedupe to Atlas manuscript hardening
TH-00283	LIMEN-SIGNAL-979D7D04C0CC995C	cross_project_duplicate	Dutch	https://algoritmes.overheid.nl/en/algoritme/gm1735/93184465/datamask	Algorithm Register of the Dutch government	Derived public-ai-registry record/table with named Dutch Algorithm Register locator and English auto-translation; deduplicate upstream.	translation-safe source review only; no legal or policy conclusion from machine translation	Route to public-ai-registry translation/source review or deduplication; do not promote as a LIMEN-reviewed source.
TH-00299	LIMEN-SIGNAL-A0BF64CA450C662C	reject_noise	ar; en; fr	/srv/tyche/pallas/pallas-ai-agent-observatory/results/boost/pallas-boost-007/readiness-negative-route-protocol-v0.1.md:21	Bahrain readiness negative-route protocol row	Protocol table row describes planned search scope, not an original-language source surface.	translation-safe source review only; no legal or policy conclusion from machine translation	Do not promote; execute URL extraction/source search for Bahrain if still needed.
TH-00324	LIMEN-SIGNAL-AC005735B19FC013	translation_source_reviewed	english	https://knowledge4policy.ec.europa.eu/sites/default/files/cyprus_ai_strategy.pdf	Cyprus National Artificial Intelligence Strategy transparency language	Named official strategy PDF locator and local transparency/traceability excerpt are reviewable.	translation-safe source review only; no legal or policy conclusion from machine translation	Use as strategy transparency language only, not proof of an operational register.
TH-00333	LIMEN-SIGNAL-AFE92F6ED26F8514	candidate_for_url_extraction	chinese	/srv/tyche/pallas/pallas-ai-agent-observatory/results/hypothesis-lab/pallas-confidence-burden-typology-v0.1.csv:11	China confidence-burden row	Row explicitly notes CAC/MIIT exact permalinks need harvest; local context is not the source surface.	translation-safe source review only; no legal or policy conclusion from machine translation	Extract CAC/MIIT permalinks before translation-source review.
TH-00354	LIMEN-SIGNAL-BB2516034848A100	needs_original_language_source	Finnish	/srv/tyche/projects/limen-ai-edge-case-atlas/results/boost/limen-boost-010/taxonomy-threshold-next-move-board.tsv:7	Finnish broadcaster-backed procedural-hallucination lineage	Threshold board says Finnish lineage lacks official corroboration and gives no source URL.	translation-safe source review only; no legal or policy conclusion from machine translation	locate authoritative Finnish police/court/ministry companion
TH-00360	LIMEN-SIGNAL-BC9C0628BE6670F6	cross_project_duplicate	Dutch	https://algoritmes.overheid.nl/en/algoritme/gm1735/93184465/datamask	Algorithm Register of the Dutch government	Derived public-ai-registry record/table with named Dutch Algorithm Register locator and English auto-translation; deduplicate upstream.	translation-safe source review only; no legal or policy conclusion from machine translation	Route to public-ai-registry translation/source review or deduplication; do not promote as a LIMEN-reviewed source.
TH-00364	LIMEN-SIGNAL-BF8B9AF60B9DA210	cross_project_duplicate	ms	/srv/tyche/pallas/pallas-ai-agent-observatory/results/pallas-gaia-bridge/paper-claim-signals.md:29	AISHAH AI Chatbot bridge signal	Pallas-GAIA bridge claim-signal row is derived review metadata, not a Malaysian source surface.	translation-safe source review only; no legal or policy conclusion from machine translation	Route upstream to Pallas/GAIA packet and extract exact Malay/official locators there.
TH-00374	LIMEN-SIGNAL-C621EDF4DFF6BF35	machine_translation_hold	Spanish	https://guatemala.un.org/es/311127-evaluaci%C3%B3n-de-ia-en-guatemala ; local digest line 4047	UN Guatemala: Evaluación de IA en Guatemala	Only GAIA notable-point summary is present at this row; original Spanish text was not reviewed.	translation-safe source review only; no legal or policy conclusion from machine translation	dedupe with Guatemala rows and review original Spanish source
TH-00452	LIMEN-SIGNAL-E4D5264CBC40D5D6	cross_project_duplicate	Dutch via English auto-translation local artifact	https://algoritmes.overheid.nl/en/algoritme/gm1735/93184465/datamask	Algorithm Register of the Dutch government / public-ai-registry artifact	Derived public-ai-registry record/gap artifact already names Dutch Algorithm Register auto-translation; route upstream rather than promote here.	translation-safe source review only; no legal or policy conclusion from machine translation	deduplicate against public-ai-registry source record and keep translation hold unless original Dutch page is reviewed upstream
TH-00453	LIMEN-SIGNAL-E4FDA23C59B0F182	translation_source_reviewed	local_context_language_not_resolved	https://mocti.gov.sl/	MoCTI/DSTI/NatCA/NCRA public portals	Named Sierra Leone official portals and MoCTI locator support only bounded negative source-surface review.	translation-safe source review only; no legal or policy conclusion from machine translation	retain bounded locator and limitation text
TH-00467	LIMEN-SIGNAL-ED17ABFB9F71E2BC	candidate_for_url_extraction	en	https://aiweek.pakistan.gov.pk/about	Pakistan official Indus AI Week platform	local metadata names aiweek.pakistan.gov.pk/about but fetch failed with network unreachable	source locator only; no programme claim	extract or stage named URL and verify content locally
TH-00515	LIMEN-SIGNAL-ED9EDB3BC8DE6AD0	cross_project_duplicate	chinese	/srv/tyche/gaia/tyche-research-vault/submissions/gaia-preprint-package-20260607T1635EEST/daily/gaia-foreign-language-digest-latest.json:7636	cross_project_atlas_or_gaia	local metadata identifies a derived cross-project language artifact	translation-safe source review only; no legal or policy conclusion from machine translation	route_upstream_or_deduplicate
TH-00516	LIMEN-SIGNAL-EE05DE6FC2491F9C	cross_project_duplicate	language_not_resolved	/srv/tyche/gaia/tyche-research-vault/release/gaia-preprint-freeze-20260605T0815EEST/data/global-agent-atlas-v0.1/backups-cycle188-active-lanes-32-foreign-language-public-service-hardening/records.jsonl:45	global_agent_atlas	local metadata identifies a derived cross-project language artifact	translation-safe source review only; no legal or policy conclusion from machine translation	route_upstream_or_deduplicate
TH-00529	LIMEN-SIGNAL-F2778FB22DD21123	cross_project_duplicate	language_not_resolved	/srv/tyche/gaia/tyche-research-vault/data/global-agent-atlas-v0.1/backups-cycle188-active-lanes-32-foreign-language-public-service-hardening/records.jsonl:40	global_agent_atlas	local metadata identifies a derived cross-project language artifact	translation-safe source review only; no legal or policy conclusion from machine translation	route_upstream_or_deduplicate
TH-00537	LIMEN-SIGNAL-F688FA7541287543	cross_project_duplicate	language_not_resolved	/srv/tyche/pallas/pallas-ai-agent-observatory/program/01-pallas-atlas/app/data/pallas_atlas_countries.json:17162	srv/tyche/pallas	local metadata identifies a derived cross-project language artifact	translation-safe source review only; no legal or policy conclusion from machine translation	route_upstream_or_deduplicate
TH-00001	LIMEN-SIGNAL-0096D74B15E1BE8B	candidate_for_url_extraction	korean	https://doi.org/10.16937/kcti.rep.2022.e13	관광산업 업종별 디지털 전환 지원체계 구축 방안 - 여행업과 관광호텔업을 중심으로 -	Korean title and DOI are present locally, but source text/URL extraction remains the next bounded step.	translation-safe source review only; no legal or policy conclusion from machine translation	Extract DOI landing/PDF locator locally before translation or factual use.
TH-00005	LIMEN-SIGNAL-03386889A892E1A5	cross_project_duplicate	dutch	https://algoritmes.overheid.nl/en/algorit	Algorithm Register of the Dutch government	Manuscript table row is a public-ai-registry derivative with truncated URL.	translation-safe source review only; no legal or policy conclusion from machine translation	deduplicate against public-ai-registry
TH-00020	LIMEN-SIGNAL-09BD03BB2D2F621B	cross_project_duplicate	dutch	https://algoritmes.overheid.nl/en/algoritme/gm1735/93184465/datamask	Dutch national Algorithm Register	Public AI Registry boost-normalized support row; derivative/upstream registry artifact.	translation-safe source review only; no legal or policy conclusion from machine translation	deduplicate against public-ai-registry
TH-00024	LIMEN-SIGNAL-0BE2DAE175086278	cross_project_duplicate	Dutch/English interface	https://algoritmes.overheid.nl/en/algoritme/88456515	Dutch Algorithm Register NL-ALG-88456515 Sounding language	Duplicate public-ai-registry accession row for the same stable Dutch register URL.	translation-safe source review only; no legal or policy conclusion from machine translation	dedupe with TH-00018/public-ai-registry
TH-00026	LIMEN-SIGNAL-0DBAA5EF885F4829	cross_project_duplicate	chinese	https://www.cac.gov.cn/2022-12/11/c_1672221949318230.htm	Provisions on the Administration of Deep Synthesis Internet Information Services (CAC)	Repeated GAIA Chinese law-context artifact for same CAC deep-synthesis provisions; upstream human translation/source review needed.	translation-safe source review only; no legal or policy conclusion from machine translation	Route to GAIA law-to-evidence row and keep only one canonical CAC locator.
TH-00029	LIMEN-SIGNAL-0E7236BF6DAA049A	cross_project_duplicate	not resolved	https://www.ppa.gov.et/	Ethiopia Public Procurement and Property Authority	Pallas source-pack negative-check row with official URL; cross-project transparency context only.	translation-safe source review only; no legal or policy conclusion from machine translation	route/dedupe in Pallas ET source pack
TH-00034	LIMEN-SIGNAL-102E87A9F3F4EBDC	cross_project_duplicate	chinese	https://www.cac.gov.cn/2022-12/11/c_1672221949318230.htm	Provisions on the Administration of Deep Synthesis Internet Information Services (CAC)	Repeated GAIA Chinese law-context artifact for same CAC deep-synthesis provisions; upstream human translation/source review needed.	translation-safe source review only; no legal or policy conclusion from machine translation	Route to GAIA law-to-evidence row and keep only one canonical CAC locator.
TH-00036	LIMEN-SIGNAL-10CCF56B3DE1E874	cross_project_duplicate	arabic	/srv/tyche/gaia/tyche-research-vault/results/boost/gaia-boost-088/language-delta.json:10	GAIA gaia-boost-088 language-delta assignment	GAIA boost assignment/patch metadata, not an original source surface for LIMEN promotion.	translation-safe source review only; no legal or policy conclusion from machine translation	deduplicate_against_upstream_gaia_or_global_agent_atlas
TH-00040	LIMEN-SIGNAL-157D6E459C2BF4A7	cross_project_duplicate	Spanish/not resolved	/srv/tyche/pallas/pallas-ai-agent-observatory/results/world-readiness-overview/algorithm-register-scarcity-map.csv:97	Pallas Guatemala algorithm-register scarcity map	Pallas scarcity-map synthesis with no row-level source URL; not a LIMEN translation source.	translation-safe source review only; no legal or policy conclusion from machine translation	route to Pallas Guatemala second-pass verification
TH-00045	LIMEN-SIGNAL-17842F5F2637EEA7	cross_project_duplicate	dutch	https://algoritmes.overheid.nl/en/algoritme/gm1735/93184465/datamask	Algorithm Register of the Dutch government	Public AI Registry sample-record duplicate from English auto-translation.	translation-safe source review only; no legal or policy conclusion from machine translation	deduplicate against public-ai-registry
TH-00052	LIMEN-SIGNAL-19C6C72147492591	cross_project_duplicate	es	/srv/tyche/gaia/tyche-research-vault/release/gaia-preprint-freeze-20260605T0815EEST/site/gaia-agent-atlas/public/data/foreign-language-digest.json:8367	GAIA/global-agent-atlas Colombia T-323/24 PretorIA digest	Derived GAIA/global-agent-atlas digest artifact; route upstream rather than promote from LIMEN translation hold.	translation-safe source review only; no legal or policy conclusion from machine translation	deduplicate_against_upstream_gaia_or_global_agent_atlas
TH-00054	LIMEN-SIGNAL-1A761053A8949FCD	candidate_for_url_extraction	pt	https://www.gov.br/anpd/pt-br/assuntos/projetos-acoes-iniciativas/sandbox/por-que-inteligencia-artificial	ANPD sandbox regulatório: Por que Inteligência Artificial?	snapshot metadata names Brazilian ANPD Portuguese sandbox URL but local fetch failed	source locator only; no sandbox/legal claim	deduplicate with ANPD rows then extract/stage URL
TH-00056	LIMEN-SIGNAL-1B55DB61792D5140	cross_project_duplicate	Finnish/English local registry metadata	/srv/tyche/projects/public-ai-registry/results/boost/public-ai-registry-boost-021/city-case-language-rights-caution-v0.1.md:64	Public AI Registry Helsinki language-rights caution artifact	Row is a derived public-ai-registry reuse/licence caution, not a fresh LIMEN translation source surface.	translation-safe source review only; no legal or policy conclusion from machine translation	deduplicate upstream against public-ai-registry Helsinki record
TH-00057	LIMEN-SIGNAL-1B72B908BA933F18	candidate_for_url_extraction	en	https://aiweek.pakistan.gov.pk/about	Pakistan official Indus AI Week platform	Local factory record names source URL and title but fetch/local content is absent or failed (URLError(OSError(101, 'Network is unreachable).	translation-safe source review only; no legal or policy conclusion from machine translation	extract_named_url_and_capture_original_source_surface
TH-00062	LIMEN-SIGNAL-1F12885ABE20229A	candidate_for_url_extraction	en	https://ai.gov.ae/wp-content/uploads/2023/05/MOCAI-AI-Ethics-EN.pdf	UAE AI Ethics Principles and Guidelines	Local factory record names source URL and title but fetch/local content is absent or failed (<HTTPError 403: 'Forbidden'>).	translation-safe source review only; no legal or policy conclusion from machine translation	extract_named_url_and_capture_original_source_surface
TH-00067	LIMEN-SIGNAL-2266E7D535E45A66	cross_project_duplicate	dutch	https://algoritmes.overheid.nl/en/algoritme/gm1735/93184465/datamask	Algorithm Register of the Dutch government (Datamask)	public-ai-registry derived artifact; English auto-translation from Dutch; local record NL-ALG-REC-93184465; route upstream/dedupe rather than LIMEN promotion.	translation-safe source review only; no legal or policy conclusion from machine translation	Route to public-ai-registry upstream translation/source review and deduplicate repeated Dutch Algorithm Register artifacts.
TH-00071	LIMEN-SIGNAL-250B42A905D6D0C1	cross_project_duplicate	dutch	https://algoritmes.overheid.nl/en/algoritme/mnre1045/83985427/octobox-anonymisation	Algorithm Register of the Dutch government (Octobox Anonymisation)	public-ai-registry derived artifact; English auto-translation from Dutch; local record NL-ALG-REC-83985427; route upstream/dedupe rather than LIMEN promotion.	translation-safe source review only; no legal or policy conclusion from machine translation	Route to public-ai-registry upstream translation/source review and deduplicate repeated Dutch Algorithm Register artifacts.
TH-00074	LIMEN-SIGNAL-25ACA6C91D85BB40	candidate_for_url_extraction	he	https://www.gov.il/BlobFolder/policy/ai_2023/en/Israels%20AI%20Policy%202023.pdf	Israel AI Policy 2023	Local factory record names source URL and title but fetch/local content is absent or failed (<HTTPError 403: 'Forbidden'>).	translation-safe source review only; no legal or policy conclusion from machine translation	extract_named_url_and_capture_original_source_surface
TH-00077	LIMEN-SIGNAL-2701D8E4D0F839C0	reject_noise	English internal prompt	/srv/tyche/pallas/pallas-ai-agent-observatory/prompts/waves/pallas-hardening-sprint-9/sv-source-hardening.md:28	Pallas hardening prompt frozen summary	Internal prompt/frozen summary is derivative workflow text and does not expose a direct original-language source surface.	translation-safe source review only; no legal or policy conclusion from machine translation	drop from translation source-surface queue
TH-00079	LIMEN-SIGNAL-296EEE3522645AF1	cross_project_duplicate	dutch	https://algoritmes.overheid.nl/en/algoritme/mnre1153/33698247/zylab-disclosure-support	Algorithm Register of the Dutch government (Zylab Disclosure Support)	public-ai-registry derived artifact; English auto-translation from Dutch; local record NL-ALG-REC-33698247; route upstream/dedupe rather than LIMEN promotion.	translation-safe source review only; no legal or policy conclusion from machine translation	Route to public-ai-registry upstream translation/source review and deduplicate repeated Dutch Algorithm Register artifacts.
TH-00087	LIMEN-SIGNAL-2ED1F87C532256F3	cross_project_duplicate	dutch	https://algoritmes.overheid.nl/en/algoritme/mnre1153/33698247/zylab-disclosure-support	Algorithm Register of the Dutch government (Zylab Disclosure Support)	public-ai-registry derived artifact; English auto-translation from Dutch; local record NL-ALG-REC-33698247; route upstream/dedupe rather than LIMEN promotion.	translation-safe source review only; no legal or policy conclusion from machine translation	Route to public-ai-registry upstream translation/source review and deduplicate repeated Dutch Algorithm Register artifacts.
TH-00091	LIMEN-SIGNAL-30215B02436F635C	candidate_for_url_extraction	Korean/English local metadata	/srv/tyche/pallas/pallas-ai-agent-observatory/results/boost/pallas-boost-018/rare-language-exemplar-packet-contract-v0.1.csv:4	Pallas PG-002 Hyodol rare-language exemplar packet	Packet lists Korean/English source-document IDs and clues, but the row itself is a derived exemplar contract without one selected original-language URL/excerpt.	translation-safe source review only; no legal or policy conclusion from machine translation	extract one Hyodol Korean source URL/excerpt or route to PG-002 upstream ledger
TH-00093	LIMEN-SIGNAL-30B8046DA4830C1F	candidate_for_url_extraction	el	https://www.gov.gr/info/politiki-xrisis-maigov	Gov.gr mAIgov usage policy	Local factory record names source URL and title but fetch/local content is absent or failed (<HTTPError 403: 'Forbidden'>).	translation-safe source review only; no legal or policy conclusion from machine translation	extract_named_url_and_capture_original_source_surface
TH-00097	LIMEN-SIGNAL-32667B90D91CD0D8	cross_project_duplicate	dutch	https://algoritmes.overheid.nl/en/algoritme/gm1735/93184465/datamask	Algorithm Register of the Dutch government (Datamask)	public-ai-registry derived artifact; English auto-translation from Dutch; local record NL-ALG-REC-93184465; route upstream/dedupe rather than LIMEN promotion.	translation-safe source review only; no legal or policy conclusion from machine translation	Route to public-ai-registry upstream translation/source review and deduplicate repeated Dutch Algorithm Register artifacts.
TH-00100	LIMEN-SIGNAL-333685915ECA37F8	candidate_for_url_extraction	en	https://ai.gov.ae/	UAE Artificial Intelligence Office	Local factory record names source URL and title but fetch/local content is absent or failed (<HTTPError 403: 'Forbidden'>).	translation-safe source review only; no legal or policy conclusion from machine translation	extract_named_url_and_capture_original_source_surface
