row_id	signal_id	translation_review_verdict	language_reviewed	source_url_or_locator	source_name	reason	claim_ceiling	next_action
TH-00198	LIMEN-SIGNAL-67B5C92AEFCD2DC4	cross_project_duplicate	dutch	https://algoritmes.overheid.nl/en/algoritme/mnre1045/83985427/octobox-anonymisation	Algorithm Register of the Dutch government	Derived public-ai-registry artifact with Dutch Algorithm Register auto-translation context; route upstream/deduplicate rather than promote here.	translation-safe source review only; no legal or policy conclusion from machine translation	Deduplicate against public-ai-registry and, if needed, perform original Dutch source review upstream.
TH-00204	LIMEN-SIGNAL-6C67FD37EA03E329	translation_source_reviewed	language_not_resolved	https://gov.sr/wp-content/uploads/2023/09/Suriname-National-Digital-Strategy-2023-2030.pdf | /srv/tyche/pallas/pallas-ai-agent-observatory/reports/PALLAS_READINESS_SPRINT_3_SOURCE_PACK.csv:775	Government of Suriname National Digital Strategy 2023-2030	Named official strategy PDF and local source-pack row provide enough locator context for bounded source-surface review.	official strategy surface only; no algorithm-register absence, legality, compliance, or implementation claim	retain as indirect strategy source with translation/access-date note
TH-00209	LIMEN-SIGNAL-709CA2B9D0FC9CB3	cross_project_duplicate	dutch	https://algoritmes.overheid.nl/en/algoritme/mnre1153/33698247/zylab-disclosure-support	Algorithm Register of the Dutch government	Derived public-ai-registry artifact with Dutch Algorithm Register auto-translation context; route upstream/deduplicate rather than promote here.	translation-safe source review only; no legal or policy conclusion from machine translation	Deduplicate against public-ai-registry and, if needed, perform original Dutch source review upstream.
TH-00213	LIMEN-SIGNAL-71FD31120D7A5481	cross_project_duplicate	en	https://www.mas.gov.sg/development/fintech/regulatory-sandbox	Singapore MAS fintech regulatory sandbox	Duplicate Atlas ledger negative source-health result already reviewed at TH-00199.	translation-safe source review only; no legal or policy conclusion from machine translation	deduplicate into TH-00199 source-review record
TH-00219	LIMEN-SIGNAL-7498DF501EAD7E7F	cross_project_duplicate	dutch	https://algoritmes.overheid.nl/en/algoritme/82319377 ; /srv/tyche/projects/public-ai-registry/data/registry-record-accession-candidates-all-priorities-20260607.csv:12	Algorithm Register of the Dutch government - Smart Language	Official Dutch register URL is already accessioned in public-ai-registry; route as upstream registry evidence rather than LIMEN promotion.	translation-safe source review only; no legal or policy conclusion from machine translation	deduplicate through public-ai-registry accession/field-coding workflow
TH-00222	LIMEN-SIGNAL-76B320FBBE34DF6D	needs_original_language_source	Finnish	/srv/tyche/projects/limen-ai-edge-case-atlas/results/boost/limen-boost-029/rare-language-threshold-sequencing-board.tsv:4	Kaleva / Finland queue-only preview lead	Queue row asks for official/public companion but provides no URL or original Finnish source text.	translation-safe source review only; no legal or policy conclusion from machine translation	extract or locate page-specific Finnish official/public source before review
TH-00225	LIMEN-SIGNAL-794B16E45B28CB10	cross_project_duplicate	ru	http://publication.pravo.gov.ru/Document/View/0001202004240030	Federal Law No. 123-FZ on the Moscow AI experimental legal regime	Duplicate GAIA/publication digest line for Russian Moscow experimental-regime source reviewed at TH-00211.	translation-safe source review only; no legal or policy conclusion from machine translation	deduplicate into TH-00211 source-review record
TH-00229	LIMEN-SIGNAL-7B3BA2DBB2620EA1	cross_project_duplicate	korean	/srv/tyche/pallas/pallas-ai-agent-observatory/results/pallas-gaia-bridge/paper-claim-signals.md:27	Pallas-GAIA bridge PG-002 Hyodol claim signal	Derived Pallas/GAIA bridge claim signal with Korean source-document IDs elsewhere; should be handled in upstream bridge source-chain workflow.	translation-safe source review only; no legal or policy conclusion from machine translation	deduplicate to Pallas-GAIA KR source-chain card and extract original Korean locators there
TH-00235	LIMEN-SIGNAL-7DC0232816123F02	cross_project_duplicate	chinese	https://www.cac.gov.cn/2022-12/11/c_1672221949318230.htm	Provisions on the Administration of Deep Synthesis Internet Information Services (CAC)	Repeated GAIA Chinese law-context artifact for same CAC deep-synthesis provisions; upstream human translation/source review needed.	translation-safe source review only; no legal or policy conclusion from machine translation	Route to GAIA law-to-evidence row and keep only one canonical CAC locator.
TH-00241	LIMEN-SIGNAL-7E7F947846F73C23	candidate_for_url_extraction	ar	/srv/tyche/atlas/tyche-thesis-atlas-factory/config/hermes-v02-expansion-seeds.json:596	Atlas expansion seed - Arabic regulatory sandbox material	Seed describes desired Arabic-language material but does not name a reviewed source URL.	translation-safe source review only; no legal or policy conclusion from machine translation	run bounded URL extraction for Arabic/Gulf sandbox sources
TH-00243	LIMEN-SIGNAL-7FF385970E7E8A1C	cross_project_duplicate	en	https://ico.org.uk/for-organisations/advice-and-services/regulatory-sandbox/	UK ICO Regulatory Sandbox	Source-ledger duplicate of ICO source reviewed at TH-00147.	translation-safe source review only; no legal or policy conclusion from machine translation	deduplicate into TH-00147 source-review record
TH-00245	LIMEN-SIGNAL-831DCFF8EF5AF1B3	cross_project_duplicate	dutch	https://algoritmes.overheid.nl/en/algoritme/mnre1153/33698247/zylab-disclosure-support	Algorithm Register of the Dutch government	Derived public-ai-registry artifact with Dutch Algorithm Register auto-translation context; route upstream/deduplicate rather than promote here.	translation-safe source review only; no legal or policy conclusion from machine translation	Deduplicate against public-ai-registry and, if needed, perform original Dutch source review upstream.
TH-00248	LIMEN-SIGNAL-841F0A4C83381F39	candidate_for_url_extraction	fi	/srv/tyche/gaia/tyche-research-vault/release/gaia-preprint-freeze-20260605T0815EEST/data/global-agent-atlas-v0.1/sources/language-policy.json:313	Global Agent Atlas language-policy trigger - AuroraAI/Nordic governance	Release language-policy trigger duplicates source clues but still lacks concrete source URL.	translation-safe source review only; no legal or policy conclusion from machine translation	extract named AuroraAI/public-service automation URLs before source review
TH-00252	LIMEN-SIGNAL-86E638926B674852	cross_project_duplicate	dutch	https://algoritmes.overheid.nl/en/algoritme/mnre1153/33698247/zylab-disclosure-support	Algorithm Register of the Dutch government	Derived public-ai-registry artifact with Dutch Algorithm Register auto-translation context; route upstream/deduplicate rather than promote here.	translation-safe source review only; no legal or policy conclusion from machine translation	Deduplicate against public-ai-registry and, if needed, perform original Dutch source review upstream.
TH-00263	LIMEN-SIGNAL-8F0BFB9EEB4BA4C6	cross_project_duplicate	chinese	https://www.cac.gov.cn/2022-12/11/c_1672221949318230.htm	Provisions on the Administration of Deep Synthesis Internet Information Services (CAC)	Repeated GAIA Chinese law-context artifact for same CAC deep-synthesis provisions; upstream human translation/source review needed.	translation-safe source review only; no legal or policy conclusion from machine translation	Route to GAIA law-to-evidence row and keep only one canonical CAC locator.
TH-00264	LIMEN-SIGNAL-8F35F303341ECD31	cross_project_duplicate	dutch	https://algoritmes.overheid.nl/en/algoritme/gm1735/931	Algorithm Register of the Dutch government	Derived public-ai-registry artifact with Dutch Algorithm Register auto-translation context; route upstream/deduplicate rather than promote here.	translation-safe source review only; no legal or policy conclusion from machine translation	Deduplicate against public-ai-registry and, if needed, perform original Dutch source review upstream.
TH-00265	LIMEN-SIGNAL-9034A790C0365149	cross_project_duplicate	Dutch	https://algoritmes.overheid.nl/en/algoritme/mnre1153/3	Algorithm Register of the Dutch government	Derived public-ai-registry record/table with named Dutch Algorithm Register locator and English auto-translation; deduplicate upstream.	translation-safe source review only; no legal or policy conclusion from machine translation	Route to public-ai-registry translation/source review or deduplication; do not promote as a LIMEN-reviewed source.
TH-00267	LIMEN-SIGNAL-9076791143E7EC5D	cross_project_duplicate	Dutch	https://algoritmes.overheid.nl/en/algoritme/gm1735/931	Algorithm Register of the Dutch government	Derived public-ai-registry record/table with named Dutch Algorithm Register locator and English auto-translation; deduplicate upstream.	translation-safe source review only; no legal or policy conclusion from machine translation	Route to public-ai-registry translation/source review or deduplication; do not promote as a LIMEN-reviewed source.
TH-00270	LIMEN-SIGNAL-924AFEB37FA05AB2	cross_project_duplicate	Dutch	https://algoritmes.overheid.nl/en/algoritme/gm1735/93184465/datamask	Algorithm Register of the Dutch government	Derived public-ai-registry record/table with named Dutch Algorithm Register locator and English auto-translation; deduplicate upstream.	translation-safe source review only; no legal or policy conclusion from machine translation	Route to public-ai-registry translation/source review or deduplication; do not promote as a LIMEN-reviewed source.
TH-00272	LIMEN-SIGNAL-9351A6674A860E0F	machine_translation_hold	Spanish	https://guatemala.un.org/es/311127-evaluaci%C3%B3n-de-ia-en-guatemala ; local snapshot data/global-agent-atlas-v0.1/snapshots/cycle344-guatemala-7eec788197d3eeca.html	UN Guatemala: Evaluación de IA en Guatemala	Local GAIA digest has Spanish locator and English summary with human_review_needed; no original excerpt was reviewed here.	translation-safe source review only; no legal or policy conclusion from machine translation	extract/review original Spanish snapshot before any claim promotion
TH-00275	LIMEN-SIGNAL-94E557A751200898	cross_project_duplicate	Dutch	https://algoritmes.overheid.nl/en/algoritme/mnre1153/3	Algorithm Register of the Dutch government	Derived public-ai-registry record/table with named Dutch Algorithm Register locator and English auto-translation; deduplicate upstream.	translation-safe source review only; no legal or policy conclusion from machine translation	Route to public-ai-registry translation/source review or deduplication; do not promote as a LIMEN-reviewed source.
TH-00277	LIMEN-SIGNAL-956B9DD2F9297080	cross_project_duplicate	language_not_resolved	path:/srv/tyche/atlas/tyche-thesis-atlas-factory/results/submission-preprint-packages/atlas-preprint-package-20260606T050050Z/source-draft.md#L8	Tyche Thesis Atlas source draft abstract	Duplicate Atlas package abstract from another package path.	translation-safe source review only; no legal or policy conclusion from machine translation	dedupe to Atlas manuscript hardening
TH-00278	LIMEN-SIGNAL-9572FBF6DA1B4005	cross_project_duplicate	chinese	https://www.cac.gov.cn/2022-12/11/c_1672221949318230.htm	Provisions on the Administration of Deep Synthesis Internet Information Services (CAC)	Repeated GAIA Chinese law-context artifact for same CAC deep-synthesis provisions; upstream human translation/source review needed.	translation-safe source review only; no legal or policy conclusion from machine translation	Route to GAIA law-to-evidence row and keep only one canonical CAC locator.
TH-00284	LIMEN-SIGNAL-97CC44D83C1A0235	cross_project_duplicate	English/local metadata	https://egov-ai.e.gov.ph/developers/chat-ai	Chat AI / eGovAI API	Global Agent Atlas fact row with developer-docs locator belongs upstream; LIMEN should not promote the derived fact.	translation-safe source review only; no legal or policy conclusion from machine translation	route to Global Agent Atlas source verification/dedupe
TH-00285	LIMEN-SIGNAL-9805C8008A6338EA	needs_original_language_source	ko/en	https://doi.org/10.3745/kipstc.2006.13c.7.837	Korean digital-identity/PKI DOI lead	Report row is an English-source DOI lead for Korean evidence work; original Korean source is not present.	translation/source-surface review only; no incident truth, legality, compliance, safety, deployment, prevalence, or ranking claim	Find Korean original-language source or keep as background only.
TH-00287	LIMEN-SIGNAL-9844A5B3E77F9310	cross_project_duplicate	language_not_resolved	path:/srv/tyche/atlas/tyche-thesis-atlas-factory/results/exploitation-wave-atlas-20260605T193210Z/claim-support-curated.json#L344	Atlas claim-language patch excerpt	Claim-support artifact repeats Atlas abstract/patch language, not an original source.	translation-safe source review only; no legal or policy conclusion from machine translation	route upstream to Atlas claim-language dedupe
TH-00290	LIMEN-SIGNAL-99D47080DFEC9AD6	cross_project_duplicate	Dutch	/srv/tyche/projects/public-ai-registry/results/submission-preprint-packages/public-ai-registry-preprint-package-20260606T050159Z/manuscript.md:138	Algorithm Register of the Dutch government	Derived public-ai-registry manuscript/table locator with truncated or absent URL; route upstream before LIMEN promotion.	translation-safe source review only; no legal or policy conclusion from machine translation	Route to public-ai-registry translation/source review or deduplication; do not promote as a LIMEN-reviewed source.
TH-00292	LIMEN-SIGNAL-9C7419FDEFED9D67	translation_source_reviewed	Danish	https://www.datatilsynet.dk/regler-og-vejledning/kunstig-intelligens	Datatilsynet: Kunstig intelligens	Local multilingual matrix provides named Danish regulator locator, title, language, and candidate-primary-source status.	translation-safe source review only; no legal or policy conclusion from machine translation	perform bounded original Danish source review if this comparator is retained
TH-00296	LIMEN-SIGNAL-9E182478834EDF45	translation_source_reviewed	english	https://statehouse.gov.sl/	Sierra Leone official public-source root	Named official government root is present with local source-pack negative transparency-register context.	translation-safe source review only; no legal or policy conclusion from machine translation	Use only as weak root-level gap evidence; harden with exact register/open-data searches.
TH-00301	LIMEN-SIGNAL-A14D79F92E68D5C6	cross_project_duplicate	dutch	https://algoritmes.overheid.nl/en/algoritme/15583895	Module to screen for language bias	Public AI Registry accession row is an upstream Dutch registry corpus artifact and duplicate route.	translation-safe source review only; no legal or policy conclusion from machine translation	Deduplicate to public-ai-registry canonical record, not LIMEN translation promotion.
TH-00304	LIMEN-SIGNAL-A18AE3BA30595634	translation_source_reviewed	english/french	https://digital-strategy.ec.europa.eu/en/policies/regulatory-framework-ai	European Commission AI Act policy page	Named EU official page and France source-pack context are enough for bounded source-surface review.	translation-safe source review only; no legal or policy conclusion from machine translation	Use for EU/France sandbox timeline context only; avoid national implementation overclaim.
TH-00306	LIMEN-SIGNAL-A2108CE960762FBF	translation_source_reviewed	en	https://moitt.gov.pk/Detail/ZWUzMjIyN2UtMWQ3Yi00Y2M1LTgxYTctY2QxMmUzOTdhNjVj	Pakistan Ministry of IT and Telecom AI Policy material	Local Atlas record names official URL/title/language but fetch failed; source-surface only.	translation-safe source review only; no legal or policy conclusion from machine translation	extract/retry URL capture if promoted
TH-00310	LIMEN-SIGNAL-A44B1A27DDD3D003	cross_project_duplicate	Dutch	https://algoritmes.overheid.nl/en/algoritme/mnre1153/3	Algorithm Register of the Dutch government	Derived public-ai-registry record/table with named Dutch Algorithm Register locator and English auto-translation; deduplicate upstream.	translation-safe source review only; no legal or policy conclusion from machine translation	Route to public-ai-registry translation/source review or deduplication; do not promote as a LIMEN-reviewed source.
TH-00312	LIMEN-SIGNAL-A57C9EC8F4FDD87B	cross_project_duplicate	es	http://www.corteconstitucional.gov.co/relatoria/2024/T-323-24.htm	GAIA foreign-language digest: Colombian Constitutional Court T-323/24	Derived GAIA digest paraphrase with human-review-needed translation gate.	translation-safe source review only; no legal or policy conclusion from machine translation	route to GAIA court-AI source review
TH-00313	LIMEN-SIGNAL-A589BC4F62C41DDE	cross_project_duplicate	Dutch	https://algoritmes.overheid.nl/en/algoritme/mnre1045/83985427/octobox-anonymisation	Algorithm Register of the Dutch government	Derived public-ai-registry record/table with named Dutch Algorithm Register locator and English auto-translation; deduplicate upstream.	translation-safe source review only; no legal or policy conclusion from machine translation	Route to public-ai-registry translation/source review or deduplication; do not promote as a LIMEN-reviewed source.
TH-00315	LIMEN-SIGNAL-A6CE9F84005343A2	reject_noise	language_not_resolved	/srv/tyche/pallas/pallas-ai-agent-observatory/reports/PALLAS_READINESS_SPRINT_2_WEAK_SOURCE_WARNINGS.md:624	Pallas weak-source warning on AI procurement governance	Warning prose is internal derivative synthesis with no named original source locator in the row.	translation-safe source review only; no legal or policy conclusion from machine translation	Replace with specific ANAP/SEAP or strategy source URLs before source review.
TH-00316	LIMEN-SIGNAL-A72A8CBB594D9C95	candidate_for_url_extraction	language_not_resolved	/srv/tyche/pallas/pallas-ai-agent-observatory/reports/PALLAS_SECOND_PASS_SPRINT_7_HARDENING_SUMMARY.csv:6	Ethiopia hardening summary	Aggregated hardening row lists source names but not the exact source URLs needed here.	translation-safe source review only; no legal or policy conclusion from machine translation	Extract the named Ethiopia source URLs from the underlying source-refresh ledger.
TH-00318	LIMEN-SIGNAL-A81E6C2A97FDD5C6	cross_project_duplicate	es	http://www.corteconstitucional.gov.co/relatoria/2024/T-323-24.htm	GAIA public foreign-language digest: Colombian Constitutional Court T-323/24	Derived public GAIA digest with manual paraphrase and human-review gate.	translation-safe source review only; no legal or policy conclusion from machine translation	route to GAIA court-AI source review
TH-00321	LIMEN-SIGNAL-A9328989A6C0F2EA	needs_original_language_source	hebrew	/srv/tyche/pallas/pallas-ai-agent-observatory/reports/PALLAS_OBSERVABILITY_LANE_SOURCE_CANDIDATES.csv:573	Israel public AI/algorithm register gap lead	Candidate row says further Hebrew-language search is needed and gives only various/current locator.	translation-safe source review only; no legal or policy conclusion from machine translation	Acquire exact Hebrew/original government source URLs before any gap conclusion.
TH-00332	LIMEN-SIGNAL-AF715E67CCBC4452	machine_translation_hold	language_not_resolved	/srv/tyche/pallas/pallas-ai-agent-observatory/reports/PALLAS_SECOND_PASS_COUNTRY_REVIEW_LOAD.csv:64	Yemen country-review warning summary	Aggregated warning text has no named original MTIT source URL in this row.	translation-safe source review only; no legal or policy conclusion from machine translation	Hold until MTIT privacy/cyber source locators are extracted and reviewed.
TH-00334	LIMEN-SIGNAL-B0721D14C519364B	reject_noise	estonian	/srv/tyche/atlas/tyche-thesis-atlas-factory/papers/01-estonia-sandbox-evidence-infrastructure-v0.4-readable-draft.md:109	internal thesis synthesis paragraph on AI evidence package	Internal thesis synthesis/translation note with no bounded original-language source surface.	translation-safe source review only; no legal or policy conclusion from machine translation	Do not promote; replace with specific Estonian source locator if needed.
TH-00335	LIMEN-SIGNAL-B08817576E501497	candidate_for_url_extraction	ko	/srv/tyche/atlas/tyche-thesis-atlas-factory/config/hermes-v02-expansion-seeds.json:736	Korean identity/e-signature/PKI expansion seed	Seed query only; no named original-language source URL in this row.	translation-safe source review only; no legal or policy conclusion from machine translation	run named URL extraction from Korean seed query
TH-00336	LIMEN-SIGNAL-B1A69926DAF6BD5E	cross_project_duplicate	Dutch	/srv/tyche/projects/public-ai-registry/results/submission-preprint-packages/public-ai-registry-preprint-package-20260606T050159Z/manuscript.md:139	Algorithm Register of the Dutch government	Derived public-ai-registry manuscript/table locator with truncated or absent URL; route upstream before LIMEN promotion.	translation-safe source review only; no legal or policy conclusion from machine translation	Route to public-ai-registry translation/source review or deduplication; do not promote as a LIMEN-reviewed source.
TH-00338	LIMEN-SIGNAL-B2ED65623E8CA753	cross_project_duplicate	language_not_resolved	path:/srv/tyche/atlas/tyche-thesis-atlas-factory/results/exploitation-wave-atlas-20260605T192929Z/claim-support-curated.json#L422	Atlas claim-language patch excerpt	Duplicate Atlas claim-support record, not an original translation source.	translation-safe source review only; no legal or policy conclusion from machine translation	route upstream to Atlas claim-support dedupe
TH-00346	LIMEN-SIGNAL-B714AB5BF1EC11EF	cross_project_duplicate	Dutch	https://algoritmes.overheid.nl/en/algoritme/mnre1153/33698247/zylab-disclosure-support	Algorithm Register of the Dutch government	Derived public-ai-registry record/table with named Dutch Algorithm Register locator and English auto-translation; deduplicate upstream.	translation-safe source review only; no legal or policy conclusion from machine translation	Route to public-ai-registry translation/source review or deduplication; do not promote as a LIMEN-reviewed source.
TH-00351	LIMEN-SIGNAL-B927AFAFE3D9DC45	cross_project_duplicate	Danish	https://digst.dk/data/dansk-sprogteknologi/	Digitaliseringsstyrelsen Dansk sprogteknologi	Duplicate Pallas Danish language-technology source row with official URL.	translation-safe source review only; no legal or policy conclusion from machine translation	dedupe with TH-00099 in Pallas
TH-00355	LIMEN-SIGNAL-BB90FFDEF7FEDCF6	cross_project_duplicate	Dutch	/srv/tyche/projects/public-ai-registry/results/boost/public-ai-registry-boost-020/source-role-flow-figure-v1.csv:18	Algorithm Register of the Dutch government	Aggregate public-ai-registry figure row with Dutch auto-translation metadata; no row-level original URL in this LIMEN batch.	translation-safe source review only; no legal or policy conclusion from machine translation	Route to public-ai-registry translation/source review or deduplication; do not promote as a LIMEN-reviewed source.
TH-00362	LIMEN-SIGNAL-BF0A2D3C9627E8E1	cross_project_duplicate	Dutch	/srv/tyche/projects/public-ai-registry/results/submission-preprint-packages/public-ai-registry-preprint-package-20260606T050415Z/manuscript.md:138	Algorithm Register of the Dutch government	Derived public-ai-registry manuscript/table locator with truncated or absent URL; route upstream before LIMEN promotion.	translation-safe source review only; no legal or policy conclusion from machine translation	Route to public-ai-registry translation/source review or deduplication; do not promote as a LIMEN-reviewed source.
TH-00363	LIMEN-SIGNAL-BF84927617AB85C0	translation_source_reviewed	en	https://moitt.gov.pk/Detail/ZWUzMjIyN2UtMWQ3Yi00Y2M1LTgxYTctY2QxMmUzOTdhNjVj	Pakistan Ministry of IT and Telecom AI Policy material	Local Atlas record names official URL/title/language but fetch failed; source-surface only.	translation-safe source review only; no legal or policy conclusion from machine translation	extract/retry URL capture if promoted
TH-00366	LIMEN-SIGNAL-C0E82537F23BDE5E	translation_source_reviewed	English	https://ico.org.uk/for-organisations/advice-and-services/regulatory-sandbox/	UK ICO Regulatory Sandbox	Local source ledger names English regulator page, access date, language, HTTP status, and comparator-use boundary.	translation-safe source review only; no legal or policy conclusion from machine translation	retain only as English regulator comparator metadata
TH-00369	LIMEN-SIGNAL-C36049721006112A	candidate_for_url_extraction	language_not_resolved	/srv/tyche/pallas/pallas-ai-agent-observatory/reports/PALLAS_SECOND_PASS_SPRINT_4_COUNTRY_SCORE_DELTA.csv:26	Lesotho algorithm-register negative check	Score-delta row names gov.ls and AI policy checks but omits exact URLs in this row.	translation-safe source review only; no legal or policy conclusion from machine translation	Extract the specific gov.ls and AI policy locators before translation-source review.
TH-00370	LIMEN-SIGNAL-C3D066E5CECFA3F9	reject_noise	English/internal article metadata	path:/srv/tyche/atlas/tyche-thesis-atlas-factory/submissions/data-for-policy-2026/data-policy-translational-article-preprint.md#L11	Data for Policy translational article keywords	Keyword line mentions Estonia but contains no source locator or translation-review surface.	translation-safe source review only; no legal or policy conclusion from machine translation	exclude from translation-source queue
