impact_id	candidate_move	current_state	minimum_new_evidence_needed	expected_publication_delta_if_successful	shared_surfaces_that_change_first	paper_thesis_use	why_rank_now	if_not_met_hold_state	caution
RIM-008-001	Capture one direct Finnish police, court, ministry, or judicial-process document for the Yle procedural-contamination row	direct_source_resolved_non_official_plus_official_probe_log	One public official Finnish document that independently confirms the phenomenon or procedural response already named in the Yle row	Would create the second stronger procedural family candidate in Table 1E Panel A and reduce dependence on one Italian document-grade anchor for shard-008 results prose	results/dashboard-paper/procedural-contamination-source-depth-panel-v0.1.tsv:SCPANEL-008-002 ; results/boost/limen-boost-008/reviewer-evidence-panel.tsv:REP-008-002 ; claims.md:LIMEN-C-008	Best route for a real cross-jurisdiction procedural-depth upgrade in the first LIMEN paper, multilingual methods note, and thesis claim-support map	It is the only open shard-008 move that can improve both procedural-family depth and under-covered-language breadth at once	Keep Finland as a bounded multilingual comparator below official confirmation	Do not promote from actor-role verification, search friction, or governance-context pages alone
RIM-008-002	Capture one non-Springer direct journal or publisher notice for the SAGE article	publisher_correction_metadata_plus_mediated_editor_statement	One direct SAGE correction, retraction, editor note, or publisher notice text	Would convert the current mediated-statement row into a publisher-diverse direct-notice candidate and make Table 1E Panel B less concentrated inside one publisher family	results/dashboard-paper/procedural-contamination-source-depth-panel-v0.1.tsv:SCPANEL-008-003 ; results/boost/limen-boost-008/caption-safe-claim-register.tsv:CCR-008-003 ; claims.md:LIMEN-C-008	Highest-yield publisher-diversification route for research-integrity wording in manuscript, appendix, and dashboard legend reuse	It changes the sharpest current reviewer-visible caveat after the Springer-book closure: direct-notice breadth is still same-family	Keep the row at mediated-editor-statement class with verified article identity	Do not restate editorial action as final until a direct journal or publisher record is captured
RIM-008-003	Freeze the NEJM archive-resolved direct-notice row as a completed threshold closure	archived_direct_publisher_notice_text	No new evidence needed; preserve the archive-resolved NEJM notice state and route later effort to seed governance or other frontier rows	Locks in one non-Springer direct-notice exemplar and prevents future shard-008 cycles from replaying a retired blocked-page route as if the threshold were still open	results/dashboard-paper/procedural-contamination-source-depth-panel-v0.1.tsv:SCPANEL-008-004 ; results/boost/limen-boost-008/reviewer-evidence-panel.tsv:REP-008-004 ; claims.md:LIMEN-C-008	Best hold-state route after the NEJM threshold closure for manuscript, dashboard, reviewer-response, and thesis reuse	The real gain already landed, so the priority has shifted from access-friction removal to seed-review discipline and remaining SAGE/procedural-depth blockers	Keep NEJM as a bounded archive-resolved direct-notice exemplar and do not spend another cycle replaying the same blocked live-page logic	Do not infer broader misconduct, clinical significance, or automatic seeded-count promotion from the completed route
RIM-008-004	Capture one second document-grade court, tribunal, or institutional process-integrity record from another family	one_document_grade_anchor_plus_one_non_official_comparator	One additional direct document-grade procedural-contamination source outside the Italian regulator-order family	Would let Panel A move from one benchmark anchor plus one bounded comparator toward a more balanced procedural-depth package	results/dashboard-paper/procedural-contamination-source-depth-panel-v0.1.tsv:SCPANEL-008-001..SCPANEL-008-002 ; results/boost/limen-boost-008/procedural-contamination-bridge.tsv:PCB-008-001..PCB-008-002 ; claims.md:LIMEN-C-008	Best long-run route for stronger results language without collapsing the shard into research-integrity-only support	This is the most publication-changing procedural move, but it depends on a new count-bearing authority-grade record rather than on polishing existing rows	Keep the shard framed as a source-depth and claim-ceiling package	Do not treat more prose about the same Italian order as a second family
RIM-008-005	Capture one direct platform, publisher, indexer, or institutional action record for a residual research-integrity lead	weak_residual_bucket	One direct action record that upgrades at least one residual row above specialist-report-only status	Would shrink the weak residual bucket and improve methods credibility around backlog handling without changing the top-depth rhetoric as much as Finland, SAGE, or NEJM	results/dashboard-paper/procedural-contamination-source-depth-panel-v0.1.tsv:SCPANEL-008-007 ; results/boost/limen-boost-008/reviewer-evidence-panel.tsv:REP-008-007	Useful for limitations/backlog transparency in the paper and thesis methods appendix	Lower rank because it improves bucket hygiene more than the shard's main reviewer-visible blocker	Keep the residual bucket explicit and quarantined	Do not infer sanctions, editorial findings, or platform action from specialist reporting alone
RIM-008-006	Freeze the Springer book row as a completed direct-notice comparator	second_same_family_direct_notice_now_captured	No new evidence needed; preserve the upgraded row and route later effort elsewhere	Locks in a journal-versus-book direct-notice comparator and prevents stale status-only wording from reappearing in manuscript or dashboard exports	results/boost/limen-boost-008/caption-safe-claim-register.tsv:CCR-008-005 ; results/boost/limen-boost-008/reviewer-evidence-panel.tsv:REP-008-005 ; results/dashboard-paper/procedural-contamination-source-depth-panel-v0.1.tsv:SCPANEL-008-005	Stabilizes the current reviewer-safe claim ceiling for Table 1E, figure captions, and thesis claim-support reuse	Ranked as a hold-state because the evidence gain already landed and the remaining blocker is diversity, not more Springer detail	Keep this row as a bounded direct-notice comparator and move later effort to publisher diversity or procedural-family depth	Do not infer generative-AI causation or broader publisher practice from this one book notice
