delta_id	candidate_id	lead_title_short	primary_subtype	starting_state	direct_source_signal	direct_source_url_or_id	source_family	access_date	verification_result	evidence_delta	paper_use	dashboard_hook	caution
LIMEN-008-SD-001	LIMEN-008-LEAD-001	Finnish absurd complaints / nonexistent cases	LPC-RI-004	Google News-discovered lead later resolved to a direct Yle article	Canonical Yle article text was directly captured and now supports institution-specific descriptive claims about AI-assisted administrative appeals, fabricated-case-reference signals, and response burden.	https://yle.fi/a/74-20212545 ; sources/sources.md:LIMEN-S-027 ; results/boost/limen-boost-008/procedural-contamination-bridge.tsv:PCB-008-002	public_broadcaster_news	2026-06-07	Direct-source verification succeeded: the Finland row is no longer title-only and is now a bounded direct-source-resolved procedural-contamination comparator below official confirmation.	Upgrades the row from platform-gated discovery friction to direct-source-resolved broadcaster support, while preserving that the next threshold still requires one official Finnish companion document.	Supports methods/results prose on how a rare-language legal-process lead moved from discovery friction into reviewer-safe multilingual evidence without becoming document-grade authority.	Authority-escalation ladder and jurisdiction/language procedural-contamination panel	Use the row for bounded descriptive and workload-burden claims only; do not convert it into official statistics, sanctions, or system-wide legal-process conclusions.
LIMEN-008-SD-002	LIMEN-008-LEAD-002	ChatGPT-updated references article	LPC-RI-001	Specialist research-integrity report only	Crossref metadata resolves the underlying SAGE article DOI named in the report and exposes an `updated-by` corrigendum relation to DOI `10.1177/25148486241258320`, but direct publisher notice text is still not visible from this lane.	DOI `10.1177/25148486241235821` ; corrigendum DOI `10.1177/25148486241258320`	doi_registry_metadata	2026-06-07	Underlying article identity verified (`Breeding distrust: The biopolitics of chronic wasting disease in white-tailed deer`, Environment and Planning E: Nature and Space); correction-status metadata is now visible, but the direct corrective-action notice still is not captured.	Upgrades the lead from generic outlet report to an article-linked correction-metadata row while preserving that the authoritative editorial action text is still missing.	Feeds a reviewer-safe table on `article identified plus correction metadata` versus `editorial action text captured`.	Research-integrity source-upgrade funnel	Do not treat article-level DOI resolution plus correction linkage as proof that the direct journal notice text or full correction wording has been captured.
LIMEN-008-SD-003	LIMEN-008-LEAD-003	NEJM AI-manipulated imagery retraction	LPC-RI-003	Specialist research-integrity report only	Crossref metadata resolves both the original NEJM item and a separate retraction DOI; direct NEJM pages were blocked from this lane with HTTP 403.	DOIs `10.1056/NEJMicm2518379` and `10.1056/NEJMc2605962`	doi_registry_metadata + blocked publisher page	2026-06-07	Direct metadata verification succeeded: original title is `RETRACTED: Bronchial Casts from Inhalation of Forest-Fire Smoke`; separate retraction title is `Retraction: Bronchial Casts from Inhalation of Forest-Fire Smoke. N Engl J Med 2026;394:1634.`	Provides a stronger publisher-linked signal for synthetic-evidence contamination without claiming details from the blocked notice text.	Supports a process-integrity figure connecting specialist discovery reporting to publisher DOI-level correction records.	Synthetic-evidence contamination timeline	Use the DOI metadata narrowly; do not restate editorial reasoning beyond what is visible in the title-level metadata unless the notice text is captured.
LIMEN-008-SD-004	LIMEN-008-LEAD-005	Medical journal fake self-citation letter	LPC-RI-001	Specialist research-integrity report only	Publisher page and Crossref metadata both expose the linked Springer item as a retracted article.	DOI `10.1007/s00134-024-07752-6`	publisher article page + doi_registry_metadata	2026-06-07	Direct publisher-originating signal captured: Springer page title and Crossref title both read `RETRACTED ARTICLE: Artificial intelligence to enhance hemodynamic management in the ICU`.	Adds the first directly retrievable publisher-page retraction signal inside shard 008, strengthening the contamination queue beyond specialist reporting alone.	Useful for a manuscript sentence that some shard-008 rows can already be tied to publisher-maintained correction surfaces.	Subtype × strongest-source-family heatmap	The accessible page shows retracted status, but the exact editor-note reasoning about the fake self-citation still requires the linked note or archived notice before stronger interpretation.
LIMEN-008-SD-005	LIMEN-008-LEAD-006	Springer ML book / retracted status page	LPC-RI-001	Publisher-visible retracted book status without captured rationale	Public Springer chapter page and chapter PDF expose a direct publisher notice stating that the Series Editor and the Publisher retracted the book after reference-validity concerns and that 25 of 46 references could not be verified.	DOI `10.1007/978-981-97-9914-5_1`; chapter PDF `https://link.springer.com/content/pdf/10.1007/978-981-97-9914-5_1.pdf`	publisher_chapter_pdf + publisher_chapter_page + book_page_metadata	2026-06-07	Direct publisher-originating notice text captured from a public Springer chapter PDF, while the book landing page remains a weaker status-only surface.	Upgrades the row from publisher-visible retracted status to direct publisher notice text, broadening shard 008 beyond journal articles into book-length reference infrastructure contamination.	Supports a reviewer-safe venue-type comparison showing that direct notice text now exists for both a journal article and a book row.	Notice-text funnel; venue-type comparison panel; metadata-consistency facet	Use only the direct publisher-bounded rationale about unverifiable references; do not infer intent or broader Springer practice from this one notice.
LIMEN-008-SD-006	LIMEN-008-LEAD-002	ChatGPT-updated references / mediated editor statement	LPC-RI-001	DOI-identified article without captured editorial action	Retraction Watch quotes journal editor Krithika Srinivasan stating that the journal investigated the paper, that Sage would take actions in line with policy, and that the incorrect references were generated when an author used ChatGPT to insert citations and the reference list after the original manuscript had correct references.	Retraction Watch article dated 2024-05-20 quoting Environment and Planning E editor; article DOI `10.1177/25148486241235821`	attributed institutional statement via specialist reporting + doi_registry_metadata	2026-06-07	Mediated institutional statement captured, but not yet a direct journal or publisher notice.	Creates a reviewer-safe intermediate class between `specialist report only` and `direct notice text`, which matters for hostile-reviewer description of source depth.	Document-depth ladder and source-authority facet for research-integrity rows	Treat the quoted editor statement as mediated public evidence, not as a direct publisher notice or final editorial action until the journal/publisher record is directly captured.	
LIMEN-008-SD-007	LIMEN-008-LEAD-003	NEJM AI-manipulated imagery retraction	LPC-RI-003	Crossref/PubMed metadata plus blocked publisher page	Wayback captures of the NEJM retraction notice and original page now expose direct publisher-originating text and a visible RETRACTED original-page banner even though the live NEJM page remains blocked from this lane.	https://web.archive.org/web/20260502134303/https://www.nejm.org/doi/10.1056/NEJMc2605962 ; https://web.archive.org/web/20260508084928/https://www.nejm.org/doi/10.1056/NEJMicm2518379 ; sources/sources.md:LIMEN-S-085 ; sources/sources.md:LIMEN-S-086 ; results/boost/limen-boost-008/nejm-wayback-notice-audit.tsv:NWNA-008-001..NWNA-008-002	public_archived_publisher_pages	2026-06-08	Archive-resolved direct publisher notice verification succeeded: the archived retraction notice states that the authors used an AI tool to move the ruler to the top of the image and requested retraction, and the archived original page visibly carries the retracted status.	Promotes the row from blocked metadata-only corroboration into a direct notice-text exemplar while preserving that the evidence is carried by archived public publisher pages rather than a live NEJM page.	Supports one non-Springer direct-notice exemplar for Table 1E, manuscript methods/results prose, and a thesis synthetic-evidence contamination note.	Blocked-versus-archived notice-depth facet and publisher-diversity threshold panel	Use the archived NEJM text narrowly and do not generalize into broader misconduct, clinical significance, or prevalence claims.
