subtype_id	primary_limen_category	secondary_limen_category	definition	minimum_public_evidence_for_T1	authoritative_upgrade_path_for_T3	preferred_source_families	crosswalk_priority	paper_or_thesis_use	visualization_hook	caution_or_limit
LPC-RI-001	legal_procedural_contamination	research_integrity	Fabricated or hallucinated citations, authorities, or references enter legal, administrative, expert, or scholarly records.	One public source describing the contaminated filing, submission, report, or paper and identifying the citation problem.	Court order, tribunal record, regulator notice, journal/editor notice, retraction, or institutional investigation confirming the contamination.	Court and tribunal records; Regulator and enforcement sources; Academic and research-integrity sources; News and investigative reporting	High	Supports a methods/results table showing that citation fabrication is a reusable edge-case pattern across legal and academic settings.	Subtype-by-evidence-tier heatmap; claim-support matrix for hostile-reviewer pass	Do not infer intent, unlawfulness, or professional misconduct without an authoritative source.
LPC-RI-002	legal_procedural_contamination	research_integrity	Generated or synthetic expert material, witness-style reports, or evidentiary submissions are used without clear provenance or validation.	One public source describing the submission/use of AI-generated expert-style material in a consequential process.	Court ruling, regulator action, institutional policy notice, or official investigation documenting the provenance or admissibility issue.	Court and tribunal records; Regulator and enforcement sources; Company and platform notices; News and investigative reporting	High	Useful for a paper section on evidentiary provenance confusion and bounded attestation claims.	Evidence-source Sankey linking subtype to authority family and downstream harm	Public reporting may overstate system capability; separate source allegation from adjudicated finding.
LPC-RI-003	legal_procedural_contamination	deepfake_or_synthetic_identity	Synthetic audio, image, or video contaminates a filing, hearing, investigation, or adjudicative record.	One public source describing the media item and the procedural setting it affected.	Court finding, police or regulator notice, forensic report, or official case summary confirming synthetic-media relevance.	Court and tribunal records; Regulator and enforcement sources; Security research and advisories; News and investigative reporting	High	Feeds a cross-domain figure connecting provenance confusion to legal/process harm without claiming media-authenticity certainty.	Timeline or topology linking media provenance disputes to process stage	Metadata-only treatment is preferred where harmful media would otherwise be mirrored.
LPC-RI-004	legal_procedural_contamination	institutional_absurdity	Automated or AI-assisted filings, complaints, or submissions overload or distort administrative or judicial procedure.	One public source describing the automated submission behavior and its procedural effect.	Court sanctions order, agency notice, platform abuse report, or official administrative response.	Court and tribunal records; Regulator and enforcement sources; Company and platform notices; News and investigative reporting	Medium	Can support a paper paragraph on procedural overload as a governance-edge case distinct from classic misinformation.	Process-funnel figure showing submission stage, screening stage, and intervention stage	Absent authoritative records, keep legal status and scale claims conservative.
RI-005	research_integrity	legal_procedural_contamination	Synthetic or AI-assisted peer review, benchmark reporting, or dataset description introduces false claims about evaluation or review.	One public source describing the integrity concern in review, evaluation, or dataset documentation.	Journal/editor notice, conference organizer statement, institutional investigation, or peer-reviewed methods critique.	Academic and research-integrity sources; Company and platform notices; News and investigative reporting	High	Directly supports LIMEN's residual-case claim by showing research-integrity incidents that do not fit standard safety or bias taxonomies.	Matrix of research-integrity subtype x authority source x claim strength	Do not classify a paper or dataset as fraudulent from media coverage alone.
RI-006	research_integrity	ai_washing_or_false_ai_claim	A system, paper, benchmark, or service falsely claims AI autonomy, AI provenance, or AI-generated output quality while hiding human substitution or fabrication.	One public source documenting the false-AI allegation or deceptive provenance issue.	Regulator notice, journal correction, company admission, procurement record, or authoritative investigative finding.	Regulator and enforcement sources; Academic and research-integrity sources; Public-sector registers and procurement; News and investigative reporting	Medium	Supports comparative discussion between research-integrity failures and AI-washing cases in the atlas.	Comparative bar chart of false-AI provenance vs citation fabrication pathways	Keep allegations about deception or fraud provisional unless an authoritative source states them.
RI-007	research_integrity	security_risk	Benchmark gaming, evaluation leakage, or synthetic evidence contamination undermines public claims about model capability or safety.	One public source describing the benchmark or evidence contamination mechanism at a non-dangerous summary level.	Peer-reviewed paper, official benchmark maintainer notice, institutional report, or security advisory.	Academic and research-integrity sources; Security research and advisories; Company and platform notices	Medium	Useful for a methods note on why LIMEN separates attestation of processing from truth of capability claims.	Method-note figure linking contamination type to evidence-tier ceiling	Avoid operational reproduction details; record only public-safe summaries.
RI-008	research_integrity	residual_unclassified	A case materially affects research or evidentiary integrity but resists existing database categories, requiring residual tracking for later taxonomy revision.	One public source that clearly describes the edge case and why standard categories fit poorly.	Any authoritative confirmation relevant to the setting, or multiple independent public sources if no authority exists.	Academic and research-integrity sources; Court and tribunal records; Regulator and enforcement sources; News and investigative reporting	High	Creates a bounded queue for taxonomy refinement and demonstrates why LIMEN needs an edge-case residual bucket.	Residual-cluster table for future taxonomy proposals	Residual status is a methodological signal, not a claim that the case is more important than classified ones.
